"422955","20.500.11850/16","Dedekind, Zane",,,,,,,,,,,"Lohmann, Ulrike||Ferrachat, Sylvaine||Hoose, Corinna","2021-10-27T05:39:18Z","2021-10-26T19:03:52Z||2021-10-27T05:39:18Z",,"2021","2021-10-27","In mixed-phase clouds (MPCs), supercooled liquid water and ice particles can co-exist at subzero temperatures warmer than ~ −38 °C. Therefore, MPCs are thermodynamically unstable enabling the rapid growth of ice crystals in conditions where liquid drops evaporate. Consequently, precipitation formation in MPCs occurs faster than in liquid water clouds. The ice phase contributes up to 63% to surface precipitation globally and up to 50% in the continental mid-latitudes. At temperatures warmer than ~ −38 °C, primary ice production occurs through heterogeneous nucleation, which involves ice nucleating particles (INPs). However, aerial and ground-based observations show that the ice crystal number concentrations (ICNCs) in winter and summertime orographic MPCs are typically 1 to 3 orders of magnitude larger than the concentration of INPs. It was hypothesized that secondary ice production, specifically ice multiplication through rime splintering, could be the reason for this discrepancy. However, theoretical calculations and numerical simulations of rime splintering could not account for the high observed ICNCs. Also, the rapid glaciation of observed MPCs is suggested to occur faster than what can be achieved in laboratory experiments that considered rime splintering. The evidence is clear that other processes than the presence of INPs enhance ice formation in MPCs. Representing the ice phase correctly in models is crucial for simulating the lifetime of MPCs and precipitation formation accurately. Therefore, in this thesis, I explored processes involving secondary ice production (SIP) and the seeder-feeder process that could enhance ICNCs using the regional climate model COSMO.  Secondary ice production occurs through (1) the breakup of ice particles during ice-graupel collisions and (2) frozen droplet shattering upon freezing. To address the discrepancy, we conducted COSMO simulations based on data collected during the RACLETS campaign, in the Swiss Alps in February and March 2019. We hypothesized that the ICNCs could be enhanced through collisional breakup and droplet shattering which could explain the INPs vs ICNCs discrepancy. On 7 March 2019 near Davos, we simulated the passage of a cold front to assess the role of secondary ice production on wintertime MPCs. Surface measurements of ICNCs, using the HoloGondel platform, were between 9±3 and 19±4 per liter during the afternoon. Simulations of droplet shattering underestimated the surface ICNCs by at least 2 orders of magnitude because the cloud base temperatures were colder than what is needed for optimal conditions for droplet shattering. However, the simulated ICNCs as a result of collisional breakup were generally in agreement with the HoloGondel observations. The explosive breakup in the mid levels of the cloud caused a drastic decrease in the liquid water fraction favoring depositional growth of ice particles. Consequently, the microphysics predominantly controlled the reduction of precipitation in localized regions of high precipitation compared to the control simulation which did not include any SIP processes. SIP show promise in narrowing the gap between observed and simulated ICNCs.  Enhanced ICNCs compared to INP concentrations can also occur when ice particles sediment from an upper seeder cloud into a lower laying feeder cloud (external seeder-feeder) or when ice particles sediment from the cirrus region into warmer regions of the same cloud (internal seeder-feeder). We hypothesize that: (1) the external and internal seeder-feeder process could significantly enhance the ICNCs and (2) when the seeding particles are removed in the simulations, the surface precipitation will decrease significantly. On 18 May 2016 in the Swiss Alps, a high number of multi-layered clouds were observed by the DARDAR-CLOUD satellite. We simulated this case to elucidate the occurrence of seeder-feeder events and their impact on surface precipitation. The external seeder-feeder events occurred 10.3% of the time when multilayered clouds were observed. On average over the domain, ice particles seldom could survive a fall greater than 2.5 km. When they survived 58.3% of the ice particle mass was lost as a result of melting or sublimation. When we removed the seeding particles from the external and internal seeder-feeder processes, the depositional growth rate was reduced, corresponding to a slower glaciation of the clouds. The precipitation was reduced in the internal seeder-feeder process by up to 7.5% compared to the control simulation. The external seeder-feeder process was shown to impact surface precipitation significantly through the enhancement of ICNCs in the feeder cloud, however their infrequent occurrence can most likely not explain the frequently observed discrepancy (from literature) between ICNCs and INPs. However, the internal seeder-feeder processes enhances the ICNCs significantly in the lower cloud resulting in significant enhancements in surface precipitation.  Increasing the concentration of INPs can aid in the formation of more ice particles, but this does not address the discrepancy between ICNCs and INPs. However, we hypothesised that enhanced aerosols can be linked with enhanced homogeneous freezing of liquid droplets. Therefore, these homogeneously formed ice crystals can sediment into the cloud’s mixed-phase region, enhancing the ICNCs and consequently surface precipitation. In summer 2017, a flooding event occurred in Switzerland which coincided with a Saharan dust outbreak during which elevated aerosol concentrations were observed ahead of the cold front. We hypothesized that there was a link between the aerosols and the flooding event. A one-moment cloud microphysics scheme, similar to the one used by MeteoSwiss, unsuccessfully predicted the flooding event. We speculated that the two-moment scheme could have predicted the flooding event. We therefore compared an aerosol perturbed two-moment scheme to a control simulation using an unperturbed control two-moment cloud microphysics scheme. The choice of the microphysics scheme had the largest impact on surface precipitation. The simulations perturbed with higher cloud condensation nuclei (CCN) showed a shift towards the lee of the Alpine ridge, while the INP perturbations enhanced precipitation on the windward side. In the INP perturbations, the reduction in the total cloud liquid and increase in total cloud ice only caused a shift in the growth mechanism to depositional growth relating to a shift in precipitation, but not a significant change in the amount of precipitation. Therefore, the enhanced aerosols could not explain the flooding event.  In this thesis, we demonstrated the importance of both collisional breakup and the seeder-feeder mechanism in enhancing ICNCs in clouds, resulting in significant changes in growth regimes of ice particles yielding significant changes in surface precipitation. Employing SIP processes in models is a way forward in reducing the discrepancy between observed and modeled ICNCs.","application/pdf","10.3929/ethz-b-000511939",,,,"http://hdl.handle.net/20.500.11850/511939","en","ETH Zurich","Creative Commons Attribution 4.0 International","http://creativecommons.org/licenses/by/4.0/","Mixed-phase clouds||Secondary ice production||Microphysics||Seeder-Feeder||Aerosols||Ice Nucleating Particles","The Impact of the Ice Phase on Orographic Mixed-phase Clouds and Surface Precipitation in the Swiss Alps","Doctoral Thesis","Open access",,"DDC - DDC::5 - Science::500 - Natural sciences",,,"2021-10-26T19:03:58Z",,,,,,"yes",,,,,,,"Exploiting orographic clouds for constraining the sources of ice crystals","175824","10.13039/501100001711","SNF","Projekte MINT","27762",,,,,,,,"ETH Zürich::00002 - ETH Zürich::00012 - Lehre und Forschung::00007 - Departemente::02350 - Dep. Umweltsystemwissenschaften / Dep. of Environmental Systems Science::02717 - Institut für Atmosphäre und Klima / Inst. Atmospheric and Climate Science::03690 - Lohmann, Ulrike / Lohmann, Ulrike","ETH Zürich::00002 - ETH Zürich::00012 - Lehre und Forschung::00007 - Departemente::02350 - Dep. Umweltsystemwissenschaften / Dep. of Environmental Systems Science::02717 - Institut für Atmosphäre und Klima / Inst. Atmospheric and Climate Science::03690 - Lohmann, Ulrike / Lohmann, Ulrike","03690","03690",,,,,"Zurich","published",,,,"10.3929/ethz-b-000509592",,,,,,,,"2021-10-27T05:39:43Z","2022-03-29T14:44:39Z","true","158 p.","FORM",,,
"392945","20.500.11850/3","van Wessem, J. Melchior||Steger, Christian R.||Wever, Nander||van den Broeke, Michiel R.",,,,,,,,,,,,"2021-03-01T13:52:23Z","2021-02-28T21:54:46Z||2021-03-01T13:52:23Z",,"2021","2021-02-15","In this study, we focus on the model detection in the Antarctic Peninsula (AP) of so-called perennial firn aquifers (PFAs) that are widespread in Greenland and Svalbard and are formed when surface meltwater percolates into the firn pack in summer, which is then buried by snowfall and does not refreeze during the following winter. We use two snow models, the Institute for Marine and Atmospheric Research Utrecht Firn Densification Model (IMAU-FDM) and SNOWPACK, and force these (partly) with mass and energy fluxes from the Regional Atmospheric Climate MOdel (RACMO2.3p2) to construct a 1979–2016 climatology of AP firn density, temperature, and liquid water content. An evaluation using 75 snow temperature observations at 10 m depth and density profiles from 11 firn cores shows that output of both snow models is sufficiently realistic to warrant further analysis of firn characteristics.  The models give comparable results: in 941 model grid points in either model, covering ∼28 000 km2, PFAs existed for at least 1 year in the simulated period, most notably in the western AP. At these locations, surface meltwater production typically exceeds 200 mmw.e.yr−1 , with accumulation for most locations >1000mmw.e.yr−1  .  Most persistent and extensive are PFAs modelled on and around Wilkins Ice Shelf. Here, both meltwater production and accumulation rates are sufficiently high to sustain a PFA on 49 % of the ice shelf area in (up to) 100 % (depending on the model) of the years in the 1979–2016 period. Although this PFA presence is confirmed by recent observations, its extent in the models appears underestimated. Other notable PFA locations are Wordie Ice Shelf, an ice shelf that has almost completely disappeared in recent decades, and the relatively warm north-western side of mountain ranges in Palmer Land, where accumulation rates can be extremely high, and PFAs are formed frequently. PFAs are not necessarily more frequent in areas with the largest melt and accumulation rates, but they do grow larger and retain more meltwater, which could increase the likelihood of ice shelf hydrofracturing.  We find that not only the magnitude of melt and accumulation is important but also the timing of precipitation events relative to melt events. Large accumulation events that occur in the months following an above-average summer melt event favour PFA formation in that year. Most PFAs are predicted near the grounding lines of the (former) Prince Gustav, Wilkins, and Wordie ice shelves. This highlights the need to further investigate how PFAs may impact ice shelf disintegration events through the process of hydrofracturing in a similar way as supraglacial lakes do.","application/pdf","10.3929/ethz-b-000472070","1994-0416||1994-0424",,"10.5194/tc-15-695-2021","http://hdl.handle.net/20.500.11850/472070","en","Copernicus Publications","Creative Commons Attribution 4.0 International","http://creativecommons.org/licenses/by/4.0/",,"An exploratory modelling study of perennial firn aquifers in the Antarctic Peninsula for the period 1979-2016","Journal Article","Open access",,,,,"2021-02-28T21:54:59Z",,,,,,"yes",,,,,,,,,,,,,,"85100891299","000619837600001",,"2","The Cryosphere","15","ETH Zürich::00002 - ETH Zürich::00012 - Lehre und Forschung::00007 - Departemente::02350 - Dep. Umweltsystemwissenschaften / Dep. of Environmental Systems Science::02717 - Institut für Atmosphäre und Klima / Inst. Atmospheric and Climate Science::03360 - Schär, Christoph / Schär, Christoph","ETH Zürich::00002 - ETH Zürich::00012 - Lehre und Forschung::00007 - Departemente::02350 - Dep. Umweltsystemwissenschaften / Dep. of Environmental Systems Science::02717 - Institut für Atmosphäre und Klima / Inst. Atmospheric and Climate Science::03360 - Schär, Christoph / Schär, Christoph","03360","03360",,,"714","695","Göttingen","published",,,,,,,,,,,,"2021-03-01T13:52:32Z","2022-03-29T05:31:13Z","true",,"SCOPUS",,"publishedVersion",
"384529","20.500.11850/3","Zhou, Sha||Williams, A. Park||Lintner, Benjamin R.||Berg, Alexis M.||Zhang, Yao||Keenan, Trevor F.||Cook, Benjamin I.||Hagemann, Stefan||Seneviratne, Sonia I.||Gentine, Pierre",,,,,,,,,,,,"2021-01-12T12:29:39Z","2021-01-10T03:41:21Z||2021-01-12T12:29:39Z",,"2021-01","2021-01-04","Global warming alters surface water availability (precipitation minus evapotranspiration, P–E) and hence freshwater resources. However, the influence of land–atmosphere feedbacks on future P–E changes and the underlying mechanisms remain unclear. Here we demonstrate that soil moisture (SM) strongly impacts future P–E changes, especially in drylands, by regulating evapotranspiration and atmospheric moisture inflow. Using modelling and empirical approaches, we find a consistent negative SM feedback on P–E, which may offset ~60% of the decline in dryland P–E otherwise expected in the absence of SM feedbacks. The negative feedback is not caused by atmospheric thermodynamic responses to declining SM; rather, reduced SM, in addition to limiting evapotranspiration, regulates atmospheric circulation and vertical ascent to enhance moisture transport into drylands. This SM effect is a large source of uncertainty in projected dryland P–E changes, underscoring the need to better constrain future SM changes and improve the representation of SM–atmosphere processes in models.",,,"1758-6798",,"10.1038/s41558-020-00945-z","http://hdl.handle.net/20.500.11850/460884","en","Nature Publishing Group",,,,"Soil moisture–atmosphere feedbacks mitigate declining water availability in drylands","Journal Article","Metadata only",,,,,"2021-01-10T03:41:25Z",,,,,,"yes",,,,,,,,,,,,,,"85098638982","000604840800003","Nat. Clim. Chang.","1","Nature Climate Change","11","ETH Zürich::00002 - ETH Zürich::00012 - Lehre und Forschung::00007 - Departemente::02350 - Dep. Umweltsystemwissenschaften / Dep. of Environmental Systems Science::02717 - Institut für Atmosphäre und Klima / Inst. Atmospheric and Climate Science::03778 - Seneviratne, Sonia / Seneviratne, Sonia","ETH Zürich::00002 - ETH Zürich::00012 - Lehre und Forschung::00007 - Departemente::02350 - Dep. Umweltsystemwissenschaften / Dep. of Environmental Systems Science::02717 - Institut für Atmosphäre und Klima / Inst. Atmospheric and Climate Science::03778 - Seneviratne, Sonia / Seneviratne, Sonia","03778","03778",,,"44","38","London","published",,,,,,,"handle/20.500.11850/528410",,,,,"2021-01-12T12:29:48Z","2022-03-29T04:48:13Z","true",,"SCOPUS",,,
"385582","20.500.11850/3","Flach, Milan||Brenning, Alexander||Gans, Fabian||Reichstein, Markus||Sippel, Sebastian||Mahecha, Miguel D.",,,,,,,,,,,,"2021-01-15T13:14:14Z","2021-01-15T05:07:43Z||2021-01-15T13:14:14Z",,"2021-01","2021-01-05","Drought and heat events affect the uptake and sequestration of carbon in terrestrial ecosystems. Factors such as the duration, timing, and intensity of extreme events influence the magnitude of impacts on ecosystem processes such as gross primary production (GPP), i.e., the ecosystem uptake of CO2. Preceding soil moisture depletion may exacerbate these impacts. However, some vegetation types may be more resilient to climate extremes than others. This effect is insufficiently understood at the global scale and is the focus of this study. Using a global upscaled product of GPP that scales up in situ land CO2 flux observations with global satellite remote sensing, we study the impact of climate extremes at the global scale. We find that GPP in grasslands and agricultural areas is generally reduced during heat and drought events. However, we also find that forests, if considered globally, appear in general to not be particularly sensitive to droughts and heat events that occurred during the analyzed period or even show increased GPP values during these events. On the one hand, normal-to-increased GPP values are in many cases plausible, e.g., when conditions prior to the event have been particularly positive. On the other hand, however, normal-to-increased GPP values in forests may also reflect a lack of sensitivity in current remote-sensing-derived GPP products to the effects of droughts and heatwaves. The overall picture calls for a differentiated consideration of different land cover types in the assessments of risks of climate extremes for ecosystem functioning.","application/pdf","10.3929/ethz-b-000462796","1726-4170||1726-4170",,"10.5194/bg-18-39-2021","http://hdl.handle.net/20.500.11850/462796","en","Copernicus","Creative Commons Attribution 4.0 International","http://creativecommons.org/licenses/by/4.0/",,"Vegetation modulates the impact of climate extremes on gross primary production","Journal Article","Open access",,,,,"2021-01-15T05:07:54Z",,,,,,"yes",,,,,,,,,,,,,,"85099069626","000606791900001",,"1","Biogeosciences","18","ETH Zürich::00002 - ETH Zürich::00012 - Lehre und Forschung::00007 - Departemente::02350 - Dep. Umweltsystemwissenschaften / Dep. of Environmental Systems Science::02717 - Institut für Atmosphäre und Klima / Inst. Atmospheric and Climate Science::03777 - Knutti, Reto / Knutti, Reto","ETH Zürich::00002 - ETH Zürich::00012 - Lehre und Forschung::00007 - Departemente::02350 - Dep. Umweltsystemwissenschaften / Dep. of Environmental Systems Science::02717 - Institut für Atmosphäre und Klima / Inst. Atmospheric and Climate Science::03777 - Knutti, Reto / Knutti, Reto","03777","03777",,,"53","39","Göttingen","published",,,,,,,,,,,,"2021-01-15T13:14:22Z","2022-03-29T04:51:43Z","true",,"SCOPUS",,"publishedVersion",
"386581","20.500.11850/3","Schemm, Sebastian||Wernli, Heini||Binder, Hanin",,,,,,,,,,,,"2021-01-20T13:50:51Z","2021-01-20T13:38:30Z||2021-01-20T13:50:51Z",,"2021","2021-01-20",,"application/pdf","10.3929/ethz-b-000464162","2698-4016||2698-4008",,"10.5194/wcd-2-55-2021","http://hdl.handle.net/20.500.11850/464162","en","Copernicus","Creative Commons Attribution 4.0 International","http://creativecommons.org/licenses/by/4.0/",,"The storm-track suppression over the western North Pacific  from a cyclone life-cycle perspective","Journal Article","Open access",,,,,"2021-01-20T13:38:38Z",,,,,,"yes",,,,,,,"Global Lagrangian Cloud Dynamics||Understanding the influence of warm conveyor belts in extratropical cyclones on tropopause dynamics: analysis with observations, reanalyses and global climate simulations","848698||185049","10.13039/501100000780||10.13039/501100001711","EC||SNF","H2020||Projekte MINT",,,,,"Weather Clim. Dynam.","1","Weather and Climate Dynamics","2","ETH Zürich::00002 - ETH Zürich::00012 - Lehre und Forschung::00007 - Departemente::02350 - Dep. Umweltsystemwissenschaften / Dep. of Environmental Systems Science::02717 - Institut für Atmosphäre und Klima / Inst. Atmospheric and Climate Science::09705 - Schemm, Sebastian / Schemm, Sebastian||ETH Zürich::00002 - ETH Zürich::00012 - Lehre und Forschung::00007 - Departemente::02350 - Dep. Umweltsystemwissenschaften / Dep. of Environmental Systems Science::02717 - Institut für Atmosphäre und Klima / Inst. Atmospheric and Climate Science::03854 - Wernli, Johann Heinrich / Wernli, Johann Heinrich","ETH Zürich::00002 - ETH Zürich::00012 - Lehre und Forschung::00007 - Departemente::02350 - Dep. Umweltsystemwissenschaften / Dep. of Environmental Systems Science::02717 - Institut für Atmosphäre und Klima / Inst. Atmospheric and Climate Science::09705 - Schemm, Sebastian / Schemm, Sebastian||ETH Zürich::00002 - ETH Zürich::00012 - Lehre und Forschung::00007 - Departemente::02350 - Dep. Umweltsystemwissenschaften / Dep. of Environmental Systems Science::02717 - Institut für Atmosphäre und Klima / Inst. Atmospheric and Climate Science::03854 - Wernli, Johann Heinrich / Wernli, Johann Heinrich","09705||03854","09705||03854",,,"69","55","Göttingen","published",,,,,,,,,,,,"2021-01-20T13:51:00Z","2022-03-29T04:54:06Z","true","15 p.","FORM",,"publishedVersion",
"394607","20.500.11850/3","Breil, Marcus||Davin, Edouard Léopold||Rechid, Diana",,,,,,,,,,,,"2021-03-15T08:48:45Z","2021-03-13T04:33:14Z||2021-03-15T08:48:45Z",,"2021","2021-03-03","Uncertainties in the evapotranspiration response to afforestation constitute a major source of disagreement between model-based studies of the potential climate benefits of forests. Forests typically have higher evapotranspiration rates than grasslands in the tropics, but whether this is also the case in the midlatitudes is still debated. To explore this question and the underlying physical processes behind these varying evapotranspiration rates of forests and grasslands in more detail, a regional model study with idealized afforestation scenarios was performed for Europe. In the first experiment, Europe was maximally forested, and in the second one, all forests were turned into grassland.  The results of this modeling study exhibit the same contradicting evapotranspiration characteristics of forests and grasslands as documented in observational studies, but by means of an additional sensitivity simulation in which the surface roughness of the forest was reduced to grassland, the mechanisms behind these varying evapotranspiration rates could be revealed. Due to the higher surface roughness of a forest, solar radiation is more efficiently transformed into turbulent sensible heat fluxes, leading to lower surface temperatures (top of vegetation) than in grassland. The saturation deficit between the vegetation and the atmosphere, which depends on the surface temperature, is consequently reduced over forests. This reduced saturation deficit counteracts the transpiration-facilitating characteristics of a forest (deeper roots, a higher leaf area index, LAI, and lower albedo values than grassland). If the impact of the reduced saturation deficit exceeds the effects of the transpiration-facilitating characteristics of a forest, evapotranspiration is reduced compared to grassland. If not, evapotranspiration rates of forests are higher. The interplay of these two counteracting factors depends on the latitude and the prevailing forest type in a region.","application/pdf","10.3929/ethz-b-000474237","1726-4170||1726-4170",,"10.5194/bg-18-1499-2021","http://hdl.handle.net/20.500.11850/474237","en","Copernicus Publications","Creative Commons Attribution 4.0 International","http://creativecommons.org/licenses/by/4.0/",,"What determines the sign of the evapotranspiration response to afforestation in European summer?","Journal Article","Open access",,,,,"2021-03-13T04:33:43Z",,,,,,"yes",,,,,,,,,,,,,,"85102057502","000626292900001",,"4","Biogeosciences","18","ETH Zürich::00002 - ETH Zürich::00012 - Lehre und Forschung::00007 - Departemente::02350 - Dep. Umweltsystemwissenschaften / Dep. of Environmental Systems Science::02717 - Institut für Atmosphäre und Klima / Inst. Atmospheric and Climate Science::03778 - Seneviratne, Sonia / Seneviratne, Sonia","ETH Zürich::00002 - ETH Zürich::00012 - Lehre und Forschung::00007 - Departemente::02350 - Dep. Umweltsystemwissenschaften / Dep. of Environmental Systems Science::02717 - Institut für Atmosphäre und Klima / Inst. Atmospheric and Climate Science::03778 - Seneviratne, Sonia / Seneviratne, Sonia","03778","03778",,,"1510","1499","Göttingen","published",,,,,,,,,,,,"2021-03-15T08:48:59Z","2022-03-29T05:45:42Z","true",,"SCOPUS",,"publishedVersion",
