"418281","20.500.11850/3","Zeman, Christian||Wedi, Nils||Dueben, Peter D.||Ban, Nikolina||Schär, Christoph",,,,,,,,,,,,"2021-09-16T12:21:35Z","2021-08-11T04:48:54Z||2021-09-16T12:21:35Z",,"2021-07-27",,"The increase in computing power and recent model developments allow for the use of global kilometer-scale weather and climate models for routine forecasts. At these scales, deep convective processes can be partially resolved explicitly by the model dynamics. Next to horizontal resolution, other aspects such as the applied numerical methods, the use of the hydrostatic approximation, and time step size are factors that might influence a model's ability to resolve deep convective processes.  In order to improve our understanding of the role of these factors, a model intercomparison between the nonhydrostatic COSMO model and the hydrostatic Integrated Forecast System (IFS) from ECMWF has been conducted. Both models have been run with different spatial and temporal resolutions in order to simulate 2 summer days over Europe with strong convection. The results are analyzed with a focus on vertical wind speed and precipitation.  Results show that even at around 3 km horizontal grid spacing the effect of the hydrostatic approximation seems to be negligible. However, time step proves to be an important factor for deep convective processes, with a reduced time step generally allowing for higher updraft velocities and thus more energy in vertical velocity spectra, in particular for shorter wavelengths. A shorter time step is also causing an earlier onset and peak of the diurnal cycle. Furthermore, the amount of horizontal diffusion plays a crucial role for deep convection with more diffusion generally leading to larger convective cells and higher precipitation intensities. The study also shows that for both models the parameterization of deep convection leads to lower updraft and precipitation intensities and biases in the diurnal cycle with a precipitation peak which is too early.","application/pdf","10.3929/ethz-b-000500382","1991-9603||1991-959X",,"10.5194/gmd-14-4617-2021","http://hdl.handle.net/20.500.11850/500382","en","Copernicus","Creative Commons Attribution 4.0 International","http://creativecommons.org/licenses/by/4.0/",,"Model intercomparison of COSMO 5.0 and IFS 45r1 at kilometer-scale grid spacing","Journal Article","Open access",,,,,"2021-08-11T04:49:03Z",,,,,,"yes",,,,,,,"INFRAEDI-02-2018 I Excellence in Simulation of Weather and Climate in Europe, Phase 2","823988","10.13039/501100000780","EC","H2020",,,"85111775538","000678371200001","Geosci. model dev.","7","Geoscientific Model Development","14","ETH Zürich::00002 - ETH Zürich::00012 - Lehre und Forschung::00007 - Departemente::02350 - Dep. Umweltsystemwissenschaften / Dep. of Environmental Systems Science::02717 - Institut für Atmosphäre und Klima / Inst. Atmospheric and Climate Science::03360 - Schär, Christoph / Schär, Christoph","ETH Zürich::00002 - ETH Zürich::00012 - Lehre und Forschung::00007 - Departemente::02350 - Dep. Umweltsystemwissenschaften / Dep. of Environmental Systems Science::02717 - Institut für Atmosphäre und Klima / Inst. Atmospheric and Climate Science::03360 - Schär, Christoph / Schär, Christoph","03360","03360",,,"4639","4617","Göttingen","published",,,,,,,,,,,,"2021-09-16T12:21:43Z","2023-02-06T22:34:34Z","true",,"SCOPUS",,"publishedVersion",
"417813","20.500.11850/3","Georgakaki, Paraskevi||Bougiatioti, Aikaterini||Wieder, Jörg||Mignani, Claudia||Ramelli, Fabiola||Kanji, Zamin A||Henneberger, Jan||Hervo, Maxime||Berne, Alexis||Lohmann, Ulrike||Nenes, Athanasios",,,,,,,,,,,,"2021-09-10T09:44:49Z","2021-07-31T02:30:31Z||2021-09-10T09:44:49Z",,"2021-07-20",,"Droplet formation provides a direct microphysical link between aerosols and clouds (liquid or mixed-phase), and its adequate description poses a major challenge for any atmospheric model. Observations are critical for evaluating and constraining the process. To this end, aerosol size distributions, cloud condensation nuclei (CCN), hygroscopicity, and lidar-derived vertical velocities were observed in alpine mixed-phase clouds during the Role of Aerosols and Clouds Enhanced by Topography on Snow (RACLETS) field campaign in the Davos, Switzerland, region during February and March 2019. Data from the mountain-top site of Weissfluhjoch (WFJ) and the valley site of Davos Wolfgang are studied. These observations are coupled with a state-of-the-art droplet activation parameterization to investigate the aerosol–cloud droplet link in mixed-phase clouds. The mean CCN-derived hygroscopicity parameter, κ, at WFJ ranges between 0.2–0.3, consistent with expectations for continental aerosols. κ tends to decrease with size, possibly from an enrichment in organic material associated with the vertical transport of fresh ultrafine particle emissions (likely from biomass burning) from the valley floor in Davos. The parameterization provides a droplet number that agrees with observations to within ∼ 25 %. We also find that the susceptibility of droplet formation to aerosol concentration and vertical velocity variations can be appropriately described as a function of the standard deviation of the distribution of updraft velocities, σw, as the droplet number never exceeds a characteristic limit, termed the “limiting droplet number”, of ∼ 150–550 cm−3, which depends solely on σw. We also show that high aerosol levels in the valley, most likely from anthropogenic activities, increase the cloud droplet number, reduce cloud supersaturation (< 0.1 %), and shift the clouds to a state that is less susceptible to changes in aerosol concentrations and very sensitive to vertical velocity variations. The transition from an aerosol to velocity-limited regime depends on the ratio of cloud droplet number to the limiting droplet number, as droplet formation becomes velocity limited when this ratio exceeds 0.65. Under such conditions, droplet size tends to be minimal, reducing the likelihood that large drops are present that would otherwise promote glaciation through rime splintering and droplet shattering. Identifying regimes where droplet number variability is dominated by dynamical – rather than aerosol – changes is key for interpreting and constraining when and which types of aerosol effects on clouds are active.","application/pdf","10.3929/ethz-b-000498798","1680-7375||1680-7367",,"10.5194/acp-21-10993-2021","http://hdl.handle.net/20.500.11850/498798","en","Copernicus","Creative Commons Attribution 4.0 International","http://creativecommons.org/licenses/by/4.0/",,"On the drivers of droplet variability in alpine mixed-phase clouds","Journal Article","Open access",,,,,"2021-07-31T02:30:36Z",,,,,,"yes",,,,,,,"Exploiting orographic clouds for constraining the sources of ice crystals","175824","10.13039/501100001711","SNF","Projekte MINT",,,"85111076981","000675388100005","Atmos. chem. phys.","14","Atmospheric Chemistry and Physics","21","ETH Zürich::00002 - ETH Zürich::00012 - Lehre und Forschung::00007 - Departemente::02350 - Dep. Umweltsystemwissenschaften / Dep. of Environmental Systems Science::02717 - Institut für Atmosphäre und Klima / Inst. Atmospheric and Climate Science::03690 - Lohmann, Ulrike / Lohmann, Ulrike","ETH Zürich::00002 - ETH Zürich::00012 - Lehre und Forschung::00007 - Departemente::02350 - Dep. Umweltsystemwissenschaften / Dep. of Environmental Systems Science::02717 - Institut für Atmosphäre und Klima / Inst. Atmospheric and Climate Science::03690 - Lohmann, Ulrike / Lohmann, Ulrike","03690","03690",,,"11012","10993","Göttingen","published",,,,,,,,,,,,"2021-09-10T09:44:56Z","2023-02-06T22:33:54Z","true",,"WOS",,"publishedVersion",
"416673","20.500.11850/3","Moreno, Ana||Iglesias, Miguel||Azorin-Molina, Cesar||Pérez-Mejías, Carlos||Bartolomé, Miguel||Sancho, Carlos||Stoll, Heather||Cacho, Isabel||Frigola, Jaime||Osácar, Cinta||Muñoz, Antonio||Delgado-Huertas, Antonio||Bladé, Ileana||Vimeux, Françoise",,,,,,,,,,,,"2021-09-02T06:18:20Z","2021-07-16T03:22:31Z||2021-09-02T06:18:20Z",,"2021-07-07",,"For the first time, this article presents a large dataset of precipitation isotopic measurements (δ18Op and δ2Hp) sampled every day or 2d from seven sites on a west-to-east transect across northern Spain for 2010-2017. The main aim of this study is to (1) characterize the rainfall isotopic variability in northern Spain at daily and monthly timescales and (2) assess the principal factors influencing rainfall isotopic variability. The relative role of air temperature and rainfall in determining the stable isotope composition of precipitation changes along the west-to-east transect, with air temperature being highly correlated with δ18Op at daily and monthly timescales, while a few sites along the transect show a significant negative correlation with precipitation. The highest air temperature-δ18Op dependency is found for a station located in the Pyrenees. Frontal systems associated with North Atlantic cyclones are the dominant mechanism inducing precipitation in this region, particularly in winter. This study allows an exploration of the role of air mass source and trajectory in determining the isotopic composition of rainfall in northern Iberia by characterizing the moisture uptake for three of the seven stations. The importance of continental versus marine moisture sources is evident, with clear seasonal and spatial variations. In addition, the type of precipitation (convective versus frontal rainfall) plays a key role, with convective rainfall associated with higher δ18Op values. This comprehensive spatiotemporal approach to analyzing the rainfall isotopic composition represents another step forward towards developing a more detailed, mechanistic framework for interpreting stable isotopes in rainfall as a paleoclimate and hydrological tracer.","application/pdf","10.3929/ethz-b-000495423","1680-7375||1680-7367",,"10.5194/acp-21-10159-2021","http://hdl.handle.net/20.500.11850/495423","en","Copernicus","Creative Commons Attribution 4.0 International","http://creativecommons.org/licenses/by/4.0/",,"Measurement report: Spatial variability of northern Iberian rainfall stable isotope values - Investigating atmospheric controls on daily and monthly timescales","Journal Article","Open access",,,,,"2021-07-16T03:22:36Z",,,,,,"yes",,,,,,,,,,,,,,"85109392217","000671766300002","Atmos. chem. phys.","13","Atmospheric Chemistry and Physics","21","ETH Zürich::00002 - ETH Zürich::00012 - Lehre und Forschung::00007 - Departemente::02330 - Dep. Erdwissenschaften / Dep. of Earth Sciences::02704 - Geologisches Institut / Geological Institute::09601 - Stoll, Heather / Stoll, Heather||ETH Zürich::00002 - ETH Zürich::00012 - Lehre und Forschung::00007 - Departemente::02330 - Dep. Erdwissenschaften / Dep. of Earth Sciences::02704 - Geologisches Institut / Geological Institute::09601 - Stoll, Heather / Stoll, Heather||ETH Zürich::00002 - ETH Zürich::00012 - Lehre und Forschung::00007 - Departemente::02350 - Dep. Umweltsystemwissenschaften / Dep. of Environmental Systems Science::02717 - Institut für Atmosphäre und Klima / Inst. Atmospheric and Climate Science::03690 - Lohmann, Ulrike / Lohmann, Ulrike","ETH Zürich::00002 - ETH Zürich::00012 - Lehre und Forschung::00007 - Departemente::02330 - Dep. Erdwissenschaften / Dep. of Earth Sciences::02704 - Geologisches Institut / Geological Institute::09601 - Stoll, Heather / Stoll, Heather","09601||09601||03690","09601",,,"10177","10159","Göttingen","published",,,,,,,,,,,,"2021-09-02T06:18:29Z","2023-02-06T22:23:35Z","true",,"SCOPUS",,"publishedVersion",
"432820","20.500.11850/3","Meier, Ronny||Schwaab, Jonas||Seneviratne, Sonia I.||Sprenger, Michael||Lewis, Elizabeth||Davin, Edouard Léopold",,,,,,,,,,,,"2022-01-10T08:30:47Z","2021-07-06T17:18:08Z||2021-07-07T05:59:09Z||2022-01-10T08:30:47Z",,"2021-07","2021-07-05","Land-cover changes can affect the climate by altering the water and energy balance of the land surface. Numerous modelling studies have indicated that alterations at the land surface can result in considerable changes in precipitation. Yet land-cover-induced precipitation changes remain largely unconstrained by observations. Here we use an observation-based continental-scale statistical model to show that forestation of rain-fed agricultural land in Europe triggers substantial changes in precipitation. Locally, we find an increase in precipitation following forestation, in particular in winter, which is supported by a paired rain-gauge analysis. In addition, forests are estimated to increase downwind precipitation in most regions during summer. By contrast, the downwind effect in winter is positive in coastal areas but near neutral and negative in Continental and Northern Europe, respectively. The combined local and non-local effects of a realistic reforestation scenario, constrained by sustainability safeguards, are estimated to increase summer precipitation by 7.6 ± 6.7% on average over Europe (0.13 ± 0.11 mm d–1), potentially offsetting a substantial part of the projected precipitation decrease from climate change. We therefore conclude that land-cover-induced alterations of precipitation should be considered when developing land management strategies for climate change adaptation and mitigation.","application/pdf","10.3929/ethz-b-000493339","1752-0908||1752-0894",,"10.1038/s41561-021-00773-6","http://hdl.handle.net/20.500.11850/493339","en","Nature Publishing Group","In Copyright - Non-Commercial Use Permitted","http://rightsstatements.org/page/InC-NC/1.0/","Land cover and land use||Precipitation||Hydrology||Climate change||Europe","Empirical Estimate of Forestation-Induced Precipitation Changes in Europe","Journal Article","Open access",,,,,"2021-07-06T17:18:14Z","2022-01-05",,,,,"yes",,,,,,,"CLimate IMPacts of Utilizing Land in Switzerland and Europe (CLIMPULSE)","172715","10.13039/501100001711","SNF","Projekte MINT",,,"85109331832","000669835000001","Nat. Geosci.",,"Nature Geoscience","14","ETH Zürich::00002 - ETH Zürich::00012 - Lehre und Forschung::00007 - Departemente::02350 - Dep. Umweltsystemwissenschaften / Dep. of Environmental Systems Science::02717 - Institut für Atmosphäre und Klima / Inst. Atmospheric and Climate Science::03778 - Seneviratne, Sonia / Seneviratne, Sonia||ETH Zürich::00002 - ETH Zürich::00012 - Lehre und Forschung::00007 - Departemente::02350 - Dep. Umweltsystemwissenschaften / Dep. of Environmental Systems Science::02717 - Institut für Atmosphäre und Klima / Inst. Atmospheric and Climate Science::03854 - Wernli, Johann Heinrich / Wernli, Johann Heinrich","ETH Zürich::00002 - ETH Zürich::00012 - Lehre und Forschung::00007 - Departemente::02350 - Dep. Umweltsystemwissenschaften / Dep. of Environmental Systems Science::02717 - Institut für Atmosphäre und Klima / Inst. Atmospheric and Climate Science::03778 - Seneviratne, Sonia / Seneviratne, Sonia||ETH Zürich::00002 - ETH Zürich::00012 - Lehre und Forschung::00007 - Departemente::02350 - Dep. Umweltsystemwissenschaften / Dep. of Environmental Systems Science::02717 - Institut für Atmosphäre und Klima / Inst. Atmospheric and Climate Science::03854 - Wernli, Johann Heinrich / Wernli, Johann Heinrich","03778||03854","03778||03854",,,"478","473","London","published",,,,,,,,,"10.3929/ethz-b-000448232",,,"2021-07-07T05:59:49Z","2022-03-29T17:25:48Z","true","20 p. accepted version, 24 p. supplementary material","FORM",,"acceptedVersion",
"409487","20.500.11850/5","Cristofanelli, Paolo||Arduni, Jgor||Serva, Federico||Calzolari, Francescopiero||Bonasoni, Paolo||Busetto, Maurizio||Maione, Michela||Sprenger, Michael||Trisolino, Pamela||Putero, Davide",,,,,,,,,,,,"2021-07-13T06:15:02Z","2021-07-13T02:27:09Z||2021-07-13T06:15:02Z",,"2021-07","2021-07-02","Several studies investigated the possible impacts of the restriction measures related to the containment of the spread of the COrona VIrus Disease (COVID-19) to atmospheric ozone (O3) at global, regional, and local scales during 2020. O3 is a secondary pollutant with adverse effects on population health and ecosystems and with negative impacts on climate, acting as greenhouse gas. Most of these studies focused on spring 2020 (i.e. March–May) and on observations in the planetary boundary layer (PBL), mostly in the vicinity of urban agglomerates. Here, we analyzed the variability of O3 above the PBL of northern Italy in 2020 by using continuous observations carried out at a high mountain WMO/GAW global station in Italy (Mt. Cimone–CMN; 44°12' N, 10°42' E, 2165 m a.s.l.). Low O3 monthly anomalies were observed during spring (MAM) and summer (JJA), when periods of low O3 intertwined with periods with higher O3, within climatological ranges. A similar variability was observed for O3 precursors like NO2 and 15 anthropogenic non-methane volatile organic carbons, but the systematic O3 anomalies were not reflected in these variables. The analysis of meteorological variables and diel O3 cycles did not suggest major changes in the vertical transport related to the thermal circulation system in the mountain area. The analysis of five days back-trajectories suggested that the observed O3 anomalies cannot be explained by differences in the synoptic-scale circulation with respect to the previous years alone. On the other hand, the characterization of two transport patterns (i.e. air masses from the regional PBL or from the free troposphere) and the analysis of back-trajectories suggested an important contribution of transport from the continental PBL during the periods with the lowest O3 at CMN. When proxies of air mass transport from the regional PBL are considered, a lower NOx content was pointed out with respect to the previous years, suggesting a lower O3 production in a NOx-limited atmosphere. Our study suggested for the first time that, during MAM and JJA 2020, the reduced anthropogenic emissions related to the COVID-19 restrictions lowered the amount of this short-lived climate forcer/pollutant at remote locations above the PBL over northern Italy. This work suggests the importance of limiting anthropogenic precursor emissions for decreasing the O3 amount at remote locations and in upper atmospheric layers.","application/pdf","10.3929/ethz-b-000494189","1748-9326||1748-9318",,"10.1088/1748-9326/ac0b6a","http://hdl.handle.net/20.500.11850/494189","en","Institute of Physics Publishing","Creative Commons Attribution 4.0 International","http://creativecommons.org/licenses/by/4.0/","COVID-19||ozone||air mass transport||mitigation||Europe||Po basin","Negative ozone anomalies at a high mountain site in northern Italy during 2020: a possible role of COVID-19 lockdowns?","Other Journal Item","Open access",,,,,"2021-07-13T02:27:24Z",,,,,,"yes",,,,,,,,,,,,,,"85110553825","000669652300001","Environ. Res. Lett.","7","Environmental Research Letters","16","ETH Zürich::00002 - ETH Zürich::00012 - Lehre und Forschung::00007 - Departemente::02350 - Dep. Umweltsystemwissenschaften / Dep. of Environmental Systems Science::02717 - Institut für Atmosphäre und Klima / Inst. Atmospheric and Climate Science::03854 - Wernli, Johann Heinrich / Wernli, Johann Heinrich","ETH Zürich::00002 - ETH Zürich::00012 - Lehre und Forschung::00007 - Departemente::02350 - Dep. Umweltsystemwissenschaften / Dep. of Environmental Systems Science::02717 - Institut für Atmosphäre und Klima / Inst. Atmospheric and Climate Science::03854 - Wernli, Johann Heinrich / Wernli, Johann Heinrich","03854","03854",,,,"074029","Bristol","published",,,,,,,,,,,,"2021-07-13T06:15:12Z","2022-03-29T10:22:47Z","true","8 p.","WOS",,"publishedVersion",
"413123","20.500.11850/21","Medhaug, Iselin",,,,,,,,,,,,"2021-08-02T05:56:23Z","2021-07-30T13:26:49Z||2021-08-02T05:56:23Z",,"2021-07",,"The following report shows the evolution of the greenhouse gas emissions from flights from business trips undertaken by ETH Zurich staff and guests, provided that the expenses are covered by ETH Zurich, and by students as part of their curriculum for the period 2016 to 2019. Overall, the flight emissions have decreased in 2019 compared to the base period 2016-2018, and more than half of the departments have already met their pledged 2025 reduction targets. This conclusion should be interpreted with care since year-to-year variations in the flight activity and therefore emissions are large. The data however show that in 2019 almost all employment categories contributed to this decrease, but overall less burden for emissions reductions are put on early career researchers (doctoral students) compared to more established researchers and professors, and emissions from guests have been cut the most (in %).  For the base period, long-haul flights caused most of the emissions (86 %) although these only come from 38 % of the flights. For 2019, these numbers are 86 % and 41 %, respectively. Policies addressing or discouraging short distance flights are often aimed at flights that can be replaced by other means of transport. For the period 2016-2018, 38 % of the long-haul flights were also related to non long-haul flights, and 34 % of all short flights are related to a long-haul flight. Even thought most (94 %) flights recorded during the base period are economy class, 19 % of the emissions come from business and first class flights. This number decreased to 16 % in 2019.    These numbers show that there is still potential for halving the emissions from business (and first) class flights just by changing flight class, and by cutting short flights that are not connected to other flights.","application/pdf","10.3929/ethz-b-000498721",,,,"http://hdl.handle.net/20.500.11850/498721","en","ETH Zurich, Institute for Atmospheric and Climate Science","Creative Commons Attribution 4.0 International","http://creativecommons.org/licenses/by/4.0/","flight emissions||ETH Zurich||Academic travel||Emissions||emissions reductions||ETH air travel project","The ETH Zurich flight emission project: Emissions 2016-2019","Report","Open access",,,,,"2021-07-30T13:27:08Z",,,,,,"yes",,,,,,,,,,,,,,,,,,,,"ETH Zürich::00002 - ETH Zürich::00012 - Lehre und Forschung::00007 - Departemente::02350 - Dep. Umweltsystemwissenschaften / Dep. of Environmental Systems Science::02717 - Institut für Atmosphäre und Klima / Inst. Atmospheric and Climate Science::03777 - Knutti, Reto / Knutti, Reto||ETH Zürich::00002 - ETH Zürich::00003 - Schulleitung und Dienste::00025 - Bereich VP Infrastruktur / Domain VP Infrastructure","ETH Zürich::00002 - ETH Zürich::00012 - Lehre und Forschung::00007 - Departemente::02350 - Dep. Umweltsystemwissenschaften / Dep. of Environmental Systems Science::02717 - Institut für Atmosphäre und Klima / Inst. Atmospheric and Climate Science::03777 - Knutti, Reto / Knutti, Reto","03777||00025","03777",,,"32","1","Zurich","published",,,"20.500.11850/498713",,,,,,,,,"2021-08-02T05:56:43Z","2022-03-29T10:51:42Z","true","32 p.","FORM",,,
