id,collection,dc.contributor.author,dc.contributor.contactPerson,dc.contributor.dataCollector,dc.contributor.editor,dc.contributor.producer,dc.contributor.projectLeader,dc.contributor.projectManager,dc.contributor.projectMember,dc.contributor.relatedPerson,dc.contributor.researchGroup,dc.contributor.rightsHolder,dc.contributor.supervisor,dc.date.accessioned,dc.date.available,dc.date.created,dc.date.issued,dc.date.published,dc.description.abstract,dc.format,dc.identifier.doi,dc.identifier.issn,dc.identifier.olduri,dc.identifier.other,dc.identifier.uri,dc.language.iso,dc.publisher,dc.rights.license,dc.rights.uri,dc.subject,dc.title,dc.type,ethz.availability,ethz.book.title,ethz.code.ddc,ethz.code.jel,ethz.date.collected,ethz.date.deposited,ethz.date.embargoend,ethz.date.retentionend,ethz.date.retentionendDate,ethz.description.methods,ethz.description.software,ethz.eth,ethz.event,ethz.event.date,ethz.event.location,ethz.geolocation.placename,ethz.geolocation.pointlat,ethz.geolocation.pointlong,ethz.grant,ethz.grant.agreementno,ethz.grant.funderDoi,ethz.grant.fundername,ethz.grant.program,ethz.identifier.diss,ethz.identifier.orcidWorkCode,ethz.identifier.scopus,ethz.identifier.wos,ethz.journal.abbreviated,ethz.journal.issue,ethz.journal.title,ethz.journal.volume,ethz.leitzahl,ethz.leitzahl.certified,ethz.leitzahlIdentifiers,ethz.leitzahlIdentifiers.certified,ethz.libdrive.url,ethz.notes,ethz.pages.end,ethz.pages.start,ethz.publication.place,ethz.publication.status,ethz.relation.cites,ethz.relation.continues,ethz.relation.hasPart,ethz.relation.isCitedBy,ethz.relation.isNewVersionOf,ethz.relation.isPartOf,ethz.relation.isReferencedBy,ethz.relation.isSupplementTo,ethz.relation.isSupplementedBy,ethz.relation.references,ethz.rosetta.exportRequired,ethz.rosetta.installDate,ethz.rosetta.lastUpdated,ethz.rosetta.versionExported,ethz.size,ethz.source,ethz.tag,ethz.version.deposit,ethz.version.edition
"441073","20.500.11850/3","Raymond, Colin||Matthews, Tom||Horton, Radley M.||Fischer, Erich||Fueglistaler, Stephan||Ivanovich, Catherine||Suarez-Gutierrez, Laura||Zhang, Yi",,,,,,,,,,,,"2022-02-24T06:48:05Z","2021-12-16T04:11:03Z||2022-02-21T09:27:59Z||2022-02-24T06:48:05Z",,"2021-12-16","2021-11-16","Humid heat presents a major societal challenge through its impacts on human health, energy demand, and economic productivity, underlined by the projected emergence of conditions beyond human tolerance. However, systematic assessment of what drives the most extreme humid heat worldwide has been lacking. Here, we investigate factors determining the location and magnitude of humid-heat extremes, framing our analysis around the four regions with the highest values: the southern Persian Gulf, north-central Pakistan, eastern South Asia, and the western Amazon. We find that strong boundary-layer moisture fluxes, together with stability that inhibits moist convection, explain well the timing and location of near-surface humid-heat extremes. These favorable conditions are achieved through regionally distinct factors, including shallow sea breezes in the Persian Gulf and large-scale subsidence in eastern South Asia. Our results demonstrate some of the principal controls on the most intense humid heat, both globally and for particular regions and heat events.",,,"0094-8276||1944-8007",,"10.1029/2021GL096082","http://hdl.handle.net/20.500.11850/520869","en","American Geophysical Union",,,,"On the Controlling Factors for Globally Extreme Humid Heat","Journal Article","Metadata only",,,,,"2021-12-16T04:11:10Z",,,,,,"yes",,,,,,,,,,,,,,"85120806146","000730019700041","Geophys. Res. Lett.","23","Geophysical Research Letters","48","ETH Zürich::00002 - ETH Zürich::00012 - Lehre und Forschung::00007 - Departemente::02350 - Dep. Umweltsystemwissenschaften / Dep. of Environmental Systems Science::02717 - Institut für Atmosphäre und Klima / Inst. Atmospheric and Climate Science::03777 - Knutti, Reto / Knutti, Reto","ETH Zürich::00002 - ETH Zürich::00012 - Lehre und Forschung::00007 - Departemente::02350 - Dep. Umweltsystemwissenschaften / Dep. of Environmental Systems Science::02717 - Institut für Atmosphäre und Klima / Inst. Atmospheric and Climate Science::03777 - Knutti, Reto / Knutti, Reto","03777","03777",,,,"e2021GL096082","Hoboken, NJ","published",,,,,,,,,,,,"2022-02-24T06:48:11Z","2022-02-24T06:48:11Z","true","11 p.","SCOPUS",,,
"438877","20.500.11850/3","Brodowsky, Christina||Sukhodolov, Timofei||Feinberg, Aryeh||Höpfner, Michael||Peter, Thomas||Stenke, Andrea||Rozanov, Eugene",,,,,,,,,,,,"2022-02-07T10:47:26Z","2021-12-16T04:11:03Z||2022-02-01T09:17:03Z||2022-02-07T10:47:26Z",,"2021-12-16","2021-11-18","Volcanic activity is a major natural climate forcing and an accurate representation of volcanic aerosols in global climate models is essential. This is a complex task involving many uncertainties in the model design and setup and observations. We analyze the performance of the aerosol-chemistry-climate model SOCOL-AERv2 for three medium-sized volcanic eruptions. We focus on the impact of differences in volcanic plume height and SO2 estimates on the stratospheric aerosol burden. The influence of internal model variability and dynamics are addressed through an ensemble of free-running and nudged simulations at different vertical resolutions. Comparing the modeled evolution of the stratospheric aerosol loading to satellite measurements reveals a good model performance. However, a conclusive validation is complicated by uncertainties in observations and emission estimates. The large spread in emitted sulfur amount and its vertical distribution consequently lead to differences in simulated aerosol burdens. Varying tropopause heights among free-running simulations add to these differences, modulating the amount of sulfur injected into the stratosphere. In nudged mode, volcanic aerosol burden peaks are well reproduced, however changes in convection and clouds affect SO2 oxidation paths and cross-tropopause transport, leading to increased background burdens compared to observations. This effect can be reduced by leaving temperatures unconstrained. A higher vertical resolution of 90 levels increases the stratospheric residence time of sulfate aerosol by reducing the diffusion out of the tropical reservoir. We conclude that the model set-up (vertical resolution and free-running vs. nudged) as well as forcing parameters (volcanic emission strength and plume height) contribute equally to the model uncertainties.","application/pdf","10.3929/ethz-b-000520870","0148-0227||2169-897X",,"10.1029/2021JD035472","http://hdl.handle.net/20.500.11850/520870","en","American Geophysical Union","Creative Commons Attribution 4.0 International","http://creativecommons.org/licenses/by/4.0/",,"Modeling the Sulfate Aerosol Evolution After Recent Moderate Volcanic Activity, 2008–2012","Journal Article","Open access",,,,,"2021-12-16T04:11:10Z",,,,,,"yes",,,,,,,"Global Atmospheric Selenium Cycling: Chemical Speciation and Transport Pathways","ETH-39 15-2","10.13039/501100003006","ETHZ","ETH Grants",,,"85120777759","000729996000040","J. geophys. res., Atmos.","23","Journal of Geophysical Research: Atmospheres","126","ETH Zürich::00002 - ETH Zürich::00012 - Lehre und Forschung::00007 - Departemente::02350 - Dep. Umweltsystemwissenschaften / Dep. of Environmental Systems Science::02717 - Institut für Atmosphäre und Klima / Inst. Atmospheric and Climate Science::03517 - Peter, Thomas (emeritus) / Peter, Thomas (emeritus)","ETH Zürich::00002 - ETH Zürich::00012 - Lehre und Forschung::00007 - Departemente::02350 - Dep. Umweltsystemwissenschaften / Dep. of Environmental Systems Science::02717 - Institut für Atmosphäre und Klima / Inst. Atmospheric and Climate Science::03517 - Peter, Thomas (emeritus) / Peter, Thomas (emeritus)","03517","03517",,,,"e2021JD035472","Washington, DC","published",,,,,,,,,,,,"2022-02-07T10:47:33Z","2023-02-07T00:09:14Z","true","24 p.","SCOPUS",,"publishedVersion",
"451232","20.500.11850/3","Berkemeier, Thomas||Mishra, Ashmi||Mattei, Coraline||Huisman, Andrew J.||Krieger, Ulrich||Pöschl, Ulrich",,,,,,,,,,,,"2022-05-17T08:30:29Z","2022-01-07T06:26:14Z||2022-05-17T08:30:29Z",,"2021-12-16","2021-11-19","The chemical processing of organic aerosol particles is important for atmospheric chemistry, climate, and public health. The heterogeneous oxidation of oleic acid particles by ozone is one of the most frequently investigated model systems. The available kinetic data span a wide range of particle size and ozone concentration and are obtained with different experimental techniques including electrodynamic balance (EDB), optical tweezers, environmental chamber, and aerosol flow tube reactors using mass spectrometry and Raman spectroscopy as detection methods. Existing kinetic and mechanistic analyses, however, reveal systematic differences and inconsistencies that are a matter of ongoing debate. We developed and applied an inverse modeling approach using a kinetic multilayer model (KM-SUB) and Monte Carlo-based global optimization algorithms to 11 literature data sets and an additional new set of EDB data. We were able to reconcile most experimental data with consistent sets of multiphase chemical kinetic parameters. For a unique determination of these parameters, however, further experiments with simultaneous measurement of multiple observables at specific, insightful reaction conditions are required. We tested three different reaction mechanisms and conclude that secondary chemistry involving Criegee intermediates appears crucial to resolve the discrepancies found in earlier studies. Primary ozone chemistry occurs close to the particle surface and secondary reactions seem to dominate in the particle bulk, involving OH formation and radical chain reactions.","application/pdf","10.3929/ethz-b-000523776","2472-3452",,"10.1021/acsearthspacechem.1c00232","http://hdl.handle.net/20.500.11850/523776","en","American Chemical Society","Creative Commons Attribution 4.0 International","http://creativecommons.org/licenses/by/4.0/","Heterogeneous chemistry||Aerosol||Reaction kinetics||Ozonolysis||Lipids||Inverse modeling||Criegee Intermediate","Ozonolysis of Oleic Acid Aerosol Revisited: Multiphase Chemical Kinetics and Reaction Mechanisms","Journal Article","Open access",,,,,"2022-01-07T06:26:21Z",,,,,,"yes",,,,,,,,,,,,,,"85120316227","000757012400004","ACS earth space chem.","12","ACS Earth and Space Chemistry","5","ETH Zürich::00002 - ETH Zürich::00012 - Lehre und Forschung::00007 - Departemente::02350 - Dep. Umweltsystemwissenschaften / Dep. of Environmental Systems Science::02717 - Institut für Atmosphäre und Klima / Inst. Atmospheric and Climate Science::03517 - Peter, Thomas (emeritus) / Peter, Thomas (emeritus)","ETH Zürich::00002 - ETH Zürich::00012 - Lehre und Forschung::00007 - Departemente::02350 - Dep. Umweltsystemwissenschaften / Dep. of Environmental Systems Science::02717 - Institut für Atmosphäre und Klima / Inst. Atmospheric and Climate Science::03517 - Peter, Thomas (emeritus) / Peter, Thomas (emeritus)","03517","03517",,,"3323","3313","Washington, DC","published",,,,,,,,,,,,"2022-05-17T08:30:36Z","2023-02-07T03:07:05Z","true",,"SCOPUS",,"publishedVersion",
"429287","20.500.11850/3","Brunner, Cyril||Brem, Benjamin T.||Collaud Coen, Martine||Conen, Franz||Hervo, Maxime||Henne, Stephan||Steinbacher, Martin||Gysel-Beer, Martin||Kanji, Zamin A",,,,,,,,,,,,"2021-12-10T09:19:38Z","2021-12-09T09:04:32Z||2021-12-10T09:19:38Z",,"2021-12-09",,"The ice phase in mixed-phase clouds has a pivotal role in global precipitation formation as well as for Earth's radiative budget. Above 235 K, sparse particles with the special ability to initiate ice formation, ice-nucleating particles (INPs), are responsible for primary ice formation within these clouds. Mineral dust has been found to be one of the most abundant INPs in the atmosphere at temperatures colder than 258 K. However, the extent of the abundance and distribution of INPs remains largely unknown. To better constrain and quantify the impact of mineral dust on ice nucleation, we investigate the frequency of Saharan dust events (SDEs) and their contribution to the INP number concentration at 243 K and at a saturation ratio with respect to liquid water (Sw) of 1.04 at the High Altitude Research Station Jungfraujoch (JFJ; 3580 m a.s.l.) from February to December 2020. Using the single-scattering albedo Ångström exponent retrieved from a nephelometer and an Aethalometer, satellite-retrieved dust mass concentrations, simulated tropospheric residence times, and the attenuated backscatter signal from a ceilometer as proxies, we detected 26 SDEs, which in total contributed to 17 % of the time span analyzed. We found every SDE to show an increase in median INP concentrations compared to those of all non-SDE periods; however, they were not always statistically significant. Median INP concentrations of individual SDEs spread between 1.7 and 161 INP std L−1 and thus 2 orders of magnitude. In the entire period analyzed, 74.7 ± 0.2 % of all INPs were measured during SDEs. Based on satellite-retrieved dust mass concentrations, we argue that mineral dust is also present at JFJ outside of SDEs but at much lower concentrations, thus still contributing to the INP population. We estimate that 97 % of all INPs active in the immersion mode at 243 K and Sw=1.04 at JFJ are dust particles. Overall, we found INP number concentrations to follow a leptokurtic lognormal frequency distribution. We found the INP number concentrations during SDEs to correlate with the ceilometer backscatter signals from a ceilometer located 4.5 km north of JFJ and 1510 m lower in altitude, thus scanning the air masses at the same altitude as JFJ. Using the European ceilometer network allows us to study the atmospheric pathway of mineral dust plumes over a large domain, which we demonstrate in two case studies. These studies showed that mineral dust plumes form ice crystals at cirrus altitudes, which then sediment to lower altitudes. Upon sublimation in dryer air layers, the residual particles are left potentially pre-activated. Future improvements to the sampling lines of INP counters are required to study whether these particles are indeed pre-activated, leading to larger INP number concentrations than reported here.","application/pdf","10.3929/ethz-b-000519707","1680-7375||1680-7367",,"10.5194/acp-21-18029-2021","http://hdl.handle.net/20.500.11850/519707","en","Copernicus","Creative Commons Attribution 4.0 International","http://creativecommons.org/licenses/by/4.0/","Ice-nucleating particles (INPs)","The contribution of Saharan dust to the ice-nucleating particle concentrations at the High Altitude Station Jungfraujoch (3580 m a.s.l.), Switzerland","Journal Article","Open access",,,,,"2021-12-09T09:04:42Z",,,,,,"yes",,,,,,,,,,,,,,"85121270733","000729349200001","Atmos. chem. phys.","23","Atmospheric Chemistry and Physics","21","ETH Zürich::00002 - ETH Zürich::00012 - Lehre und Forschung::00007 - Departemente::02350 - Dep. Umweltsystemwissenschaften / Dep. of Environmental Systems Science::02717 - Institut für Atmosphäre und Klima / Inst. Atmospheric and Climate Science::03690 - Lohmann, Ulrike / Lohmann, Ulrike","ETH Zürich::00002 - ETH Zürich::00012 - Lehre und Forschung::00007 - Departemente::02350 - Dep. Umweltsystemwissenschaften / Dep. of Environmental Systems Science::02717 - Institut für Atmosphäre und Klima / Inst. Atmospheric and Climate Science::03690 - Lohmann, Ulrike / Lohmann, Ulrike","03690","03690",,,"18053","18029","Göttingen","published",,,,,,,,,"10.3929/ethz-b-000515082",,,"2021-12-10T09:20:11Z","2023-02-06T23:26:41Z","true",,"FORM","ice nucleating particles; HNT; CNT;||Aerosol-Cloud Interactions","publishedVersion",
"436181","20.500.11850/3","Yuan, Menghan||Leirvik, Thomas||Wild, Martin",,,,,,,,,,,,"2022-01-24T13:10:20Z","2021-12-06T17:31:31Z||2022-01-24T13:10:20Z",,"2021-12-01","2021-11-09","Downward surface solar radiation (SSR) is a crucial component of the global energy balance, affecting temperature and the hydrological cycle profoundly, and it provides crucial information about climate change. Many studies have examined SSR trends; however, they have often concentrated on specific regions due to limited spatial coverage of ground-based observation stations. To overcome this spatial limitation, this study performs a spatial interpolation based on amachine learning method, randomforest, to interpolatemonthly SSR anomalies using a number of climatic variables (various temperature indices, cloud coverage, etc.), time-point indicators (years and months of SSR observations), and geographical characteristics of locations (latitude, longitude, etc.). The predictors that provide the largest explanatory power for interannual variability are diurnal temperature range and cloud coverage. The output of the spatial interpolation is a 0.58 3 0.58 monthly gridded dataset of SSR anomalies with complete land coverage over the period 1961 2019, which is used afterward in a comprehensive trend analysis for (i) each continent separately and (ii) the entire globe. The continental-level analysis reveals the major contributors to the global dimming and brightening. In particular, the global dimming before the 1980s is primarily dominated by negative trends in Asia and North America, whereas Europe and Oceania have been the two largest contributors to the brightening after 1982 and up until 2019.",,,"0894-8755||1520-0442",,"10.1175/JCLI-D-21-0165.1","http://hdl.handle.net/20.500.11850/518944","en","American Meteorological Society",,,,"Global Trends in Downward Surface Solar Radiation from Spatial Interpolated Ground Observations during 1961 2019","Journal Article","Metadata only",,,,,"2021-12-06T17:32:05Z",,,,,,"yes",,,,,,,"Towards an improved understanding of the Global Energy Balance: causes of decadal changes of solar radiation","188601","10.13039/501100001711","SNF","Projekte MINT",,,"85119979913","000752649500017","J. climate","23","Journal of Climate","34","ETH Zürich::00002 - ETH Zürich::00012 - Lehre und Forschung::00007 - Departemente::02350 - Dep. Umweltsystemwissenschaften / Dep. of Environmental Systems Science::02717 - Institut für Atmosphäre und Klima / Inst. Atmospheric and Climate Science::03360 - Schär, Christoph / Schär, Christoph","ETH Zürich::00002 - ETH Zürich::00012 - Lehre und Forschung::00007 - Departemente::02350 - Dep. Umweltsystemwissenschaften / Dep. of Environmental Systems Science::02717 - Institut für Atmosphäre und Klima / Inst. Atmospheric and Climate Science::03360 - Schär, Christoph / Schär, Christoph","03360","03360",,,"9521","9501","Boston, MA","published",,,,,,,,,,,,"2022-01-24T13:10:27Z","2022-03-29T17:47:24Z","true",,"SCOPUS",,,
"437665","20.500.11850/3","Mony, Christoph||Jansing, Lukas||Sprenger, Michael",,,,,,,,,,,,"2022-01-28T20:06:52Z","2022-01-07T10:53:17Z||2022-01-28T20:06:52Z",,"2021-12-01","2021-10-29","This study explores the possibilities of employing machine learning algorithms to predict foehn occurrence in Switzerland at a north Alpine (Altdorf) and south Alpine (Lugano) station from its synoptic fingerprint in reanalysis data and climate simulations. This allows for an investigation on a potential future shift in monthly foehn frequencies. First, inputs from various atmospheric fields from the European Centre for Medium-Range Weather Forecasts (ECMWF) interim reanalysis (ERAI) were used to train an XGBoost model. Here, similar predictive performance to previous work was achieved, showing that foehn can accurately be diagnosed from the coarse synoptic situation. In the next step, the algorithm was generalized to predict foehn based on the Community Earth System Model (CESM) ensemble simulations of a present-day and warming future climate. The best generalization between ERAI and CESM was obtained by including the present-day data in the training procedure and simultaneously optimizing two objective functions, namely, the negative log loss and squared mean loss, on both datasets, respectively. It is demonstrated that the same synoptic fingerprint can be identified in CESM climate simulation data. Finally, predictions for present-day and future simulations were verified and compared for statistical significance. Our model is shown to produce valid output for most months, revealing that south foehn in Altdorf is expected to become more common during spring, while north foehn in Lugano is expected to become more common during summer.",,,"0882-8156||1520-0434",,"10.1175/waf-d-21-0036.1","http://hdl.handle.net/20.500.11850/523862","en","American Meteorological Society",,,"Downslope winds||Climate prediction||Ensembles||Forecast verification/skill||Forecasting techniques||Numerical weather prediction/forecasting||Probability forecasts/models/distribution||Statistical forecasting||Classification||Data science||Machine learning||Model interpretation and visualization","Evaluating foehn occurrence in a changing climate based on reanalysis and climate model data using machine learning","Journal Article","Metadata only",,,,,"2022-01-07T10:53:25Z",,,,,,"yes",,,,,,,"An integrated weather-system perspective on the characteristics, dynamics and impacts of extreme seasons||Foehn Dynamics - Lagrangian Analysis and Large-Eddy Simulation","787652||181992","10.13039/501100000780||10.13039/501100001711","EC||SNF","H2020||Projekte MINT",,,,"000757394200008","Weather forecast.","6","Weather and Forecasting","36","ETH Zürich::00002 - ETH Zürich::00012 - Lehre und Forschung::00007 - Departemente::02350 - Dep. Umweltsystemwissenschaften / Dep. of Environmental Systems Science::02717 - Institut für Atmosphäre und Klima / Inst. Atmospheric and Climate Science::03854 - Wernli, Johann Heinrich / Wernli, Johann Heinrich","ETH Zürich::00002 - ETH Zürich::00012 - Lehre und Forschung::00007 - Departemente::02350 - Dep. Umweltsystemwissenschaften / Dep. of Environmental Systems Science::02717 - Institut für Atmosphäre und Klima / Inst. Atmospheric and Climate Science::03854 - Wernli, Johann Heinrich / Wernli, Johann Heinrich","03854","03854",,,"2055","2039","Boston, MA","published",,,,,,,,,,,,"2022-01-28T20:07:04Z","2022-03-29T18:23:37Z","true",,"FORM",,,
"414075","20.500.11850/3","Bento, Virgílio A.||Ribeiro, Andreia F.S.||Russo, Ana||Gouveia, Célia M.||Cardoso, Rita M.||Soares, Pedro M.M.",,,,,,,,,,,,"2021-08-09T12:23:03Z","2021-08-09T02:55:25Z||2021-08-09T12:23:03Z",,"2021-12","2021-07-29","The impact of climate change on wheat and barley yields in two regions of the Iberian Peninsula is here examined. Regression models are developed by using EURO-CORDEX regional climate model (RCM) simulations, forced by ERA-Interim, with monthly maximum and minimum air temperatures and monthly accumulated precipitation as predictors. Additionally, RCM simulations forced by different global climate models for the historical period (1972–2000) and mid-of-century (2042–2070; under the two emission scenarios RCP4.5 and RCP8.5) are analysed. Results point to different regional responses of wheat and barley. In the southernmost regions, results indicate that the main yield driver is spring maximum temperature, while further north a larger dependence on spring precipitation and early winter maximum temperature is observed. Climate change seems to induce severe yield losses in the southern region, mainly due to an increase in spring maximum temperature. On the contrary, a yield increase is projected in the northern regions, with the main driver being early winter warming that stimulates earlier growth. These results warn on the need to implement sustainable agriculture policies, and on the necessity of regional adaptation strategies.","application/pdf","10.3929/ethz-b-000500031","2045-2322",,"10.1038/s41598-021-95014-6","http://hdl.handle.net/20.500.11850/500031","en","Nature","Creative Commons Attribution 4.0 International","http://creativecommons.org/licenses/by/4.0/",,"The impact of climate change in wheat and barley yields in the Iberian Peninsula","Journal Article","Open access",,,,,"2021-08-09T02:55:29Z",,,,,,"yes",,,,,,,"Risk assessment of critical ecological thresholds in Amazonia and Cerrado","186282||186282||186282","10.13039/501100001711||10.13039/501100001711||10.13039/501100001711","SNF||SNF||SNF","Brazilian-Swiss Joint Research Programme (full proposal)||Brazilian-Swiss Joint Research Programme (full proposal)||Brazilian-Swiss Joint Research Programme (full proposal)",,,"85111526903","000681066000075","Sci Rep","1","Scientific Reports","11","ETH Zürich::00002 - ETH Zürich::00012 - Lehre und Forschung::00007 - Departemente::02350 - Dep. Umweltsystemwissenschaften / Dep. of Environmental Systems Science::02717 - Institut für Atmosphäre und Klima / Inst. Atmospheric and Climate Science::03778 - Seneviratne, Sonia / Seneviratne, Sonia","ETH Zürich::00002 - ETH Zürich::00012 - Lehre und Forschung::00007 - Departemente::02350 - Dep. Umweltsystemwissenschaften / Dep. of Environmental Systems Science::02717 - Institut für Atmosphäre und Klima / Inst. Atmospheric and Climate Science::03778 - Seneviratne, Sonia / Seneviratne, Sonia","03778","03778",,,,"15484","London","published",,,,,,,,,,,,"2021-08-09T12:23:11Z","2022-03-29T10:59:19Z","true","12 p.","SCOPUS",,"publishedVersion",
