"486270","20.500.11850/30","Schemm, Sebastian","Schemm, Sebastian",,,,,,,,,,,"2023-01-23T13:23:37Z","2023-01-19T11:04:56Z||2023-01-20T06:44:12Z||2023-01-23T12:07:05Z||2023-01-23T13:23:37Z",,"2023-01-20",,"Seconday data used in the related publication.","application/gzip||application/x-tar||application/netcdf","10.3929/ethz-b-000593564",,,,"http://hdl.handle.net/20.500.11850/593564","en","ETH Zurich","Creative Commons Attribution-NonCommercial-ShareAlike 4.0 International","http://creativecommons.org/licenses/by-nc-sa/4.0/",,"Secondary data ""Toward eliminating the decades-old ""too zonal and too equatorward"" storm-track bias in climate models""","Data Collection","Open access",,,"2023-01-19T11:04:56Z",,"10 years","2033-01-20T06:44:13Z",,"yes",,,,,,,,,,,,,,"ETH Zürich::00002 - ETH Zürich::00012 - Lehre und Forschung::00007 - Departemente::02350 - Dep. Umweltsystemwissenschaften / Dep. of Environmental Systems Science::02717 - Institut für Atmosphäre und Klima / Inst. Atmospheric and Climate Science::09705 - Schemm, Sebastian / Schemm, Sebastian","ETH Zürich::00002 - ETH Zürich::00012 - Lehre und Forschung::00007 - Departemente::02350 - Dep. Umweltsystemwissenschaften / Dep. of Environmental Systems Science::02717 - Institut für Atmosphäre und Klima / Inst. Atmospheric and Climate Science::09705 - Schemm, Sebastian / Schemm, Sebastian","09705","09705",,,,,"Zurich",,"handle/20.500.11850/596915","10.3929/ethz-b-000596915",,,"2023-01-23T13:23:52Z","2023-02-07T10:00:55Z","true","773.82 MB","FORM",,,
"492106","20.500.11850/31","Röthlisberger, Matthias","Röthlisberger, Matthias",,,,"Röthlisberger, Matthias","Röthlisberger, Matthias","Papritz, Lukas",,"Wernli, Heini",,,"2023-03-06T17:09:50Z","2022-09-16T13:14:19Z||2022-09-16T15:33:15Z||2023-01-13T15:46:04Z||2023-01-16T07:43:15Z||2023-03-06T17:09:50Z","2021–12 to 2022-9","2023-01-16",,"(1) 15-day Kinematic backward trajectories from all hottest days of each year in 1979–2022 for all ERA5 grid points at 0.5° latitude by 0.5° longitude resolution.  (2) Lagrangian temperature anomaly budget for all TX1day backward trajectories","NETCDF||CSV||application/pdf||text/csv||application/netcdf||text/plain","10.3929/ethz-b-000571107",,,,"http://hdl.handle.net/20.500.11850/571107","en","ETH Zurich","In Copyright - Non-Commercial Use Permitted","http://rightsstatements.org/page/InC-NC/1.0/","heat wave||Trajectory||decomposition","Lagrangian temperature anomaly decomposition for ERA5 hot extremes","Dataset","Open access",,"DDC - DDC::5 - Science::500 - Natural sciences","2022-09-16T13:14:26Z",,"10 years","2033-01-16T07:43:16Z",,"yes",,,,,,,,,,,,,,"ETH Zürich::00002 - ETH Zürich::00012 - Lehre und Forschung::00007 - Departemente::02350 - Dep. Umweltsystemwissenschaften / Dep. of Environmental Systems Science::02717 - Institut für Atmosphäre und Klima / Inst. Atmospheric and Climate Science::03854 - Wernli, Johann Heinrich / Wernli, Johann Heinrich","ETH Zürich::00002 - ETH Zürich::00012 - Lehre und Forschung::00007 - Departemente::02350 - Dep. Umweltsystemwissenschaften / Dep. of Environmental Systems Science::02717 - Institut für Atmosphäre und Klima / Inst. Atmospheric and Climate Science::03854 - Wernli, Johann Heinrich / Wernli, Johann Heinrich","03854","03854","https://libdrive.ethz.ch/index.php/s/7doXhBjww8Jfwfk",,,,"Zurich",,,,,"true","2023-01-16T07:43:16Z","2023-01-16T07:43:16Z","true","1.3 TB","FORM","Project: INTEXseas project, funded by the European Research Council (ERC) under the European Union’s Horizon 2020 research and innovation programme (grant agreement no. 787652).",,
"485222","20.500.11850/3","Luo, Beiping||Schaub, Aline||Glas, Irina||Klein, Liviana K.||David, Shannon C.||Bluvshtein, Nir||Violaki, Kalliopi||Motos, Ghislain||Pohl, Marie O.||Hugentobler, Walter||Nenes, Athanasios||Krieger, Ulrich||Stertz, Silke||Peter, Thomas||Kohn, Tamar",,,,,,,,,,,,"2023-01-17T10:58:27Z","2023-01-12T07:57:19Z||2023-01-17T10:58:27Z",,"2023-01-10","2022-12-20","Respiratory viruses, including influenza virus and SARS-CoV-2, are transmitted by the airborne route. Air filtration and ventilation mechanically reduce the concentration of airborne viruses and are necessary tools for disease mitigation. However, they ignore the potential impact of the chemical environment surrounding aerosolized viruses, which determines the aerosol pH. Atmospheric aerosol gravitates toward acidic pH, and enveloped viruses are prone to inactivation at strong acidity levels. Yet, the acidity of expiratory aerosol particles and its effect on airborne virus persistence have not been examined. Here, we combine pH dependent inactivation rates of influenza A virus (IAV) and SARSCoV-2 with microphysical properties of respiratory fluids using a biophysical aerosol model. We find that particles exhaled into indoor air (with relative humidity >= 50%) become mildly acidic (pH similar to 4), rapidly inactivating IAV within minutes, whereas SARSCoV-2 requires days. If indoor air is enriched with nonhazardous levels of nitric acid, aerosol pH drops by up to 2 units, decreasing 99%-inactivation times for both viruses in small aerosol particles to below 30 s. Conversely, unintentional removal of volatile acids from indoor air may elevate pH and prolong airborne virus persistence. The overlooked role of aerosol acidity has profound implications for virus transmission and mitigation strategies.","application/pdf","10.3929/ethz-b-000591839",,"0013-936X||1520-5851","10.1021/acs.est.2c05777","http://hdl.handle.net/20.500.11850/591839","en","American Chemical Society","Creative Commons Attribution-NonCommercial-NoDerivatives 4.0 International","http://creativecommons.org/licenses/by-nc-nd/4.0/","influenza virus||SARS-CoV-2||aerosol acidity||airborne transmission||risk mitigation","Expiratory Aerosol pH: The Overlooked Driver of Airborne Virus Inactivation","Journal Article","Open access",,,"2023-01-12T07:57:21Z",,,,,"yes","Infectivity of influenza viruses in expiratory aerosols under ambient temperatures and humidities (IVEA)||Acidic pH inactivation of SARS-CoV-2  in exhaled breath and expectoration (ApHiCoV)","189939||196729","10.13039/501100001711||10.13039/501100001711","SNF||SNF","Sinergia||Special Call on Coronaviruses",,,"85144384693","000901861300001","Environ. Sci. Technol.","1","Environmental Science & Technology","57","ETH Zürich::00002 - ETH Zürich::00012 - Lehre und Forschung::00007 - Departemente::02350 - Dep. Umweltsystemwissenschaften / Dep. of Environmental Systems Science::02717 - Institut für Atmosphäre und Klima / Inst. Atmospheric and Climate Science::03517 - Peter, Thomas (emeritus) / Peter, Thomas (emeritus)","ETH Zürich::00002 - ETH Zürich::00012 - Lehre und Forschung::00007 - Departemente::02350 - Dep. Umweltsystemwissenschaften / Dep. of Environmental Systems Science::02717 - Institut für Atmosphäre und Klima / Inst. Atmospheric and Climate Science::03517 - Peter, Thomas (emeritus) / Peter, Thomas (emeritus)","03517","03517",,,"497","486","Washington, DC","published",,,,,"2023-01-17T10:58:28Z","2023-02-07T09:56:37Z","true",,"WOS",,,"publishedVersion"
"482697","20.500.11850/31","de Vries, Iris","de Vries, Iris",,,,,,,,,,,"2023-01-04T07:42:04Z","2022-12-29T09:01:55Z||2023-01-03T09:55:00Z||2023-01-03T19:44:36Z||2023-01-04T07:42:04Z",,"2023-01-04",,"Detection and attribution (D&A) of forced precipitation change is challenging due to internal variability and limited spatial and temporal coverage of observational records. These factors result in a low signal-to-noise ratio of potential regional and even global trends. Here, we use a statistical method – ridge regression – to create physically interpretable fingerprints for detection of forced changes in mean and extreme precipitation with a high signal-to-noise ratio. The fingerprints are constructed using CMIP6 multi-model output masked to match coverage of three gridded precipitation observational datasets – GHCNDEX, HadEX3, and GPCC –, and are then applied to these observational datasets to assess the degree of forced change detectable in the real-world climate.  We show that the signature of forced change is detected in all three observational datasets for global metrics of mean and extreme precipitation. Forced changes are still detectable from changes in the spatial patterns of precipitation even if the global mean trend is removed from the data. This shows detection of forced change in mean and extreme precipitation beyond a global mean trend, and increases confidence in the detection method's power, as well as in climate models' ability to capture the relevant processes that contribute to large-scale patterns of change.  We also find, however, that detectability depends on the observational dataset used. Not only coverage differences but also observational uncertainty contribute to dataset disagreement, exemplified by times of emergence of forced change from internal variability ranging from 1998 to 2004 among datasets. Furthermore, different choices for the period over which the forced trend is computed result in different levels of agreement between observations and model projections. These sensitivities may explain apparent contradictions in recent studies on whether models under- or overestimate the observed forced increase in mean and extreme precipitation. Lastly, the detection fingerprints are found to rely primarily on the signal in the extratropical Northern Hemisphere, which is at least partly due to observational coverage, but potentially also due to the presence of a more robust signal in the Northern Hemisphere in general.","application/zip||application/netcdf||application/pdf||text/csv||text/plain||application/dbase||application/octet-stream||application/x-shapefile","10.3929/ethz-b-000589377",,,,"http://hdl.handle.net/20.500.11850/589377","en","ETH Zurich","Creative Commons Attribution 4.0 International","http://creativecommons.org/licenses/by/4.0/","Climate change||Detection and attribution||Precipitation","Robust global detection of forced changes in mean and extreme precipitation despite observational disagreement on the magnitude of change - code and data","Dataset","Open access",,"DDC - DDC::5 - Science::550 - Earth sciences","2022-12-29T09:01:56Z",,"indefinite","292278994-08-17T07:12:55Z",,"yes",,,,,,,,,,,,,,"ETH Zürich::00002 - ETH Zürich::00012 - Lehre und Forschung::00007 - Departemente::02350 - Dep. Umweltsystemwissenschaften / Dep. of Environmental Systems Science::02717 - Institut für Atmosphäre und Klima / Inst. Atmospheric and Climate Science::03777 - Knutti, Reto / Knutti, Reto","ETH Zürich::00002 - ETH Zürich::00012 - Lehre und Forschung::00007 - Departemente::02350 - Dep. Umweltsystemwissenschaften / Dep. of Environmental Systems Science::02717 - Institut für Atmosphäre und Klima / Inst. Atmospheric and Climate Science::03777 - Knutti, Reto / Knutti, Reto","03777","03777",,,,,"Zurich",,,"10.5194/egusphere-2022-568||10.3929/ethz-b-000598177",,,"2023-01-04T07:51:40Z","2023-02-07T09:26:53Z","true","29.57 GB","FORM",,,
"486796","20.500.11850/31","Michel, Dominik||Oertel, Annika||Vitvar, Tomáš||Seneviratne, Sonia I.",,,,,,,,,,,,"2023-02-01T13:37:21Z","2023-02-01T13:37:21Z",,"2023",,,,,,,,"http://hdl.handle.net/20.500.11850/596572",,,,,,"Stable water isotopes in the Rietholzbach research catchment from 1994 to 2007","Dataset",,,,"2023-02-01T13:37:21Z",,,,"Yes","yes",,,,,,,,,,,,,,"ETH Zürich::00002 - ETH Zürich::00012 - Lehre und Forschung::00007 - Departemente::02350 - Dep. Umweltsystemwissenschaften / Dep. of Environmental Systems Science::02717 - Institut für Atmosphäre und Klima / Inst. Atmospheric and Climate Science::03778 - Seneviratne, Sonia / Seneviratne, Sonia",,"03778",,,,,,,,,,,"true",,,,,"FORM",,,
"488368","20.500.11850/31","Hirschi, Martin||Seneviratne, Sonia I.||Michel, Dominik||Lehner, Irene",,,,,,,,,,,,"2023-02-01T16:54:01Z","2023-02-01T16:54:01Z",,"2023",,,,,,,,"http://hdl.handle.net/20.500.11850/596657",,,,,,"Rietholzbach Catchment Data 1976-2015 (daily)","Dataset",,,,"2023-02-01T16:54:01Z",,,,"Yes","yes",,,,,,,,,,,,,,"ETH Zürich::00002 - ETH Zürich::00012 - Lehre und Forschung::00007 - Departemente::02350 - Dep. Umweltsystemwissenschaften / Dep. of Environmental Systems Science::02717 - Institut für Atmosphäre und Klima / Inst. Atmospheric and Climate Science::03778 - Seneviratne, Sonia / Seneviratne, Sonia",,"03778",,,,,,,,,"10.1029/2011WR011749||20.500.11850/51245||20.500.11850/185973",,"true",,,,,"FORM",,,
"483978","20.500.11850/4","Domeisen, Daniela||Eltahir, Elfatih A.B.||Fischer, Erich||Knutti, Reto||Perkins-Kirkpatrick, Sarah E.||Schär, Christoph||Seneviratne, Sonia I.||Weisheimer, Antje||Wernli, Heini",,,,,,,,,,,,"2023-01-11T08:31:35Z","2022-12-14T12:23:08Z||2022-12-14T14:31:45Z||2023-01-11T08:31:35Z",,"2023-01","2022-12-13","Heatwaves constitute a major threat to human health and ecosystems. Projected increases in heatwave frequency and severity thus lead to the need for prediction to enhance preparedness and minimize adverse impacts. In this Review, we document current capabilities for heatwave prediction at daily to decadal timescales and outline projected changes under anthropogenic warming. Various local and remote drivers and feedbacks influence heatwave development. On daily timescales, extratropical atmospheric blocking and global land–atmosphere coupling are most pertinent, and on subseasonal to seasonal timescales, soil moisture and ocean surface anomalies contribute. Knowledge of these drivers allows heatwaves to be skilfully predicted at daily to weekly lead times. Predictions are challenging beyond timescales of a few weeks, but tendencies for above-average temperatures can be estimated. Further into the future, heatwaves are anticipated to become more frequent, persistent and intense in nearly all inhabited regions, with trends amplified by soil drying in some areas, especially the mid-latitudes. There is also an increased occurrence of humid heatwaves, especially in southern Asia. A better understanding of the relevant drivers and their model representation, including atmospheric dynamics, atmospheric and soil moisture, and surface cover should be prioritized to improve heatwave prediction and projection.",,,,"2662-138X","10.1038/s43017-022-00371-z","http://hdl.handle.net/20.500.11850/587105","en","Nature",,,,"Prediction and projection of heatwaves","Review Article","Metadata only",,,"2022-12-14T12:23:08Z",,,,,"yes","Improving the Prediction of Sub-seasonal to Seasonal Weather and Climate – From Theory to Application||Remote Drivers of Extreme Temperature Events||European Climate Prediction System||Understanding and quantifying the occurrence of  very rare climate extremes in a changing climate","170523||198896||776613||178778","10.13039/501100001711||10.13039/501100001711||10.13039/501100000780||10.13039/501100001711","SNF||SNF||EC||SNF","SNF-Förderungsprofessuren Stufe 2||SNF-Förderungsprofessuren: Fortsetzungsgesuche||H2020||Projekte MINT",,,"85143915960","000898684500001","Nat Rev Earth Environ",,"Nature Reviews Earth & Environment","4","ETH Zürich::00002 - ETH Zürich::00012 - Lehre und Forschung::00007 - Departemente::02350 - Dep. Umweltsystemwissenschaften / Dep. of Environmental Systems Science::02717 - Institut für Atmosphäre und Klima / Inst. Atmospheric and Climate Science::03360 - Schär, Christoph / Schär, Christoph||ETH Zürich::00002 - ETH Zürich::00012 - Lehre und Forschung::00007 - Departemente::02350 - Dep. Umweltsystemwissenschaften / Dep. of Environmental Systems Science::02717 - Institut für Atmosphäre und Klima / Inst. Atmospheric and Climate Science::03777 - Knutti, Reto / Knutti, Reto||ETH Zürich::00002 - ETH Zürich::00012 - Lehre und Forschung::00007 - Departemente::02350 - Dep. Umweltsystemwissenschaften / Dep. of Environmental Systems Science::02717 - Institut für Atmosphäre und Klima / Inst. Atmospheric and Climate Science::03778 - Seneviratne, Sonia / Seneviratne, Sonia||ETH Zürich::00002 - ETH Zürich::00012 - Lehre und Forschung::00007 - Departemente::02350 - Dep. Umweltsystemwissenschaften / Dep. of Environmental Systems Science::02717 - Institut für Atmosphäre und Klima / Inst. Atmospheric and Climate Science::03854 - Wernli, Johann Heinrich / Wernli, Johann Heinrich||ETH Zürich::00002 - ETH Zürich::00012 - Lehre und Forschung::00007 - Departemente::02350 - Dep. Umweltsystemwissenschaften / Dep. of Environmental Systems Science::02717 - Institut für Atmosphäre und Klima / Inst. Atmospheric and Climate Science::09612 - Domeisen, Daniela / Domeisen, Daniela||ETH Zürich::00002 - ETH Zürich::00012 - Lehre und Forschung::00007 - Departemente::02350 - Dep. Umweltsystemwissenschaften / Dep. of Environmental Systems Science::02717 - Institut für Atmosphäre und Klima / Inst. Atmospheric and Climate Science","ETH Zürich::00002 - ETH Zürich::00012 - Lehre und Forschung::00007 - Departemente::02350 - Dep. Umweltsystemwissenschaften / Dep. of Environmental Systems Science::02717 - Institut für Atmosphäre und Klima / Inst. Atmospheric and Climate Science::09612 - Domeisen, Daniela / Domeisen, Daniela||ETH Zürich::00002 - ETH Zürich::00012 - Lehre und Forschung::00007 - Departemente::02350 - Dep. Umweltsystemwissenschaften / Dep. of Environmental Systems Science::02717 - Institut für Atmosphäre und Klima / Inst. Atmospheric and Climate Science::03360 - Schär, Christoph / Schär, Christoph||ETH Zürich::00002 - ETH Zürich::00012 - Lehre und Forschung::00007 - Departemente::02350 - Dep. Umweltsystemwissenschaften / Dep. of Environmental Systems Science::02717 - Institut für Atmosphäre und Klima / Inst. Atmospheric and Climate Science::03778 - Seneviratne, Sonia / Seneviratne, Sonia||ETH Zürich::00002 - ETH Zürich::00012 - Lehre und Forschung::00007 - Departemente::02350 - Dep. Umweltsystemwissenschaften / Dep. of Environmental Systems Science::02717 - Institut für Atmosphäre und Klima / Inst. Atmospheric and Climate Science::03777 - Knutti, Reto / Knutti, Reto||ETH Zürich::00002 - ETH Zürich::00012 - Lehre und Forschung::00007 - Departemente::02350 - Dep. Umweltsystemwissenschaften / Dep. of Environmental Systems Science::02717 - Institut für Atmosphäre und Klima / Inst. Atmospheric and Climate Science::03854 - Wernli, Johann Heinrich / Wernli, Johann Heinrich","03360||03777||03778||03854||09612||02717","09612||03360||03778||03777||03854",,,"50","36","London","published",,,,,"2023-01-11T08:31:36Z","2023-02-07T09:48:45Z","true",,"FORM",,,
"490280","20.500.11850/3","Pyrina, Maria||Domeisen, Daniela",,,,,,,,,,,,"2023-02-18T11:20:59Z","2022-11-16T08:27:52Z||2022-11-16T13:15:32Z||2022-12-09T08:00:32Z||2023-02-18T11:20:59Z",,"2023-01","2022-11-09","Successful weather forecasts on sub-seasonal time scales can support societal preparedness and mitigate the impacts of extreme events. Heatwaves in particular can in certain cases be predicted on timescales of several weeks in advance. Heatwave predictability is commonly assessed in terms of heatwave intensity. In addition to heatwave intensity, we assess the predictability of heatwave onset and duration, being crucial components of early warning systems and emergency preparedness plans. The forecast skill of heatwaves is investigated over the European region in the sub-seasonal forecasting system of the European Centre for Medium-Range Weather Forecasts (ECMWF). The heatwaves are first detected in ERA-Interim reanalysis data over the period 1998-2017 and then allocated into 6 clusters in the following regions: (a) Black Sea (BSea), (b) Russia (Ru), (c) Western Europe (WEu), (d) North Sea (NSea), (e) Scandinavia (Sc), and (f) Eastern Europe (EEu). The European regions with the highest predictability in heatwave onset and duration are the clusters Ru, Sc and NSea. The WEu cluster has the lowest bias in heatwave intensity and is found to be the most predictable region in terms of the number of heatwave events with predictable intensity at lead week-2. Heatwave intensity is generally found to be the most predictable characteristic of European heatwaves, being predictable by the model ensemble mean up to lead times of 3 weeks. Furthermore, this analysis identifies the most predictable heatwaves, allowing for a further investigation of the physical mechanisms and heatwave characteristics leading to enhanced heatwave forecast skill over different European regions.","application/pdf","10.3929/ethz-b-000580965",,"0035-9009||1477-870X","10.1002/qj.4394","http://hdl.handle.net/20.500.11850/580965","en","Wiley","Creative Commons Attribution-NonCommercial-NoDerivatives 4.0 International","http://creativecommons.org/licenses/by-nc-nd/4.0/","Heatwaves||sub-seasonal predictability||Europe||ECMWF||heatwave onset||heatwave duration||extreme events","Sub‐seasonal predictability of onset, duration, and intensity of European heat extremes","Journal Article","Open access",,,"2022-11-16T08:27:52Z",,,,,"yes","Improving the Prediction of Sub-seasonal to Seasonal Weather and Climate – From Theory to Application||Remote Drivers of Extreme Temperature Events","170523||198896","10.13039/501100001711||10.13039/501100001711","SNF||SNF","SNF-Förderungsprofessuren Stufe 2||SNF-Förderungsprofessuren: Fortsetzungsgesuche",,,"85143885257","000895943600001","Q. J. R. Meteorol. Soc.","750","Quarterly Journal of the Royal Meteorological Society","149","ETH Zürich::00002 - ETH Zürich::00012 - Lehre und Forschung::00007 - Departemente::02350 - Dep. Umweltsystemwissenschaften / Dep. of Environmental Systems Science||ETH Zürich::00002 - ETH Zürich::00012 - Lehre und Forschung::00007 - Departemente::02350 - Dep. Umweltsystemwissenschaften / Dep. of Environmental Systems Science::02717 - Institut für Atmosphäre und Klima / Inst. Atmospheric and Climate Science::09612 - Domeisen, Daniela / Domeisen, Daniela","ETH Zürich::00002 - ETH Zürich::00012 - Lehre und Forschung::00007 - Departemente::02350 - Dep. Umweltsystemwissenschaften / Dep. of Environmental Systems Science::02717 - Institut für Atmosphäre und Klima / Inst. Atmospheric and Climate Science::09612 - Domeisen, Daniela / Domeisen, Daniela","02350||09612","09612",,,"101","84","Oxford","published",,,,"true","2023-02-18T11:21:00Z","2023-02-18T11:21:00Z","true",,"FORM",,,"publishedVersion"
"489674","20.500.11850/3","Gao, Qinggang||Zeman, Christian||Vergara Temprado, Jesus||Lima, Daniela C.A.||Molnar, Peter||Schär, Christoph",,,,,,,,,,,,"2023-02-14T12:24:49Z","2023-02-13T14:35:03Z||2023-02-14T12:24:49Z",,"2023","2023-02-02","Atmospheric vortex streets are a widely studied dynamical effect of isolated mountainous islands. Observational evidence comes from case studies and satellite imagery, but the climatology and annual cycle of vortex shedding are often poorly understood. Using the non-hydrostatic limited-area COSMO model driven by the ERA-Interim reanalysis, we conducted a 10-year-long simulation over a mesoscale domain covering the Madeira and Canary archipelagos at high spatial (grid spacing of 1 km) and temporal resolutions. Basic properties of vortex streets were analysed and validated through a 6 d long case study in the lee of Madeira Island. The simulation compares well with satellite and aerial observations and with existing literature on idealised simulations. Our results show a strong dependency of vortex shedding on local and synoptic-flow conditions, which are to a large extent governed by the location, shape and strength of the Azores high. As part of the case study, we developed a vortex identification algorithm. The algorithm is based on a set of criteria and enabled us to develop a climatology of vortex shedding from Madeira Island for the 10-year simulation period. The analysis shows a pronounced annual cycle with an increasing vortex-shedding rate from April to August and a sudden decrease in September. This cycle is consistent with mesoscale wind conditions and local inversion height patterns.","application/pdf","10.3929/ethz-b-000598244",,"2698-4016||2698-4008","10.5194/wcd-4-189-2023","http://hdl.handle.net/20.500.11850/598244","en","Copernicus","Creative Commons Attribution 4.0 International","http://creativecommons.org/licenses/by/4.0/",,"Vortex streets to the lee of Madeira in a kilometre-resolution regional climate model","Journal Article","Open access",,,"2023-02-13T14:35:03Z",,,,,"yes","European Climate Prediction System","776613","10.13039/501100000780","EC","H2020",,,"85148005864",,"Weather Clim. Dynam.","1","Weather and Climate Dynamics","4","ETH Zürich::00002 - ETH Zürich::00012 - Lehre und Forschung::00007 - Departemente::02350 - Dep. Umweltsystemwissenschaften / Dep. of Environmental Systems Science::02717 - Institut für Atmosphäre und Klima / Inst. Atmospheric and Climate Science::03360 - Schär, Christoph / Schär, Christoph","ETH Zürich::00002 - ETH Zürich::00012 - Lehre und Forschung::00007 - Departemente::02350 - Dep. Umweltsystemwissenschaften / Dep. of Environmental Systems Science::02717 - Institut für Atmosphäre und Klima / Inst. Atmospheric and Climate Science::03360 - Schär, Christoph / Schär, Christoph","03360","03360",,,"211","189","Göttingen","published",,,,"true","2023-02-14T12:24:50Z","2023-02-14T12:24:50Z","true",,"FORM",,,"publishedVersion"
