"261137","20.500.11850/3","Sant, Vivek||Posselt, Rebekka||Lohmann, Ulrike",,,,"2018-10-31T12:47:22Z","2017-06-11T22:40:24Z||2018-10-31T12:47:22Z","2015","2015-08-07","A new parameterization with three prognostic liquid water classes was implemented into the general circulation model (GCM) ECHAM5 with the aerosol module HAM in order to improve the global representation of rain formation in marine stratiform clouds. The additionally introduced drizzle class improves the physical representation of the droplet spectrum and, more importantly, improves the microphysical processes relevant for precipitation formation compared to the standard parameterization. In order to avoid a mismatch of the liquid and ice phase, a prognostic treatment of snow has been introduced too. This has a significant effect on the amount and altitude of ice clouds, which in turn affects not only the in- and outgoing radiation but also the parameterized collection rates. With the introduction of a prognostic precipitation scheme, a more realistic representation of both liquid and ice phase large-scale precipitation is achieved compared to a diagnostic treatment. An encouraging finding is that with the prognostic treatment the increase of the liquid water path in response to anthropogenic aerosols is reduced by about 25 %. Although the total net radiative forcing is decreased from −1.3±0.3 to −1.6±0.3 W m−2 from the control to the prognostic model version, the difference is within the interannual variability. Altogether the results suggest that the treatment of precipitation in global circulation models has not only a significant influence on the phase of clouds and their conversion rates, but also hints towards uncertainties related to a prognostic precipitation scheme.","application/pdf","10.3929/ethz-b-000109439",,"1680-7375||1680-7367",,"10.5194/acp-15-8717-2015","http://hdl.handle.net/20.500.11850/109439","en","Copernicus","Creative Commons Attribution 3.0 Unported","http://creativecommons.org/licenses/by/3.0/",,"Prognostic precipitation with three liquid water classes in the ECHAM5-HAM GCM","Journal Article","Open access",,,"2017-06-11T22:41:01Z",,"pub:170533",,"yes",,,,,,,,,,"imp593653e243baa73815","004294181",,,,"Atmos. chem. phys.","15","Atmospheric Chemistry and Physics","15","ETH Zürich::00002 - ETH Zürich::00012 - Lehre und Forschung::00007 - Departemente::02350 - Dep. Umweltsystemwissenschaften / Dep. of Environmental Systems Science::02717 - Institut für Atmosphäre und Klima / Inst. Atmospheric and Climate Science::03690 - Lohmann, Ulrike / Lohmann, Ulrike","ETH Zürich::00002 - ETH Zürich::00012 - Lehre und Forschung::00007 - Departemente::02350 - Dep. Umweltsystemwissenschaften / Dep. of Environmental Systems Science::02717 - Institut für Atmosphäre und Klima / Inst. Atmospheric and Climate Science::03690 - Lohmann, Ulrike / Lohmann, Ulrike","03690","03690",,"8738","8717","Göttingen","published",,,,,,"2017-07-18T15:30:14Z","2023-02-06T16:33:24Z","true",,"ECIT",,"publishedVersion"
"293567","20.500.11850/3","Tuccella, Paolo||Curci, Gabriele||Grell, Georg A.||Visconti, Guido||Crumeroylle, Suzanne||Schwarzenboeck, Alfonso||Mensah, Amewu Antoinette",,,,"2019-05-16T15:12:40Z","2017-06-11T22:40:27Z||2019-05-16T15:12:40Z","2015","2015-09-04","A parameterization for secondary organic aerosol (SOA) production based on the volatility basis set (VBS) approach has been coupled with microphysics and radiative schemes in the Weather Research and Forecasting model with Chemistry (WRF-Chem) model. The new chemistry option called ""RACM-MADE-VBS-AQCHEM"" was evaluated on a cloud resolving scale against ground-based and aircraft measurements collected during the IMPACT-EUCAARI (Intensive Cloud Aerosol Measurement Campaign – European Integrated project on Aerosol Cloud Climate and Air quality interaction) campaign, and complemented with satellite data from MODIS. The day-to-day variability and the diurnal cycle of ozone (O3) and nitrogen oxides (NOx) at the surface are captured by the model. Surface aerosol mass concentrations of sulfate (SO4), nitrate (NO3), ammonium (NH4), and organic matter (OM) are simulated with correlations larger than 0.55. WRF-Chem captures the vertical profile of the aerosol mass concentration in both the planetary boundary layer (PBL) and free troposphere (FT) as a function of the synoptic condition, but the model does not capture the full range of the measured concentrations. Predicted OM concentration is at the lower end of the observed mass concentrations. The bias may be attributable to the missing aqueous chemistry processes of organic compounds and to uncertainties in meteorological fields. A key role could be played by assumptions on the VBS approach such as the SOA formation pathways, oxidation rate, and dry deposition velocity of organic condensable vapours. Another source of error in simulating SOA is the uncertainties in the anthropogenic emissions of primary organic carbon. Aerosol particle number concentration (condensation nuclei, CN) is overestimated by a factor of 1.4 and 1.7 within the PBL and FT, respectively. Model bias is most likely attributable to the uncertainties of primary particle emissions (mostly in the PBL) and to the nucleation rate. Simulated cloud condensation nuclei (CCN) are also overestimated, but the bias is more contained with respect to that of CN. The CCN efficiency, which is a characterization of the ability of aerosol particles to nucleate cloud droplets, is underestimated by a factor of 1.5 and 3.8 in the PBL and FT, respectively. The comparison with MODIS data shows that the model overestimates the aerosol optical thickness (AOT). The domain averages (for 1 day) are 0.38 ± 0.12 and 0.42 ± 0.10 for MODIS and WRF-Chem data, respectively. The droplet effective radius (Re) in liquid-phase clouds is underestimated by a factor of 1.5; the cloud liquid water path (LWP) is overestimated by a factor of 1.1–1.6. The consequence is the overestimation of average liquid cloud optical thickness (COT) from a few percent up to 42 %. The predicted cloud water path (CWP) in all phases displays a bias in the range +41–80 %, whereas the bias of COT is about 15 %. In sensitivity tests where we excluded SOA, the skills of the model in reproducing the observed patterns and average values of the microphysical and optical properties of liquid and all phase clouds decreases. Moreover, the run without SOA (NOSOA) shows convective clouds with an enhanced content of liquid and frozen hydrometers, and stronger updrafts and downdrafts. Considering that the previous version of WRF-Chem coupled with a modal aerosol module predicted very low SOA content (secondary organic aerosol model (SORGAM) mechanism) the new proposed option may lead to a better characterization of aerosol–cloud feedbacks.","application/pdf","10.3929/ethz-b-000109444",,"1991-9603||1991-959X",,"10.5194/gmd-8-2749-2015","http://hdl.handle.net/20.500.11850/109444","en","Copernicus Publications","Creative Commons Attribution 3.0 Unported","http://creativecommons.org/licenses/by/3.0/",,"A new chemistry option in WRF/Chem v. 3.4 for the simulation of direct and indirect aerosol effects using VBS: Evaluation against IMPACT-EUCAARI data","Journal Article","Open access",,,"2017-06-11T22:41:01Z",,"pub:170539",,"yes",,,,,,,,,,"imp593653e25e29c57509","010180250",,,,"Geosci. model dev.","9","Geoscientific Model Development","8","ETH Zürich::00002 - ETH Zürich::00012 - Lehre und Forschung::00007 - Departemente::02350 - Dep. Umweltsystemwissenschaften / Dep. of Environmental Systems Science::02717 - Institut für Atmosphäre und Klima / Inst. Atmospheric and Climate Science::03690 - Lohmann, Ulrike / Lohmann, Ulrike","ETH Zürich::00002 - ETH Zürich::00012 - Lehre und Forschung::00007 - Departemente::02350 - Dep. Umweltsystemwissenschaften / Dep. of Environmental Systems Science::02717 - Institut für Atmosphäre und Klima / Inst. Atmospheric and Climate Science::03690 - Lohmann, Ulrike / Lohmann, Ulrike","03690","03690",,"2776","2749","Göttingen","published",,,,,,"2017-07-19T10:51:10Z","2023-02-06T17:07:36Z","true",,"ECIT",,"publishedVersion"
"293484","20.500.11850/3","Rautenhaus, Marc||Grams, Christian M.||Schäfler, Andreas||Westermann, Rüdiger",,,,"2019-05-16T09:23:35Z","2017-06-11T18:53:23Z||2019-05-16T09:23:35Z","2015","2015-07-31","We present the application of interactive three-dimensional (3-D) visualization of ensemble weather predictions to forecasting warm conveyor belt situations during aircraft-based atmospheric research campaigns. Motivated by forecast requirements of the T-NAWDEX-Falcon 2012 (THORPEX – North Atlantic Waveguide and Downstream Impact Experiment) campaign, a method to predict 3-D probabilities of the spatial occurrence of warm conveyor belts (WCBs) has been developed. Probabilities are derived from Lagrangian particle trajectories computed on the forecast wind fields of the European Centre for Medium Range Weather Forecasts (ECMWF) ensemble prediction system. Integration of the method into the 3-D ensemble visualization tool Met.3D, introduced in the first part of this study, facilitates interactive visualization of WCB features and derived probabilities in the context of the ECMWF ensemble forecast. We investigate the sensitivity of the method with respect to trajectory seeding and grid spacing of the forecast wind field. Furthermore, we propose a visual analysis method to quantitatively analyse the contribution of ensemble members to a probability region and, thus, to assist the forecaster in interpreting the obtained probabilities. A case study, revisiting a forecast case from T-NAWDEX-Falcon, illustrates the practical application of Met.3D and demonstrates the use of 3-D and uncertainty visualization for weather forecasting and for planning flight routes in the medium forecast range (3 to 7 days before take-off).","application/pdf","10.3929/ethz-b-000103465",,"1991-9603||1991-959X",,"10.5194/gmd-8-2355-2015","http://hdl.handle.net/20.500.11850/103465","en","Copernicus Publications","Creative Commons Attribution 3.0 Unported","http://creativecommons.org/licenses/by/3.0/",,"Three-dimensional visualization of ensemble weather forecasts - Part 2: Forecasting warm conveyor belt situations for aircraft-based field campaigns","Journal Article","Open access",,,"2017-06-11T18:53:26Z",,"pub:161711",,"yes",,,,,,,,,,"imp593653683875e35403","010180250",,,"000358917100025","Geosci. model dev.","7","Geoscientific Model Development","8","ETH Zürich::00002 - ETH Zürich::00012 - Lehre und Forschung::00007 - Departemente::02350 - Dep. Umweltsystemwissenschaften / Dep. of Environmental Systems Science::02717 - Institut für Atmosphäre und Klima / Inst. Atmospheric and Climate Science::03854 - Wernli, Johann Heinrich / Wernli, Johann Heinrich","ETH Zürich::00002 - ETH Zürich::00012 - Lehre und Forschung::00007 - Departemente::02350 - Dep. Umweltsystemwissenschaften / Dep. of Environmental Systems Science::02717 - Institut für Atmosphäre und Klima / Inst. Atmospheric and Climate Science::03854 - Wernli, Johann Heinrich / Wernli, Johann Heinrich","03854","03854",,"2377","2355","Göttingen","published",,,,,,"2017-08-02T12:00:16Z","2023-02-06T17:06:52Z","true",,"ECIT",,"publishedVersion"
"293468","20.500.11850/3","Stegehuis, Annemiek I.||Vautard, Robert||Ciais, Philippe||Teuling, Adriaan J.||Miralles, Diego G.||Wild, Martin",,,,"2019-05-16T08:06:44Z","2017-06-11T18:55:20Z||2019-05-16T08:05:33Z||2019-05-16T08:06:44Z","2015","2015-07-29","Many climate models have difficulties in properly reproducing climate extremes, such as heat wave conditions. Here we use the Weather Research and Forecasting (WRF) regional climate model with a large combination of different atmospheric physics schemes, in combination with the NOAH land-surface scheme, with the goal of detecting the most sensitive physics and identifying those that appear most suitable for simulating the heat wave events of 2003 in western Europe and 2010 in Russia. In total, 55 out of 216 simulations combining different atmospheric physical schemes have a temperature bias smaller than 1 °C during the heat wave episodes, the majority of simulations showing a cold bias of on average 2–3 °C. Conversely, precipitation is mostly overestimated prior to heat waves, and shortwave radiation is slightly overestimated. Convection is found to be the most sensitive atmospheric physical process impacting simulated heat wave temperature across four different convection schemes in the simulation ensemble. Based on these comparisons, we design a reduced ensemble of five well performing and diverse scheme configurations, which may be used in the future to perform heat wave analysis and to investigate the impact of climate change during summer in Europe.","application/pdf","10.3929/ethz-b-000103466",,"1991-9603||1991-959X",,"10.5194/gmd-8-2285-2015","http://hdl.handle.net/20.500.11850/103466","en","Copernicus Publications","Creative Commons Attribution 3.0 Unported","http://creativecommons.org/licenses/by/3.0/",,"An observation-constrained multi-physics WRF ensemble for simulating European mega heat waves","Journal Article","Open access",,,"2017-06-11T18:56:27Z",,"pub:161712",,"yes",,,,,,,,,,"imp593653683d77f53947","010180250",,,"000358917100021","Geosci. model dev.","7","Geoscientific Model Development","8","ETH Zürich::00002 - ETH Zürich::00012 - Lehre und Forschung::00007 - Departemente::02350 - Dep. Umweltsystemwissenschaften / Dep. of Environmental Systems Science::02717 - Institut für Atmosphäre und Klima / Inst. Atmospheric and Climate Science::03360 - Schär, Christoph / Schär, Christoph","ETH Zürich::00002 - ETH Zürich::00012 - Lehre und Forschung::00007 - Departemente::02350 - Dep. Umweltsystemwissenschaften / Dep. of Environmental Systems Science::02717 - Institut für Atmosphäre und Klima / Inst. Atmospheric and Climate Science::03360 - Schär, Christoph / Schär, Christoph","03360","03360",,"2298","2285","Göttingen","published",,,,,,"2017-07-26T19:18:35Z","2023-02-06T17:06:44Z","true",,"ECIT",,"publishedVersion"
"256759","20.500.11850/3","Wex, Heike||Augustin-Bauditz, Stefanie||Boose, Yvonne||Budke, Carsten||Curtius, Joachim||Diehl, Karoline||Dreyer, Axel||Frank, F.||Hartmann, Susan||Hiranuma, Naruki||Jantsch, E.||Kanji, Zamin A||Kiselev, Alexei A.||Koop, Thomas||Möhler, Ottmar||Niedermeier, Dennis||Nillius, Björn||Rosch, M.||Rose, Diana||Schmidt, C.||Steinke, Isabelle||Stratmann, Frank",,,,"2018-10-08T13:43:23Z","2017-06-11T16:53:48Z||2018-10-08T13:43:23Z","2015","2015-02-10","Seven different instruments and measurement methods were used to examine the immersion freezing of bacterial ice nuclei from Snomax® (hereafter Snomax), a product containing ice-active protein complexes from non-viable Pseudomonas syringae bacteria. The experimental conditions were kept as similar as possible for the different measurements. Of the participating instruments, some examined droplets which had been made from suspensions directly, and the others examined droplets activated on previously generated Snomax particles, with particle diameters of mostly a few hundred nanometers and up to a few micrometers in some cases. Data were obtained in the temperature range from −2 to −38 °C, and it was found that all ice-active protein complexes were already activated above −12 °C. Droplets with different Snomax mass concentrations covering 10 orders of magnitude were examined. Some instruments had very short ice nucleation times down to below 1 s, while others had comparably slow cooling rates around 1 K min−1. Displaying data from the different instruments in terms of numbers of ice-active protein complexes per dry mass of Snomax, nm, showed that within their uncertainty, the data agree well with each other as well as to previously reported literature results. Two parameterizations were taken from literature for a direct comparison to our results, and these were a time-dependent approach based on a contact angle distribution (Niedermeier et al., 2014) and a modification of the parameterization presented in Hartmann et al. (2013) representing a time-independent approach. The agreement between these and the measured data were good; i.e., they agreed within a temperature range of 0.6 K or equivalently a range in nm of a factor of 2. From the results presented herein, we propose that Snomax, at least when carefully shared and prepared, is a suitable material to test and compare different instruments for their accuracy of measuring immersion freezing.","application/pdf","10.3929/ethz-b-000099824",,"1680-7375||1680-7367",,"10.5194/acp-15-1463-2015","http://hdl.handle.net/20.500.11850/99824","en","Copernicus","Creative Commons Attribution 3.0 Unported","http://creativecommons.org/licenses/by/3.0/",,"Intercomparing different devices for the investigation of ice nucleating particles using Snomax (R) as test substance","Journal Article","Open access",,,"2017-06-11T16:54:28Z",,"pub:156280",,"yes",,,,,,,,,,"imp59365313c83e687731","004294181","84922953880",,"000349799500021","Atmos. chem. phys.","3","Atmospheric Chemistry and Physics","15","ETH Zürich::00002 - ETH Zürich::00012 - Lehre und Forschung::00007 - Departemente::02350 - Dep. Umweltsystemwissenschaften / Dep. of Environmental Systems Science::02717 - Institut für Atmosphäre und Klima / Inst. Atmospheric and Climate Science::03690 - Lohmann, Ulrike / Lohmann, Ulrike","ETH Zürich::00002 - ETH Zürich::00012 - Lehre und Forschung::00007 - Departemente::02350 - Dep. Umweltsystemwissenschaften / Dep. of Environmental Systems Science::02717 - Institut für Atmosphäre und Klima / Inst. Atmospheric and Climate Science::03690 - Lohmann, Ulrike / Lohmann, Ulrike","03690","03690",,"1485","1463","Göttingen","published",,,,,,"2017-07-26T19:16:09Z","2023-02-06T16:00:48Z","true",,"ECIT",,"publishedVersion"
"255207","20.500.11850/3","Lüthi, Z.L.||Škerlak, Bojan||Kim, S.-W.||Lauer, Axel||Mues, Andrea||Rupakheti, Maheswar||Kang, Shichang",,,,"2018-09-27T12:35:53Z","2017-06-11T18:08:13Z||2018-09-27T12:35:53Z","2015","2015-06-01","The Himalayas and the Tibetan Plateau region (HTP), despite being a remote and sparsely populated area, is regularly exposed to polluted air masses with significant amounts of aerosols including black carbon. These dark, light-absorbing particles are known to exert a great melting potential on mountain cryospheric reservoirs through albedo reduction and radiative forcing. This study combines ground-based and satellite remote sensing data to identify a severe aerosol pollution episode observed simultaneously in central Tibet and on the southern side of the Himalayas during 13–19 March 2009 (pre-monsoon). Trajectory calculations based on the high-resolution numerical weather prediction model COSMO are used to locate the source regions and study the mechanisms of pollution transport in the complex topography of the HTP. We detail how polluted air masses from an atmospheric brown cloud (ABC) over South Asia reach the Tibetan Plateau within a few days. Lifting and advection of polluted air masses over the great mountain range is enabled by a combination of synoptic-scale and local meteorological processes. During the days prior to the event, winds over the Indo-Gangetic Plain (IGP) are generally weak at lower levels, allowing for accumulation of pollutants and thus the formation of ABCs. The subsequent passing of synoptic-scale troughs leads to southwesterly flow in the middle troposphere over northern and central India, carrying the polluted air masses across the Himalayas. As the IGP is known to be a hotspot of ABCs, the cross-Himalayan transport of polluted air masses may have serious implications for the cryosphere in the HTP and impact climate on regional to global scales. Since the current study focuses on one particularly strong pollution episode, quantifying the frequency and magnitude of similar events in a climatological study is required to assess the total impact.","application/pdf","10.3929/ethz-b-000102147",,"1680-7375||1680-7367",,"10.5194/acp-15-6007-2015","http://hdl.handle.net/20.500.11850/102147","en","Copernicus","Creative Commons Attribution 3.0 Unported","http://creativecommons.org/licenses/by/3.0/",,"Atmospheric brown clouds reach the Tibetan Plateau by crossing the Himalayas","Journal Article","Open access",,,"2017-06-11T18:08:34Z",,"pub:160274",,"yes",,,,,,,,,,"imp593653498d9fc69519","004294181",,,"000356180900001","Atmos. chem. phys.","11","Atmospheric Chemistry and Physics","15","ETH Zürich::00002 - ETH Zürich::00012 - Lehre und Forschung::00007 - Departemente::02350 - Dep. Umweltsystemwissenschaften / Dep. of Environmental Systems Science::02717 - Institut für Atmosphäre und Klima / Inst. Atmospheric and Climate Science::03854 - Wernli, Johann Heinrich / Wernli, Johann Heinrich","ETH Zürich::00002 - ETH Zürich::00012 - Lehre und Forschung::00007 - Departemente::02350 - Dep. Umweltsystemwissenschaften / Dep. of Environmental Systems Science::02717 - Institut für Atmosphäre und Klima / Inst. Atmospheric and Climate Science::03854 - Wernli, Johann Heinrich / Wernli, Johann Heinrich","03854","03854",,"6021","6007","Göttingen","published",,,,,,"2017-07-20T14:27:29Z","2023-02-06T15:56:20Z","true",,"ECIT",,"publishedVersion"
