"396404","20.500.11850/4","Baldwin, Mark P.||Ayarzagüena, Blanca||Birner, Thomas||Butchart, Neal||Butler, Amy H.||Charlton‐Perez, Andrew J.||Domeisen, Daniela||Garfinkel, Chaim I.||Garny, Hella||Gerber, Edwin P.||Hegglin, Michaela I.||Langematz, Ulrike||Pedatella, Nicholas M.",,,,,,,,,,,,"2021-03-29T14:46:11Z","2020-12-04T12:22:55Z||2020-12-15T07:18:32Z||2021-03-29T14:46:11Z",,"2021-03","2020-11-23","Sudden stratospheric warmings (SSWs) are impressive fluid dynamical events in which large and rapid temperature increases in the winter polar stratosphere (⁓10‐50km) are associated with a complete reversal of the climatological wintertime westerly winds. SSWs are caused by the breaking of planetary‐scale waves that propagate upwards from the troposphere. During an SSW, the polar vortex breaks down, accompanied by rapid descent and warming of air in polar latitudes, mirrored by ascent and cooling above the warming. The rapid warming and descent of the polar air column affects tropospheric weather, shifting jet streams, storm tracks, and the Northern Annular Mode, making cold air outbreaks over North America and Eurasia more likely. SSWs affect the atmosphere above the stratosphere, producing widespread effects on atmospheric chemistry, temperatures, winds, neutral (non‐ionized) particles and electron densities, and electric fields. These effects span both hemispheres. Given their crucial role in the whole atmosphere, SSWs are also seen as a key process to analyze in climate change studies and subseasonal to seasonal prediction. This work reviews the current knowledge on the most important aspects of SSWs, from the historical background to dynamical processes, modelling, chemistry, and impact on other atmospheric layers.",,,"8755-1209||0096-1043||1944-9208",,"10.1029/2020rg000708","http://hdl.handle.net/20.500.11850/454629","en","American Geophysical Union",,,"middle atmosphere||QBO||stratosphere||upper atmosphere||weather forecasts","Sudden Stratospheric Warmings","Review Article","Metadata only",,,,,"2020-12-04T12:23:07Z",,,,,,"yes",,,,,,,"Improving the Prediction of Sub-seasonal to Seasonal Weather and Climate – From Theory to Application","170523","10.13039/501100001711","SNF","SNF-Förderungsprofessuren Stufe 2",,,"85101020395","000635222000002","Rev. Geophys.","1","Reviews of Geophysics","59","ETH Zürich::00002 - ETH Zürich::00012 - Lehre und Forschung::00007 - Departemente::02350 - Dep. Umweltsystemwissenschaften / Dep. of Environmental Systems Science::02717 - Institut für Atmosphäre und Klima / Inst. Atmospheric and Climate Science::09612 - Domeisen, Daniela / Domeisen, Daniela","ETH Zürich::00002 - ETH Zürich::00012 - Lehre und Forschung::00007 - Departemente::02350 - Dep. Umweltsystemwissenschaften / Dep. of Environmental Systems Science::02717 - Institut für Atmosphäre und Klima / Inst. Atmospheric and Climate Science::09612 - Domeisen, Daniela / Domeisen, Daniela","09612","09612",,,,"e2020RG000708","Washington, DC","published",,,,,,,,,,,,"2021-03-29T14:46:22Z","2022-03-29T06:05:56Z","true","37 p.","FORM",,,
"394623","20.500.11850/3","Tebaldi, Claudia||Debeire, Kevin||Eyring, Veronika||Fischer, Erich||Fyfe, John||Friedlingstein, Pierre||Knutti, Reto||Lowe, Jason||O'Neill, Brian C.||Sanderson, Benjamin||Van Vuuren, Detlef||Riahi, Keywan||Meinshausen, Malte||Nicholls, Zebedee||Tokarska, Katarzyna B.||Hurtt, George||Kriegler, Elmar||Lamarque, Jean-François||Meehl, Gerald||Moss, Richard||Bauer, Susanne E.||Boucher, Olivier||Brovkin, Victor||Byun, Young-Hwa||Dix, Martin||Gualdi, Silvio||Guo, Huan||John, Jasmin G.||Kharin, Slava||Kim, YoungHo||Koshiro, Tsuyoshi||Ma, Libin||Olivié, Dirk||Panickal, Swapna||Qiao, Fangli||Rong, Xinyao||Rosenbloom, Nan||Schupfner, Martin||Séférian, Roland||Sellar, Alistair||Semmler, Tido||Shi, Xiaoying||Song, Zhenya||Steger, Christian||Stouffer, Ronald||Swart, Neil||Tachiiri, Kaoru||Tang, Qi||Tatebe, Hiroaki||Voldoire, Aurore||Volodin, Evgeny||Wyser, Klaus||Xin, Xiaoge||Yang, Shuting||Yu, Yongqiang||Ziehn, Tilo",,,,,,,,,,,,"2021-03-15T09:35:57Z","2021-03-15T05:23:34Z||2021-03-15T09:35:57Z",,"2021-03-01","2021-03-01","The Scenario Model Intercomparison Project (ScenarioMIP) defines and coordinates the main set of future climate projections, based on concentration-driven simulations, within the Coupled Model Intercomparison Project phase 6 (CMIP6). This paper presents a range of its outcomes by synthesizing results from the participating global coupled Earth system models. We limit our scope to the analysis of strictly geophysical outcomes: mainly global averages and spatial patterns of change for surface air temperature and precipitation. We also compare CMIP6 projections to CMIP5 results, especially for those scenarios that were designed to provide continuity across the CMIP phases, at the same time highlighting important differences in forcing composition, as well as in results. The range of future temperature and precipitation changes by the end of the century (2081–2100) encompassing the Tier 1 experiments based on the Shared Socioeconomic Pathway (SSP) scenarios (SSP1-2.6, SSP2-4.5, SSP3-7.0 and SSP5-8.5) and SSP1-1.9 spans a larger range of outcomes compared to CMIP5, due to higher warming (by close to 1.5 ∘C) reached at the upper end of the 5 %–95 % envelope of the highest scenario (SSP5-8.5). This is due to both the wider range of radiative forcing that the new scenarios cover and the higher climate sensitivities in some of the new models compared to their CMIP5 predecessors. Spatial patterns of change for temperature and precipitation averaged over models and scenarios have familiar features, and an analysis of their variations confirms model structural differences to be the dominant source of uncertainty. Models also differ with respect to the size and evolution of internal variability as measured by individual models' initial condition ensemble spreads, according to a set of initial condition ensemble simulations available under SSP3-7.0. These experiments suggest a tendency for internal variability to decrease along the course of the century in this scenario, a result that will benefit from further analysis over a larger set of models. Benefits of mitigation, all else being equal in terms of societal drivers, appear clearly when comparing scenarios developed under the same SSP but to which different degrees of mitigation have been applied. It is also found that a mild overshoot in temperature of a few decades around mid-century, as represented in SSP5-3.4OS, does not affect the end outcome of temperature and precipitation changes by 2100, which return to the same levels as those reached by the gradually increasing SSP4-3.4 (not erasing the possibility, however, that other aspects of the system may not be as easily reversible). Central estimates of the time at which the ensemble means of the different scenarios reach a given warming level might be biased by the inclusion of models that have shown faster warming in the historical period than the observed. Those estimates show all scenarios reaching 1.5 ∘C of warming compared to the 1850–1900 baseline in the second half of the current decade, with the time span between slow and fast warming covering between 20 and 27 years from present. The warming level of 2 ∘C of warming is reached as early as 2039 by the ensemble mean under SSP5-8.5 but as late as the mid-2060s under SSP1-2.6. The highest warming level considered (5 ∘C) is reached by the ensemble mean only under SSP5-8.5 and not until the mid-2090s.","application/pdf","10.3929/ethz-b-000474394","2190-4987||2190-4979",,"10.5194/esd-12-253-2021","http://hdl.handle.net/20.500.11850/474394","en","Copernicus","Creative Commons Attribution 4.0 International","http://creativecommons.org/licenses/by/4.0/",,"Climate model projections from the Scenario Model Intercomparison Project (ScenarioMIP) of CMIP6","Journal Article","Open access",,,,,"2021-03-15T05:23:41Z",,,,,,"yes",,,,,,,"Coordinated Research in Earth Systems and Climate: Experiments, kNowledge, Dissemination and Outreach||LC-CLA-08-2018 | RIA | Constraining uncertainty of multi decadal climate projections","641816||820829","10.13039/501100007352||10.13039/501100000780","SBFI||EC","H2020||H2020",,,"85102007893","000625878300001",,"1","Earth System Dynamics","12","ETH Zürich::00002 - ETH Zürich::00012 - Lehre und Forschung::00007 - Departemente::02350 - Dep. Umweltsystemwissenschaften / Dep. of Environmental Systems Science::02717 - Institut für Atmosphäre und Klima / Inst. Atmospheric and Climate Science::03777 - Knutti, Reto / Knutti, Reto","ETH Zürich::00002 - ETH Zürich::00012 - Lehre und Forschung::00007 - Departemente::02350 - Dep. Umweltsystemwissenschaften / Dep. of Environmental Systems Science::02717 - Institut für Atmosphäre und Klima / Inst. Atmospheric and Climate Science::03777 - Knutti, Reto / Knutti, Reto","03777","03777",,,"293","253","Göttingen","published",,,,,,,,,,,,"2021-03-15T09:36:10Z","2022-03-29T05:45:55Z","true",,"SCOPUS",,"publishedVersion",
"396015","20.500.11850/3","Pokhrel, Yadu||Felfelani, Farshid||Satoh, Yusuke||Boulange, Julien||Burek, Peter||Gädeke, Anne||Gerten, Dieter||Gosling, Simon N.||Grillakis, Manolis||Gudmundsson, Lukas||Hanasaki, Naota||Kim, Hyungjun||Koutroulis, Aristeidis||Liu, Junguo||Papadimitriou, Lamprini||Schewe, Jacob||Müller Schmied, Hannes||Stacke, Tobias||Telteu, Camelia-Eliza||Thiery, Wim||Veldkamp, Ted||Zhao, Fang||Wada, Yoshihide",,,,,,,,,,,,"2021-03-25T14:10:31Z","2021-01-28T21:30:17Z||2021-02-03T07:43:26Z||2021-03-25T14:10:31Z",,"2021-03","2021-01-11","Terrestrial water storage (TWS) modulates the hydrological cycle and is a key determinant of water availability and an indicator of drought. While historical TWS variations have been increasingly studied, future changes in TWS and the linkages to droughts remain unexamined. Here, using ensemble hydrological simulations, we show that climate change could reduce TWS in many regions, especially those in the Southern Hemisphere. Strong inter-ensemble agreement indicates high confidence in the projected changes that are driven primarily by climate forcing rather than land and water management activities. Declines in TWS translate to increases in future droughts. By the late twenty-first century, the global land area and population in extreme-to-exceptional TWS drought could more than double, each increasing from 3% during 1976-2005 to 7% and 8%, respectively. Our findings highlight the importance of climate change mitigation to avoid adverse TWS impacts and increased droughts, and the need for improved water resource management and adaptation.",,,"1758-6798",,"10.1038/s41558-020-00972-w","http://hdl.handle.net/20.500.11850/466499","en","Nature",,,,"Global terrestrial water storage and drought severity under climate change","Journal Article","Metadata only",,,,,"2021-01-28T21:30:22Z",,,,,,"yes",,,,,,,"European Climate Prediction System","776613","10.13039/501100000780","EC","H2020",,,"85100196380","000607033900005","Nat. Clim. Chang.","3","Nature Climate Change","11","ETH Zürich::00002 - ETH Zürich::00012 - Lehre und Forschung::00007 - Departemente::02350 - Dep. Umweltsystemwissenschaften / Dep. of Environmental Systems Science::02717 - Institut für Atmosphäre und Klima / Inst. Atmospheric and Climate Science::03778 - Seneviratne, Sonia / Seneviratne, Sonia","ETH Zürich::00002 - ETH Zürich::00012 - Lehre und Forschung::00007 - Departemente::02350 - Dep. Umweltsystemwissenschaften / Dep. of Environmental Systems Science::02717 - Institut für Atmosphäre und Klima / Inst. Atmospheric and Climate Science::03778 - Seneviratne, Sonia / Seneviratne, Sonia","03778","03778",,,"233","226","London","published",,,,,,,,,,,,"2021-03-25T14:10:39Z","2022-03-29T05:59:36Z","true",,"WOS",,,
"396035","20.500.11850/3","Gillett, Nathan P.||Kirchmeier-Young, Megan||Ribes, Aurélien||Shiogama, Hideo||Hegerl, Gabriele C.||Knutti, Reto||Gastineau, Guillaume||John, Jasmin G.||Li, Lijuan||Nazarenko, Larissa||Rosenbloom, Nan||Seland, Øyvind||Wu, Tongwen||Yukimoto, Seiji||Ziehn, Tilo",,,,,,,,,,,,"2021-03-25T15:04:21Z","2021-02-06T03:42:46Z||2021-02-09T11:24:56Z||2021-03-25T15:04:21Z",,"2021-03","2021-01-18","Parties to the Paris Agreement agreed to holding global average temperature increases ""well below 2 degrees C above pre-industrial levels and pursuing efforts to limit the temperature increase to 1.5 degrees C above pre-industrial levels"". Monitoring the contributions of human-induced climate forcings to warming so far is key to understanding progress towards these goals. Here we use climate model simulations from the Detection and Attribution Model Intercomparison Project, as well as regularized optimal fingerprinting, to show that anthropogenic forcings caused 0.9 to 1.3 degrees C of warming in global mean near-surface air temperature in 2010-2019 relative to 1850-1900, compared with an observed warming of 1.1 degrees C. Greenhouse gases and aerosols contributed changes of 1.2 to 1.9 degrees C and -0.7 to -0.1 degrees C, respectively, and natural forcings contributed negligibly. These results demonstrate the substantial human influence on climate so far and the urgency of action needed to meet the Paris Agreement goals.",,,"1758-6798",,"10.1038/s41558-020-00965-9","http://hdl.handle.net/20.500.11850/468146","en","Nature Publishing Group",,,,"Constraining human contributions to observed warming since the pre-industrial period","Journal Article","Metadata only",,,,,"2021-02-06T03:42:51Z",,,,,,"yes",,,,,,,,,,,,,,"85100212968","000608681000003","Nat. Clim. Chang.","3","Nature Climate Change","11","ETH Zürich::00002 - ETH Zürich::00012 - Lehre und Forschung::00007 - Departemente::02350 - Dep. Umweltsystemwissenschaften / Dep. of Environmental Systems Science::02717 - Institut für Atmosphäre und Klima / Inst. Atmospheric and Climate Science::03777 - Knutti, Reto / Knutti, Reto","ETH Zürich::00002 - ETH Zürich::00012 - Lehre und Forschung::00007 - Departemente::02350 - Dep. Umweltsystemwissenschaften / Dep. of Environmental Systems Science::02717 - Institut für Atmosphäre und Klima / Inst. Atmospheric and Climate Science::03777 - Knutti, Reto / Knutti, Reto","03777","03777",,,"212","207","London","published",,,,,,,,,,,,"2021-03-25T15:04:30Z","2022-03-29T05:59:45Z","true",,"WOS",,,
"406152","20.500.11850/3","Fearon, Matthew G.||Doyle, James D.||Ryglicki, David R.||Finocchio, Peter M.||Sprenger, Michael",,,,,,,,,,,,"2021-06-16T06:55:07Z","2021-06-16T02:59:06Z||2021-06-16T06:55:07Z",,"2021-02-28","2020-02-06","In this study, ERA5 reanalysis is used to quantify cyclone-induced moisture transport into the Arctic on a seasonal basis (1998–2018). Moist airstreams are spatially identified and temporally linked to individual cyclones (50–90°N). Results show that cyclones account for 74% of the annual poleward flux across 70°N. For these cyclone cases, which primarily emerge over the central Arctic in summer or otherwise originate from the North Atlantic, the amount of moisture transport is found to closely depend on track orientation and poleward propagation. Cyclone tracks oriented in the poleward direction along with coupling to an upper-level vortex which influences the steering flow are the most important characteristics that determine the moisture flux into the Arctic. Back trajectories highlight low-level moisture source regions over the Atlantic Gulf Stream throughout the year and over the high-latitude continental land surface during the warm season.","application/pdf",,"0094-8276||1944-8007",,"10.1029/2020GL090353","http://hdl.handle.net/20.500.11850/489747","en","John Wiley & Sons",,,,"The Role of Cyclones in Moisture Transport into the Arctic","Journal Article","Metadata only",,,,,"2021-06-16T02:59:09Z",,,,,,"yes",,,,,,,,,,,,,,"85101505237","000623802900020","Geophys. Res. Lett.","4","Geophysical Research Letters","48","ETH Zürich::00002 - ETH Zürich::00012 - Lehre und Forschung::00007 - Departemente::02350 - Dep. Umweltsystemwissenschaften / Dep. of Environmental Systems Science::02717 - Institut für Atmosphäre und Klima / Inst. Atmospheric and Climate Science||ETH Zürich::00002 - ETH Zürich::00012 - Lehre und Forschung::00007 - Departemente::02350 - Dep. Umweltsystemwissenschaften / Dep. of Environmental Systems Science::02717 - Institut für Atmosphäre und Klima / Inst. Atmospheric and Climate Science::03854 - Wernli, Johann Heinrich / Wernli, Johann Heinrich","ETH Zürich::00002 - ETH Zürich::00012 - Lehre und Forschung::00007 - Departemente::02350 - Dep. Umweltsystemwissenschaften / Dep. of Environmental Systems Science::02717 - Institut für Atmosphäre und Klima / Inst. Atmospheric and Climate Science::03854 - Wernli, Johann Heinrich / Wernli, Johann Heinrich","02717||03854","03854",,,,"e2020GL090353","s.l.","published",,,,,,,,,,,,"2021-06-16T06:55:14Z","2022-03-29T08:47:26Z","true","11 p.","SCOPUS",,,
"394619","20.500.11850/3","Reinares Martínez, Irene||Evan, Stephanie||Wienhold, Frank||Brioude, Jerome||Jensen, Eric||Thornberry, Troy||Héron, Damien||Verreyken, B.||Körner, S.||Vömel, Holger||Metzger, Jean-Marc||Posny, Francoise",,,,,,,,,,,,"2021-03-15T09:48:24Z","2021-03-13T04:32:14Z||2021-03-15T09:48:24Z",,"2021-02-28","2020-12-17","A nascent in situ cirrus was observed on January 11, 2019 in the tropical tropopause layer (TTL) over the southwestern Indian Ocean, with the use of balloon‐borne instruments. Data from cryogenic frost point hygrometer (CFH) and Compact Optical Backscatter and AerosoL Detector (COBALD) instruments were used to characterize the cirrus and its environment. Optical modeling was employed to estimate the cirrus microphysical properties from the COBALD backscatter measurements. Newly fomed ice crystals with radius <1 μm and concentration ∼500 L−1 were reported at the tropopause. The relatively low concentration and CFH ice supersaturation (1.5) suggests a homogeneous freezing event stalled by a high‐frequency gravity wave. The observed vertical wind speed and temperature anomalies that triggered the cirrus formation were due to a 1.5‐km vertical‐scale wave, as shown by a spectral analysis. This cirrus observation shortly after nucleation is beyond remote sensing capabilities and presents a type of cirrus never reported before. © 2020 American Geophysical Union",,,"0094-8276||1944-8007",,"10.1029/2020GL090936","http://hdl.handle.net/20.500.11850/474227","en","American Geophysical Union",,,"cirrus||COBALD observation||gravity wave||modeling||tropical tropopause layer","Unprecedented Observations of a Nascent In Situ Cirrus in the Tropical Tropopause Layer","Journal Article","Metadata only",,,,,"2021-03-13T04:32:20Z",,,,,,"yes",,,,,,,,,,,,,,"85101782450","000623804200001","Geophys. Res. Lett.","4","Geophysical Research Letters","48","ETH Zürich::00002 - ETH Zürich::00012 - Lehre und Forschung::00007 - Departemente::02350 - Dep. Umweltsystemwissenschaften / Dep. of Environmental Systems Science::02717 - Institut für Atmosphäre und Klima / Inst. Atmospheric and Climate Science::03517 - Peter, Thomas (emeritus) / Peter, Thomas (emeritus)","ETH Zürich::00002 - ETH Zürich::00012 - Lehre und Forschung::00007 - Departemente::02350 - Dep. Umweltsystemwissenschaften / Dep. of Environmental Systems Science::02717 - Institut für Atmosphäre und Klima / Inst. Atmospheric and Climate Science::03517 - Peter, Thomas (emeritus) / Peter, Thomas (emeritus)","03517","03517",,,,"e2020GL090936","Washington, DC","published",,,,,,,,,,,,"2021-03-15T09:48:36Z","2023-02-06T21:36:07Z","true","11 p.","SCOPUS",,,
"394869","20.500.11850/3","Coppola, Erika||Sørland, Silje L.||Demory, Marie-Estelle",,,,,,,,,,,,"2021-03-16T12:41:08Z","2021-03-14T05:18:40Z||2021-03-16T12:41:08Z",,"2021-02-27","2020-11-20","This paper analyzes the ensemble of regional climate model (RCM) projections for Europe completed within the EURO‐CORDEX project. Projections are available for the two greenhouse gas concentration scenarios RCP2.6 (22 members) and RCP8.5 (55 members) at 0.11° resolution from 11 RCMs driven by eight global climate models (GCMs). The RCM ensemble results are compared with the driving CMIP5 global models but also with a subset of available last generation CMIP6 projections. Maximum warming is projected by all ensembles in Northern Europe in winter, along with a maximum precipitation increase there; in summer, maximum warming occurs in the Mediterranean and Southern European regions associated with a maximum precipitation decrease. The CMIP6 ensemble shows the largest signals, both for temperature and precipitation, along with the largest inter‐model spread. There is a high model consensus across the ensembles on an increase of extreme precipitation and drought frequency in the Mediterranean region. Extreme temperature indices show an increase of heat extremes and a decrease of cold extremes, with CMIP6 showing the highest values and EURO‐CORDEX the finest spatial details. This data set of unprecedented size and quality will provide the basis for impact assessment and climate service activities for the European region. © 2020 American Geophysical Union",,,,,"10.1029/2019JD032356","http://hdl.handle.net/20.500.11850/474278","en","Wiley",,,"EURO‐CORDEX||regional climate modeling||global model||CMIP5||CMIP6||climate impact indices","Assessment of the European Climate Projections as Simulated by the Large EURO‐CORDEX Regional and Global Climate Model Ensemble","Journal Article","Metadata only",,,,,"2021-03-14T05:18:50Z",,,,,,"yes",,,,,,,,,,,,,,"85101780691","000624348900002",,"4","Journal of Geophysical Research: Atmospheres","126","ETH Zürich::00002 - ETH Zürich::00012 - Lehre und Forschung::00007 - Departemente::02350 - Dep. Umweltsystemwissenschaften / Dep. of Environmental Systems Science::02717 - Institut für Atmosphäre und Klima / Inst. Atmospheric and Climate Science::03360 - Schär, Christoph / Schär, Christoph","ETH Zürich::00002 - ETH Zürich::00012 - Lehre und Forschung::00007 - Departemente::02350 - Dep. Umweltsystemwissenschaften / Dep. of Environmental Systems Science::02717 - Institut für Atmosphäre und Klima / Inst. Atmospheric and Climate Science::03360 - Schär, Christoph / Schär, Christoph","03360","03360",,,,"e2019JD032356","Hoboken, NJ","published",,,,,,,,,,,,"2021-03-16T12:41:20Z","2022-03-29T05:48:41Z","true","20 p.","SCOPUS",,,
"397801","20.500.11850/3","Cooper, Alan||Rozanov, Eugene||Friedel, Marina||Peter, Thomas",,,,,,,,,,,,"2021-04-14T05:50:47Z","2021-03-04T04:21:17Z||2021-03-04T09:45:00Z||2021-04-14T05:50:47Z",,"2021-02-19",,"Geological archives record multiple reversals of Earth’s magnetic poles, but the global impacts of these events, if any, remain unclear. Uncertain radiocarbon calibration has limited investigation of the potential effects of the last major magnetic inversion, known as the Laschamps Excursion [41 to 42 thousand years ago (ka)]. We use ancient New Zealand kauri trees (Agathis australis) to develop a detailed record of atmospheric radiocarbon levels across the Laschamps Excursion. We precisely characterize the geomagnetic reversal and perform global chemistry-climate modeling and detailed radiocarbon dating of paleoenvironmental records to investigate impacts. We find that geomagnetic field minima ~42 ka, in combination with Grand Solar Minima, caused substantial changes in atmospheric ozone concentration and circulation, driving synchronous global climate shifts that caused major environmental changes, extinction events, and transformations in the archaeological record. © 2021 American Association for the Advancement of Science",,,"0036-8075||1095-9203",,"10.1126/science.abb8677","http://hdl.handle.net/20.500.11850/472822","en","AAAS",,,,"A global environmental crisis 42,000 years ago","Journal Article","Metadata only",,,,,"2021-03-04T04:21:34Z",,,,,,"yes",,,,,,,"The Overlooked Role of Stratospheric Ozone in forcing Northern Hemispheric climate (TORSO)","180043","10.13039/501100001711","SNF","Ambizione",,,"85101409528","000619664700050",,"6531","Science","371","ETH Zürich::00002 - ETH Zürich::00012 - Lehre und Forschung::00007 - Departemente::02350 - Dep. Umweltsystemwissenschaften / Dep. of Environmental Systems Science::02717 - Institut für Atmosphäre und Klima / Inst. Atmospheric and Climate Science::03517 - Peter, Thomas (emeritus) / Peter, Thomas (emeritus)","ETH Zürich::00002 - ETH Zürich::00012 - Lehre und Forschung::00007 - Departemente::02350 - Dep. Umweltsystemwissenschaften / Dep. of Environmental Systems Science::02717 - Institut für Atmosphäre und Klima / Inst. Atmospheric and Climate Science::03517 - Peter, Thomas (emeritus) / Peter, Thomas (emeritus)","03517","03517",,,"818","811","Washington, DC","published",,,,,,,,,,,,"2021-03-04T09:45:09Z","2023-02-06T21:41:38Z","true",,"SCOPUS",,,
