"494640","20.500.11850/16","Li, Guangyu",,,,,,,,,,,"Lohmann, Ulrike||Kanji, Zamin A||Henning, Silvia","2023-03-27T13:48:06Z","2023-03-27T09:44:39Z||2023-03-27T13:48:06Z",,"2023","2023-03-27","The frequency and distribution of the ice phase in mixed-phase clouds (MPCs) influence the Earth’s energy budget by determining the clouds’ radiative properties and lifetime. The presence of ice-nucleating particles (INPs), a unique fraction of atmospheric aerosols, is vital to trigger the primary formation of ice crystals in MPCs by lowering the energy barrier during the phase transition. Despite the extraordinary scarcity of atmospheric INPs, their role in cloud-phase feedback to climate is indispensable, particularly in the Arctic, where the climate is experiencing accelerated warming (i.e., Arctic amplification). However, unconstrained representations of complex interactions between clouds and aerosols in climate models induce substantial uncertainties in the cloud-phase feedback. These uncertainties are largely hindered by insuﬀicient knowledge on the abundance, variability, properties, sources and predictability of atmospheric INPs. The principal objective of this dissertation is to narrow this knowledge gap by expanding the observational data coverage of Arctic INPs and associated aerosol properties based on extensive in situ measurements. For this purpose, three field campaigns were conducted at different Arctic sites and during different seasons.  During the Ny-Ålesund AeroSol Cloud ExperimeNT (NASCENT) campaign in Svalbard, Norway, in autumn 2019 and spring 2020, INP concentrations and aerosol properties were determined by a set of ground-based measurements. A distinguishable seasonal difference in INP concentrations was not observed during the measurement period. A robust relationship between INP concentrations and the associated physical properties of aerosols could also not be established. In addition, any season-dependent variable (e.g., aerosol burden, fluorescent particle abundance or ambient temperature) would induce a seasonal bias in the prediction of INP concentrations , which is contradictory to our observations of no seasonal difference. We developed a simplistic approach for predicting INP concentrations  based on an atmospheric random dilution model, in which a log-normal frequency distribution of INP concentrations is hypothesized. The novel INP parameterization exhibits consistent predictability of atmospheric INP concentrations in Arctic transition seasons (autumn and spring) as a sole function of nucleation temperature without retrieving additional aerosol property parameters. In addition to developing an INP parameterization, we conducted a comprehensive analysis of ambient aerosol properties within selected cases to deduce the nature and origin of INPs. The heat-lability of INPs exhibited in most samples implies the presence of proteinaceous INPs. Significant correlations were found between autumnal INP concentrations at higher ice nucleation temperatures (e.g., T > -15 °C) and fluorescent particle concentration, high wind speeds over the ocean and concentration of methanesulfonic acid (MSA, an oxidation product of dimethylsulfide (DMS), a precursor gas from marine biological productivity). Therefore, marine biogenic aerosols likely serve as important sources of INPs at the Arctic coastal site during the ice-melting seasons. Moreover, for case studies, while high-latitude dust sources from long-range transport (e.g., coastal Greenland) could contribute to INP abundance, diversity in relative aerosol compositions may have a negligible impact.  We also investigated the summertime INPs from the ship-based Arctic Century Expedition in 2021 over the previously unexplored Eurasian Arctic Ocean. Immersion-mode INP concentrations varied geographically, with high INP concentrations frequently observed over the ice-free ocean and over the marginal ice zones, in particular in the vicinity of land. INP concentrations were relatively low when the ship was located within the ice pack. Results from heat tests, chemical composition analyses and case studies suggest that marine biogenic INPs sporadically contribute to the Arctic INP populations at warm temperatures (T > -15 °C). INP concentrations-resolved backward trajectories demonstrate that peak INP concentrations occurred in locations close to northern Novaya Zemlya, with air masses originating from the western Siberian coast. Moreover, in situ measurements of aerosolized INPs via a sea spray aerosol (SSA) bubble tank generator revealed a high correlation with ambient INP concentrations but no correlation with INP abundance in the subsurface seawater. Our results suggest the potential importance of the aerosolization mechanism for partitioning INPs between the ocean and the atmosphere.  In summary, the present dissertation facilitates a fundamental understanding of primary ice formation relevant for Arctic MPCs by quantifying the abundance, variability and predictability of atmospheric INPs and elucidating the nature and origin of responsible aerosols. Further constraining the role of INPs, particularly their dynamic variations in the warming Arctic, is highly encouraged to reduce the model uncertainties in analyzing the cloud-phase feedback to Arctic amplification.","application/pdf","10.3929/ethz-b-000605091",,,,"http://hdl.handle.net/20.500.11850/605091","en","ETH Zurich","In Copyright - Non-Commercial Use Permitted","http://rightsstatements.org/page/InC-NC/1.0/","Arctic amplification||ice nucleating particles||Cloud microphysics||Climate change","Determining the Abundance, Variability, Sources and Predictability of IceNucleating Particles in the Arctic","Doctoral Thesis","Open access",,"DDC - DDC::5 - Science::550 - Earth sciences||DDC - DDC::5 - Science::500 - Natural sciences","2023-03-27T09:44:39Z",,,,,"yes",,,,,,"29136",,,,,,,,"ETH Zürich::00002 - ETH Zürich::00012 - Lehre und Forschung::00007 - Departemente::02350 - Dep. Umweltsystemwissenschaften / Dep. of Environmental Systems Science::02717 - Institut für Atmosphäre und Klima / Inst. Atmospheric and Climate Science::03690 - Lohmann, Ulrike / Lohmann, Ulrike",,"03690",,,,,,"Zurich","published",,,,"true","2023-03-27T13:48:08Z","2023-03-27T13:48:08Z","true","150 p.","FORM",,,
"494717","20.500.11850/16","Gabathuler, Jérôme P.",,,,,,,,,,,"Ammann, Markus||Peter, Thomas||Bluhm, Hendrik","2023-03-28T06:52:45Z","2023-03-27T12:15:32Z||2023-03-28T06:52:45Z",,"2023","2023-03-28","Ice is ubiquitous in the environment and plays a role in atmospheric chemical cycles, which impacts the environment and human health. Therefore, it is important to understand the mechanism by which ice interacts with the air. The commonly accepted picture is the presence of a quasi-liquid layer (QLL) on the surface of the ice that increases in thickness with increasing temperature or with increasing concentrations of soluble species. X-ray excited electron spectroscopy, X-ray photoelectron spectroscopy (XPS), and partial electron yield X-ray absorption spectroscopy (PEY-XAS) are well-suited surface science techniques to investigate the QLL at the interface between the ice and the air of the atmosphere. While XPS enables a quantitative surface sensitive elemental and chemical composition analysis, PEY-XAS provides insights into the structure of the hydrogen bonding (HB) network in the ice lattice close to the surface. In the frame of this thesis, I investigated the thickness of the QLL on ice as a function of temperature. I developed a careful analysis of the different uncertainties related to PEY-XAS, with a special focus on the assessment of the probing depth in PEY-XAS, using a Monte Carlo (MC) simulation of electron scattering. The results indicate that, at the probing kinetic energy (KE) window typically used to detect electrons in PEY-XAS, the escape depth is about ∼3 times larger compared to that of unscattered electrons and that gas phase scattering decreases this factor down to ∼1.5, at 5 mbar. Consideration of electron scattering in PEY-XAS is novel and the improved analysis of the PEY-XAS data reveals that the QLL is of the order of ∼2nm close to the melting point. After the QLL investigation on pure ice, I studied the adsorption of hexylamine (HA) on ice to complement the large literature that is available about the adsorption of acids on ice. I measured the surface coverage of HA as a function of gas-phase partial pressure, and for two different temperatures. I found that a saturated monolayer is present already at a partial pressure of 2 × 10−5mbar, and that more than half of the HA molecules are protonated. The PEY-XAS data revealed that the adsorbed HA on ice at -20°C increases the fraction of water molecules in disordered configurations, and give a PEY-XAS signal similar to that of pure ice at -1°C. This is expected and has been observed in the literature with different acids such as HCl. Finally, I studied the temperature dependence of the surface disorder in liquid water and found that the latter increases with temperature, similar to the QLL on ice. As a logical continuation of the MC simulation results, I established the proof-of-principle of PEY-XAS depth profiling ability on an ice sample, by probing the HB network and the carbon contamination as a function of depth. Last but not least, I investigated the direct impact of gas phase pressure (in this experiment, N2) on the surface disorder of the ice and found no impact at -120°C.","application/pdf","10.3929/ethz-b-000605153",,,,"http://hdl.handle.net/20.500.11850/605153","en","ETH Zurich","In Copyright - Non-Commercial Use Permitted","http://rightsstatements.org/page/InC-NC/1.0/","Ice surface||XPS surface analysis||PEY-XAS||QLL","The thickness of the quasi-liquid layer on ice and its interaction with atmospheric gases as seen by X-ray absorption and photoelectron spectroscopies","Doctoral Thesis","Open access",,"DDC - DDC::5 - Science::550 - Earth sciences","2023-03-27T12:15:32Z",,,,,"yes",,,,,,"28726",,,,,,,,"ETH Zürich::00002 - ETH Zürich::00012 - Lehre und Forschung::00007 - Departemente::02350 - Dep. Umweltsystemwissenschaften / Dep. of Environmental Systems Science::02717 - Institut für Atmosphäre und Klima / Inst. Atmospheric and Climate Science::03517 - Peter, Thomas (emeritus) / Peter, Thomas (emeritus)",,"03517",,,,,,"Zurich","published",,,,,"2023-03-28T06:52:47Z","2023-03-28T06:52:47Z","true","146 p.","FORM",,,
"494929","20.500.11850/3","He, Yanyi||Yang, Kun||Wild, Martin||Wang, Kaicun||Tong, Dan||Shao, Changkun||Zhou, Tianjun",,,,,,,,,,,,"2023-03-29T10:01:00Z","2022-12-05T11:05:32Z||2022-12-05T11:55:29Z||2023-03-17T09:44:11Z||2023-03-29T10:01:00Z",,"2023-01","2022-10-29","As the Earth's primary energy source, surface downward solar radiation (Rs) determines the solar power potential and usage for climate change mitigation. Future projections of Rs based on climate models have large uncertainties that interfere with the efficient deployment of solar energy to achieve China's carbon neutrality goal. Here we assess 24 models in the latest Coupled Model Intercomparison Project Phase 6 with historical observations in China, and find systematic biases in simulating historical Rs values likely due to model biases in cloud cover and clear-sky radiation, resulting in largely uncertain projections for future changes in Rs. Based on emergent constraints, we obtain credible Rs with narrowed uncertainties by ∼56% in the mid-21st century, and show that the mean Rs change during 2050-2069 relative to 1995-2014 is 30% more brightening than the raw projections. Particularly in North China and Southeast China with higher power demand, the constrained projections present more significant brightening, highlighting the importance of considering the spatial changes in future Rs when locating new solar energy infrastructures.","application/pdf","10.3929/ethz-b-000584880",,,"10.1093/nsr/nwac242","http://hdl.handle.net/20.500.11850/584880","en","Oxford University Press","Creative Commons Attribution 4.0 International","http://creativecommons.org/licenses/by/4.0/","Surface downward solar radiation||CMIP6 model||Emergent constraints||Future change||Solar energy","Constrained future brightening of solar radiation and its implication for China's solar power","Journal Article","Open access",,,"2022-12-05T11:05:33Z",,,,,"yes",,,,,,,,,"000909404800001",,"1","National Science Review","10","ETH Zürich::00002 - ETH Zürich::00012 - Lehre und Forschung::00007 - Departemente::02350 - Dep. Umweltsystemwissenschaften / Dep. of Environmental Systems Science::02717 - Institut für Atmosphäre und Klima / Inst. Atmospheric and Climate Science::03360 - Schär, Christoph / Schär, Christoph","ETH Zürich::00002 - ETH Zürich::00012 - Lehre und Forschung::00007 - Departemente::02350 - Dep. Umweltsystemwissenschaften / Dep. of Environmental Systems Science::02717 - Institut für Atmosphäre und Klima / Inst. Atmospheric and Climate Science::03360 - Schär, Christoph / Schär, Christoph","03360","03360",,,,"nwac242","Oxford","published",,,,"true","2023-03-17T09:44:13Z","2023-03-17T09:44:13Z","true","12 p.","FORM",,,"publishedVersion"
"497808","20.500.11850/18","Hotz, Belinda",,,,,,,,,,,"Röthlisberger, Matthias||Papritz, Lukas","2023-04-26T06:43:11Z","2023-03-23T14:56:54Z||2023-04-25T14:50:33Z||2023-04-26T06:28:02Z||2023-04-26T06:43:11Z",,"2023",,,"application/pdf","10.3929/ethz-b-000604749",,,,"http://hdl.handle.net/20.500.11850/604749","en","ETH Zurich","In Copyright - Non-Commercial Use Permitted","http://rightsstatements.org/page/InC-NC/1.0/",,"Heat Domes: Science or Fiction?","Master Thesis","Open access",,,"2023-03-23T14:56:54Z",,,,,"yes",,,,,,,,,,,,,,"ETH Zürich::00002 - ETH Zürich::00012 - Lehre und Forschung::00007 - Departemente::02350 - Dep. Umweltsystemwissenschaften / Dep. of Environmental Systems Science::02717 - Institut für Atmosphäre und Klima / Inst. Atmospheric and Climate Science::03854 - Wernli, Johann Heinrich / Wernli, Johann Heinrich",,"03854",,,,,,"Zurich","published",,,,"true",,,,"70 p.","FORM",,,
"499724","20.500.11850/16","Tully, Colin",,,,,,,,,,,"Lohmann, Ulrike||Villanueva Ortiz, Diego||Krämer, Martina","2023-05-15T07:00:05Z","2023-04-05T01:02:04Z||2023-05-12T02:06:26Z||2023-05-13T01:35:15Z||2023-05-15T07:00:05Z",,"2023","2023-05-15",,"application/pdf","10.3929/ethz-b-000606659",,,,"http://hdl.handle.net/20.500.11850/606659","en","ETH Zurich","Creative Commons Attribution 4.0 International","http://creativecommons.org/licenses/by/4.0/","Climate intervention||aerosol-cloud interactions||Cirrus clouds||Cirrus cloud thinning||Cirrus cloud seeding||geoengineering||climate modelling","Cirrus Climate Intervention: Sensitivity analysis of aerosol-ice-cloud interactions","Doctoral Thesis","Open access",,"DDC - DDC::5 - Science::550 - Earth sciences","2023-04-05T01:02:04Z",,,,,"yes",,,,,,"28900",,,,,,,,"ETH Zürich::00002 - ETH Zürich::00012 - Lehre und Forschung::00007 - Departemente::02350 - Dep. Umweltsystemwissenschaften / Dep. of Environmental Systems Science::02717 - Institut für Atmosphäre und Klima / Inst. Atmospheric and Climate Science::03690 - Lohmann, Ulrike / Lohmann, Ulrike",,"03690",,,,,,"Zurich","published",,,,"true",,,,"218 p.","FORM",,,
"497661","20.500.11850/3","Bevacqua, Emanuele||Suarez-Gutierrez, Laura||Jézéquel, Aglaé||Lehner, Flavio||Vrac, Mathieu||Yiou, Pascal||Zscheischler, Jakob",,,,,,,,,,,,"2023-04-25T08:39:40Z","2023-04-23T05:49:52Z||2023-04-25T08:39:40Z",,"2023","2023-04-14","Societally relevant weather impacts typically result from compound events, which are rare combinations of weather and climate drivers. Focussing on four event types arising from different combinations of climate variables across space and time, here we illustrate that robust analyses of compound events - such as frequency and uncertainty analysis under present-day and future conditions, event attribution to climate change, and exploration of low-probability-high-impact events - require data with very large sample size. In particular, the required sample is much larger than that needed for analyses of univariate extremes. We demonstrate that Single Model Initial-condition Large Ensemble (SMILE) simulations from multiple climate models, which provide hundreds to thousands of years of weather conditions, are crucial for advancing our assessments of compound events and constructing robust model projections. Combining SMILEs with an improved physical understanding of compound events will ultimately provide practitioners and stakeholders with the best available information on climate risks.","application/pdf","10.3929/ethz-b-000608920",,"2041-1723","10.1038/s41467-023-37847-5","http://hdl.handle.net/20.500.11850/608920","en","Nature","Creative Commons Attribution 4.0 International","http://creativecommons.org/licenses/by/4.0/",,"Advancing research on compound weather and climate events via large ensemble model simulations","Journal Article","Open access",,,"2023-04-23T05:49:53Z",,,,,"yes","Extreme Events: Artificial Intelligence for Detection and Attribution","101003469","10.13039/501100000780","EC","H2020",,,"85152520680",,"Nat Commun","1","Nature Communications","14","ETH Zürich::00002 - ETH Zürich::00012 - Lehre und Forschung::00007 - Departemente::02350 - Dep. Umweltsystemwissenschaften / Dep. of Environmental Systems Science::02717 - Institut für Atmosphäre und Klima / Inst. Atmospheric and Climate Science::03777 - Knutti, Reto / Knutti, Reto","ETH Zürich::00002 - ETH Zürich::00012 - Lehre und Forschung::00007 - Departemente::02350 - Dep. Umweltsystemwissenschaften / Dep. of Environmental Systems Science::02717 - Institut für Atmosphäre und Klima / Inst. Atmospheric and Climate Science::03777 - Knutti, Reto / Knutti, Reto","03777","03777",,,,"2145","London","published",,,,"true",,,,"16 p.","SCOPUS",,,"publishedVersion"
"496295","20.500.11850/3","Kendon, Elizabeth J.||Fischer, Erich||Short, Chris J.",,,,,,,,,,,,"2023-04-12T08:04:42Z","2023-03-18T07:54:12Z||2023-03-21T10:45:19Z||2023-03-21T13:47:25Z||2023-04-12T08:04:42Z",,"2023","2023-03-07","Extreme precipitation is projected to intensify with warming, but how this will manifest locally through time is uncertain. Here, we exploit an ensemble of convection-permitting transient simulations to examine the emerging signal in local hourly rainfall extremes over 100-years. We show rainfall events in the UK exceeding 20 mm/h that can cause flash floods are 4-times as frequent by 2070s under high emissions; in contrast, a coarser resolution regional model shows only a 2.6x increase. With every degree of regional warming, the intensity of extreme downpours increases by 5-15%. Regional records of local hourly rainfall occur 40% more often than in the absence of warming. However, these changes are not realised as a smooth trend. Instead, as a result of internal variability, extreme years with record-breaking events may be followed by multiple decades with no new local rainfall records. The tendency for extreme years to cluster poses key challenges for communities trying to adapt.","application/pdf","10.3929/ethz-b-000603779",,"2041-1723","10.1038/s41467-023-36499-9","http://hdl.handle.net/20.500.11850/603779","en","Nature","Creative Commons Attribution 4.0 International","http://creativecommons.org/licenses/by/4.0/",,"Variability conceals emerging trend in 100yr projections of UK local hourly rainfall extremes","Journal Article","Open access",,,"2023-03-18T07:54:12Z",,,,,"yes","Extreme Events: Artificial Intelligence for Detection and Attribution||Understanding and quantifying the occurrence of  very rare climate extremes in a changing climate","101003469||178778","10.13039/501100000780||10.13039/501100001711","EC||SNF","H2020||Projekte MINT",,,"85149505158",,"Nat Commun","1","Nature Communications","14","ETH Zürich::00002 - ETH Zürich::00012 - Lehre und Forschung::00007 - Departemente::02350 - Dep. Umweltsystemwissenschaften / Dep. of Environmental Systems Science::02717 - Institut für Atmosphäre und Klima / Inst. Atmospheric and Climate Science::03777 - Knutti, Reto / Knutti, Reto","ETH Zürich::00002 - ETH Zürich::00012 - Lehre und Forschung::00007 - Departemente::02350 - Dep. Umweltsystemwissenschaften / Dep. of Environmental Systems Science::02717 - Institut für Atmosphäre und Klima / Inst. Atmospheric and Climate Science::03777 - Knutti, Reto / Knutti, Reto","03777","03777",,,,"1133","London","published",,,,"true","2023-04-12T08:04:43Z","2023-04-12T08:04:43Z","true","14 p.","SCOPUS",,,"publishedVersion"
"489826","20.500.11850/4","Humphrey, Vincent||Rodell, Matthew||Eicker, Annette",,,,,,,,,,,,"2023-02-15T10:58:32Z","2023-02-13T12:44:24Z||2023-02-15T10:58:32Z",,"2023","2023-01-13","Land water storage plays a key role for the Earth's climate, natural ecosystems, and human activities. Since the launch of the first Gravity Recovery and Climate Experiment (GRACE) mission in 2002, spaceborne observations of changes in terrestrial water storage (TWS) have provided a unique, global perspective on natural and human-induced changes in freshwater resources. Even though they have become much used within the broader Earth system science community, space-based TWS datasets still incorporate important and case-specific limitations which may not always be clear to users not familiar with the underlying processing algorithms. Here, we provide an accessible and illustrated overview of the measurement concept, of the main available data products, and of some frequently encountered technical terms and concepts. We summarize concrete recommendations on how to use TWS data in combination with other hydrological or climatological datasets, and guidance on how to avoid possible pitfalls. Finally, we provide an overview of some of the main applications of GRACE TWS data in the fields of hydrology and climate science. This review is written with the intention of supporting future research and facilitating the use of satellite-based terrestrial water storage datasets in interdisciplinary contexts.",,,,"0169-3298||1573-0956","10.1007/s10712-022-09754-9","http://hdl.handle.net/20.500.11850/598151","en","Springer",,,"Terrestrial water storage||GRACE||Climatology||Hydrology||Remote sensing||Geodesy","Using Satellite-Based Terrestrial Water Storage Data: A Review","Review Article","Metadata only",,,"2023-02-13T12:44:34Z",,,,,"yes",,,,,,,,,"000913546400001","Surv. geophys.",,"Surveys in Geophysics",,"ETH Zürich::00002 - ETH Zürich::00012 - Lehre und Forschung::00007 - Departemente::02350 - Dep. Umweltsystemwissenschaften / Dep. of Environmental Systems Science::02717 - Institut für Atmosphäre und Klima / Inst. Atmospheric and Climate Science::03777 - Knutti, Reto / Knutti, Reto","ETH Zürich::00002 - ETH Zürich::00012 - Lehre und Forschung::00007 - Departemente::02350 - Dep. Umweltsystemwissenschaften / Dep. of Environmental Systems Science::02717 - Institut für Atmosphäre und Klima / Inst. Atmospheric and Climate Science::03777 - Knutti, Reto / Knutti, Reto","03777","03777",,,,,"Dordrecht","published",,,,"true",,,,"29 p.","WOS",,,
