"100175","20.500.11850/3","Vernier, J.P.||Fairlie, T.D.||Natarajan, M.||Wienhold, F.G.||Bian, J.||Martinsson, B.G.||Crumeyrolle, S.||Thomason, L.W.||Bedka, K.M.",,,,"2017-06-11T17:04:29Z","2017-06-11T17:04:29Z","2015-02",,,,,,"0148-0227||2169-897X",,"10.1002/2014JD022372","http://hdl.handle.net/20.500.11850/100208","en","American Geophysical Union",,,"Aerosol||Pollution||Trend","Increase in upper tropospheric and lower stratospheric aerosol levels and its potential connection with Asian pollution","Journal Article","Metadata only",,,"2017-06-11T17:05:20Z",,"pub:157133",,"yes",,,,,,,,,,"imp5936531d005f412646","004289357",,,"000351182400023","J. geophys. res., Atmos.","4","Journal of Geophysical Research: Atmospheres","120","ETH Zürich::00002 - ETH Zürich::00012 - Lehre und Forschung::00007 - Departemente::02350 - Dep. Umweltsystemwissenschaften / Dep. of Environmental Systems Science::02717 - Institut für Atmosphäre und Klima / Inst. Atmospheric and Climate Science::03517 - Peter, Thomas (emeritus) / Peter, Thomas (emeritus)","ETH Zürich::00002 - ETH Zürich::00012 - Lehre und Forschung::00007 - Departemente::02350 - Dep. Umweltsystemwissenschaften / Dep. of Environmental Systems Science::02717 - Institut für Atmosphäre und Klima / Inst. Atmospheric and Climate Science::03517 - Peter, Thomas (emeritus) / Peter, Thomas (emeritus)","03517","03517","Published online by: Wiley. Manuscript Received 1 August 2014, Manuscript Revised 15 December 2014, Manuscript Accepted 30 December 2014, Accepted manuscript online 7 January 2015, Article first published online 16 February 2015.","1619","1608","Washington, DC","published",,,,,,"2017-07-19T12:11:39Z","2023-02-06T12:53:19Z","true",,"ECIT",,
"299387","20.500.11850/3","Xia, Lili||Robock, Alan||Mills, Michael||Stenke, Andrea||Helfand, Ira",,,,"2019-07-01T10:21:59Z","2017-06-11T18:30:17Z||2019-07-01T10:21:59Z","2015-02","2015-01-05","A regional nuclear war between India and Pakistan could decrease global surface temperature by 1°C–2°C for 5–10 years and have major impacts on precipitation and solar radiation reaching Earth's surface. Using a crop simulation model forced by three global climate model simulations, we investigate the impacts on agricultural production in China, the largest grain producer in the world. In the first year after the regional nuclear war, a cooler, drier, and darker environment would reduce annual rice production by 30 megaton (Mt) (29%), maize production by 36 Mt (20%), and wheat production by 23 Mt (53%). With different agriculture management—no irrigation, auto irrigation, 200 kg/ha nitrogen fertilizer, and 10 days delayed planting date—simulated national crop production reduces 16%–26% for rice, 9%–20% for maize, and 32%–43% for wheat during 5 years after the nuclear war event. This reduction of food availability would continue, with gradually decreasing amplitude, for more than a decade. Assuming these impacts are indicative of those in other major grain producers, a nuclear war using much less than 1% of the current global arsenal could produce a global food crisis and put a billion people at risk of famine.","application/pdf","10.3929/ethz-b-000102748",,"2328-4277",,"10.1002/2014EF000283","http://hdl.handle.net/20.500.11850/102748","en","Wiley","Creative Commons Attribution-NonCommercial-NoDerivatives 4.0 International","http://creativecommons.org/licenses/by-nc-nd/4.0/","regional nuclear war||nuclear winter||agriculture impacts||China||DSSAT||famine","Decadal reduction of Chinese agriculture after a regional nuclear war","Journal Article","Open access",,,"2017-06-11T18:30:36Z",,"pub:160904",,"yes",,,,,,,,,,"imp59365357a2e5b12085","010090819",,,"000358139000001",,"2","Earth's Future","3","ETH Zürich::00002 - ETH Zürich::00012 - Lehre und Forschung::00007 - Departemente::02350 - Dep. Umweltsystemwissenschaften / Dep. of Environmental Systems Science::02717 - Institut für Atmosphäre und Klima / Inst. Atmospheric and Climate Science::03517 - Peter, Thomas (emeritus) / Peter, Thomas (emeritus)","ETH Zürich::00002 - ETH Zürich::00012 - Lehre und Forschung::00007 - Departemente::02350 - Dep. Umweltsystemwissenschaften / Dep. of Environmental Systems Science::02717 - Institut für Atmosphäre und Klima / Inst. Atmospheric and Climate Science::03517 - Peter, Thomas (emeritus) / Peter, Thomas (emeritus)","03517","03517",,"48","37","Hoboken, NJ","published",,,,,,"2017-07-19T10:38:37Z","2023-02-06T17:20:55Z","true",,"ECIT",,"publishedVersion"
"259814","20.500.11850/3","O'Sullivan, Daniel||Murray, Benjamin J.||Ross, James F.||Whale, Thomas F.||Price, Hannah C.||Atkinson, James D.||Umo, Nsikanabasi S.||Webb, Michael E.",,,,"2018-10-23T14:58:43Z","2017-06-11T22:40:26Z||2018-10-23T14:58:43Z","2015-01-28",,"Most studies of the role of biological entities as atmospheric ice-nucleating particles have focused on relatively rare supermicron particles such as bacterial cells, fungal spores and pollen grains. However, it is not clear that there are sufficient numbers of these particles in the atmosphere to strongly influence clouds. Here we show that the ice-nucleating activity of a fungus from the ubiquitous genus Fusarium is related to the presence of nanometre-scale particles which are far more numerous, and therefore potentially far more important for cloud glaciation than whole intact spores or hyphae. In addition, we quantify the ice-nucleating activity of nano-ice nucleating particles (nano-INPs) washed off pollen and also show that nano-INPs are present in a soil sample. Based on these results, we suggest that there is a reservoir of biological nano-INPs present in the environment which may, for example, become aerosolised in association with fertile soil dust particles.","application/pdf","10.3929/ethz-b-000109442",,"2045-2322",,"10.1038/srep08082","http://hdl.handle.net/20.500.11850/109442","en","Nature Publishing Group","Creative Commons Attribution 4.0 International","http://creativecommons.org/licenses/by/4.0/","Atmospheric science||Environmental sciences","The relevance of nanoscale biological fragments for ice nucleation in clouds","Journal Article","Open access",,,"2017-06-11T22:41:01Z",,"pub:170536",,"yes",,,,,,,,,,"imp593653e25283613172","006751867",,,,"Sci Rep",,"Scientific Reports","5","ETH Zürich::00002 - ETH Zürich::00012 - Lehre und Forschung::00007 - Departemente::02350 - Dep. Umweltsystemwissenschaften / Dep. of Environmental Systems Science::02717 - Institut für Atmosphäre und Klima / Inst. Atmospheric and Climate Science::03690 - Lohmann, Ulrike / Lohmann, Ulrike","ETH Zürich::00002 - ETH Zürich::00012 - Lehre und Forschung::00007 - Departemente::02350 - Dep. Umweltsystemwissenschaften / Dep. of Environmental Systems Science::02717 - Institut für Atmosphäre und Klima / Inst. Atmospheric and Climate Science::03690 - Lohmann, Ulrike / Lohmann, Ulrike","03690","03690",,,"8082","London","published",,,,,,"2017-07-26T18:50:36Z","2021-02-15T02:16:21Z","true","7 p.","ECIT",,"publishedVersion"
"174144","20.500.11850/3","Johnson, Nils||Krey, Volker||McCollum, David L.||Rao, Shilpa||Riahi, Keywan||Rogelj, Joeri",,,,"2017-08-21T12:45:41Z","2017-06-19T16:01:32Z||2017-06-20T09:09:24Z||2017-06-20T09:12:21Z||2017-06-22T09:00:31Z||2017-06-11T06:24:57Z||2017-08-21T12:45:41Z","2015-01","2014-03-29",,"application/pdf","10.3929/ethz-b-000164424",,"0040-1625","http://hdl.handle.net/20.500.11850/164424||http://hdl.handle.net/20.500.11850/81938","10.1016/j.techfore.2014.02.028","http://hdl.handle.net/20.500.11850/179226","en","Elsevier","Creative Commons Attribution 3.0 Unported","http://creativecommons.org/licenses/by/3.0/","Integrated assessment modeling||Near-term climate policy||Coal-based electricity generation without CCS||Premature retirement||Stranded capacity||CCS retrofit","Stranded on a low-carbon planet: Implications of climate policy for the phase-out of coal-based power plants","Journal Article","Open access",,"DDC - DDC::3 - Social sciences::330 - Economics||DDC - DDC::0 - Computer science, information & general works::000 - Generalities, science","2017-06-11T06:27:14Z",,"pub:170322||pub:129151",,"yes",,,,,,,,,,"imp593653dedeaad72357||imp593651bde445c63073","000028692","84916939968",,"000347605300007","Technol. Forecasting Soc. Change","Part A","Technological Forecasting and Social Change","90","ETH Zürich::00002 - ETH Zürich::00012 - Lehre und Forschung::00007 - Departemente::02350 - Dep. Umweltsystemwissenschaften / Dep. of Environmental Systems Science::02717 - Institut für Atmosphäre und Klima / Inst. Atmospheric and Climate Science::03777 - Knutti, Reto / Knutti, Reto","ETH Zürich::00002 - ETH Zürich::00012 - Lehre und Forschung::00007 - Departemente::02350 - Dep. Umweltsystemwissenschaften / Dep. of Environmental Systems Science::02717 - Institut für Atmosphäre und Klima / Inst. Atmospheric and Climate Science::03777 - Knutti, Reto / Knutti, Reto","03777","03777",,"102","89","New York, NY","published",,,,,,"2017-08-21T12:45:44Z","2021-02-14T18:26:19Z","true",,"ECIT",,"publishedVersion"
"109414","20.500.11850/14","Lohmann, Ulrike",,,,"2017-06-11T22:40:29Z","2017-06-11T22:40:29Z","2015",,,,,"978-0-12-409548-9",,,"10.1016/B978-0-12-382225-3.00052-9","http://hdl.handle.net/20.500.11850/109447","en","Elsevier Academic Press",,,"Cloud droplet formation||Hygroscopic growth||Ice crystal formation||Radiative forcing","Aerosol-Cloud Interactions and Their Radiative Forcing","Book Chapter","Metadata only","Encyclopedia of Atmospheric Sciences",,"2017-06-11T22:41:01Z",,"pub:170543",,"yes",,,,,,,,,,"imp593653e27015e46230","010514169",,,,,,,"1","ETH Zürich::00002 - ETH Zürich::00012 - Lehre und Forschung::00007 - Departemente::02350 - Dep. Umweltsystemwissenschaften / Dep. of Environmental Systems Science::02717 - Institut für Atmosphäre und Klima / Inst. Atmospheric and Climate Science::03690 - Lohmann, Ulrike / Lohmann, Ulrike","ETH Zürich::00002 - ETH Zürich::00012 - Lehre und Forschung::00007 - Departemente::02350 - Dep. Umweltsystemwissenschaften / Dep. of Environmental Systems Science::02717 - Institut für Atmosphäre und Klima / Inst. Atmospheric and Climate Science::03690 - Lohmann, Ulrike / Lohmann, Ulrike","03690","03690",,"22","17","Amsterdam","published",,,,,,"2017-08-01T16:31:06Z","2018-11-02T21:20:59Z","true","2nd edition","ECIT",,
"174044","20.500.11850/16","Hakuba, Maria Z.",,,"Schär, Christoph Joseph||Wild, Martin","2017-08-21T10:37:42Z","2017-06-11T18:20:19Z||2017-08-21T10:37:42Z","2015","2015",,"application/pdf","10.3929/ethz-a-010478709",,,,,"http://hdl.handle.net/20.500.11850/102457","en","ETH-Zürich","In Copyright - Non-Commercial Use Permitted","http://rightsstatements.org/page/InC-NC/1.0/","SOLAR RADIATION ABSORPTION, EMISSION AND DISPERSION (METEOROLOGY)||STRAHLUNG (METEOROLOGIE)||EUROPA||METEOROLOGICAL SATELLITES||ABSORPTION, SCATTERING AND TRANSMISSION OF RADIATION IN THE ATMOSPHERE (METEOROLOGY)||RADIATION OBSERVATIONS (METEOROLOGY)||RADIATION (METEOROLOGY)||SATELLITEN/METEOROLOGISCHE BEOBACHTUNGEN||STRAHLUNGSBEOBACHTUNG (METEOROLOGIE)||ABSORPTION, AUSSTRAHLUNG UND ZERSTREUUNG DER STRAHLUNG IN DER ATMOSPHÄRE (METEOROLOGIE)||EUROPE||SONNENSTRAHLUNGSABSORPTION (METEOROLOGIE)","Solar absorption in the atmosphere","Doctoral Thesis","Open access",,"DDC - DDC::5 - Science::550 - Earth sciences||DDC - DDC::3 - Social sciences::333.7 - Natural resources, energy and environment","2017-06-11T18:20:34Z",,"pub:160594","eth:47885","yes",,,,,,,,,"22420","imp5936535109cef75744||imp59366b79d4bdb75794","010478709",,,,,,,,"ETH Zürich::00002 - ETH Zürich::00012 - Lehre und Forschung::00007 - Departemente::02350 - Dep. Umweltsystemwissenschaften / Dep. of Environmental Systems Science::02717 - Institut für Atmosphäre und Klima / Inst. Atmospheric and Climate Science::03360 - Schär, Christoph / Schär, Christoph||ETH Zürich::00002 - ETH Zürich::00012 - Lehre und Forschung::00007 - Departemente::02350 - Dep. Umweltsystemwissenschaften / Dep. of Environmental Systems Science||ETH Zürich::00002 - ETH Zürich::00012 - Lehre und Forschung::00007 - Departemente::02350 - Dep. Umweltsystemwissenschaften / Dep. of Environmental Systems Science::02717 - Institut für Atmosphäre und Klima / Inst. Atmospheric and Climate Science",,"03360||02350||02717",,,,,"Zürich","published",,,,,,"2017-07-14T19:46:14Z","2021-02-14T18:25:43Z","true","1 Band","ECOL||ECIT","Improved estimates from surface and satellite observations",
"251941","20.500.11850/16","Ban, Nikolina",,,"Schär, Christoph J.||Schmidli, Jürg||Kendon, Elizabeth J.","2018-09-06T09:01:30Z","2017-06-11T19:11:45Z||2017-08-23T11:55:01Z||2017-10-27T11:02:57Z||2018-09-06T09:01:30Z","2015","2015-09-07",,"application/pdf","10.3929/ethz-a-010510915",,,,,"http://hdl.handle.net/20.500.11850/103936","en","ETH Zurich","In Copyright - Non-Commercial Use Permitted","http://rightsstatements.org/page/InC-NC/1.0/","KONVEKTION (METEOROLOGIE)||KONVEKTIVE NIEDERSCHLAGSSYSTEME + GEWITTER, SCHAUER (METEOROLOGIE)||CLIMATE MODELS + PROXY DATA (CLIMATOLOGY)||METEOROLOGISCHE MODELLE||METEOROLOGICAL MODELS||PRECIPITATIONS/EXCESSIVE FALLS IN SHORT OR LONG PERIODS (METEOROLOGY)||GLOBAL CHANGE + GLOBAL WARMING (CLIMATOLOGY)||NIEDERSCHLAG/AUSSERGEWÖHNLICHE NIEDERSCHLÄGE IN KURZEN UND LANGEN ZWISCHENRÄUMEN (METEOROLOGIE)||GLOBAL CHANGE + KLIMAERWÄRMUNG (KLIMATOLOGIE)||EXTREME VALUE STATISTICS (MATHEMATICAL STATISTICS)||ALPENGEBIET (SCHWEIZ)||SWITZERLAND (CENTRAL EUROPE). SWISS CONFEDERATION||SCHWEIZ (MITTELEUROPA). SCHWEIZERISCHE EIDGENOSSENSCHAFT||ALPINE REGION (SWITZERLAND)||EXTREMWERTSTATISTIK (MATHEMATISCHE STATISTIK)||CONVECTION (METEOROLOGY)||CONVECTIVE PRECIPITATION SYSTEMS + THUNDERSTORMS, SHOWERS (METEOROLOGY)||KLIMAMODELLE + PROXY DATA (KLIMATOLOGIE)","Convection-Resolving Climate Simulations for the Greater Alpine Region","Doctoral Thesis","Open access",,"DDC - DDC::5 - Science::550 - Earth sciences","2017-06-11T19:12:07Z","2018-09-07","pub:162482","eth:48059","yes",,,,,,,,,"22425","imp593653735d28698426||imp59366b7caf05f69396","010510915",,,,,,,,"ETH Zürich::00002 - ETH Zürich::00012 - Lehre und Forschung::00007 - Departemente::02350 - Dep. Umweltsystemwissenschaften / Dep. of Environmental Systems Science::02717 - Institut für Atmosphäre und Klima / Inst. Atmospheric and Climate Science::03360 - Schär, Christoph / Schär, Christoph||ETH Zürich::00002 - ETH Zürich::00012 - Lehre und Forschung::00007 - Departemente::02350 - Dep. Umweltsystemwissenschaften / Dep. of Environmental Systems Science||ETH Zürich::00002 - ETH Zürich::00012 - Lehre und Forschung::00007 - Departemente::02350 - Dep. Umweltsystemwissenschaften / Dep. of Environmental Systems Science::02717 - Institut für Atmosphäre und Klima / Inst. Atmospheric and Climate Science",,"03360||02350||02717",,,,,"Zurich","published",,,,,,"2017-07-20T14:31:28Z","2018-11-08T01:40:37Z","true","184 p.","ECOL||ECIT","Development, Evaluation and Climate Projections",
"308005","20.500.11850/3","Whale, Thomas F.||Murray, Benjamin J.||O'Sullivan, Daniel||Wilson, Theodore W.||Umo, N.S.||Baustian, Kelly J.||Atkinson, James D.||Workneh, D.A.||Morris, George John",,,,"2019-09-04T14:16:33Z","2017-06-11T22:40:28Z||2019-09-04T14:16:33Z","2015","2015-06-15","In many clouds, the formation of ice requires the presence of particles capable of nucleating ice. Ice-nucleating particles (INPs) are rare in comparison to cloud condensation nuclei. However, the fact that only a small fraction of aerosol particles can nucleate ice means that detection and quantification of INPs is challenging. This is particularly true at temperatures above about −20 °C since the population of particles capable of serving as INPs decreases dramatically with increasing temperature. In this paper, we describe an experimental technique in which droplets of microlitre volume containing ice-nucleating material are cooled down at a controlled rate and their freezing temperatures recorded. The advantage of using large droplet volumes is that the surface area per droplet is vastly larger than in experiments focused on single aerosol particles or cloud-sized droplets. This increases the probability of observing the effect of less common, but important, high-temperature INPs and therefore allows the quantification of their ice nucleation efficiency. The potential artefacts which could influence data from this experiment, and other similar experiments, are mitigated and discussed. Experimentally determined heterogeneous ice nucleation efficiencies for K-feldspar (microcline), kaolinite, chlorite, NX-illite, Snomax® and silver iodide are presented.","application/pdf","10.3929/ethz-b-000109446",,"1867-1381||1867-8548",,"10.5194/amt-8-2437-2015","http://hdl.handle.net/20.500.11850/109446","en","Copernicus","Creative Commons Attribution 3.0 Unported","http://creativecommons.org/licenses/by/3.0/",,"A technique for quantifying heterogeneous ice nucleation in microlitre supercooled water droplets","Journal Article","Open access",,,"2017-06-11T22:41:01Z",,"pub:170541",,"yes",,,,,,,,,,"imp593653e26903a48863","010152804",,,,"Atmos. meas. tech.","6","Atmospheric Measurement Techniques","8","ETH Zürich::00002 - ETH Zürich::00012 - Lehre und Forschung::00007 - Departemente::02350 - Dep. Umweltsystemwissenschaften / Dep. of Environmental Systems Science::02717 - Institut für Atmosphäre und Klima / Inst. Atmospheric and Climate Science::03690 - Lohmann, Ulrike / Lohmann, Ulrike","ETH Zürich::00002 - ETH Zürich::00012 - Lehre und Forschung::00007 - Departemente::02350 - Dep. Umweltsystemwissenschaften / Dep. of Environmental Systems Science::02717 - Institut für Atmosphäre und Klima / Inst. Atmospheric and Climate Science::03690 - Lohmann, Ulrike / Lohmann, Ulrike","03690","03690",,"2447","2437","Göttingen","published",,,,,,"2017-07-18T15:25:55Z","2019-09-04T14:16:45Z","true",,"ECIT",,"publishedVersion"
"178665","20.500.11850/31","Welti, André",,"Ickes, Luisa",,"2017-09-20T07:07:51Z","2017-09-18T10:43:40Z||2017-09-20T07:07:51Z","2015",,"Measurements were done with IMCA/ZINC (http://www.iac.ethz.ch/group/atmospheric-physics/research/ice-nucleation/imca.html). The raw data (non averaged) is available upon request.",,,,,,"10.5905/ethz-1007-76","http://hdl.handle.net/20.500.11850/185338",,"ETH Zürich, IAC",,,"Immersion freezing||mineral dust||ice nucleation","Immersion Freezing Dataset of Kaolinite, Illite, Montmorillonite, Microcline and Arizona Test Dust (ATD)","Dataset","Metadata only",,,"2017-09-18T10:43:40Z",,,,"yes",,,,,,,,,,,,,,,,,,,"ETH Zürich::00002 - ETH Zürich::00012 - Lehre und Forschung::00007 - Departemente::02350 - Dep. Umweltsystemwissenschaften / Dep. of Environmental Systems Science::02717 - Institut für Atmosphäre und Klima / Inst. Atmospheric and Climate Science::03690 - Lohmann, Ulrike / Lohmann, Ulrike",,"03690",,,,,"Zürich",,,,"10.3929/ethz-b-000128558",,,"2017-09-20T07:08:00Z","2017-09-20T07:08:00Z","true",,"FORM",,
"98479","20.500.11850/3","Davies, Huw C.",,,,"2017-06-11T16:19:49Z","2017-06-11T16:19:49Z","2015-01",,,,,,"1520-0493||0027-0644",,"10.1175/MWR-D-14-00098.1","http://hdl.handle.net/20.500.11850/98512","en","American Meteorological Society",,,,"The Quasigeostrophic Omega Equation: Reappraisal, Refinements, and Relevance","Journal Article","Metadata only",,,"2017-06-11T16:20:03Z",,"pub:154123",,"yes",,,,,,,,,,"imp593652f68fc3454242","000051257",,,"000347916700001","Mon. Weather Rev.","1","Monthly Weather Review","143","ETH Zürich::00002 - ETH Zürich::00012 - Lehre und Forschung::00007 - Departemente::02350 - Dep. Umweltsystemwissenschaften / Dep. of Environmental Systems Science::02717 - Institut für Atmosphäre und Klima / Inst. Atmospheric and Climate Science::03854 - Wernli, Johann Heinrich / Wernli, Johann Heinrich","ETH Zürich::00002 - ETH Zürich::00012 - Lehre und Forschung::00007 - Departemente::02350 - Dep. Umweltsystemwissenschaften / Dep. of Environmental Systems Science::02717 - Institut für Atmosphäre und Klima / Inst. Atmospheric and Climate Science::03854 - Wernli, Johann Heinrich / Wernli, Johann Heinrich","03854","03854",,"25","3","Boston, MA","published",,,,,,"2017-07-26T05:24:41Z","2020-02-14T15:03:29Z","true",,"ECIT",,
"102750","20.500.11850/3","Zhang, Xiaotong||Liang, Shunlin||Wild, Martin||Jiang, Bo",,,,"2017-06-11T18:32:15Z","2017-06-11T18:32:15Z","2015",,,,,,"0034-4257",,"10.1016/j.rse.2015.05.015","http://hdl.handle.net/20.500.11850/102783","en","Elsevier",,,"Incident shortwave radiation||Remote sensing||Satellite||Global irradiance","Analysis of surface incident shortwave radiation from four satellite products","Journal Article","Metadata only",,,"2017-06-11T18:33:11Z",,"pub:160940",,"yes",,,,,,,,,,"imp59365358834ed53358","000053663",,,"000357545400015","Remote Sens. Environ.",,"Remote Sensing of Environment","165","ETH Zürich::00002 - ETH Zürich::00012 - Lehre und Forschung::00007 - Departemente::02350 - Dep. Umweltsystemwissenschaften / Dep. of Environmental Systems Science::02717 - Institut für Atmosphäre und Klima / Inst. Atmospheric and Climate Science::03360 - Schär, Christoph / Schär, Christoph","ETH Zürich::00002 - ETH Zürich::00012 - Lehre und Forschung::00007 - Departemente::02350 - Dep. Umweltsystemwissenschaften / Dep. of Environmental Systems Science::02717 - Institut für Atmosphäre und Klima / Inst. Atmospheric and Climate Science::03360 - Schär, Christoph / Schär, Christoph","03360","03360","Received 26 November 2014, Received in revised form 20 April 2015, Accepted 20 May 2015, Available online 26 May 2015.","202","186","New York","published",,,,,,"2017-07-15T15:42:56Z","2021-02-14T13:08:28Z","true",,"ECIT",,
"108244","20.500.11850/3","Sanderson, Benjamin M.||Knutti, Reto||Caldwell, Peter",,,,"2017-06-11T21:51:16Z","2017-06-11T21:51:16Z","2015",,,,,,"0894-8755||1520-0442",,"10.1175/JCLI-D-14-00362.1","http://hdl.handle.net/20.500.11850/108277","en","American Meteorological Society",,,,"A Representative Democracy to Reduce Interdependency in a Multimodel Ensemble","Journal Article","Metadata only",,,"2017-06-11T21:51:44Z",,"pub:169075",,"yes",,,,,,,,,,"imp593653cb9bf7075602","000490902","84942067342",,"000357485700010","J. climate","13","Journal of Climate","28","ETH Zürich::00002 - ETH Zürich::00012 - Lehre und Forschung::00007 - Departemente::02350 - Dep. Umweltsystemwissenschaften / Dep. of Environmental Systems Science::02717 - Institut für Atmosphäre und Klima / Inst. Atmospheric and Climate Science::03777 - Knutti, Reto / Knutti, Reto","ETH Zürich::00002 - ETH Zürich::00012 - Lehre und Forschung::00007 - Departemente::02350 - Dep. Umweltsystemwissenschaften / Dep. of Environmental Systems Science::02717 - Institut für Atmosphäre und Klima / Inst. Atmospheric and Climate Science::03777 - Knutti, Reto / Knutti, Reto","03777","03777","Manuscript received 22 May 2014, In final form 6 March 2015.","5194","5171","Boston, MA","published",,,,,,"2017-07-15T15:32:54Z","2018-12-02T06:39:13Z","true",,"ECIT",,
"252159","20.500.11850/3","Jerez, Sonia||Tobin, Isabelle||Vautard, Robert||Montávez, Juan P.||López-Romero, Jose M.||Thais, Françoise||Bartok, Blanka||Christensen, Ole B.||Colette, Augustin||Déqué, Michel||Nikulin, Grigory||Kotlarski, Sven||Van Meijgaard, Erik||Teichmann, Claas||Wild, Martin",,,,"2018-09-07T11:25:25Z","2017-06-11T22:23:40Z||2018-09-07T11:25:25Z","2015","2015-12-11","Ambitious climate change mitigation plans call for a significant increase in the use of renewables, which could, however, make the supply system more vulnerable to climate variability and changes. Here we evaluate climate change impacts on solar photovoltaic (PV) power in Europe using the recent EURO-CORDEX ensemble of high-resolution climate projections together with a PV power production model and assuming a well-developed European PV power fleet. Results indicate that the alteration of solar PV supply by the end of this century compared with the estimations made under current climate conditions should be in the range (−14%;+2%), with the largest decreases in Northern countries. Temporal stability of power generation does not appear as strongly affected in future climate scenarios either, even showing a slight positive trend in Southern countries. Therefore, despite small decreases in production expected in some parts of Europe, climate change is unlikely to threaten the European PV sector.","application/pdf","10.3929/ethz-b-000109241",,"2041-1723",,"10.1038/ncomms10014","http://hdl.handle.net/20.500.11850/109241","en","Nature Publishing Group","Creative Commons Attribution 4.0 International","http://creativecommons.org/licenses/by/4.0/",,"The impact of climate change on photovoltaic power generation in Europe","Journal Article","Open access",,,"2017-06-11T22:24:16Z",,"pub:170306",,"yes",,,,,,,,,,"imp593653dea9c8585252","007044158","84949580254",,"000367567400002","Nat Commun",,"Nature Communications","6","ETH Zürich::00002 - ETH Zürich::00012 - Lehre und Forschung::00007 - Departemente::02350 - Dep. Umweltsystemwissenschaften / Dep. of Environmental Systems Science::02717 - Institut für Atmosphäre und Klima / Inst. Atmospheric and Climate Science::03360 - Schär, Christoph / Schär, Christoph","ETH Zürich::00002 - ETH Zürich::00012 - Lehre und Forschung::00007 - Departemente::02350 - Dep. Umweltsystemwissenschaften / Dep. of Environmental Systems Science::02717 - Institut für Atmosphäre und Klima / Inst. Atmospheric and Climate Science::03360 - Schär, Christoph / Schär, Christoph","03360","03360",,,"10014","London","published",,,,,,"2017-07-15T15:53:38Z","2020-02-15T14:48:16Z","true","8 p.","ECIT",,"publishedVersion"
