"103224","20.500.11850/3","Aemisegger, F.||Spiegel, J.K.||Pfahl, S.||Sodemann, H.||Eugster, Werner||Wernli, Heini",,,,"2017-06-11T18:46:00Z","2017-06-11T18:46:00Z","2015-07-16",,,,,,"0094-8276||1944-8007",,"10.1002/2015GL063988","http://hdl.handle.net/20.500.11850/103257","en","American Geophysical Union",,,,"Isotope meteorology of cold front passages: A case study combining observations and modeling","Journal Article","Metadata only",,,"2017-06-11T18:46:08Z",,"pub:161468",,"yes",,,,,,,,,,"imp593653637d65222294","000047284","84938203185",,"000358691300071","Geophys. Res. Lett.","13","Geophysical Research Letters","42","ETH Zürich::00002 - ETH Zürich::00012 - Lehre und Forschung::00007 - Departemente::02350 - Dep. Umweltsystemwissenschaften / Dep. of Environmental Systems Science::02703 - Institut für Agrarwissenschaften / Institute of Agricultural Sciences::03648 - Buchmann, Nina / Buchmann, Nina||ETH Zürich::00002 - ETH Zürich::00012 - Lehre und Forschung::00007 - Departemente::02350 - Dep. Umweltsystemwissenschaften / Dep. of Environmental Systems Science::02717 - Institut für Atmosphäre und Klima / Inst. Atmospheric and Climate Science::03854 - Wernli, Johann Heinrich / Wernli, Johann Heinrich","ETH Zürich::00002 - ETH Zürich::00012 - Lehre und Forschung::00007 - Departemente::02350 - Dep. Umweltsystemwissenschaften / Dep. of Environmental Systems Science::02703 - Institut für Agrarwissenschaften / Institute of Agricultural Sciences::03648 - Buchmann, Nina / Buchmann, Nina||ETH Zürich::00002 - ETH Zürich::00012 - Lehre und Forschung::00007 - Departemente::02350 - Dep. Umweltsystemwissenschaften / Dep. of Environmental Systems Science::02717 - Institut für Atmosphäre und Klima / Inst. Atmospheric and Climate Science::03854 - Wernli, Johann Heinrich / Wernli, Johann Heinrich","03648||03854","03648||03854","Received 27 March 2015, Accepted 19 June 2015, Accepted article online 24 June 2015, Published online 14 July 2015. Published online by Wiley.","5660","5652","Washington, DC","published",,,,,,"2017-07-15T09:38:53Z","2021-02-14T13:11:24Z","true",,"ECIT",,
"103225","20.500.11850/3","Greve, P.||Seneviratne, Sonia I.",,,,"2017-06-11T18:46:00Z","2017-06-11T18:46:00Z","2015-07-16",,,,,,"0094-8276||1944-8007",,"10.1002/2015GL064127","http://hdl.handle.net/20.500.11850/103258","en","American Geophysical Union",,,,"Assessment of future changes in water availability and aridity","Journal Article","Metadata only",,,"2017-06-11T18:46:08Z",,"pub:161469",,"yes",,,,,,,,,,"imp59365363836c895199","000047284",,,"000358691300051","Geophys. Res. Lett.","13","Geophysical Research Letters","42","ETH Zürich::00002 - ETH Zürich::00012 - Lehre und Forschung::00007 - Departemente::02350 - Dep. Umweltsystemwissenschaften / Dep. of Environmental Systems Science::02717 - Institut für Atmosphäre und Klima / Inst. Atmospheric and Climate Science::03778 - Seneviratne, Sonia / Seneviratne, Sonia","ETH Zürich::00002 - ETH Zürich::00012 - Lehre und Forschung::00007 - Departemente::02350 - Dep. Umweltsystemwissenschaften / Dep. of Environmental Systems Science::02717 - Institut für Atmosphäre und Klima / Inst. Atmospheric and Climate Science::03778 - Seneviratne, Sonia / Seneviratne, Sonia","03778","03778","Received 4 April 2015, Accepted 8 June 2015, Accepted article online 11 June 2015, Published online 4 July 2015. Published online by Wiley.","5499","5493","Washington, DC","published",,,,,,"2017-07-19T08:44:35Z","2022-03-28T14:01:37Z","true",,"ECIT",,
"313534","20.500.11850/3","Würsch, Michael||Sprenger, Michael",,,,"2019-10-11T14:04:56Z","2017-06-11T18:45:58Z||2019-10-11T14:04:56Z","2015-07-16","2015-04-04","Two different South Foehn types have been described in the literature: the Swiss Foehn is characterized by significant ascent on the southern side of the Alps, hence fulfilling a requirement of the thermodynamic Foehn theory associated with latent heating. On contrast, the Austrian Foehn is characterized by near-horizontal flow to the south of the Alps, followed by dry-adiabatic descent into the northern Foehn valleys. In this study, we make use of three years (2000–2002) of NWP reanalysis data, based on the COSMO model, and corresponding Foehn observations at a Swiss (Altdorf in the Reuss Valley) and Austrian (Ellbögen in the Wipp Valley) measurement site to address the applicability of this Foehn type classification. First, the methods are introduced in a case study of a strong Foehn case on 2–4 April 2000. The more traditional Eulerian analysis is complemented by trajectory calculations. Forward trajectories started in the Po Valley and backward trajectories started at the two Foehn stations reveal a complex flow situation. For instance, air parcels arriving in Altdorf can be trapped in the easterly, low-level Po Valley jet before ascending and passing over the Alpine crest, thus originating from further east than air parcels arriving in Ellbögen and having experienced less vertical ascent south of the Alps. This highlights the potential of Lagrangian-based flow analysis and concurrently points to the limitations of a pure Eulerian perspective.The main part of the study considers a climatology of the 3-year backward trajectories started at Altdorf and Ellbögen. Some key findings are: (i) a larger fraction of trajectories arriving in Altdorf experience substantial lifting on the Alpine south side compared to Ellbögen; (ii) both Foehn types can be observed at both stations, i.e., the type naming cannot be taken as an exclusive regional classification; (iii) precipitation traced back is more predominant for Altdorf trajectories than for Ellbögen ones, indicating that the latent heating contributes more to Foehn warming in Altdorf than in Ellbögen. Finally, from a forecasting perspective it is of interest whether the Foehn type can be deduced from a simple measurement alone. To this aim, Milan pseudo-soundings in the Po Valley, essentially south of Altdorf, are considered. Composite soundings are compared for Foehn cases in Altdorf with substantial lifting to those with weak lifting, corresponding to a non-blocked and blocked flow in the Po Valley. The two classes clearly differ in their composite profile; however, the spread prohibits an immediate classification on this sounding alone.","application/pdf","10.3929/ethz-b-000103254",,"0941-2948||1610-1227",,"10.1127/metz/2015/0647","http://hdl.handle.net/20.500.11850/103254","en","Schweizerbart","Creative Commons Attribution-NonCommercial 3.0 Unported","http://creativecommons.org/licenses/by-nc/3.0/","Foehn||Climatology||Altdorf||Innsbruck||trajectories","Swiss and Austrian Foehn revisited: A Lagrangian-based analysis","Journal Article","Open access",,,"2017-06-11T18:46:08Z",,"pub:161465",,"yes",,,,,,,,,,"imp593653636a82714419","000637360",,,"000358784000001","Meteorol. Z.","3","Meteorologische Zeitschrift","24","ETH Zürich::00002 - ETH Zürich::00012 - Lehre und Forschung::00007 - Departemente::02350 - Dep. Umweltsystemwissenschaften / Dep. of Environmental Systems Science::02717 - Institut für Atmosphäre und Klima / Inst. Atmospheric and Climate Science::03854 - Wernli, Johann Heinrich / Wernli, Johann Heinrich","ETH Zürich::00002 - ETH Zürich::00012 - Lehre und Forschung::00007 - Departemente::02350 - Dep. Umweltsystemwissenschaften / Dep. of Environmental Systems Science::02717 - Institut für Atmosphäre und Klima / Inst. Atmospheric and Climate Science::03854 - Wernli, Johann Heinrich / Wernli, Johann Heinrich","03854","03854",,"242","225","Stuttgart","published",,,,,,"2017-07-19T12:54:53Z","2022-03-28T23:51:18Z","true",,"ECIT",,"publishedVersion"
"229430","20.500.11850/3","Rogelj, Joeri||Reisinger, Andy||McCollum, David L.||Knutti, Reto||Riahi, Keywan||Meinshausen, Malte",,,,"2018-04-06T12:19:14Z","2017-06-11T18:52:24Z||2018-04-06T12:19:14Z","2015-07","2015-07-10","Global-mean temperature increase is roughly proportional to cumulative emissions of carbon-dioxide (CO2). Limiting global warming to any level thus implies a finite CO2 budget. Due to geophysical uncertainties, the size of such budgets can only be expressed in probabilistic terms and is further influenced by non-CO2 emissions. We here explore how societal choices related to energy demand and specific mitigation options influence the size of carbon budgets for meeting a given temperature objective. We find that choices that exclude specific CO2 mitigation technologies (like Carbon Capture and Storage) result in greater costs, smaller compatible CO2 budgets until 2050, but larger CO2 budgets until 2100. Vice versa, choices that lead to a larger CO2 mitigation potential result in CO2 budgets until 2100 that are smaller but can be met at lower costs. In most cases, these budget variations can be explained by the amount of non-CO2 mitigation that is carried out in conjunction with CO2, and associated global carbon prices that also drive mitigation of non-CO2 gases. Budget variations are of the order of 10% around their central value. In all cases, limiting warming to below 2 °C thus still implies that CO2 emissions need to be reduced rapidly in the coming decades.","application/pdf","10.3929/ethz-b-000103372",,"1748-9326||1748-9318",,"10.1088/1748-9326/10/7/075003","http://hdl.handle.net/20.500.11850/103372","en","Institute of Physics","Creative Commons Attribution 3.0 Unported","http://creativecommons.org/licenses/by/3.0/","Climate change||Carbot budgets||Emission budgets||Mitigation||Greenhouse gases||Non-CO2||Methane","Mitigation choices impact carbon budget size compatible with low temperature goals","Journal Article","Open access",,,"2017-06-11T18:53:26Z",,"pub:161614",,"yes",,,,,,,,,,"imp59365366296f376032","005253059","84982064540",,"000366759200020","Environ. Res. Lett.","7","Environmental Research Letters","10","ETH Zürich::00002 - ETH Zürich::00012 - Lehre und Forschung::00007 - Departemente::02350 - Dep. Umweltsystemwissenschaften / Dep. of Environmental Systems Science::02717 - Institut für Atmosphäre und Klima / Inst. Atmospheric and Climate Science::03777 - Knutti, Reto / Knutti, Reto","ETH Zürich::00002 - ETH Zürich::00012 - Lehre und Forschung::00007 - Departemente::02350 - Dep. Umweltsystemwissenschaften / Dep. of Environmental Systems Science::02717 - Institut für Atmosphäre und Klima / Inst. Atmospheric and Climate Science::03777 - Knutti, Reto / Knutti, Reto","03777","03777",,,"075003","Bristol","published",,,,,,"2017-07-15T07:06:02Z","2021-02-14T23:11:22Z","true","11 p.","ECIT",,"publishedVersion"
"229425","20.500.11850/3","Rogelj, Joeri||Meinshausen, Malte||Schaeffer, Michiel||Knutti, Reto||Riahi, Keywan",,,,"2018-04-06T12:14:48Z","2017-06-11T18:52:23Z||2018-04-06T12:14:48Z","2015-07","2015-07-10","Limiting global warming to any level requires limiting the total amount of CO2 emissions, or staying within a CO2 budget. Here we assess how emissions from short-lived non-CO2 species like methane, hydrofluorocarbons (HFCs), black-carbon, and sulphates influence these CO2 budgets. Our default case, which assumes mitigation in all sectors and of all gases, results in a CO2 budget between 2011–2100 of 340 PgC for a >66% chance of staying below 2°C, consistent with the assessment of the Fifth Assessment Report of the Intergovernmental Panel on Climate Change. Extreme variations of air-pollutant emissions from black-carbon and sulphates influence this budget by about ±5%. In the hypothetical case of no methane or HFCs mitigation—which is unlikely when CO2 is stringently reduced—the budgets would be much smaller (40% or up to 60%, respectively). However, assuming very stringent CH4 mitigation as a sensitivity case, CO2 budgets could be 25% higher. A limit on cumulative CO2 emissions remains critical for temperature targets. Even a 25% higher CO2 budget still means peaking global emissions in the next two decades, and achieving net zero CO2 emissions during the third quarter of the 21st century. The leverage we have to affect the CO2 budget by targeting non-CO2 diminishes strongly along with CO2 mitigation, because these are partly linked through economic and technological factors.","application/pdf","10.3929/ethz-b-000103371",,"1748-9326||1748-9318",,"10.1088/1748-9326/10/7/075001","http://hdl.handle.net/20.500.11850/103371","en","Institute of Physics","Creative Commons Attribution 3.0 Unported","http://creativecommons.org/licenses/by/3.0/","Climate change||Carbon budget||Cumulative carbon||Short-lived climate pollutants||Global warming||Carbon dioxide","Impact of short-lived non-CO2 mitigation on carbon budgets for stabilizing global warming","Journal Article","Open access",,,"2017-06-11T18:53:26Z",,"pub:161613",,"yes",,,,,,,,,,"imp5936536623bfd24097","005253059","84982074184",,"000366759200018","Environ. Res. Lett.","7","Environmental Research Letters","10","ETH Zürich::00002 - ETH Zürich::00012 - Lehre und Forschung::00007 - Departemente::02350 - Dep. Umweltsystemwissenschaften / Dep. of Environmental Systems Science::02717 - Institut für Atmosphäre und Klima / Inst. Atmospheric and Climate Science::03777 - Knutti, Reto / Knutti, Reto","ETH Zürich::00002 - ETH Zürich::00012 - Lehre und Forschung::00007 - Departemente::02350 - Dep. Umweltsystemwissenschaften / Dep. of Environmental Systems Science::02717 - Institut für Atmosphäre und Klima / Inst. Atmospheric and Climate Science::03777 - Knutti, Reto / Knutti, Reto","03777","03777",,,"075001","Bristol","published",,,,,,"2017-07-31T14:57:33Z","2021-02-14T23:11:20Z","true","10 p.","ECIT",,"publishedVersion"
"103559","20.500.11850/3","Ma, Qian||Wang, Kaicun||Wild, Martin",,,,"2017-06-11T19:03:24Z","2017-06-11T19:03:24Z","2015-07",,,,,,"0148-0227||2169-897X",,"10.1002/2014JD022572","http://hdl.handle.net/20.500.11850/103592","en","Blackwell Publishing Ltd",,,"Clouds||CMIP5||Earth System Model||Surface incident solar radiation","Impact of geolocations of validation data on the evaluation of surface incident shortwave radiation from Earth System Models","Journal Article","Metadata only",,,"2017-06-11T19:04:11Z",,"pub:161854",,"yes",,,,,,,,,,"imp5936536b3e17c69120","004289357","84939266129",,,"J. geophys. res., Atmos.","14","Journal of Geophysical Research: Atmospheres","120","ETH Zürich::00002 - ETH Zürich::00012 - Lehre und Forschung::00007 - Departemente::02350 - Dep. Umweltsystemwissenschaften / Dep. of Environmental Systems Science::02717 - Institut für Atmosphäre und Klima / Inst. Atmospheric and Climate Science::03360 - Schär, Christoph / Schär, Christoph","ETH Zürich::00002 - ETH Zürich::00012 - Lehre und Forschung::00007 - Departemente::02350 - Dep. Umweltsystemwissenschaften / Dep. of Environmental Systems Science::02717 - Institut für Atmosphäre und Klima / Inst. Atmospheric and Climate Science::03360 - Schär, Christoph / Schär, Christoph","03360","03360","Published online by: Wiley. Received 12 September 2014, Revised 13 May 2015, Accepted 8 July 2015, First published 27 July 2015.","6844","6825","Washington, DC","published",,,,,,"2017-07-18T15:35:40Z","2022-03-28T14:03:15Z","true",,"ECIT",,
"103097","20.500.11850/3","Lobo, Prem||Durdina, Lukas||Smallwood, Gregory J.||Rindlisbacher, Theodor||Siegerist, Frithjof||Black, Elizabeth A.||Yu, Zhenhong||Mensah, Amewu A.||Hagen, Donald E.||Miake-Lye, Richard C.||Thomson, Kevin A.||Brem, Benjamin R.||Corbin, Joel C.||Abegglen, Manuel||Sierau, Berko||Whitefield, Philip D.||Wang, Jing",,,,"2017-06-11T18:42:35Z","2017-06-11T18:42:35Z","2015-07",,,,,,"0278-6826||1521-7388",,"10.1080/02786826.2015.1047012","http://hdl.handle.net/20.500.11850/103130","en","Taylor & Francis",,,,"Measurement of Aircraft Engine Non-volatile PM Emissions: Results of the Aviation - Particle Regulatory Instrument Demonstration Experiment (A-PRIDE) 4 Campaign","Journal Article","Metadata only",,,"2017-06-11T18:42:59Z",,"pub:161326",,"yes",,,,,,,,,,"imp59365360cedb160739","000016965",,,,"Aerosol Sci. Tech.","7","Aerosol Science and Technology","49","ETH Zürich::00002 - ETH Zürich::00012 - Lehre und Forschung::00007 - Departemente::02350 - Dep. Umweltsystemwissenschaften / Dep. of Environmental Systems Science::02717 - Institut für Atmosphäre und Klima / Inst. Atmospheric and Climate Science::03690 - Lohmann, Ulrike / Lohmann, Ulrike||ETH Zürich::00002 - ETH Zürich::00012 - Lehre und Forschung::00007 - Departemente::02115 - Dep. Bau, Umwelt und Geomatik / Dep. of Civil, Env. and Geomatic Eng.::02608 - Institut für Umweltingenieurwiss. / Institute of Environmental Engineering::03887 - Wang, Jing / Wang, Jing","ETH Zürich::00002 - ETH Zürich::00012 - Lehre und Forschung::00007 - Departemente::02350 - Dep. Umweltsystemwissenschaften / Dep. of Environmental Systems Science::02717 - Institut für Atmosphäre und Klima / Inst. Atmospheric and Climate Science::03690 - Lohmann, Ulrike / Lohmann, Ulrike||ETH Zürich::00002 - ETH Zürich::00012 - Lehre und Forschung::00007 - Departemente::02115 - Dep. Bau, Umwelt und Geomatik / Dep. of Civil, Env. and Geomatic Eng.::02608 - Institut für Umweltingenieurwiss. / Institute of Environmental Engineering::03887 - Wang, Jing / Wang, Jing","03690||03887","03690||03887","Received 28 December 2014, Accepted 27 April 2015, Accepted author version posted online 01 May 2015.","484","472","London","published",,,,,,"2017-08-01T09:38:13Z","2022-03-28T14:01:17Z","true",,"ECIT",,
"322704","20.500.11850/3","Mitchell, Daniel M.||Misios, Stergios||Gray, Lesley||Tourpali, Kleareti||Matthes, Katja||Hood, Lon||Schmidt, Hauke||Chiodo, Gabriel||Thiéblemont, Rémi||Rozanov, Eugene||Shindell, Drew||Krivolutsky, Alexei",,,,"2019-12-04T14:21:27Z","2017-06-11T19:20:12Z||2019-12-04T14:21:27Z","2015-07","2015-02-09","The 11 year solar‐cycle component of climate variability is assessed in historical simulations of models taken from the Coupled Model Intercomparison Project, phase 5 (CMIP‐5). Multiple linear regression is applied to estimate the zonal temperature, wind and annular mode responses to a typical solar cycle, with a focus on both the stratosphere and the stratospheric influence on the surface over the period ∼1850–2005. The analysis is performed on all CMIP‐5 models but focuses on the 13 CMIP‐5 models that resolve the stratosphere (high‐top models) and compares the simulated solar cycle signature with reanalysis data. The 11 year solar cycle component of climate variability is found to be weaker in terms of magnitude and latitudinal gradient around the stratopause in the models than in the reanalysis. The peak in temperature in the lower equatorial stratosphere (∼70 hPa) reported in some studies is found in the models to depend on the length of the analysis period, with the last 30 years yielding the strongest response.  A modification of the Polar Jet Oscillation (PJO) in response to the 11 year solar cycle is not robust across all models, but is more apparent in models with high spectral resolution in the short‐wave region. The PJO evolution is slower in these models, leading to a stronger response during February, whereas observations indicate it to be weaker. In early winter, the magnitude of the modelled response is more consistent with observations when only data from 1979–2005 are considered. The observed North Pacific high‐pressure surface response during the solar maximum is only simulated in some models, for which there are no distinguishing model characteristics. The lagged North Atlantic surface response is reproduced in both high‐ and low‐top models, but is more prevalent in the former. In both cases, the magnitude of the response is generally lower than in observations.","application/pdf","10.3929/ethz-b-000104237",,"0035-9009||1477-870X",,"10.1002/qj.2530","http://hdl.handle.net/20.500.11850/104237","en","Wiley","Creative Commons Attribution 4.0 International","http://creativecommons.org/licenses/by/4.0/","SolarMIP||Solar variability||Stratosphere||CMIP-5||Climate||Natural variability","Solar signals in CMIP‐5 simulations: the stratospheric pathway","Journal Article","Open access",,,"2017-06-11T19:20:32Z",,"pub:163074",,"yes",,,,"Future and Past Solar Influence on the Terrestrial Climate II","147659","10.13039/501100001711","SNF","SNF: Sonstige",,"imp593653799d87070729","000053342","84941179513",,"000360986200031","Q. J. R. Meteorol. Soc.","691","Quarterly Journal of the Royal Meteorological Society","141","ETH Zürich::00002 - ETH Zürich::00012 - Lehre und Forschung::00007 - Departemente::02350 - Dep. Umweltsystemwissenschaften / Dep. of Environmental Systems Science::02717 - Institut für Atmosphäre und Klima / Inst. Atmospheric and Climate Science::03517 - Peter, Thomas (emeritus) / Peter, Thomas (emeritus)","ETH Zürich::00002 - ETH Zürich::00012 - Lehre und Forschung::00007 - Departemente::02350 - Dep. Umweltsystemwissenschaften / Dep. of Environmental Systems Science::02717 - Institut für Atmosphäre und Klima / Inst. Atmospheric and Climate Science::03517 - Peter, Thomas (emeritus) / Peter, Thomas (emeritus)","03517","03517",,"2403","2390","London","published",,,,,,"2017-08-03T08:38:47Z","2023-02-06T17:55:57Z","true",,"ECIT",,"publishedVersion"
"465632","20.500.11850/3","Sanderson, Benjamin M.||Knutti, Reto||Caldwell, Peter",,,,"2022-08-30T11:10:20Z","2022-08-30T11:07:52Z||2022-08-30T11:10:20Z","2015-07-01",,"The diverse set of Earth system models used to conduct the CMIP5 ensemble can partly sample the uncertainties in future climate projections. However, combining those projections is complicated by the fact that models developed by different groups share ideas and code and therefore biases. The authors propose a method for combining model results into single or multivariate distributions that are more robust to the inclusion of models with a large degree of interdependency. This study uses a multivariate metric of present-day climatology to assess both model performance and similarity in two recent model intercomparisons, CMIP3 and CMIP5. Model characteristics can be interpolated and then resampled in a space defined by independent climate properties. A form of weighting can be applied by sampling more densely in the region of the space close to the projected observations, thus taking into account both model performance and interdependence. The choice of the sampling distribution’s parameters is a subjective decision that should reflect the researcher’s prior assumptions as to the acceptability of different model errors.",,,,"0894-8755||1520-0442","http://hdl.handle.net/20.500.11850/164406||http://hdl.handle.net/20.500.11850/102500","10.1175/JCLI-D-14-00361.1","http://hdl.handle.net/20.500.11850/567602","en","American Meteorological Society",,,,"Addressing Interdependency in a Multimodel Ensemble by Interpolation of Model Properties","Journal Article","Metadata only",,,"2017-06-11T18:24:04Z",,"pub:169074||pub:160640",,"yes",,,,,,,,,,"imp593653cb9664059872||imp59365351e564a32741",,"84942025934",,"000357485700009","J. climate","13","Journal of Climate","28","ETH Zürich::00002 - ETH Zürich::00012 - Lehre und Forschung::00007 - Departemente::02350 - Dep. Umweltsystemwissenschaften / Dep. of Environmental Systems Science::02717 - Institut für Atmosphäre und Klima / Inst. Atmospheric and Climate Science::03777 - Knutti, Reto / Knutti, Reto","ETH Zürich::00002 - ETH Zürich::00012 - Lehre und Forschung::00007 - Departemente::02350 - Dep. Umweltsystemwissenschaften / Dep. of Environmental Systems Science::02717 - Institut für Atmosphäre und Klima / Inst. Atmospheric and Climate Science::03777 - Knutti, Reto / Knutti, Reto","03777","03777",,"5170","5150","Boston, MA","published",,,,,,"2022-08-30T11:08:00Z","2023-02-07T05:51:05Z","true",,"ECIT",,
"103530","20.500.11850/3","Schemm, Sebastian||Rudeva, Irina||Simmonds, Ian",,,,"2017-06-11T18:56:23Z","2017-06-11T18:56:23Z","2015-07",,,,,,"0035-9009||1477-870X",,"10.1002/qj.2471","http://hdl.handle.net/20.500.11850/103563","en","Wiley-Blackwell",,,"Automated detection||Climatology||Fronts||Thermal fronts||Wind fronts","Extratropical fronts in the lower troposphere-global perspectives obtained from two automated methods","Journal Article","Metadata only",,,"2017-06-11T18:56:27Z",,"pub:161811",,"yes",,,,,,,,,,"imp5936536a7cf9756206",,"84939452769",,"000360203800016","Q. J. R. Meteorol. Soc.","690","Quarterly Journal of the Royal Meteorological Society","141","ETH Zürich::00002 - ETH Zürich::00012 - Lehre und Forschung::00007 - Departemente::02350 - Dep. Umweltsystemwissenschaften / Dep. of Environmental Systems Science::02717 - Institut für Atmosphäre und Klima / Inst. Atmospheric and Climate Science::03854 - Wernli, Johann Heinrich / Wernli, Johann Heinrich","ETH Zürich::00002 - ETH Zürich::00012 - Lehre und Forschung::00007 - Departemente::02350 - Dep. Umweltsystemwissenschaften / Dep. of Environmental Systems Science::02717 - Institut für Atmosphäre und Klima / Inst. Atmospheric and Climate Science::03854 - Wernli, Johann Heinrich / Wernli, Johann Heinrich","03854","03854","Received 8 May 2014, Revised 1 September 2014, Accepted 23 September 2014, Published online 21 November 2014.","1698","1686","London","published",,,,,"true","2017-07-19T10:58:35Z","2023-02-06T13:00:16Z","true",,"ECIT",,
