"440988","20.500.11850/3","Ammann, Jeanine||Walter, Achim||El Benni, Nadja",,,,,,,,,,,"2022-02-23T12:06:53Z","2021-12-26T03:55:22Z||2022-02-21T13:28:43Z||2022-02-23T12:06:53Z",,"2022-01","2021-12-21","The use of digital technologies in agriculture offers various benefits, such as site-specific application, better monitoring, and physical relief. The handling of these technologies requires a specific skill set. Therefore, the question arises of when and how farm managers learn about digital technologies. Aiming to analyse the current situation, the present research investigated the role that digital technologies play in vocational training for future farm managers. Taking the example of farm management information systems (FMIS), the present study also analysed various predictors of adoption, including the effect of training. To investigate these research questions, an online survey among teachers and students of the farm management vocational programme across Switzerland was conducted in the spring of 2021. In total, 150 individuals participated, 41 of whom were teachers. Participants answered questions about the learning content in the farm management programme and their perception of digital technologies in general. Students further reported whether they already had a farm they would be managing in the future and how they perceived FMIS. The results indicate that both teachers and students are convinced that digital technologies play an important role in agriculture and will gain more importance in the future. A substantial part of 43% of the students who participated indicated that they had learned neither about digital technologies during their basic agricultural training nor the subsequent farm management programme. In terms of FMIS, 51% of the student sample indicated that they had never heard about FMIS during their agricultural training. While having learned about FMIS was not a significant predictor for adoption, gender, perceived ease of use, and intention to use more digital technologies in the future significantly predicted the adoption of FMIS. The paper concludes that, to support the adoption of digital technologies and FMIS specifically, training for future farm managers should focus on how to operate an FMIS to increase the perceived ease of use of this technology.","application/pdf","10.3929/ethz-b-000522351",,"0743-0167",,"10.1016/j.jrurstud.2021.12.008","http://hdl.handle.net/20.500.11850/522351","en","Elsevier","Creative Commons Attribution-NonCommercial-NoDerivatives 4.0 International","http://creativecommons.org/licenses/by-nc-nd/4.0/","Farm management information system||Education||Training||Digital technology||Adoption||Environmental concerns","Adoption and perception of farm management information systems by future Swiss farm managers – An online study",,"Journal Article","Open access",,,,"2021-12-26T03:55:29Z",,,,,,,"yes",,,,,,,,,,,,,,"85121438038",,"000749488500004",,,"Journal of Rural Studies","89","ETH Zürich::00002 - ETH Zürich::00012 - Lehre und Forschung::00007 - Departemente::02350 - Dep. Umweltsystemwissenschaften / Dep. of Environmental Systems Science::02703 - Institut für Agrarwissenschaften / Institute of Agricultural Sciences::03894 - Walter, Achim / Walter, Achim","ETH Zürich::00002 - ETH Zürich::00012 - Lehre und Forschung::00007 - Departemente::02350 - Dep. Umweltsystemwissenschaften / Dep. of Environmental Systems Science::02703 - Institut für Agrarwissenschaften / Institute of Agricultural Sciences::03894 - Walter, Achim / Walter, Achim","03894","03894",,"305","298","New York, NY","published",,,,,,,,,,,,,,"2022-02-23T12:07:05Z","2023-02-07T00:16:00Z","true",,"SCOPUS",,,"publishedVersion",
"444684","20.500.11850/3","Greeff, Michael||Caspers, Max||Kalkman, Vincent||Willemse, Luc||Sunderland, Barry Dermot||Bánki, Olaf||Hogeweg, Laurens",,,,,,,,,,,"2022-03-23T09:28:43Z","2022-03-21T16:45:18Z||2022-03-22T06:10:26Z||2022-03-23T09:28:43Z",,"2022","2022-03-01","Natural history collections play a vital role in biodiversity research and conservation by providing a window to the past. The usefulness of the vast amount of historical data depends on their quality, with correct taxonomic identifications being the most critical. The identification of many of the objects of natural history collections, however, is wanting, doubtful or outdated. Providing correct identifications is difficult given the sheer number of objects and the scarcity of expertise. Here we outline the construction of an ecosystem for the collaborative development and exchange of image recognition algorithms designed to support the identification of objects. Such an ecosystem will facilitate sharing taxonomic expertise among institutions by offering image datasets that are correctly identified by their in-house taxonomic experts. Together with openly accessible machine learning algorithms and easy to use workbenches, this will allow other institutes to train image recognition algorithms and thereby compensate for the lacking expertise.","application/pdf","10.3929/ethz-b-000538223",,"2367-7163",,"10.3897/rio.8.e79187","http://hdl.handle.net/20.500.11850/538223","en","Pensoft Publishers","Creative Commons Attribution 4.0 International","http://creativecommons.org/licenses/by/4.0/","Digitization||image recognition||taxonomic expertise||herbaria||natural history collections","Sharing taxonomic expertise between natural history collections using image recognition",,"Journal Article","Open access",,"DDC - DDC::0 - Computer science, information & general works::060 - General organization & museology||DDC - DDC::5 - Science::500 - Natural sciences||DDC - DDC::0 - Computer science, information & general works::080 - General collections",,"2022-03-21T16:45:24Z",,,,,,,"yes",,,,,,,,,,,,,,,,,,,"Research Ideas and Outcomes","8","ETH Zürich::00002 - ETH Zürich::00012 - Lehre und Forschung::00007 - Departemente::02350 - Dep. Umweltsystemwissenschaften / Dep. of Environmental Systems Science::02703 - Institut für Agrarwissenschaften / Institute of Agricultural Sciences::03970 - De Moraes, Consuelo / De Moraes, Consuelo","ETH Zürich::00002 - ETH Zürich::00012 - Lehre und Forschung::00007 - Departemente::02350 - Dep. Umweltsystemwissenschaften / Dep. of Environmental Systems Science::02703 - Institut für Agrarwissenschaften / Institute of Agricultural Sciences::03970 - De Moraes, Consuelo / De Moraes, Consuelo","03970","03970",,,"e79187","Sofia","published",,,,,,,,,,,,,,"2022-03-22T06:10:31Z","2023-02-07T00:27:41Z","true","20 p.","FORM",,,"publishedVersion",
"447290","20.500.11850/3","Lugarà, Rosamaria||Realini, Livio||Kreuzer, Michael||Giller, Katrin",,,,,,,,,,,"2022-04-13T07:44:08Z","2022-02-28T09:58:03Z||2022-04-13T07:41:47Z||2022-04-13T07:44:08Z",,"2022","2022-02-15",,"application/pdf","10.3929/ethz-b-000534531",,"0309-1740",,"10.1016/j.meatsci.2022.108769","http://hdl.handle.net/20.500.11850/534531","en","Elsevier","Creative Commons Attribution 4.0 International","http://creativecommons.org/licenses/by/4.0/","Pig||Developmental programming||Maternal dietary fat||Microalga||Meat quality||Longissimus thoracis","Effects of maternal high-energy diet and spirulina supplementation in pregnant and lactating sows on performance, quality of carcass and meat, and its fatty acid profile in male and female offspring",,"Journal Article","Open access",,,,"2022-02-28T09:58:08Z",,,,,,,"yes",,,,,,,,,,,,,,"85125451655",,"000793126600014",,,"Meat Science","187","ETH Zürich::00002 - ETH Zürich::00012 - Lehre und Forschung::00007 - Departemente::02350 - Dep. Umweltsystemwissenschaften / Dep. of Environmental Systems Science::02703 - Institut für Agrarwissenschaften / Institute of Agricultural Sciences::03428 - Kreuzer, Michael (emeritus) / Kreuzer, Michael (emeritus)||ETH Zürich::00002 - ETH Zürich::00012 - Lehre und Forschung::00007 - Departemente::02350 - Dep. Umweltsystemwissenschaften / Dep. of Environmental Systems Science::02703 - Institut für Agrarwissenschaften / Institute of Agricultural Sciences::09747 - Niu, Mutian / Niu, Mutian","ETH Zürich::00002 - ETH Zürich::00012 - Lehre und Forschung::00007 - Departemente::02350 - Dep. Umweltsystemwissenschaften / Dep. of Environmental Systems Science::02703 - Institut für Agrarwissenschaften / Institute of Agricultural Sciences::03428 - Kreuzer, Michael (emeritus) / Kreuzer, Michael (emeritus)||ETH Zürich::00002 - ETH Zürich::00012 - Lehre und Forschung::00007 - Departemente::02350 - Dep. Umweltsystemwissenschaften / Dep. of Environmental Systems Science::02703 - Institut für Agrarwissenschaften / Institute of Agricultural Sciences::09747 - Niu, Mutian / Niu, Mutian","03428||09747","03428||09747",,,"108769","Amsterdam","published",,,,,,,,,,,,,,"2022-04-13T07:42:08Z","2023-02-07T00:47:52Z","true","9 p.","FORM",,,"publishedVersion",
"447799","20.500.11850/16","Siegenthaler, Maja",,,,,,,,,,"Frossard, Emmanuel||Tamburini, Federica||McLaren, Timothy Ian||Doetterl, Sebastian","2022-04-20T07:01:59Z","2022-04-19T16:39:28Z||2022-04-20T07:01:59Z",,"2022","2022-04-20","High atmospheric nitrogen (N) deposition together with climatic changes have been suggested to drive European temperate forests towards phosphorus (P) limitation. In forest ecosystems, trees and microorganisms take up phosphate from the soil solution, which represents a small proportion of total P in soil. To meet P demands, the soil solution must be replenished with P from less labile soil P pools by abiotic (desorption and dissolution) and biotic (solubilization and mineralization) processes. Soil microorganisms contribute to inorganic P solubilization through the release of organic acids and to organic P mineralization through the release of enzymes (e.g. phosphatases). Besides, they synthesize organic P forms. Upon microbial cell death, the microbially synthesized P species return to the soil and can potentially get mineralized or stabilized. Understanding the role of microorganisms in soil P cycling is thus crucial to assess the resilience of forest ecosystems to the increasing imbalance between N and P concentrations. The objective of this thesis was to study the effects of P and N additions on P cycling in the organic (O) soil horizon of temperate beech (Fagus sylvatica L.) forests developed on silicate bedrock. Although not extensively studied, the O horizon is crucial for microbial processes and beech nutrition, particularly under low P availability. Inputs of P and N were hypothesized to affect microbial activity, microbial community composition and the processes microorganisms modulate. Consequently, the proportions of inorganic and organic P pools and forms were expected to change. The effects of P and N inputs were assumed to depend on the initial nutrient status of the soils, which is defined by the underlying parent material. To gain a holistic view, several experimental (field and incubation experiments) and methodological approaches (chemical extractions, spectroscopy, isotopic tracing, enzyme assays, and molecular fingerprinting) were combined.  In chapter 1, bacterial (16S rRNA), fungal (ITS), and alkaline (phoD) and acid (acpA) phosphatase harbouring bacterial community responses to changes in soil N and P concentrations in the O horizon were investigated. A field experiment with water-soluble N and P additions was conducted at two beech forest sites with contrasting P stocks (low-P site Lüss (LUE) and high-P site Bad-Brückenau (BBR)). In BBR, microbial community structure changed in response to the increase in resin P induced by the P addition. In LUE, microbial community structure changed in response to decreasing P concentrations in several soil P pools induced by the N addition. Furthermore, the increased importance of strategies to access organic P forms in sites with low P supply from minerals was reflected by a higher relative abundance of some dominant phoD harbouring taxa in LUE than in BBR. In chapter 2, the fate of the 33P-labelled P fertilizer was traced into soil P pools and the impact of enzyme-mediated P cycling processes was determined by the level of incorporation of 18O from 18O-enriched water into phosphate in the field. During a dry summer, a field experiment with water-soluble N and P additions was conducted at a guarded beech forest site in Jülich (JUE). Approximately 40% of P fertilizer was recovered in the studied soil layer, the majority being in inorganic P pools independent of N addition. However, the incorporation of 18O into resin P was mainly stimulated by N addition. In chapter 3, the organic soil horizons from two beech forest sites with contrasting P stocks (low-P site LUE and high-P site Vessertal (VES)) were subjected to four nutrient addition treatments (control without addition, P addition, combined carbon (C) and N addition, combined CNP addition) in an incubation experiment of 103 days. Enzyme-mediated P cycling processes were assessed by studying the oxygen (O) incorporation from 18O-enriched water into phosphate. Phosphorus fluxes into sequentially extracted P pools were traced by labelling the added water-soluble P with 33P. Furthermore, the chemical nature of P in NaOH/EDTA extracts was studied with solution 31P NMR spectroscopy. In the LUE O horizon, half of the added P was recovered in the microbial and organic P pools, while 31P NMR revealed increases in the P classes polyphosphates, phosphonates, and phosphodiesters following inorganic P addition. In contrast, in the VES O horizon, added P was mainly recovered in inorganic P pools. Overall, P and N additions were shown to influence the soil microbial communities and the biological processes they modulate, the P fluxes between soil P pools, and the forms of P present in O horizons of temperate beech forests. On the short-term (days) and under unfavourable environmental conditions for microorganisms, abiotic processes dominated the response to inorganic P addition. In contrast, on a longer-term (months), the P stock, as influenced by the underlying parent material, determined the response to P additions. Abiotic processes dominated in high-P and biotic processes in low-P sites. In the O horizons of low-P sites, microorganisms are strongly interacting with soil organic P, as they mineralize and produce organic P forms. These microbial P cycling processes can be negatively affected by N deposition and extreme environmental conditions (e.g. drought or heat waves). In low-P sites, N addition can induce decreases in soil P pool concentrations, which affects microbial communities (Chapter 1), and can reduce microbial organic P synthesis (Chapter 3). Dry conditions can reduce the influence of biotic processes on P fluxes (Chapter 2). High N deposition and extreme environmental conditions thus represent a greater threat to low-P O horizons with high competition for P than to high-P O horizons.","application/pdf","10.3929/ethz-b-000542793",,,,,"http://hdl.handle.net/20.500.11850/542793","en","ETH Zurich",,,"PHOSPHORUS CYCLE (GEOCHEMISTRY)||PHOSPHATASES (ENZYMES)||Beech forest||18O||33P||Nitrogen deposition||T-RFLP||Soil||FERTILIZER APPLICATION (PLANT NUTRITION AND FERTILIZATION)||31P NMR||phoD||Field experiment||Soil incubation","Effects of phosphorus and nitrogen inputs on phosphorus cycling in organic soil horizons of beech forests",,"Doctoral Thesis","Embargoed",,"DDC - DDC::5 - Science::550 - Earth sciences",,"2022-04-19T16:39:36Z","2024-04-20",,,,,,"yes",,,,,,,"Impacts of N/P inputs on organic P dynamics and P status in soils and plants along a nutrient gradient","171170","10.13039/501100001711","SNF","Projekte MINT","28095",,,,,,,,,"ETH Zürich::00002 - ETH Zürich::00012 - Lehre und Forschung::00007 - Departemente::02350 - Dep. Umweltsystemwissenschaften / Dep. of Environmental Systems Science::02703 - Institut für Agrarwissenschaften / Institute of Agricultural Sciences::03427 - Frossard, Emmanuel / Frossard, Emmanuel",,"03427",,,,,"Zurich","published",,,,,,,,,,,"10.3929/ethz-b-000466815||https://doi.org/10.1016/j.apsoil.2021.104357||https://doi.org/10.1007/s10533-021-00884-7.",,,"2022-04-20T07:02:11Z","2023-02-07T00:52:14Z","true","197 p.","FORM",,,,
"473290","20.500.11850/3","Foggi, Giulia||Terranova, Melissa||Conte, Giuseppe||Mantino, Alberto||Amelchanka, Sergej||Kreuzer, Michael||Mele, Marcello",,,,,,,,,,,"2022-10-27T12:51:02Z","2022-10-27T07:53:41Z||2022-10-27T12:51:02Z",,"2022","2022-10-26","Tannins and essential oils (EOs) have been previously described for their properties to mitigate ruminal methane and ammonia. Their combination might be even more efficient, as they have different modes of action on rumen pathways. This study aimed to screen in vitro the mitigating properties of variously combining tannins with EO in a total of 48 treatments: 12 single additives, 10 mg of EO or 20 mg of tannins/g diet, to establish their basal efficiency; 36 combinations of 20 mg of tannins/g + 10–15 mg of EO. Quebracho (Q) and chestnut (C) tannins defined C, Q and C/Q groups of mixtures with EO blends, formulated with oregano, thyme and clove EO, citrus peel, carvacrol, thymol, eugenol, α-pinene, and bornyl acetate. Supplements were added to a control diet, which was also incubated alone as a basis for comparisons with supplemented treatments, in a total of six runs. Effects on rumen pH, protozoal count, and proportions of individual volatile fatty acids (VFA) were limited. The tannins extracts seemed to cause most of the mitigating effects by suppressing ammonia by up to 31% and methane yield by up to 15%, with the highest reductions obtained with tannins-based supplements. However, this occurred by contemporary affecting the feeding value of the substrate, as indicated by reductions in total VFA and in vitro organic matter digestibility. Overall, six mixtures of C and Q groups were the most efficient and they need further studies to understand the mechanisms of actions and the synergistic effects occurring among compounds.","application/pdf","10.3929/ethz-b-000578055",,"1594-4077||1828-051X",,"10.1080/1828051x.2022.2130832","http://hdl.handle.net/20.500.11850/578055","en","Taylor & Francis","Creative Commons Attribution 4.0 International","http://creativecommons.org/licenses/by/4.0/","Oregano||Thyme||Rumen||Supplement","In vitro screening of the ruminal methane and ammonia mitigating potential of mixtures of either chestnut or quebracho tannins with blends of essential oils as feed additives",,"Journal Article","Open access",,,,"2022-10-27T07:53:41Z",,,,,,,"yes",,,,,,,,,,,,,,,,"000875990400001","Ital.J.Anim.Sci.","1","Italian Journal of Animal Science","21","ETH Zürich::00002 - ETH Zürich::00012 - Lehre und Forschung::00007 - Departemente::02350 - Dep. Umweltsystemwissenschaften / Dep. of Environmental Systems Science::02703 - Institut für Agrarwissenschaften / Institute of Agricultural Sciences::03428 - Kreuzer, Michael (emeritus) / Kreuzer, Michael (emeritus)","ETH Zürich::00002 - ETH Zürich::00012 - Lehre und Forschung::00007 - Departemente::02350 - Dep. Umweltsystemwissenschaften / Dep. of Environmental Systems Science::02703 - Institut für Agrarwissenschaften / Institute of Agricultural Sciences::03428 - Kreuzer, Michael (emeritus) / Kreuzer, Michael (emeritus)","03428","03428",,"1532","1520","Abingdon","published",,,,,,,,,,,,,,"2022-10-27T12:51:03Z","2023-02-07T07:22:49Z","true",,"FORM",,,"publishedVersion",
"471021","20.500.11850/31","Graf, Lukas Valentin","Graf, Lukas Valentin",,,"Graf, Lukas Valentin",,"Aasen, Helge",,"Walter, Achim",,,"2022-10-10T12:28:38Z","2022-10-07T15:35:08Z||2022-10-10T12:28:38Z","2022","2022","2022-10-10",,"application/zip||image/tiff||image/png||image/jp2||text/csv||text/plain","10.3929/ethz-b-000574818",,,,,"http://hdl.handle.net/20.500.11850/574818","en","ETH Zurich, Crop Science","GNU General Public License 3.0","http://www.gnu.org/licenses/gpl-3.0","Uncertainty||Uncertainty propagation||Uncertainty Quantification||Remote Sensing||Sentinel 2||Phenology||Monte Carlo","Propagated Sentinel-2 Radiometric Uncertainties in NDVI, EVI and GLAI for an Entire Growing Season",,"Dataset","Open access",,,"2022","2022-10-07T15:35:09Z",,"indefinite","292278994-08-17T07:12:55Z","Radiometric uncertainties were propagated from Sentinel-1 top-of-atmosphere reflectance factors via atmospheric correction with Sen2Cor into two spectral indices EVI and NDVI (Enhanced Vegetation Index and Normalized Difference Vegetation Index) and the green leaf area index (GLAI) from inversion of the radiative transfer model ProSAIL using Monte Carlo simulation. The radiometric uncertainties are from the Sentinel-2 L1C Radiometry Uncertainty Toolbox. The Monte Carlo framework used is freely available in https://github.com/remote-sensing-team/s2toarup under GPL v3 license and allows full reproducibility of the results deposited in this Research Collection.  The Collection contains the original NDVI, EVI, and GLAI values for 34 Sentinel-2 scenes covering an entire growing season, as well as the associated standard uncertainties (k=1) from Monte Carlo propagation of the radiometric uncertainties.",,,"yes",,,,"Zurich",,,"PhenomEn","198091","10.13039/501100001711","SNF","COST",,,,,,,,,,"ETH Zürich::00002 - ETH Zürich::00012 - Lehre und Forschung::00007 - Departemente::02350 - Dep. Umweltsystemwissenschaften / Dep. of Environmental Systems Science||ETH Zürich::00002 - ETH Zürich::00012 - Lehre und Forschung::00007 - Departemente::02350 - Dep. Umweltsystemwissenschaften / Dep. of Environmental Systems Science::02703 - Institut für Agrarwissenschaften / Institute of Agricultural Sciences::03894 - Walter, Achim / Walter, Achim","ETH Zürich::00002 - ETH Zürich::00012 - Lehre und Forschung::00007 - Departemente::02350 - Dep. Umweltsystemwissenschaften / Dep. of Environmental Systems Science::02703 - Institut für Agrarwissenschaften / Institute of Agricultural Sciences::03894 - Walter, Achim / Walter, Achim","02350||03894","03894",,,,"Zurich",,,,,,,,,,,,,,,"2022-10-10T12:30:06Z","2023-02-07T07:01:54Z","true","4.76 GB","FORM",,,,"1.0"
"466042","20.500.11850/16","Keller, Magdalena",,,,,,,,,,"Kreuzer, Michael||Giller, Katrin||Silacci, Paolo","2022-09-01T06:30:12Z","2022-08-31T20:07:49Z||2022-09-01T06:30:12Z",,"2022","2022-09-01",,"application/pdf","10.3929/ethz-b-000568228",,,,,"http://hdl.handle.net/20.500.11850/568228","en","ETH Zurich",,,,"Alternative protein and energy sources for intensive production of high-quality beef in Switzerland",,"Doctoral Thesis","Embargoed",,"DDC - DDC::6 - Technology, medicine and applied sciences::630 - Agriculture",,"2022-08-31T20:07:56Z","2025-09-01",,,,,,"yes",,,,,,,,,,,,"28223",,,,,,,,,"ETH Zürich::00002 - ETH Zürich::00012 - Lehre und Forschung::00007 - Departemente::02350 - Dep. Umweltsystemwissenschaften / Dep. of Environmental Systems Science::02703 - Institut für Agrarwissenschaften / Institute of Agricultural Sciences::03428 - Kreuzer, Michael (emeritus) / Kreuzer, Michael (emeritus)",,"03428",,,,,"Zurich","published",,,,,,,,,,,,,,"2022-09-01T06:30:18Z","2023-02-07T05:55:04Z","true","175 p.","FORM",,,,
