id,collection,dc.contributor.author,dc.contributor.contactPerson,dc.contributor.dataCollector,dc.contributor.editor,dc.contributor.producer,dc.contributor.projectLeader,dc.contributor.projectManager,dc.contributor.projectMember,dc.contributor.researchGroup,dc.contributor.rightsHolder,dc.contributor.supervisor,dc.date.accessioned,dc.date.available,dc.date.created,dc.date.issued,dc.date.published,dc.description.abstract,dc.format,dc.identifier.doi,dc.identifier.isbn,dc.identifier.issn,dc.identifier.olduri,dc.identifier.other,dc.identifier.uri,dc.language.iso,dc.publisher,dc.rights.license,dc.rights.uri,dc.subject,dc.title,dc.title.alternative,dc.type,ethz.availability,ethz.book.title,ethz.code.ddc,ethz.date.collected,ethz.date.deposited,ethz.date.embargoend,ethz.date.retentionend,ethz.date.retentionendDate,ethz.description.methods,ethz.description.software,ethz.doipreview,ethz.eth,ethz.event,ethz.event.date,ethz.event.location,ethz.geolocation.placename,ethz.geolocation.pointlat,ethz.geolocation.pointlong,ethz.grant,ethz.grant.agreementno,ethz.grant.funderDoi,ethz.grant.fundername,ethz.grant.program,ethz.identifier.diss,ethz.identifier.orcidWorkCode,ethz.identifier.scopus,ethz.identifier.url,ethz.identifier.wos,ethz.journal.abbreviated,ethz.journal.issue,ethz.journal.title,ethz.journal.volume,ethz.leitzahl,ethz.leitzahl.certified,ethz.leitzahlIdentifiers,ethz.leitzahlIdentifiers.certified,ethz.notes,ethz.pages.end,ethz.pages.start,ethz.publication.place,ethz.publication.status,ethz.relation.cites,ethz.relation.continues,ethz.relation.hasPart,ethz.relation.isCitedBy,ethz.relation.isIdenticalTo,ethz.relation.isNewVersionOf,ethz.relation.isOriginalFormOf,ethz.relation.isPartOf,ethz.relation.isPreviousVersionOf,ethz.relation.isSupplementTo,ethz.relation.isSupplementedBy,ethz.relation.isVariantFormOf,ethz.rosetta.exportRequired,ethz.rosetta.installDate,ethz.rosetta.lastUpdated,ethz.rosetta.versionExported,ethz.size,ethz.source,ethz.tag,ethz.title.subtitle,ethz.version.deposit,ethz.version.edition
"481797","20.500.11850/31","Feigenwinter, Iris","Feigenwinter, Iris",,,,,,,,,,"2022-12-23T06:34:52Z","2022-01-10T10:39:40Z||2022-12-22T17:32:06Z||2022-12-23T06:34:52Z",,"2022-12-23",,,"application/zip||text/richtext||application/gzip||text/csv","10.3929/ethz-b-000524199",,,,,"http://hdl.handle.net/20.500.11850/524199","en","ETH Zurich","Creative Commons Attribution-ShareAlike 4.0 International","http://creativecommons.org/licenses/by-sa/4.0/",,"Dataset including 16 years of carbon fluxes and meteorological variables from intensively managed permanent grassland",,"Dataset","Open access",,,,"2022-01-10T10:39:46Z",,"indefinite","292278994-08-17T07:12:55Z",,,,"yes",,,,,,,,,,,,,,,,,,,,,"ETH Zürich::00002 - ETH Zürich::00012 - Lehre und Forschung::00007 - Departemente::02350 - Dep. Umweltsystemwissenschaften / Dep. of Environmental Systems Science::02703 - Institut für Agrarwissenschaften / Institute of Agricultural Sciences::03648 - Buchmann, Nina / Buchmann, Nina","ETH Zürich::00002 - ETH Zürich::00012 - Lehre und Forschung::00007 - Departemente::02350 - Dep. Umweltsystemwissenschaften / Dep. of Environmental Systems Science::02703 - Institut für Agrarwissenschaften / Institute of Agricultural Sciences::03648 - Buchmann, Nina / Buchmann, Nina","03648","03648",,,,"Zurich",,,,,,,,,,,,,,,"2022-12-23T06:35:00Z","2022-12-23T06:35:00Z","true","386.28 MB","FORM",,,,
"481550","20.500.11850/22","Nay, Michelle M.||Grieder, Christoph||Frey, Lea A.||Amdahl, Helga||Radovic, Jasmina||Jaluvka, Libor||Palme, Anna||Skot, Leif||Ruttink, Tom||Kölliker, Roland",,,,,,,,,,,"2022-12-21T14:29:08Z","2022-12-21T13:32:57Z||2022-12-21T14:29:08Z",,"2022-12-20",,"Red clover (Trifolium pratense L.) is an outcrossing forage legume that has adapted to a wide range of climatic and growing conditions across Europe. Red clover is valued for its high yield potential and forage quality. The high amount of genetic diversity present in red clover provides an invaluable, but often poorly characterized resource to improve key traits such as yield, quality, and resistance to biotic and abiotic stresses. In this study, we examined the genetic and phenotypic diversity within a diverse set of 395 diploid red clover accessions via genome wide allele frequency fingerprinting and multi-location field trials across Europe. We found that the genetic structure of accessions mostly reflected their geographic origin and only few cases were detected, where breeders integrated foreign genetic resources into their local breeding pools. Phenotypic performance of accessions in the multi-location field trials revealed a very high accession x location interaction. Thereby, breeding material and cultivars generally performed well at the location where they were developed. Local adaptation was especially prominent in Nordic red clover accessions that showed a distinct adaptation to the growing conditions and cutting regime of the North. Our results confirmed that red clover cultivars were bred from regional ecotypes and show a narrow adaptation to regional conditions. Our study can serve as a valuable basis for identifying interesting material that express the desired characteristics and contribute to the adaptation of red clover to future climatic conditions.","application/pdf","10.3929/ethz-b-000588642",,,,"10.1101/2022.12.19.520744","http://hdl.handle.net/20.500.11850/588642","en","Cold Spring Harbor Laboratory","Creative Commons Attribution-NonCommercial-NoDerivatives 4.0 International","http://creativecommons.org/licenses/by-nc-nd/4.0/","red clover||plant breeding||forage||legume||adaptation","Multi-location trials and population-based genotyping reveal high diversity and adaptation to breeding environments in a large collection of red clover",,"Working Paper","Open access",,,,"2022-12-21T13:32:57Z",,,,,,,"yes",,,,,,,,,,,,,,,,,,,"bioRxiv",,"ETH Zürich::00002 - ETH Zürich::00012 - Lehre und Forschung::00007 - Departemente::02350 - Dep. Umweltsystemwissenschaften / Dep. of Environmental Systems Science::02703 - Institut für Agrarwissenschaften / Institute of Agricultural Sciences::03969 - Studer, Bruno / Studer, Bruno","ETH Zürich::00002 - ETH Zürich::00012 - Lehre und Forschung::00007 - Departemente::02350 - Dep. Umweltsystemwissenschaften / Dep. of Environmental Systems Science::02703 - Institut für Agrarwissenschaften / Institute of Agricultural Sciences::03969 - Studer, Bruno / Studer, Bruno","03969","03969",,,,"Cold Spring Harbor, NY","published",,,,,,,,,"10.3929/ethz-b-000606857",,,,,"2022-12-21T14:29:09Z","2023-02-07T09:02:20Z","true","32 p.","FORM",,,,
"498511","20.500.11850/22","Laub, Moritz||Corbeels, Marc||Couëdel, Antoine||Ndungu, Samuel Mathu||Mucheru-Muna, Monicah Wanjiku||Mugendi, Daniel||Necpálová, Magdalena||Waswa, Wycliffe||Van de Broek, Marijn||Vanlauwe, Bernard||Six, Johan",,,,,,,,,,,"2023-05-03T10:47:45Z","2023-05-02T10:11:40Z||2023-05-03T10:47:45Z",,"2022-12-16",,"In sub-Saharan Africa, long-term maize cropping with low external inputs has been associated with the loss of soil fertility. While adding high-quality organic resources combined with mineral fertilizer has been proposed to counteract this fertility loss, the long-term effectiveness and interactions with site properties still require more understanding. This study used repeated measurements over time to assess the effect of different quantities and qualities of organic resource addition combined with mineral N on the change of soil organic carbon concentrations (SOC) over time (and SOC stocks in the year 2021) in four ongoing long-term trials in Kenya. These trials were established with identical treatments in moist to dry climates, on coarse to clayey soil textures, and have been managed for at least 16 years. They received organic resources in quantities equivalent to 1.2 and 4 t C ha−1 per year in the form of Tithonia diversifolia (high quality, fast turnover), Calliandra calothyrsus (high quality, intermediate turnover), Zea mays stover (low quality, fast turnover), sawdust (low quality, slow turnover) and local farmyard manure (variable quality, intermediate turnover). Furthermore, the addition or absence of 240 kg N ha−1 per year as mineral N fertilizer was the split-plot treatment. At all sites, a loss of SOC, rather than gain, was predominantly observed due to a recent conversion from permanent vegetation to agriculture. The average reduction of SOC concentration over 19 years in the 0 to 15 cm depth ranged from 42 % to 13 % of the initial SOC concentration for the control and the farmyard manure treatments at 4 t C ha−1 yr−1, respectively. Adding Calliandra or Tithonia at 4 t C ha−1 yr−1 limited the loss of SOC concentrations to about 24 % of initial SOC, while the addition of saw dust, maize stover (in 3 of 4 sites) and sole mineral N addition, showed no significant reduction in SOC loss over the control. Site specific analyses, however, did show, that at the site with the lowest initial SOC concentration (about 6 g kg−1), the addition of 4 t C ha−1 yr−1 farmyard manure or Calliandra plus mineral N led to a gain in SOC concentrations. All other sites lost SOC in all treatments, albeit at site specific rates. While subsoil SOC stocks in 2021 were little affected by organic resource additions (no difference in 3 of 4 sites), the topsoil SOC stocks corroborated the results for SOC concentrations. The relative annual change of SOC concentrations showed a higher site specificity in high-quality organic resource treatments than in the control, suggesting that the drivers of site specificity in SOC buildup (mineralogy, climate) need to be better understood for effective targeting of organic resources. Even though farmyard manure showed the most potential for reducing SOC loss, our results clearly show that maintaining SOC with external inputs only is not possible at organic resource rates that are realistic for small scale farmers. Thus, additional agronomic interventions such as intercropping, crop rotations or strong rooting crops may be necessary to maintain or increase SOC.","application/pdf","10.3929/ethz-b-000610268",,,,"10.5194/egusphere-2022-1416","http://hdl.handle.net/20.500.11850/610268","en","Copernicus","Creative Commons Attribution 4.0 International","http://creativecommons.org/licenses/by/4.0/",,"High quality organic resources are most efficient in stabilizing soil organic carbon: Evidence from four long-term experiments in Kenya",,"Working Paper","Open access",,,,"2023-05-02T10:11:40Z",,,,,,,"yes",,,,,,,"Integrated soil fertility management for climate smart intensification of maize-based cropping systems in Kenya","172940","10.13039/501100001711","SNF","Projekte MINT",,,,,,,,"EGUsphere",,"ETH Zürich::00002 - ETH Zürich::00012 - Lehre und Forschung::00007 - Departemente::02350 - Dep. Umweltsystemwissenschaften / Dep. of Environmental Systems Science::02703 - Institut für Agrarwissenschaften / Institute of Agricultural Sciences::03982 - Six, Johan / Six, Johan","ETH Zürich::00002 - ETH Zürich::00012 - Lehre und Forschung::00007 - Departemente::02350 - Dep. Umweltsystemwissenschaften / Dep. of Environmental Systems Science::02703 - Institut für Agrarwissenschaften / Institute of Agricultural Sciences::03982 - Six, Johan / Six, Johan","03982","03982",,,,"Göttingen","published",,,,,,,,,,,,,"true",,,,"33 p.","FORM",,,,
"483141","20.500.11850/31","Broggini, Giovanni","Broggini, Giovanni A.L.||Broggini, Giovanni","Broggini, Giovanni A. L.||Broggini, Giovanni",,,"Broggini, Giovanni",,,,,,"2023-01-05T16:02:33Z","2023-01-05T13:04:01Z||2023-01-05T16:02:33Z",,"2022-12-15",,"Fruit appearance of apples is cultivar-specific and one of the main criteria for consumer choice. Consequently, appearance is an important selection criterion in the breeding of new cultivars. It is also used for the description of older varieties or landraces. In commercial apple production, sorting devices are used to classify a high number of fruits of a few cultivars. In contrast, the description of fruits from germplasm collections or for breeding is based on a few fruits from many cultivars and is mostly performed visually by pomology experts. Therefore, such visual ratings are laborious, often difficult to compare and generally remain subjective. Here we report on the assembly and testing of a morphometric device, the Phenobox, allowing automated fruit weighting and appearance description using computer-based analysis of five images per fruit. The recoding of approximately 100 fruits each from 15 apple cultivars using the Phenobox was achieved rapidly, with an average handling and recording time below eleven seconds per fruit. The comparison of the fruits of 15 apple cultivars identified significant differences in shape index, fruit width, height and weight. Fruit shape was characteristic for each cultivar, while fruit coloration showed larger variation within sample sets. Assessing a subset of 20 randomly selected fruits per cultivar, fruit height and width were described with a 95% confidence interval (and a 95% confidence level) of ±2.6 and ±2.1 %, respectively, of the mean value calculated using all available fruits, while describing fruit weight this interval was ±6.2 %.  The Phenobox allows for the rapid and consistent description of fruit samples of a single apple genotype. By relating the description confidence intervals with different sample sizes, it was possible to determine an appropriate fruit sample size to efficiently and accuately describe the recorded traits. Therefore, the Phenobox is a useful tool for breeding and the description of apple germplasm collections.",,,,,,,"http://hdl.handle.net/20.500.11850/590509","it","ETH Zurich","In Copyright - Non-Commercial Use Permitted","http://rightsstatements.org/page/InC-NC/1.0/",,"Phenobox: Raw images in TIF format of approximately 100 fruits each from 15 different apple cultivars",,"Dataset",,,,,"2023-01-05T13:04:01Z",,"10 years","2033-01-05T16:02:33Z",,,"Yes","yes",,,,,,,,,,,,,,,,,,,,,"ETH Zürich::00002 - ETH Zürich::00012 - Lehre und Forschung::00007 - Departemente::02350 - Dep. Umweltsystemwissenschaften / Dep. of Environmental Systems Science::02703 - Institut für Agrarwissenschaften / Institute of Agricultural Sciences::03969 - Studer, Bruno / Studer, Bruno","ETH Zürich::00002 - ETH Zürich::00012 - Lehre und Forschung::00007 - Departemente::02350 - Dep. Umweltsystemwissenschaften / Dep. of Environmental Systems Science::02703 - Institut für Agrarwissenschaften / Institute of Agricultural Sciences::03969 - Studer, Bruno / Studer, Bruno","03969","03969",,,,"Zurich",,,,,,,,,,,,,,"true",,,,,"FORM",,,,
"467716","20.500.11850/3","Schmautz, Zala||Walser, Jean-Claude||Espinal, Carlos A.||Gartmann, Florentina||Scott, Ben||Pothier, Joël F.||Frossard, Emmanuel||Junge, Ranka||Smits, Theo H.M.",,,,,,,,,,,"2022-09-14T09:04:44Z","2022-09-09T18:29:41Z||2022-09-14T09:04:44Z",,"2022-12-15","2022-09-05","Aquaponics combines hydroponic crop production with recirculating aquaculture. These systems comprise various compartments (fish tank, biofilter, sump, hydroponic table, radial flow settler and anaerobic digester), each with their own specific environmental pressures, which trigger the formation of unique microbial communities. Triplicated aquaponic systems were used to investigate the microbial community composition during three lettuce growing cycles. The sampling of individual compartments allowed community patterns to be generated using amplicon sequencing of bacterial and archaeal 16S rRNA genes. Nitrifying bacteria were identified in the hydroponic compartments, indicating that these compartments may play a larger role than previously thought in the system's nitrogen cycle. In addition to the observed temporal changes in community compositions within the anaerobic compartment, more archaeal reads were obtained from sludge samples than from the aerobic part of the system. Lower bacterial diversity was observed in fresh fish feces, where a highly discrete gut flora composition was seen. Finally, the most pronounced differences in microbial community compositions were observed between the aerobic and anaerobic loops of the system, with unique bacterial compositions in each individual compartment.","application/pdf","10.3929/ethz-b-000569916",,"0048-9697||1879-1026",,"10.1016/j.scitotenv.2022.158426","http://hdl.handle.net/20.500.11850/569916","en","Elsevier","Creative Commons Attribution 4.0 International","http://creativecommons.org/licenses/by/4.0/","Aquaponics||Community analysis||bacteria||archaea||tilapia","Microbial diversity across compartments in an aquaponic system and its connection to the nitrogen cycle",,"Journal Article","Open access",,,,"2022-09-09T18:29:44Z",,,,,,,"yes",,,,,,,,,,,,,,"85137013520",,"000864081000009","Sci. Total Environ.",,"Science of The Total Environment","852","ETH Zürich::00002 - ETH Zürich::00012 - Lehre und Forschung::00007 - Departemente::02350 - Dep. Umweltsystemwissenschaften / Dep. of Environmental Systems Science::02703 - Institut für Agrarwissenschaften / Institute of Agricultural Sciences::03427 - Frossard, Emmanuel / Frossard, Emmanuel","ETH Zürich::00002 - ETH Zürich::00012 - Lehre und Forschung::00007 - Departemente::02350 - Dep. Umweltsystemwissenschaften / Dep. of Environmental Systems Science::02703 - Institut für Agrarwissenschaften / Institute of Agricultural Sciences::03427 - Frossard, Emmanuel / Frossard, Emmanuel","03427","03427",,,"158426","Amsterdam","published",,,,,,,,,,,,,,"2022-09-14T09:04:52Z","2023-02-07T06:18:21Z","true","10 p.","SCOPUS",,,"publishedVersion",
"471875","20.500.11850/3","Shekhar, Ankit||Buchmann, Nina||Gharun, Mana",,,,,,,,,,,"2022-10-17T06:30:14Z","2022-10-13T15:21:07Z||2022-10-17T06:30:14Z",,"2022-12-15","2022-10-12","The collection of various long-term reconstructed solar-induced fluorescence (SIF) datasets derived at a range of spatio-temporal scales provides new opportunities for modelling vegetation dynamics, in particular, gross primary productivity (GPP). Information about the proximity of the reconstructed SIF (SIFr) datasets to GPP across land cover types and climatic conditions provides important support for a better application of these products for modelling applications. We conducted a multiscale analysis of four different long-term (12 years, 2007–2018) high-resolution global SIFr datasets (0.05° × 0.05°), namely – CSIF (Contiguous SIF), GOSIF (Global OCO-2 SIF), LUE-SIF (Light Use Efficiency SIF), and HSIF (Harmonized SIF) - at 4-day, 8-day, and monthly time scales and found that for the majority of sites, the SIFr is linearly related to ground-based GPP measurements with the eddy covariance method. While the relationship between SIFr and GPP (i.e., the slope - GPP/SIFr) varied significantly across the SIFr datasets, sites, and land cover types, all four SIFr datasets were unequivocally a better predictor of GPP compared to remotely sensed vegetation indices – NDVI (normalized difference vegetation index) and EVI (enhanced vegetation index), sensed by the MODIS satellite. Furthermore, we also analyzed SIF-GPP relationships during drought vs non-drought conditions and found that for about 30% of the sites, comprising mostly non-forests site, the SIF-GPP relationship became weaker (decreased R2) with a lower slope during drought conditions compared to non-drought conditions. Among the four different products, the CSIF (at 4-day timescale) and GOSIF (at 8-day timescale) predicted GPP better compared to LUE-SIF and HSIF across all land cover types. Owing to their long-term availability (since 2000 for CSIF and GOSIF), these SIFr datasets combined with proxies of ecosystem properties can be used to appropriately capture vegetation dynamics and the interannual variabilities across a wide range of climatic conditions.","application/pdf","10.3929/ethz-b-000575875",,"0034-4257",,"10.1016/j.rse.2022.113282","http://hdl.handle.net/20.500.11850/575875","en","Elsevier","Creative Commons Attribution 4.0 International","http://creativecommons.org/licenses/by/4.0/","CSIF||GOSIF||GOME-2||OCO-2||HSIF||Eddy-covariance||MODIS","How well do recently reconstructed solar-induced fluorescence datasets model gross primary productivity?",,"Journal Article","Open access",,,,"2022-10-13T15:21:07Z",,,,,,,"yes",,,,,,,,,,,,,,"85139592021",,"000875408000001","Remote Sens. Environ.",,"Remote Sensing of Environment","283","ETH Zürich::00002 - ETH Zürich::00012 - Lehre und Forschung::00007 - Departemente::02350 - Dep. Umweltsystemwissenschaften / Dep. of Environmental Systems Science::02703 - Institut für Agrarwissenschaften / Institute of Agricultural Sciences::03648 - Buchmann, Nina / Buchmann, Nina","ETH Zürich::00002 - ETH Zürich::00012 - Lehre und Forschung::00007 - Departemente::02350 - Dep. Umweltsystemwissenschaften / Dep. of Environmental Systems Science::02703 - Institut für Agrarwissenschaften / Institute of Agricultural Sciences::03648 - Buchmann, Nina / Buchmann, Nina","03648","03648",,,"113282","Amsterdam","published",,,,,,,,,,,,,,"2022-10-17T06:30:15Z","2023-02-07T07:08:45Z","true","16 p.","FORM",,,"publishedVersion",
"481901","20.500.11850/3","Wang, Han||Harrison, Sandy P.||Li, Meng||Prentice, I. Colin||Qiao, Shengchao||Wang, Runxi||Xu, Huiying||Mengoli, Giulia||Peng, Yunke||Yang, Yanzheng",,,,,,,,,,,"2022-12-23T14:59:23Z","2022-12-20T09:15:38Z||2022-12-23T14:59:23Z",,"2022-12-15",,"Plant functional traits represent adaptive strategies to the environment, linked to biophysical and biogeochemical processes and ecosystem functioning. Compilations of trait data facilitate research in multiple fields from plant ecology through to land-surface modelling. Here we present version 2 of the China Plant Trait Database, which contains information on morphometric, physical, chemical, photosynthetic and hydraulic traits from 1529 unique species in 140 sites spanning a diversity of vegetation types. Version 2 has five improvements compared to the previous version: (1) new data from a 4-km elevation transect on the edge of Tibetan Plateau, including alpine vegetation types not sampled previously; (2) inclusion of traits related to hydraulic processes, including specific sapwood conductance, the area ratio of sapwood to leaf, wood density and turgor loss point; (3) inclusion of information on soil properties to complement the existing data on climate and vegetation (4) assessments and flagging the reliability of individual trait measurements; and (5) inclusion of standardized templates for systematical field sampling and measurements.","application/pdf","10.3929/ethz-b-000588326",,"2052-4463",,"10.1038/s41597-022-01884-4","http://hdl.handle.net/20.500.11850/588326","en","Nature","Creative Commons Attribution 4.0 International","http://creativecommons.org/licenses/by/4.0/","Biodiversity||Biogeography||Carbon cycle||Ecophysiology||Ecosystem ecology","The China plant trait database version 2",,"Journal Article","Open access",,,,"2022-12-20T09:15:38Z",,,,,,,"yes",,,,,,,,,,,,,,"85144225121",,"000899539900002","Sci Data",,"Scientific Data","9","ETH Zürich::00002 - ETH Zürich::00012 - Lehre und Forschung::00007 - Departemente::02350 - Dep. Umweltsystemwissenschaften / Dep. of Environmental Systems Science::02703 - Institut für Agrarwissenschaften / Institute of Agricultural Sciences::09678 - Stocker, Benjamin David (ehemalig) / Stocker, Benjamin David (former)","ETH Zürich::00002 - ETH Zürich::00012 - Lehre und Forschung::00007 - Departemente::02350 - Dep. Umweltsystemwissenschaften / Dep. of Environmental Systems Science::02703 - Institut für Agrarwissenschaften / Institute of Agricultural Sciences::09678 - Stocker, Benjamin David (ehemalig) / Stocker, Benjamin David (former)","09678","09678",,,"769","London","published",,,,,,,,,,,,,,"2022-12-23T14:59:24Z","2023-02-07T09:13:32Z","true","13 p.","FORM",,,"publishedVersion",
