"104312","20.500.11850/8","Samootkwam, Kittipong||Jaturasitha, Sanchai||Tipnate, Bulgul||Wicke, Michael||Kreuzer, Michael",,,,,"2017-06-11T19:23:30Z","2017-06-11T19:23:30Z","2015",,,,,,"2210-7843",,"10.1016/j.aaspro.2015.08.022","http://hdl.handle.net/20.500.11850/104345","en","Elsevier",,,"Angus||White Lamphun||Holstein Friesian||Carcass||Meat","Effect of Improving Lamphun Cattle with Black Angus on Carcass and Meat Quality",,"Conference Paper","Metadata only",,,"2017-06-11T19:23:44Z",,"pub:163186",,"yes","1st International Conference on Asian Highland Natural Resources Management (AsiaHiLand) and 2nd IDRC-SEARCA Upland Fellowship and Conference","January 7 - 9, 2015","Chiang Mai, Thailand",,,,,,,,,,"imp5936537bbd90c63959",,,,,,"2015","Agriculture and Agricultural Science Procedia","5","ETH Zürich::00002 - ETH Zürich::00012 - Lehre und Forschung::00007 - Departemente::02350 - Dep. Umweltsystemwissenschaften / Dep. of Environmental Systems Science::02703 - Institut für Agrarwissenschaften / Institute of Agricultural Sciences::03428 - Kreuzer, Michael (emeritus) / Kreuzer, Michael (emeritus)","ETH Zürich::00002 - ETH Zürich::00012 - Lehre und Forschung::00007 - Departemente::02350 - Dep. Umweltsystemwissenschaften / Dep. of Environmental Systems Science::02703 - Institut für Agrarwissenschaften / Institute of Agricultural Sciences::03428 - Kreuzer, Michael (emeritus) / Kreuzer, Michael (emeritus)","03428","03428",,"150","145","Amsterdam","published",,,,,,"2017-07-26T05:03:02Z","2022-03-28T14:06:32Z","true",,"ECIT",,
"104311","20.500.11850/3","Intarak, Intira||Lhasudta, Pisit||Jaturasitha, Sanchai||Wicke, Michael||Kreuzer, Michael",,,,,"2017-06-11T19:23:30Z","2017-06-11T19:23:30Z","2015",,,,,,"2210-7843",,"10.1016/j.aaspro.2015.08.025","http://hdl.handle.net/20.500.11850/104344","en","Elsevier",,,,"Effects of Slaughter Weight on Carcass and Meat Characteristics of Punga Fish (Pangasius bocourti Sauvage)",,"Journal Article","Metadata only",,,"2017-06-11T19:23:44Z",,"pub:163185",,"yes","1st International Conference on Asian Highland Natural Resources Management, AsiaHiLand 2015","January 7-9, 2015","Chiang Mai, Thailand",,,,,,,,,,"imp5936537bb836811235",,,,"000379872700025",,,"Agriculture and Agricultural Science Procedia","5","ETH Zürich::00002 - ETH Zürich::00012 - Lehre und Forschung::00007 - Departemente::02350 - Dep. Umweltsystemwissenschaften / Dep. of Environmental Systems Science::02703 - Institut für Agrarwissenschaften / Institute of Agricultural Sciences::03428 - Kreuzer, Michael (emeritus) / Kreuzer, Michael (emeritus)","ETH Zürich::00002 - ETH Zürich::00012 - Lehre und Forschung::00007 - Departemente::02350 - Dep. Umweltsystemwissenschaften / Dep. of Environmental Systems Science::02703 - Institut für Agrarwissenschaften / Institute of Agricultural Sciences::03428 - Kreuzer, Michael (emeritus) / Kreuzer, Michael (emeritus)","03428","03428",,"169","164","Amsterdam","published",,,,,,"2017-07-19T11:47:16Z","2022-03-28T14:06:31Z","true",,"ECIT",,
"104696","20.500.11850/10","Holinger, Mirjam||Früh, Barbara||Stoll, Peter||Kreuzer, Michael||Hillmann, Edna",,,,,"2017-06-11T19:36:58Z","2017-06-11T19:36:58Z","2015",,,,,,,,,"http://hdl.handle.net/20.500.11850/104729","en","ETH-Zürich, Institute of Agricultural Sciences",,,,"Utility of roughages to improve health and welfare of male pigs",,"Other Conference Item","Metadata only","Symposium for new PhD students 2015",,"2017-06-11T19:37:17Z",,"pub:163871",,"yes","Symposium for New Phd students 2015","October 29-30, 2015","Einsiedeln, Switzerland",,,,,,,,,,"imp59365383b383881606",,,,,,,,,"ETH Zürich::00002 - ETH Zürich::00012 - Lehre und Forschung::00007 - Departemente::02350 - Dep. Umweltsystemwissenschaften / Dep. of Environmental Systems Science::02703 - Institut für Agrarwissenschaften / Institute of Agricultural Sciences::03428 - Kreuzer, Michael (emeritus) / Kreuzer, Michael (emeritus)||ETH Zürich::00002 - ETH Zürich, direkt::00012 - Lehre und Forschung, direkt::00007 - Departemente, direkt::02350 - Departement Umweltsystemwissenschaften / Department of Environmental Systems Science::02703 - Institut für Agrarwissenschaften / Institute of Agricultural Sciences (IAS)::08682 - Einheit für Verhalten, Gesundheit und Tierwohl","ETH Zürich::00002 - ETH Zürich::00012 - Lehre und Forschung::00007 - Departemente::02350 - Dep. Umweltsystemwissenschaften / Dep. of Environmental Systems Science::02703 - Institut für Agrarwissenschaften / Institute of Agricultural Sciences::03428 - Kreuzer, Michael (emeritus) / Kreuzer, Michael (emeritus)||ETH Zürich::00002 - ETH Zürich, direkt::00012 - Lehre und Forschung, direkt::00007 - Departemente, direkt::02350 - Departement Umweltsystemwissenschaften / Department of Environmental Systems Science::02703 - Institut für Agrarwissenschaften / Institute of Agricultural Sciences (IAS)::08682 - Einheit für Verhalten, Gesundheit und Tierwohl","03428||08682","03428||08682",,"30","30","Zürich","published",,,,,,"2017-07-13T08:44:19Z","2022-03-28T14:08:10Z","true",,"ECIT",,
"104695","20.500.11850/10","Meese, Susanne||Schwarm, Angela||Ulbrich, Susanne E.||Kreuzer, Michael",,,,,"2017-06-11T19:36:58Z","2017-06-11T19:36:58Z","2015",,,,,,,,,"http://hdl.handle.net/20.500.11850/104728","en","ETH-Zürich, Institute of Agricultural Sciences",,,,"Characterization of bioenergetic processes during mononuclear leukocyte activation in periparturient dairy cows",,"Other Conference Item","Metadata only","Symposium for new PhD students 2015",,"2017-06-11T19:37:17Z",,"pub:163870",,"yes","Symposium for New Phd students 2015","October 29-30, 2015","Einsiedeln, Switzerland",,,,,,,,,,"imp59365383b0d3657301",,,,,,,,,"ETH Zürich::00002 - ETH Zürich::00012 - Lehre und Forschung::00007 - Departemente::02350 - Dep. Umweltsystemwissenschaften / Dep. of Environmental Systems Science::02703 - Institut für Agrarwissenschaften / Institute of Agricultural Sciences::03999 - Ulbrich, Susanne / Ulbrich, Susanne||ETH Zürich::00002 - ETH Zürich::00012 - Lehre und Forschung::00007 - Departemente::02350 - Dep. Umweltsystemwissenschaften / Dep. of Environmental Systems Science::02703 - Institut für Agrarwissenschaften / Institute of Agricultural Sciences::03428 - Kreuzer, Michael (emeritus) / Kreuzer, Michael (emeritus)","ETH Zürich::00002 - ETH Zürich::00012 - Lehre und Forschung::00007 - Departemente::02350 - Dep. Umweltsystemwissenschaften / Dep. of Environmental Systems Science::02703 - Institut für Agrarwissenschaften / Institute of Agricultural Sciences::03999 - Ulbrich, Susanne / Ulbrich, Susanne||ETH Zürich::00002 - ETH Zürich::00012 - Lehre und Forschung::00007 - Departemente::02350 - Dep. Umweltsystemwissenschaften / Dep. of Environmental Systems Science::02703 - Institut für Agrarwissenschaften / Institute of Agricultural Sciences::03428 - Kreuzer, Michael (emeritus) / Kreuzer, Michael (emeritus)","03999||03428","03999||03428",,"29","29","Zürich","published",,,,,,"2017-07-13T05:48:37Z","2022-03-28T14:08:09Z","true",,"ECIT",,
"104693","20.500.11850/10","Poteko, Jernej||Schrade, Sabine||Schwarm, Angela||Mohn, Joachim||Zeyer, Kerstin||Kreuzer, Michael",,,,,"2017-06-11T19:36:57Z","2017-06-11T19:36:57Z","2015",,,,,,,,,"http://hdl.handle.net/20.500.11850/104726","en","ETH-Zürich, Institute of Agricultural Sciences",,,,"Quantification of abatement strategies to reduce NH3, and greenhouse gas emissions in naturally ventilated dairy housings",,"Other Conference Item","Metadata only","Symposium for new PhD students 2015",,"2017-06-11T19:37:17Z",,"pub:163868",,"yes","Symposium for New Phd students 2015","October 29-30, 2015","Einsiedeln, Switzerland",,,,,,,,,,"imp59365383ac30025363",,,,,,,,,"ETH Zürich::00002 - ETH Zürich::00012 - Lehre und Forschung::00007 - Departemente::02350 - Dep. Umweltsystemwissenschaften / Dep. of Environmental Systems Science::02703 - Institut für Agrarwissenschaften / Institute of Agricultural Sciences::03428 - Kreuzer, Michael (emeritus) / Kreuzer, Michael (emeritus)","ETH Zürich::00002 - ETH Zürich::00012 - Lehre und Forschung::00007 - Departemente::02350 - Dep. Umweltsystemwissenschaften / Dep. of Environmental Systems Science::02703 - Institut für Agrarwissenschaften / Institute of Agricultural Sciences::03428 - Kreuzer, Michael (emeritus) / Kreuzer, Michael (emeritus)","03428","03428",,"38","38","Zürich","published",,,,,,"2017-07-13T09:12:03Z","2022-03-28T14:08:07Z","true",,"ECIT",,
"104694","20.500.11850/10","Wang, Shaopu||Schwarm, Angela||Kreuzer, Michael",,,,,"2017-06-11T19:36:58Z","2017-06-11T19:36:58Z","2015",,,,,,,,,"http://hdl.handle.net/20.500.11850/104727","en","ETH-Zürich, Institute of Agricultural Sciences",,,,"Exploring effective nutritional strategies in vitro and in vivo to reduce enteric methane emission and to enhance health in ruminants",,"Other Conference Item","Metadata only","Symposium for new PhD students 2015",,"2017-06-11T19:37:17Z",,"pub:163869",,"yes","Symposium for New Phd students 2015","October 29-30, 2015","Einsiedeln, Switzerland",,,,,,,,,,"imp59365383ae55b99945",,,,,,,,,"ETH Zürich::00002 - ETH Zürich::00012 - Lehre und Forschung::00007 - Departemente::02350 - Dep. Umweltsystemwissenschaften / Dep. of Environmental Systems Science::02703 - Institut für Agrarwissenschaften / Institute of Agricultural Sciences::03428 - Kreuzer, Michael (emeritus) / Kreuzer, Michael (emeritus)","ETH Zürich::00002 - ETH Zürich::00012 - Lehre und Forschung::00007 - Departemente::02350 - Dep. Umweltsystemwissenschaften / Dep. of Environmental Systems Science::02703 - Institut für Agrarwissenschaften / Institute of Agricultural Sciences::03428 - Kreuzer, Michael (emeritus) / Kreuzer, Michael (emeritus)","03428","03428",,"37","37","Zürich","published",,,,,,"2017-07-18T09:52:39Z","2022-03-28T14:08:08Z","true",,"ECIT",,
"104012","20.500.11850/3","In'T Zandt, Dina||Le Marié, Chantal||Kirchgessner, Norbert||Visser, Eric J.W.||Hund, Andreas",,,,,"2017-06-11T19:15:14Z","2017-06-11T19:15:14Z","2015",,,"application/pdf","10.3929/ethz-b-000104045",,"1460-2431||0022-0957",,"10.1093/jxb/erv307","http://hdl.handle.net/20.500.11850/104045","en","Oxford University Press","Creative Commons Attribution 3.0 Unported","http://creativecommons.org/licenses/by/3.0/","Corn||Foraging||Nitrogen||Rhizotrons||Root growth||Split-root","High-resolution quantification of root dynamics in split-nutrient rhizoslides reveals rapid and strong proliferation of maize roots in response to local high nitrogen",,"Journal Article","Open access",,,"2017-06-11T19:15:29Z","2018-09-01","pub:162737",,"yes",,,,,,,,,,,,,"imp5936537567a6892580","000049325","84940777725",,"000361208000011","J. Exp. Bot.","18","Journal of Experimental Botany","66","ETH Zürich::00002 - ETH Zürich::00012 - Lehre und Forschung::00007 - Departemente::02350 - Dep. Umweltsystemwissenschaften / Dep. of Environmental Systems Science::02703 - Institut für Agrarwissenschaften / Institute of Agricultural Sciences::03894 - Walter, Achim / Walter, Achim","ETH Zürich::00002 - ETH Zürich::00012 - Lehre und Forschung::00007 - Departemente::02350 - Dep. Umweltsystemwissenschaften / Dep. of Environmental Systems Science::02703 - Institut für Agrarwissenschaften / Institute of Agricultural Sciences::03894 - Walter, Achim / Walter, Achim","03894","03894","It was possible to publish this article open access thanks to a Swiss National Licence with the publisher","5517","5507","Oxford","published",,,,,,"2017-07-19T11:44:00Z","2022-03-28T14:05:07Z","true",,"ECIT",,"publishedVersion"
"104011","20.500.11850/3","Nagel, Kerstin A.||Bonnett, David||Furbank, Robert||Walter, Achim||Schurr, Ulrich||Watt, Michelle",,,,,"2017-06-11T19:15:13Z","2017-06-11T19:15:13Z","2015",,,"application/pdf","10.3929/ethz-b-000104044",,"1460-2431||0022-0957",,"10.1093/jxb/erv290","http://hdl.handle.net/20.500.11850/104044","en","Oxford University Press","Creative Commons Attribution 3.0 Unported","http://creativecommons.org/licenses/by/3.0/","Light||Root branching||Root depth||Root partitioning||Water deficit||Water uptake","Simultaneous effects of leaf irradiance and soil moisture on growth and root system architecture of novel wheat genotypes: Implications for phenotyping",,"Journal Article","Open access",,,"2017-06-11T19:15:29Z","2018-09-01","pub:162736",,"yes",,,,,,,,,,,,,"imp5936537561ad255123","000049325","84940780523",,,"J. Exp. Bot.","18","Journal of Experimental Botany","66","ETH Zürich::00002 - ETH Zürich::00012 - Lehre und Forschung::00007 - Departemente::02350 - Dep. Umweltsystemwissenschaften / Dep. of Environmental Systems Science::02703 - Institut für Agrarwissenschaften / Institute of Agricultural Sciences::03894 - Walter, Achim / Walter, Achim","ETH Zürich::00002 - ETH Zürich::00012 - Lehre und Forschung::00007 - Departemente::02350 - Dep. Umweltsystemwissenschaften / Dep. of Environmental Systems Science::02703 - Institut für Agrarwissenschaften / Institute of Agricultural Sciences::03894 - Walter, Achim / Walter, Achim","03894","03894","Received 15 December 2014, Revised 22 May 2015, Accepted 26 May 2015, Published online 18 June 2015. It was possible to publish this article open access thanks to a Swiss National Licence with the publisher","5452","5441","Oxford","published",,,,,,"2017-07-13T10:33:41Z","2022-03-28T14:05:06Z","true",,"ECIT",,"publishedVersion"
"108650","20.500.11850/3","Dorn, Brigitte||Ulbrich, Susanne E.",,,,,"2017-06-11T22:05:09Z","2017-06-11T22:05:09Z","2015",,,,,,"1663-7852||1663-7909",,,"http://hdl.handle.net/20.500.11850/108683","de","Agroscope",,,,"Susanne Ulbrich, Professor of Animal Physiology at the ETH Zurich",,"Journal Article","Metadata only","Susanne Ulbrich, Professor of Animal Physiology at the ETH Zurich",,"2017-06-11T22:05:30Z",,"pub:169682",,"yes",,,,,,,,,,,,,"imp593653d38466c74517","005928960",,,"000366238500007","Agrarforsch. Schweiz","1","Agrarforschung Schweiz","6","ETH Zürich::00002 - ETH Zürich::00012 - Lehre und Forschung::00007 - Departemente::02350 - Dep. Umweltsystemwissenschaften / Dep. of Environmental Systems Science::02703 - Institut für Agrarwissenschaften / Institute of Agricultural Sciences::03999 - Ulbrich, Susanne / Ulbrich, Susanne","ETH Zürich::00002 - ETH Zürich::00012 - Lehre und Forschung::00007 - Departemente::02350 - Dep. Umweltsystemwissenschaften / Dep. of Environmental Systems Science::02703 - Institut für Agrarwissenschaften / Institute of Agricultural Sciences::03999 - Ulbrich, Susanne / Ulbrich, Susanne","03999","03999","Interview.","41","40","Posieux, Switzerland","published",,,,,,"2017-07-19T09:42:09Z","2022-03-28T14:24:29Z","true",,"ECIT",,
"106788","20.500.11850/10","Hagen, K.||Kreuzer, Michael||Clauss, M.",,,,,"2017-06-11T20:58:32Z","2017-06-11T20:58:32Z","2015",,,,,,"2040-4700||2040-4719",,,"http://hdl.handle.net/20.500.11850/106821","en","British Society of Animal Science",,,,"Methane production by vertebrate herbivores - a comparative perspective",,"Other Conference Item","Metadata only","Proceedings of the British Society of Animal Science",,"2017-06-11T20:58:39Z",,"pub:167233",,"yes","British Society of Animal Science Annual Conference 2015","April 14-15, 2015","Chester, England",,,,,,,,,,"imp593653aec507c69914","001900363",,,,,"2","Advances in Animal Biosciences","6","ETH Zürich::00002 - ETH Zürich::00012 - Lehre und Forschung::00007 - Departemente::02350 - Dep. Umweltsystemwissenschaften / Dep. of Environmental Systems Science::02703 - Institut für Agrarwissenschaften / Institute of Agricultural Sciences::03428 - Kreuzer, Michael (emeritus) / Kreuzer, Michael (emeritus)","ETH Zürich::00002 - ETH Zürich::00012 - Lehre und Forschung::00007 - Departemente::02350 - Dep. Umweltsystemwissenschaften / Dep. of Environmental Systems Science::02703 - Institut für Agrarwissenschaften / Institute of Agricultural Sciences::03428 - Kreuzer, Michael (emeritus) / Kreuzer, Michael (emeritus)","03428","03428",,"125","125","Penicuik","published",,,,,,"2017-07-13T10:46:54Z","2022-03-28T14:16:22Z","true",,"ECIT",,
"171206","20.500.11850/10","Grosse Brinkhaus, Anja||Bee, Giuseppe||Pellikaan, Wilbert F.||Dohme-Meier, Frigga",,,,,"2017-08-04T09:26:37Z","2017-06-11T22:46:13Z||2017-08-04T09:26:37Z","2015",,,,,"978-90-8686-816-2||978-90-8686-269-6","1382-6077",,"10.3920/978-90-8686-816-2","http://hdl.handle.net/20.500.11850/109668","en","Wageningen Academic Publishers",,,,"Effect of concentration and source of condensed tannins on ruminal fatty acid biohydrogenation",,"Other Conference Item","Metadata only","Book of Abstracts of the 66th Annual Meeting of the European Federation of Animal Science",,"2017-06-11T22:46:28Z",,"pub:170787",,"yes","66th Annual Meeting of the European Federation of Animal Science (EAAP 2015)","August 31 - September 4, 2015","Warsaw, Poland",,,,,,,,,,"imp593653e6a7ed739403",,,,,"Annu. meet. Eur. Assoc. Anim. Prod.",,"EAAP Book of Abstracts","21","ETH Zürich::00002 - ETH Zürich::00012 - Lehre und Forschung::00007 - Departemente::02350 - Dep. Umweltsystemwissenschaften / Dep. of Environmental Systems Science::02703 - Institut für Agrarwissenschaften / Institute of Agricultural Sciences::03428 - Kreuzer, Michael (emeritus) / Kreuzer, Michael (emeritus)","ETH Zürich::00002 - ETH Zürich::00012 - Lehre und Forschung::00007 - Departemente::02350 - Dep. Umweltsystemwissenschaften / Dep. of Environmental Systems Science::02703 - Institut für Agrarwissenschaften / Institute of Agricultural Sciences::03428 - Kreuzer, Michael (emeritus) / Kreuzer, Michael (emeritus)","03428","03428",,"381","381","Wageningen","published",,,,,,"2017-07-18T10:18:44Z","2022-03-28T17:20:48Z","true",,"ECIT",,
"171194","20.500.11850/10","Leiber, Florian||Gelencsér, Tobias||Ayrle, Hannah||Amsler-Kepalaite, Zivile||Stamer, Andreas||Früh, Barbara||Maurer, Veronika",,,,,"2017-08-04T08:48:08Z","2017-06-11T22:45:38Z||2017-08-04T08:48:08Z","2015",,,,,"978-90-8686-269-6||978-90-8686-816-2","1382-6077",,"10.3920/978-90-8686-816-2","http://hdl.handle.net/20.500.11850/109608","en","Wageningen Academic Publishers",,,,"Insect or legume based protein sources to replace soybean cake in a broiler diet",,"Other Conference Item","Metadata only","Book of Abstracts of the 66th Annual Meeting of the European Federation of Animal Science",,"2017-06-11T22:46:28Z",,"pub:170721",,"yes","66th Annual Meeting of the European Federation of Animal Science (EAAP 2015)","August 31 - September 4, 2015","Warsaw, Poland",,,,,,,,,,"imp593653e58eb0930165","010523559",,,,"Annu. meet. Eur. Assoc. Anim. Prod.",,"EAAP Book of Abstracts","21","ETH Zürich::00002 - ETH Zürich::00012 - Lehre und Forschung::00007 - Departemente::02350 - Dep. Umweltsystemwissenschaften / Dep. of Environmental Systems Science::02703 - Institut für Agrarwissenschaften / Institute of Agricultural Sciences::03428 - Kreuzer, Michael (emeritus) / Kreuzer, Michael (emeritus)","ETH Zürich::00002 - ETH Zürich::00012 - Lehre und Forschung::00007 - Departemente::02350 - Dep. Umweltsystemwissenschaften / Dep. of Environmental Systems Science::02703 - Institut für Agrarwissenschaften / Institute of Agricultural Sciences::03428 - Kreuzer, Michael (emeritus) / Kreuzer, Michael (emeritus)","03428","03428",,"266","266","Wageningen","published",,,,,,"2017-07-15T08:08:30Z","2022-03-28T17:20:42Z","true",,"ECIT",,
"171196","20.500.11850/10","Zehnder, Tobias||Gangnat, Isabelle D.M.||Kreuzer, Michael||Schneider, Manuel||Berard, Joel",,,,,"2017-08-04T08:28:41Z","2017-06-11T22:45:52Z||2017-08-04T08:22:01Z||2017-08-04T08:28:41Z","2015",,,,,"978-90-8686-269-6||978-90-8686-816-2","1382-6077",,"10.3920/978-90-8686-816-2","http://hdl.handle.net/20.500.11850/109634","en","Wageningen Academic Publishers",,,,"Meat quality of Dexter cattle kept on alpine pastures compared to Charolais crossbred calves",,"Other Conference Item","Metadata only","Book of Abstracts of the 66th Annual Meeting of the European Federation of Animal Science",,"2017-06-11T22:46:28Z",,"pub:170748",,"yes","66th Annual Meeting of the European Federation of Animal Science (EAAP 2015)","August 31 - September 4, 2015","Warsaw, Poland",,,,,,,,,,"imp593653e5f298321480","010523559",,,,"Annu. meet. Eur. Assoc. Anim. Prod.",,"EAAP Book of Abstracts","21","ETH Zürich::00002 - ETH Zürich::00012 - Lehre und Forschung::00007 - Departemente::02350 - Dep. Umweltsystemwissenschaften / Dep. of Environmental Systems Science::02703 - Institut für Agrarwissenschaften / Institute of Agricultural Sciences::03428 - Kreuzer, Michael (emeritus) / Kreuzer, Michael (emeritus)","ETH Zürich::00002 - ETH Zürich::00012 - Lehre und Forschung::00007 - Departemente::02350 - Dep. Umweltsystemwissenschaften / Dep. of Environmental Systems Science::02703 - Institut für Agrarwissenschaften / Institute of Agricultural Sciences::03428 - Kreuzer, Michael (emeritus) / Kreuzer, Michael (emeritus)","03428","03428",,"231","231","Wageningen","published",,,,,,"2017-07-13T07:12:01Z","2022-03-28T17:20:43Z","true",,"ECIT",,
"171197","20.500.11850/10","Grandl, Florian||Furger, Marisa||Zeitz, Johanna O.||Kreuzer, Michael||Schwarm, Angela",,,,,"2017-08-04T09:19:50Z","2017-06-11T22:46:12Z||2017-08-04T09:19:50Z","2015",,,,,"978-90-8686-269-6||978-90-8686-816-2","1382-6077",,"10.3920/978-90-8686-816-2","http://hdl.handle.net/20.500.11850/109665","en","Wageningen Academic Publishers",,,,"Feed intake, digestion efficiency and methane emissions of lactating cows of different age",,"Other Conference Item","Metadata only","Book of Abstracts of the 66th Annual Meeting of the European Federation of Animal Science",,"2017-06-11T22:46:28Z",,"pub:170784",,"yes","66th Annual Meeting of the European Federation of Animal Science (EAAP 2015)","August 31 - September 4, 2015","Warsaw, Poland",,,,,,,,,,"imp593653e6a2ec823668","010523559",,,,"Annu. meet. Eur. Assoc. Anim. Prod.",,"EAAP Book of Abstracts","21","ETH Zürich::00002 - ETH Zürich::00012 - Lehre und Forschung::00007 - Departemente::02350 - Dep. Umweltsystemwissenschaften / Dep. of Environmental Systems Science::02703 - Institut für Agrarwissenschaften / Institute of Agricultural Sciences::03428 - Kreuzer, Michael (emeritus) / Kreuzer, Michael (emeritus)","ETH Zürich::00002 - ETH Zürich::00012 - Lehre und Forschung::00007 - Departemente::02350 - Dep. Umweltsystemwissenschaften / Dep. of Environmental Systems Science::02703 - Institut für Agrarwissenschaften / Institute of Agricultural Sciences::03428 - Kreuzer, Michael (emeritus) / Kreuzer, Michael (emeritus)","03428","03428",,"133","133","Wageningen","published",,,,,,"2017-07-19T11:01:19Z","2022-03-28T17:20:43Z","true",,"ECIT",,
