"196013","20.500.11850/3","Meyer, Swanhild U.||Sass, Steffen||Mueller, Nikola S.||Krebs, Stefan||Bauersachs, Stefan||Kaiser, Sebastian||Blum, Helmut||Thirion, Christian||Krause, Sabine||Theis, Fabian J.||Pfaffl, Michael",,,,,"2017-11-21T08:59:46Z","2017-06-14T03:39:25Z||2017-07-12T12:17:03Z||2017-06-11T19:47:44Z||2017-11-21T08:59:46Z","2015-08","2015-08-13","Introduction Skeletal muscle cell differentiation is impaired by elevated levels of the inflammatory cytokine tumor necrosis factor-α (TNF-α) with pathological significance in chronic diseases or inherited muscle disorders. Insulin like growth factor-1 (IGF1) positively regulates muscle cell differentiation. Both, TNF-α and IGF1 affect gene and microRNA (miRNA) expression in this process. However, computational prediction of miRNA-mRNA relations is challenged by false positives and targets which might be irrelevant in the respective cellular transcriptome context. Thus, this study is focused on functional information about miRNA affected target transcripts by integrating miRNA and mRNA expression profiling data.  Methodology/Principal Findings Murine skeletal myocytes PMI28 were differentiated for 24 hours with concomitant TNF-α or IGF1 treatment. Both, mRNA and miRNA expression profiling was performed. The data-driven integration of target prediction and paired mRNA/miRNA expression profiling data revealed that i) the quantity of predicted miRNA-mRNA relations was reduced, ii) miRNA targets with a function in cell cycle and axon guidance were enriched, iii) differential regulation of anti-differentiation miR-155-5p and miR-29b-3p as well as pro-differentiation miR-335-3p, miR-335-5p, miR-322-3p, and miR-322-5p seemed to be of primary importance during skeletal myoblast differentiation compared to the other miRNAs, iv) the abundance of targets and affected biological processes was miRNA specific, and v) subsets of miRNAs may collectively regulate gene expression.  Conclusions Joint analysis of mRNA and miRNA profiling data increased the process-specificity and quality of predicted relations by statistically selecting miRNA-target interactions. Moreover, this study revealed miRNA-specific predominant biological implications in skeletal muscle cell differentiation and in response to TNF-α or IGF1 treatment. Furthermore, myoblast differentiation-associated miRNAs are suggested to collectively regulate gene clusters and targets associated with enriched specific gene ontology terms or pathways. Predicted miRNA functions of this study provide novel insights into defective regulation at the transcriptomic level during myocyte proliferation and differentiation due to inflammatory stimuli.","application/pdf","10.3929/ethz-a-010580476",,"1932-6203","http://hdl.handle.net/20.500.11850/105123||http://hdl.handle.net/20.500.11850/155399","10.1371/journal.pone.0135284","http://hdl.handle.net/20.500.11850/210923","en","Public Library of Science","Creative Commons Attribution 4.0 International","http://creativecommons.org/licenses/by/4.0/",,"Integrative Analysis of MicroRNA and mRNA Data Reveals an Orchestrated Function of MicroRNAs in Skeletal Myocyte Differentiation in Response to TNF-α or IGF1",,"Journal Article","Open access",,"DDC - DDC::6 - Technology, medicine and applied sciences::610 - Medical sciences, medicine","2017-06-11T19:48:04Z",,"pub:164568","eth:48521","yes",,,,,,,,,,,,,"imp59366b853824130738||imp5936538bbf67a39196",,"84943193527",,,"PLoS ONE","8","PLoS ONE","10","ETH Zürich::00002 - ETH Zürich::00012 - Lehre und Forschung::00007 - Departemente::02350 - Dep. Umweltsystemwissenschaften / Dep. of Environmental Systems Science::02703 - Institut für Agrarwissenschaften / Institute of Agricultural Sciences||ETH Zürich::00002 - ETH Zürich::00012 - Lehre und Forschung::00007 - Departemente::02350 - Dep. Umweltsystemwissenschaften / Dep. of Environmental Systems Science::02703 - Institut für Agrarwissenschaften / Institute of Agricultural Sciences::03999 - Ulbrich, Susanne / Ulbrich, Susanne","ETH Zürich::00002 - ETH Zürich::00012 - Lehre und Forschung::00007 - Departemente::02350 - Dep. Umweltsystemwissenschaften / Dep. of Environmental Systems Science::02703 - Institut für Agrarwissenschaften / Institute of Agricultural Sciences::03999 - Ulbrich, Susanne / Ulbrich, Susanne","02703||03999","03999",,,"e0135284","San Francisco, CA","published",,,,,,"2017-11-21T08:52:39Z","2021-02-14T20:31:43Z","true","23 p.","ECOL||ECIT",,"publishedVersion"
"103855","20.500.11850/3","Parazoo, Nicholas C.||Barnes, Elizabeth||Worden, John||Harper, Anna B.||Bowman, Kevin B.||Frankenberg, Christian||Wolf, Sebastian||Litvak, Marcy||Keenan, Trevor F.",,,,,"2017-06-11T19:11:13Z","2017-06-11T19:11:13Z","2015-08",,,,,,"0886-6236||1944-9224",,"10.1002/2015GB005125","http://hdl.handle.net/20.500.11850/103888","en","American Geophysical Union",,,"Carbon cycle||Climate variability||Remote sensing||Land surface modeling||Land/atmosphere interactions||Hydrological cycle","Influence of ENSO and the NAO on terrestrial carbon uptake in the Texas-northern Mexico region",,"Journal Article","Metadata only",,,"2017-06-11T19:12:07Z",,"pub:162429",,"yes",,,,,,,,,,,,,"imp59365371b048652395","000041178","84940094023",,"000363702400010","Glob. biogeochem. cycles","8","Global Biogeochemical Cycles","29","ETH Zürich::00002 - ETH Zürich::00012 - Lehre und Forschung::00007 - Departemente::02350 - Dep. Umweltsystemwissenschaften / Dep. of Environmental Systems Science::02703 - Institut für Agrarwissenschaften / Institute of Agricultural Sciences::03648 - Buchmann, Nina / Buchmann, Nina","ETH Zürich::00002 - ETH Zürich::00012 - Lehre und Forschung::00007 - Departemente::02350 - Dep. Umweltsystemwissenschaften / Dep. of Environmental Systems Science::02703 - Institut für Agrarwissenschaften / Institute of Agricultural Sciences::03648 - Buchmann, Nina / Buchmann, Nina","03648","03648","Published online 24 August 2015.","1265","1247","Washington, DC","published",,,,,,"2017-07-19T11:39:41Z","2021-02-14T13:14:48Z","true",,"ECIT",,
"102293","20.500.11850/3","Vanlierde, A.||Vanrobays, M.-L.||Dehareng, F.||Froidmont, E.||Soyeurt, H.||McParland, S.||Lewis, E.||Deighton, M.H.K.||Grandl, F.||Kreuzer, M.||Gredler, B.||Dardenne, P.||Gengler, N.",,,,,"2017-06-11T18:14:47Z","2017-06-11T18:14:47Z","2015-08",,,,,,"0022-0302||1525-3198",,"10.3168/jds.2014-8436","http://hdl.handle.net/20.500.11850/102326","en","Elsevier",,,"Dairy cattle||Mid-infrared||Methane||Lactation stage||Milk","Hot topic: Innovative lactation-stage-dependent prediction of methane emissions from milk mid-infrared spectra",,"Journal Article","Metadata only",,,"2017-06-11T18:15:23Z",,"pub:160457",,"yes",,,,,,,,,,,,,"imp5936534db1da350937","000032582",,,"000357842100064","J. Dairy Sci.","8","Journal of Dairy Science","98","ETH Zürich::00002 - ETH Zürich::00012 - Lehre und Forschung::00007 - Departemente::02350 - Dep. Umweltsystemwissenschaften / Dep. of Environmental Systems Science::02703 - Institut für Agrarwissenschaften / Institute of Agricultural Sciences::03428 - Kreuzer, Michael (emeritus) / Kreuzer, Michael (emeritus)","ETH Zürich::00002 - ETH Zürich::00012 - Lehre und Forschung::00007 - Departemente::02350 - Dep. Umweltsystemwissenschaften / Dep. of Environmental Systems Science::02703 - Institut für Agrarwissenschaften / Institute of Agricultural Sciences::03428 - Kreuzer, Michael (emeritus) / Kreuzer, Michael (emeritus)","03428","03428","Received 3 June 2014, Accepted 31 March 2015, Published online 28 May 2015.","5747","5740","Savoy, IL","published",,,,,,"2017-07-13T07:02:14Z","2022-03-28T13:58:06Z","true",,"ECIT",,
"207729","20.500.11850/3","Kikvidze, Zaal||Brooker, Rob W.||Butterfield, Bradley J.||Callaway, Ragan M.||Cavieres, Lohengrin A.||Cook, Bradley J.||Lortie, Christopher J.||Michalet, Richard||Pugnaire, Francisco I.||Xiao, Sa||Anthelme, Fabien||Björk, Robert G.||Cranston, Brittany H.||Gavilán, Rosario||Kanka, Robert||Lingua, Emanuele||Maalouf, Jean-Paul||Noroozi, Jalil||Parajuli, Rabindra||Phoenix, Gareth K.||Reid, Anya M.||Ridenour, Wendy M.||Rixen, Christian||Schöb, Christian",,,,,"2018-01-09T10:48:53Z","2017-12-18T15:47:36Z||2018-01-09T10:48:53Z","2015-08","2015-08-01",,,,,"0012-9658||1939-9170",,"10.1890/14-2443.1","http://hdl.handle.net/20.500.11850/222338","en","Ecological Society of America",,,"Biodiversity||Biogeographic gradients||Community assembly rules||Cushion plants||Foundation species||Niche construction||Species recruitment||Β-diversity||alpine environment||assembly rule||biodiversity||community ecology||ecological modeling||floristics||microhabitat||niche||phytogeography||plant community||recruitment (population dynamics)||shrub||species diversity||soil||water||biodiversity||biological model||chemistry||classification||plant||soil||Biodiversity||Models, Biological||Plants||Soil||Water","The effects of foundation species on community assembly: A global study on alpine cushion plant communities",,"Journal Article","Metadata only",,,"2017-12-18T15:47:37Z",,,,"no",,,,,,,,,,,,,,,,,,"Ecol.","8","Ecology","96","ETH Zürich::00002 - ETH Zürich::00012 - Lehre und Forschung::00007 - Departemente::02350 - Dep. Umweltsystemwissenschaften / Dep. of Environmental Systems Science||ETH Zürich::00002 - ETH Zürich::00012 - Lehre und Forschung::00007 - Departemente::02350 - Dep. Umweltsystemwissenschaften / Dep. of Environmental Systems Science::02703 - Institut für Agrarwissenschaften / Institute of Agricultural Sciences||ETH Zürich::00002 - ETH Zürich::00012 - Lehre und Forschung::00007 - Departemente::02350 - Dep. Umweltsystemwissenschaften / Dep. of Environmental Systems Science::02703 - Institut für Agrarwissenschaften / Institute of Agricultural Sciences::09618 - Schöb, Christian (ehemalig) / Schöb, Christian (former)","ETH Zürich::00002 - ETH Zürich::00012 - Lehre und Forschung::00007 - Departemente::02350 - Dep. Umweltsystemwissenschaften / Dep. of Environmental Systems Science::02703 - Institut für Agrarwissenschaften / Institute of Agricultural Sciences::09618 - Schöb, Christian (ehemalig) / Schöb, Christian (former)","02350||02703||09618","09618",,"2069","2064","Washington, DC","published",,,,,,"2018-01-09T10:48:57Z","2022-03-28T18:49:43Z","true",,"BATCH",,
"100678","20.500.11850/3","Pérez-Priego, O.||López-Ballesteros, A.||Sánchez-Cañete, E.||Serrano-Ortiz, P.||Kutzbach, Lars||Domingo, F.||Eugster, Werner||Kowalski, Andrew S.",,,,,"2017-06-11T17:21:32Z","2017-06-11T17:21:32Z","2015-08",,,,,,"0032-079X||1573-5036",,"10.1007/s11104-015-2481-x","http://hdl.handle.net/20.500.11850/100711","en","Springer",,,"Canopy chamber||Closed chamber||Flux calculation methods||Flux uncertainties||Shrublands","Analysing uncertainties in the calculation of fluxes using whole-plant chambers: random and systematic errors",,"Journal Article","Metadata only",,,"2017-06-11T17:22:22Z",,"pub:158069",,"yes",,,,,,,,,,,,,"imp59365328b517044049","000052447","84938293128",,"000358666600018","Plant Soil","1","Plant and Soil","393","ETH Zürich::00002 - ETH Zürich::00012 - Lehre und Forschung::00007 - Departemente::02350 - Dep. Umweltsystemwissenschaften / Dep. of Environmental Systems Science::02703 - Institut für Agrarwissenschaften / Institute of Agricultural Sciences::03648 - Buchmann, Nina / Buchmann, Nina","ETH Zürich::00002 - ETH Zürich::00012 - Lehre und Forschung::00007 - Departemente::02350 - Dep. Umweltsystemwissenschaften / Dep. of Environmental Systems Science::02703 - Institut für Agrarwissenschaften / Institute of Agricultural Sciences::03648 - Buchmann, Nina / Buchmann, Nina","03648","03648","Received 23 October 2014, Accepted 16 April 2015, Published online 30 April 2015.","244","229","Berlin","published",,,,,,"2017-07-13T19:32:01Z","2023-02-06T12:54:29Z","true",,"ECIT",,
"102869","20.500.11850/3","Maltais-Landry, G.||Frossard, Emmanuel",,,,,"2017-06-11T18:35:29Z","2017-06-11T18:35:29Z","2015-08",,,,,,"0032-079X||1573-5036",,"10.1007/s11104-015-2477-6","http://hdl.handle.net/20.500.11850/102902","en","Springer",,,"Fava bean (Vicia faba)||Purple vetch (Vicia benghalensis)||Rye (Secale cereale)||Oat (Avena sativa)||Winter wheat (Triticum aestivum)||White mustard (Sinapis alba)","Similar phosphorus transfer from cover crop residues and water-soluble mineral fertilizer to soils and a subsequent crop",,"Journal Article","Metadata only",,,"2017-06-11T18:36:16Z",,"pub:161062",,"yes",,,,,,,,,,,,,"imp5936535b1b0ff74946","000052447","84938292719",,"000358666600015","Plant Soil","1-2","Plant and Soil","393","ETH Zürich::00002 - ETH Zürich::00012 - Lehre und Forschung::00007 - Departemente::02350 - Dep. Umweltsystemwissenschaften / Dep. of Environmental Systems Science::02703 - Institut für Agrarwissenschaften / Institute of Agricultural Sciences::03427 - Frossard, Emmanuel / Frossard, Emmanuel","ETH Zürich::00002 - ETH Zürich::00012 - Lehre und Forschung::00007 - Departemente::02350 - Dep. Umweltsystemwissenschaften / Dep. of Environmental Systems Science::02703 - Institut für Agrarwissenschaften / Institute of Agricultural Sciences::03427 - Frossard, Emmanuel / Frossard, Emmanuel","03427","03427","Received 3 February 2015, Accepted 8 April 2015, Published online 25 April 2015.","205","193","Berlin","published",,,,,,"2017-07-15T08:30:02Z","2023-02-06T12:58:44Z","true",,"ECIT",,
"322940","20.500.11850/3","Frank, Dorothe A.||Reichstein, Markus||Bahn, Michael||Thonicke, Kirsten||Frank, David||Mahecha, Miguel D.||Smith, Pete||Van Der Velde, Marijn||Vicca, Sara||Babst, Flurin||Beer, Christian||Buchmann, Nina||Canadell, Josep G.||Ciais, Philippe||Cramer, Wolfgang||Ibrom, Andreas||Miglietta, Franco||Poulter, Ben||Rammig, Anja||Seneviratne, Sonia I.||Walz, Ariane||Wattenbach, Martin||Zavala, Miguel A.||Zscheischler, Jakob",,,,,"2019-12-05T13:52:19Z","2017-06-11T18:49:33Z||2019-12-05T13:52:19Z","2015-08","2015-03-07","Extreme droughts, heat waves, frosts, precipitation, wind storms and other climate extremes may impact the structure, composition and functioning of terrestrial ecosystems, and thus carbon cycling and its feedbacks to the climate system. Yet, the interconnected avenues through which climate extremes drive ecological and physiological processes and alter the carbon balance are poorly understood. Here, we review the literature on carbon cycle relevant responses of ecosystems to extreme climatic events. Given that impacts of climate extremes are considered disturbances, we assume the respective general disturbance‐induced mechanisms and processes to also operate in an extreme context. The paucity of well‐defined studies currently renders a quantitative meta‐analysis impossible, but permits us to develop a deductive framework for identifying the main mechanisms (and coupling thereof) through which climate extremes may act on the carbon cycle. We find that ecosystem responses can exceed the duration of the climate impacts via lagged effects on the carbon cycle. The expected regional impacts of future climate extremes will depend on changes in the probability and severity of their occurrence, on the compound effects and timing of different climate extremes, and on the vulnerability of each land‐cover type modulated by management. Although processes and sensitivities differ among biomes, based on expert opinion, we expect forests to exhibit the largest net effect of extremes due to their large carbon pools and fluxes, potentially large indirect and lagged impacts, and long recovery time to regain previous stocks. At the global scale, we presume that droughts have the strongest and most widespread effects on terrestrial carbon cycling. Comparing impacts of climate extremes identified via remote sensing vs. ground‐based observational case studies reveals that many regions in the (sub‐)tropics are understudied. Hence, regional investigations are needed to allow a global upscaling of the impacts of climate extremes on global carbon–climate feedbacks.","application/pdf","10.3929/ethz-b-000103296",,"1354-1013||1365-2486",,"10.1111/gcb.12916","http://hdl.handle.net/20.500.11850/103296","en","Wiley-Blackwell","Creative Commons Attribution 4.0 International","http://creativecommons.org/licenses/by/4.0/","Carbon cycle||Climate change||Climate extremes||Climate variability||Disturbance||Terrestrial ecosystems","Effects of climate extremes on the terrestrial carbon cycle: concepts, processes and potential future impacts",,"Journal Article","Open access",,,"2017-06-11T18:50:21Z",,"pub:161508",,"yes",,,,,,,,,,,,,"imp593653646a57f25511",,,,"000358485200006","Glob. Chang. Biol.","8","Global Change Biology","21","ETH Zürich::00002 - ETH Zürich::00012 - Lehre und Forschung::00007 - Departemente::02350 - Dep. Umweltsystemwissenschaften / Dep. of Environmental Systems Science::02703 - Institut für Agrarwissenschaften / Institute of Agricultural Sciences::03648 - Buchmann, Nina / Buchmann, Nina||ETH Zürich::00002 - ETH Zürich::00012 - Lehre und Forschung::00007 - Departemente::02350 - Dep. Umweltsystemwissenschaften / Dep. of Environmental Systems Science::02717 - Institut für Atmosphäre und Klima / Inst. Atmospheric and Climate Science::03778 - Seneviratne, Sonia / Seneviratne, Sonia","ETH Zürich::00002 - ETH Zürich::00012 - Lehre und Forschung::00007 - Departemente::02350 - Dep. Umweltsystemwissenschaften / Dep. of Environmental Systems Science::02703 - Institut für Agrarwissenschaften / Institute of Agricultural Sciences::03648 - Buchmann, Nina / Buchmann, Nina||ETH Zürich::00002 - ETH Zürich::00012 - Lehre und Forschung::00007 - Departemente::02350 - Dep. Umweltsystemwissenschaften / Dep. of Environmental Systems Science::02717 - Institut für Atmosphäre und Klima / Inst. Atmospheric and Climate Science::03778 - Seneviratne, Sonia / Seneviratne, Sonia","03648||03778","03648||03778",,"2880","2861","Oxford","published",,,,,"true","2017-07-14T20:22:08Z","2022-03-29T00:25:56Z","true",,"ECIT",,"publishedVersion"
"103224","20.500.11850/3","Aemisegger, F.||Spiegel, J.K.||Pfahl, S.||Sodemann, H.||Eugster, Werner||Wernli, Heini",,,,,"2017-06-11T18:46:00Z","2017-06-11T18:46:00Z","2015-07-16",,,,,,"0094-8276||1944-8007",,"10.1002/2015GL063988","http://hdl.handle.net/20.500.11850/103257","en","American Geophysical Union",,,,"Isotope meteorology of cold front passages: A case study combining observations and modeling",,"Journal Article","Metadata only",,,"2017-06-11T18:46:08Z",,"pub:161468",,"yes",,,,,,,,,,,,,"imp593653637d65222294","000047284","84938203185",,"000358691300071","Geophys. Res. Lett.","13","Geophysical Research Letters","42","ETH Zürich::00002 - ETH Zürich::00012 - Lehre und Forschung::00007 - Departemente::02350 - Dep. Umweltsystemwissenschaften / Dep. of Environmental Systems Science::02703 - Institut für Agrarwissenschaften / Institute of Agricultural Sciences::03648 - Buchmann, Nina / Buchmann, Nina||ETH Zürich::00002 - ETH Zürich::00012 - Lehre und Forschung::00007 - Departemente::02350 - Dep. Umweltsystemwissenschaften / Dep. of Environmental Systems Science::02717 - Institut für Atmosphäre und Klima / Inst. Atmospheric and Climate Science::03854 - Wernli, Johann Heinrich / Wernli, Johann Heinrich","ETH Zürich::00002 - ETH Zürich::00012 - Lehre und Forschung::00007 - Departemente::02350 - Dep. Umweltsystemwissenschaften / Dep. of Environmental Systems Science::02703 - Institut für Agrarwissenschaften / Institute of Agricultural Sciences::03648 - Buchmann, Nina / Buchmann, Nina||ETH Zürich::00002 - ETH Zürich::00012 - Lehre und Forschung::00007 - Departemente::02350 - Dep. Umweltsystemwissenschaften / Dep. of Environmental Systems Science::02717 - Institut für Atmosphäre und Klima / Inst. Atmospheric and Climate Science::03854 - Wernli, Johann Heinrich / Wernli, Johann Heinrich","03648||03854","03648||03854","Received 27 March 2015, Accepted 19 June 2015, Accepted article online 24 June 2015, Published online 14 July 2015. Published online by Wiley.","5660","5652","Washington, DC","published",,,,,,"2017-07-15T09:38:53Z","2021-02-14T13:11:24Z","true",,"ECIT",,
"296082","20.500.11850/3","Soliva, Carla R.||Amelchanka, Sergej L.||Kreuzer, Michael",,,,,"2019-06-06T15:15:03Z","2017-06-11T18:10:54Z||2019-06-06T15:15:03Z","2015-07-14",,"Ruminant feed evaluation systems use constant minimum requirements of rumen-degradable protein (RDP) and often relate this to apparently degradable organic matter (OM). However, studies with tropical forages indicate that RDP: apparently degraded OM might not be constant across high-fiber diets. This was tested with semi-continuous ruminal cultures (Rusitec) using dried contrasting low-protein fiber sources: brachiaria hay (high in fiber, medium lignified), apple pomace (medium in fiber, highly lignified), and sugar beet pulp (medium in fiber and lignification). Each feed was incubated at 14 g dry matter day−1 with 0, 0.85, 1.7, 3.4, 6.8, 13.6, or 27.2 mg g−1 urea. The amount of urea needed to reach a similar basal concentration of ammonia in the incubation fluid was tested for each feed in advance. Apparent fiber and OM degradability were determined after 48 h of incubation. Data was evaluated by regressions and analysis of variance. The response curve of incubation fluid ammonia to urea supplementation was similar in slope in all feeds. Plateaus in apparent OM degradability in relation to ammonia concentration were determined. The ammonia concentration where apparent OM and fiber degradability reached 95% of maximum was approached in the order of pomace < pulp < hay. With regard to fiber degradability, a plateau was reached at ≥ 80 g kg−1 crude protein only with hay and pomace, whilst a linear relationship existed between RDP and OM degradation for pulp. In hay the ratio RDP: OM degraded was equal to 1.6 but was only 1.0 in the other feeds. There was no obvious lack of branched short-chain fatty acids at low RDP. Thus, the hypothesis was confirmed but the demand for RDP seems even higher in tropical forage compared to food industrial byproducts. The efficiency of urea to promote apparent OM and fiber degradation was also variable. Thus, it seems that minimum thresholds of either RDP or ruminal ammonia concentration may not be reflected appropriately by constants.","application/pdf","10.3929/ethz-b-000102192",,"1664-302X",,"10.3389/fmicb.2015.00715","http://hdl.handle.net/20.500.11850/102192","en","Frontiers Media","Creative Commons Attribution 4.0 International","http://creativecommons.org/licenses/by/4.0/","Ammonia||Brachiaria||Sugar beet pulp||Apple pomace||Nitrogen","The requirements for rumen-degradable protein per unit of fermentable organic matter differ between fibrous feed sources",,"Journal Article","Open access",,,"2017-06-11T18:11:47Z",,"pub:160319",,"yes",,,,,,,,,,,,,"imp5936534aa64eb27874","010181524",,,"000358574400001","Front Microbiol",,"Frontiers in Microbiology","6","ETH Zürich::00002 - ETH Zürich::00012 - Lehre und Forschung::00007 - Departemente::02350 - Dep. Umweltsystemwissenschaften / Dep. of Environmental Systems Science::02703 - Institut für Agrarwissenschaften / Institute of Agricultural Sciences::03428 - Kreuzer, Michael (emeritus) / Kreuzer, Michael (emeritus)","ETH Zürich::00002 - ETH Zürich::00012 - Lehre und Forschung::00007 - Departemente::02350 - Dep. Umweltsystemwissenschaften / Dep. of Environmental Systems Science::02703 - Institut für Agrarwissenschaften / Institute of Agricultural Sciences::03428 - Kreuzer, Michael (emeritus) / Kreuzer, Michael (emeritus)","03428","03428",,,"715","Lausanne","published",,,,,"true","2017-07-18T10:46:24Z","2022-03-28T23:02:28Z","true","17 p.","ECIT",,"publishedVersion"
"102335","20.500.11850/3","Silva, Lucas C.R.||Doane, Timothy A.||Correa, Rodrigo S.||Valverde, Vinicius||Pereira, Engil I.P.||Horwath, William R.",,,,,"2017-06-11T18:15:14Z","2017-06-11T18:15:14Z","2015-07",,,,,,"1051-0761||1939-5582",,"10.1890/14-2151.1","http://hdl.handle.net/20.500.11850/102368","en","Ecological Society of America",,,"Carbon sequestration||Iron||Land restoration||Soil-plant interactions||Stable isotopes||Urban waste","Iron-mediated stabilization of soil carbon amplifies the benefits of ecological restoration in degraded lands",,"Journal Article","Metadata only",,,"2017-06-11T18:15:23Z",,"pub:160500",,"yes",,,,,,,,,,,,,"imp5936534ea2ebe29352","000580756",,,"000356898400006","Ecol. Appl.","5","Ecological Applications","25","ETH Zürich::00002 - ETH Zürich::00012 - Lehre und Forschung::00007 - Departemente::02350 - Dep. Umweltsystemwissenschaften / Dep. of Environmental Systems Science::02703 - Institut für Agrarwissenschaften / Institute of Agricultural Sciences::03982 - Six, Johan / Six, Johan","ETH Zürich::00002 - ETH Zürich::00012 - Lehre und Forschung::00007 - Departemente::02350 - Dep. Umweltsystemwissenschaften / Dep. of Environmental Systems Science::02703 - Institut für Agrarwissenschaften / Institute of Agricultural Sciences::03982 - Six, Johan / Six, Johan","03982","03982","Received 12 November 2014, Accepted 26 November 2014.","1234","1226","Ithaca, NY","published",,,,,,"2017-07-20T14:55:20Z","2020-02-14T15:27:57Z","true",,"ECIT",,
