"442991","20.500.11850/3","Scherreiks, Pascal||Gossner, Martin M.||Ambarlı, Didem||Ayasse, Manfred||Blüthgen, Nico||Fischer, Markus||Klaus, Valentin||Kleinebecker, Till||Neff, Felix||Prati, Daniel||Seibold, Sebastian||Simons, Nadja K.||Weisser, Wolfgang W.||Wells, Konstans||Westphal, Catrin||Thiele, Jan",,,,,,,,,,,"2022-03-10T08:29:16Z","2022-01-18T07:19:02Z||2022-03-10T08:29:16Z",,"2022-03","2022-01-12","Context Current diversity and species composition of ecological communities can often not exclusively be explained by present land use and landscape structure. Historical land use may have considerably influenced ecosystems and their properties for decades and centuries.  Objectives We analysed the effects of present and historical landscape structure on plant and arthropod species richness in temperate grasslands, using data from comprehensive plant and arthropod assessments across three regions in Germany and maps of current and historical land cover from three time periods between 1820 and 2016.  Methods We calculated local, grassland class and landscape scale metrics for 150 grassland plots. Class and landscape scale metrics were calculated in buffer zones of 100 to 2000 m around the plots. We considered effects on total species richness as well as on the richness of species subsets determined by taxonomy and functional traits related to habitat use, dispersal and feeding.  Results Overall, models containing a combination of present and historical landscape metrics showed the best fit for several functional groups. Comparing three historical time periods, data from the 1820/50s was among the most frequent significant time periods in our models (29.7% of all significant variables).  Conclusions Our results suggest that the historical landscape structure is an important predictor of current species richness across different taxa and functional groups. This needs to be considered to better identify priority sites for conservation and to design biodiversity-friendly land use practices that will affect landscape structure in the future.","application/pdf","10.3929/ethz-b-000526399",,"0921-2973||1572-9761",,"10.1007/s10980-021-01392-7","http://hdl.handle.net/20.500.11850/526399","en","Springer","Creative Commons Attribution 4.0 International","http://creativecommons.org/licenses/by/4.0/","Species richness||Landscape metrics||GLM||Land-use intensity||Historical landscape structure||Landscape configuration||Landscape composition","Present and historical landscape structure shapes current species richness in Central European grasslands",,"Journal Article","Open access",,,,"2022-01-18T07:19:17Z",,,,,,,"yes",,,,,,,,,,,,,,"85122705873",,"000741232900001","Landsc. ecol.","3","Landscape Ecology","37","ETH Zürich::00002 - ETH Zürich::00012 - Lehre und Forschung::00007 - Departemente::02350 - Dep. Umweltsystemwissenschaften / Dep. of Environmental Systems Science::02703 - Institut für Agrarwissenschaften / Institute of Agricultural Sciences::03648 - Buchmann, Nina / Buchmann, Nina","ETH Zürich::00002 - ETH Zürich::00012 - Lehre und Forschung::00007 - Departemente::02350 - Dep. Umweltsystemwissenschaften / Dep. of Environmental Systems Science::02703 - Institut für Agrarwissenschaften / Institute of Agricultural Sciences::03648 - Buchmann, Nina / Buchmann, Nina","03648","03648",,"762","745","Dordrecht","published",,,,,,,,,,,,,,"2022-03-10T08:29:36Z","2022-03-29T20:34:56Z","true",,"WOS",,,"publishedVersion",
"441890","20.500.11850/3","Marqués, Laura||Ogle, Kiona||Peltier, Drew M.P.||Camarero, J. Julio",,,,,,,,,,,"2022-03-02T13:06:35Z","2022-01-06T19:47:30Z||2022-02-28T09:11:39Z||2022-03-02T13:06:35Z",,"2022-03-01","2021-12-30","Warming temperatures and droughts are driving widespread forest dieback and growth decline worldwide. In forests experiencing dieback, declining trees may exhibit altered climate memory of growth, indicative of physiological impairment. Thus, we evaluated climate-growth responses of trees in four drought-disturbed forests dominated either by gymnosperms (Abies alba, Pinus sylvestris) or angiosperms (Fagus sylvatica, Quercus humilis) in Northern Spain, where we compared responses of declining (heavily defoliated) and non-declining (slightly or not defoliated) trees. To disentangle the effects of forest dieback and past climate on tree growth, we applied the stochastic antecedent modeling (SAM) framework to annual tree-ring widths to quantify climatic memory. Declining trees had lower recent growth than non-declining conspecifics. All species responded positively to precipitation and temperature, independent of their vigor class, except for declining silver fir (A. alba) and European beech (F. sylvatica) individuals, which showed a negative effect of warmer temperatures on growth. Declining trees of these two species were also more sensitive to recent temperature and precipitation conditions, whilst climatic conditions further into the past were more important for non-declining trees. Silver fir and European beech from both vigor classes were also coupled to climate conditions during markedly different seasons, with dry summer conditions particularly affecting declining trees. Declining and non-declining Scots pine (P. sylvetris) and pubescent oak (Q. humilis) trees did not show different responses to past climate. While drought-triggered dieback differentially impacted silver fir and European beech individuals, Scots pine and pubescent oak trees suffered from a chronic process of loss in tree growth and vigor. Our results highlight the differences in climate sensitivity and climate memory of tree growth in forests experiencing ongoing dieback.","application/pdf","10.3929/ethz-b-000523755",,"0168-1923||1873-2240",,"10.1016/j.agrformet.2021.108787","http://hdl.handle.net/20.500.11850/523755","en","Elsevier","Creative Commons Attribution-NonCommercial-NoDerivatives 4.0 International","http://creativecommons.org/licenses/by-nc-nd/4.0/","Antecedent climate effects||Climatic memory||Drought stress||Forest dieback||Tree growth","Altered climate memory characterizes tree growth during forest dieback",,"Journal Article","Open access",,,,"2022-01-06T19:47:36Z",,,,,,,"yes",,,,,,,,,,,,,,"85121911473",,"000819806600004","Agric. for. meteorol.",,"Agricultural and Forest Meteorology","314","ETH Zürich::00002 - ETH Zürich::00012 - Lehre und Forschung::00007 - Departemente::02350 - Dep. Umweltsystemwissenschaften / Dep. of Environmental Systems Science::02703 - Institut für Agrarwissenschaften / Institute of Agricultural Sciences::09678 - Stocker, Benjamin David (ehemalig) / Stocker, Benjamin David (former)","ETH Zürich::00002 - ETH Zürich::00012 - Lehre und Forschung::00007 - Departemente::02350 - Dep. Umweltsystemwissenschaften / Dep. of Environmental Systems Science::02703 - Institut für Agrarwissenschaften / Institute of Agricultural Sciences::09678 - Stocker, Benjamin David (ehemalig) / Stocker, Benjamin David (former)","09678","09678",,,"108787","Amsterdam","published",,,,,,,,,,,,,,"2022-03-02T13:06:43Z","2023-02-07T00:17:57Z","true","12 p.","SCOPUS",,,"publishedVersion",
"446061","20.500.11850/3","Sun, Qing||Klaus, Valentin||Wittwer, Raphaël||Liu, Yujie||van der Heijden, Marcel G.A.||Gilgen, Anna K.||Buchmann, Nina",,,,,,,,,,,"2022-04-01T13:39:58Z","2022-04-01T12:01:40Z||2022-04-01T13:39:58Z",,"2022-03-01",,"Agricultural production is under threat of water scarcity due to increasingly frequent and severe drought events under climate change. Whether a change in cropping systems can be used as an effective adaptation strategy against drought is still unclear. We investigated how plant water uptake patterns of a field-grown pea–barley (Pisum sativum L. and Hordeum vulgare L.) mixture, an important fodder intercrop, responded to experimental drought under four cropping systems, i.e. organic intensive tillage, conventional intensive tillage, conventional no tillage, and organic reduced tillage. Drought was simulated after crop establishment using rain shelters. Proportional contributions to plant water uptake from different soil layers were estimated based on stable water isotopes using Bayesian mixing models. Pea plants always took up proportionally more water from shallower depths than barley plants. Water uptake patterns of neither species were affected by cropping systems. Both species showed similar responses to the drought simulation and increased their proportional water uptake from the shallow soil layer (0–20 cm) in all cropping systems. Our results highlight the impact of drought on plant water uptake patterns for two important crop species and suggest that cropping systems might not be as successful as adaptation strategies against drought as previously thought.","application/pdf","10.3929/ethz-b-000540536",,"1726-4170||1726-4170",,"10.5194/bg-19-1853-2022","http://hdl.handle.net/20.500.11850/540536","en","Copernicus","Creative Commons Attribution 4.0 International","http://creativecommons.org/licenses/by/4.0/",,"Water uptake patterns of pea and barley responded to  drought but not to cropping systems",,"Journal Article","Open access",,,,"2022-04-01T12:01:48Z",,,,,,,"yes",,,,,,,,,,,,,,"85128191650",,"000776707700001",,"6","Biogeosciences","19","ETH Zürich::00002 - ETH Zürich::00012 - Lehre und Forschung::00007 - Departemente::02350 - Dep. Umweltsystemwissenschaften / Dep. of Environmental Systems Science::02703 - Institut für Agrarwissenschaften / Institute of Agricultural Sciences::03648 - Buchmann, Nina / Buchmann, Nina","ETH Zürich::00002 - ETH Zürich::00012 - Lehre und Forschung::00007 - Departemente::02350 - Dep. Umweltsystemwissenschaften / Dep. of Environmental Systems Science::02703 - Institut für Agrarwissenschaften / Institute of Agricultural Sciences::03648 - Buchmann, Nina / Buchmann, Nina","03648","03648",,"1869","1853","Göttingen","published",,,,,,"10.3929/ethz-b-000512580",,,,,"10.3929/ethz-b-000533193",,,"2022-04-01T13:41:00Z","2023-02-07T00:40:20Z","true",,"FORM",,,"publishedVersion",
"445733","20.500.11850/3","McLaren, Timothy I.||Verel, René||Frossard, Emmanuel",,,,,,,,,,,"2022-03-31T07:58:38Z","2022-01-07T08:45:15Z||2022-01-13T12:27:05Z||2022-03-31T07:58:38Z",,"2022-03","2021-10-23","The majority of soil organic P is typically that of “unresolved” phosphomonoesters, which are associated with organic P (Po) in large molecular weight (MW) fractions. However, the composition of this pool of Po remains unclear and could contain more than one component. Our aim was to identify the number and nature of components in soil extracts of different MW using solution 31P nuclear magnetic resonance (NMR) spectroscopy and spectral deconvolution fitting. Three surface soils were collected from native sites, which were extracted for Po using 0.25 M NaOH + 0.05 M Na2–EDTA (unfractionated), followed by size separation using ultrafiltration, resulting in four MW fractions (>10 kDa, <10 kDa, <10 kDa and >3 kDa, and <3 kDa). The NMR analyses revealed a diversity of Po species in all MW fractions across the three soils. In particular, the phosphomonoester region of the >10-kDa fraction comprised up to 10 components of varying linewidth (0.5–18.6 Hz) and a broad signal (228 Hz). This broad signal was also present in the <3-kDa fraction, albeit at a lower concentration (average was 29% of that in the unfractionated extracts). Furthermore, solution 31P NMR spectra on the <3-kDa fraction revealed a diversity of sharp signals (up to 28) in the phosphomonoester region. Overall, our findings show that soil phosphomonoesters in large MW fractions comprise multiple components of varying linewidth.","application/pdf","10.3929/ethz-b-000523814",,"0361-5995||1435-0661",,"10.1002/saj2.20347","http://hdl.handle.net/20.500.11850/523814","en","Wiley","Creative Commons Attribution 4.0 International","http://creativecommons.org/licenses/by/4.0/",,"Soil phosphomonoesters in large molecular weight material comprise multiple components",,"Journal Article","Open access",,,,"2022-01-07T08:45:21Z",,,,,,,"yes",,,,,,,,,,,,,,"85122477187",,"000739752800001","Soil Sci. Soc. Am. j.","2","Soil Science Society of America Journal","86","ETH Zürich::00002 - ETH Zürich::00012 - Lehre und Forschung::00007 - Departemente::02350 - Dep. Umweltsystemwissenschaften / Dep. of Environmental Systems Science::02703 - Institut für Agrarwissenschaften / Institute of Agricultural Sciences::03427 - Frossard, Emmanuel / Frossard, Emmanuel","ETH Zürich::00002 - ETH Zürich::00012 - Lehre und Forschung::00007 - Departemente::02350 - Dep. Umweltsystemwissenschaften / Dep. of Environmental Systems Science::02703 - Institut für Agrarwissenschaften / Institute of Agricultural Sciences::03427 - Frossard, Emmanuel / Frossard, Emmanuel","03427","03427",,"357","345","Hoboken, NJ","published",,,,,,,,,,,,,,"2022-03-31T07:58:45Z","2023-02-07T00:37:51Z","true",,"FORM",,,"publishedVersion",
"440322","20.500.11850/3","Büchi, Lucie||Walder, Florian||Banerjee, Samiran||Colombi, Tino||van der Heijden, Marcel G.A.||Keller, Thomas||Charles, Raphaël||Six, Johan",,,,,,,,,,,"2022-02-17T07:40:08Z","2021-12-11T04:37:56Z||2022-02-07T11:39:47Z||2022-02-07T13:39:34Z||2022-02-08T16:32:52Z||2022-02-17T07:40:08Z",,"2022-03-01","2021-12-03","The degradation of soil from agricultural land is a major threat to food security and a driver of global changes. Soil conservation systems are thus being promoted and/or adopted worldwide. In this on-farm study conducted in Switzerland, we compared the effect of three cropping systems – conventional with tillage, conventional without tillage (i.e. no-till) and organic farming with tillage – on soil quality. Samples from 60 winter wheat fields belonging to these three systems were analysed for soil carbon concentration, soil aggregate distribution and soil biological properties (microbial carbon and mycorrhizal biomarkers), at three different depths (0–5 cm, 5–20 cm and 20–50 cm). Information about cropping practices was collected through surveys. The main differences in soil properties between systems occurred for the surface layer (0–5 cm depth), with increased soil organic carbon concentration and stock under no-till compared to the conventionally tilled fields. No-till and organic fields showed a higher mean aggregate size and proportion of macroaggregates in the surface layer compared to tilled conventional fields, with a greater amount of carbon in the large macroaggregates. However, large within-system variability was also observed, which tended to override differences between systems. Across systems, clay content, microbial carbon, and the mycorrhizal PFLA biomarkers were the major drivers of soil organic carbon concentration, clay to carbon ratio and carbon accumulation in the large macroaggregate fraction. Aggregation at 0–5 cm was mostly related to tillage depth, while climate variables and especially clay content played a major role for deeper layers. Our results demonstrate that within the constraints set by soil texture and climate, organic agriculture and no-till can contribute to improved soil carbon and aggregation properties. Thus, we advocate for the identification of the main drivers of soil quality in order to inform management and improve soil functioning in agricultural fields in the long term.",,,,"0016-7061||1872-6259",,"10.1016/j.geoderma.2021.115632","http://hdl.handle.net/20.500.11850/520168","en","Elsevier",,,"No-till||Organic farming||Soil biological properties||Tillage||Cropping practices","Pedoclimatic factors and management determine soil organic carbon and aggregation in farmer fields at a regional scale",,"Journal Article","Metadata only",,,,"2021-12-11T04:38:00Z",,,,,,,"yes",,,,,,,,,,,,,,"85120476533",,,"Geoderma",,"Geoderma","409","ETH Zürich::00002 - ETH Zürich::00012 - Lehre und Forschung::00007 - Departemente::02350 - Dep. Umweltsystemwissenschaften / Dep. of Environmental Systems Science::02703 - Institut für Agrarwissenschaften / Institute of Agricultural Sciences::03982 - Six, Johan / Six, Johan","ETH Zürich::00002 - ETH Zürich::00012 - Lehre und Forschung::00007 - Departemente::02350 - Dep. Umweltsystemwissenschaften / Dep. of Environmental Systems Science::02703 - Institut für Agrarwissenschaften / Institute of Agricultural Sciences::03982 - Six, Johan / Six, Johan","03982","03982",,,"115632","Amsterdam","published",,,,,,,,,,,,,,"2022-02-07T13:39:40Z","2023-02-07T00:14:43Z","true","12 p.","SCOPUS",,,,
"443988","20.500.11850/3","Mapel, Xena Marie||Hiltpold, Maya||Kadri, Naveen Kumar||Witschi, Ulrich||Pausch, Hubert",,,,,,,,,,,"2022-03-17T17:16:02Z","2022-01-11T09:54:42Z||2022-01-30T11:15:04Z||2022-03-17T17:16:02Z",,"2022-03","2022-01-10","Undisturbed reproduction is key for successful breeding of beef and dairy cattle. Improving reproductive ability can be difficult because of antagonistic relationships with other economically relevant traits. In cattle, thorough investigation of female fertility revealed unfavorable genetic correlations with various production phenotypes. However, the correlation between male reproductive ability and production traits remains poorly understood. Here, we investigated the genetic relationships among and between male fertility characteristics and economically relevant traits in a population of Brown Swiss cattle. We performed GWAS with imputed genotypes at nearly 12 million sequence variants for semen quality (sperm head and tail anomalies, motility, concentration, and volume), male fertility, and 57 production phenotypes. Allele substitution effects were then correlated on a trait-by-trait basis to estimate genetic correlations. Correlations between male reproductive characteristics and traits of economic value were small and ranged from −0.0681 to 0.0787. Among the semen quality parameters, sperm motility was negatively correlated with anomalies (head: r = −0.7083 ± 0.0002; tail: r = −0.7739 ± 0.0002) and volume (r = −0.1266 ± 0.0003), whereas volume was negatively correlated with concentration (r = −0.3503 ± 0.0002). Sire nonreturn rate was negatively correlated with sperm anomalies (head: r = −0.1640 ± 0.0002; tail: r = −0.1580 ± 0.0002) and positively correlated with motility (r = 0.1598 ± 0.0002). A meta-analysis of male reproductive traits identified 2 quantitative trait loci: a previously described region on chromosome 6 showed pleiotropic effects and a novel region on chromosome 11 was associated with sperm head anomalies. In conclusion, our results suggest that selection for economically important dairy and production phenotypes has little impact on semen quality and fertility of Brown Swiss bulls.","application/pdf","10.3929/ethz-b-000524534",,,,"10.3168/jdsc.2021-0164","http://hdl.handle.net/20.500.11850/524534","en","Elsevier","Creative Commons Attribution-NonCommercial-NoDerivatives 4.0 International","http://creativecommons.org/licenses/by-nc-nd/4.0/",,"Bull fertility and semen quality are not correlated with dairy and production traits in Brown Swiss cattle",,"Journal Article","Open access",,,,"2022-01-11T09:54:49Z",,,,,,,"yes",,,,,,,,,,,,,,,,,,"2","JDS Communications","3","ETH Zürich::00002 - ETH Zürich::00012 - Lehre und Forschung::00007 - Departemente::02350 - Dep. Umweltsystemwissenschaften / Dep. of Environmental Systems Science::02703 - Institut für Agrarwissenschaften / Institute of Agricultural Sciences::09575 - Pausch, Hubert / Pausch, Hubert||ETH Zürich::00002 - ETH Zürich::00012 - Lehre und Forschung::00007 - Departemente::02350 - Dep. Umweltsystemwissenschaften / Dep. of Environmental Systems Science::02703 - Institut für Agrarwissenschaften / Institute of Agricultural Sciences::09575 - Pausch, Hubert / Pausch, Hubert||ETH Zürich::00002 - ETH Zürich::00012 - Lehre und Forschung::00007 - Departemente::02350 - Dep. Umweltsystemwissenschaften / Dep. of Environmental Systems Science::02703 - Institut für Agrarwissenschaften / Institute of Agricultural Sciences::09575 - Pausch, Hubert / Pausch, Hubert","ETH Zürich::00002 - ETH Zürich::00012 - Lehre und Forschung::00007 - Departemente::02350 - Dep. Umweltsystemwissenschaften / Dep. of Environmental Systems Science::02703 - Institut für Agrarwissenschaften / Institute of Agricultural Sciences::09575 - Pausch, Hubert / Pausch, Hubert","09575||09575||09575","09575",,"125","120","Amsterdam","published",,,,,,,,,,,,,,"2022-03-29T20:41:08Z","2023-02-07T00:24:45Z","true",,"FORM",,,"publishedVersion",
"441892","20.500.11850/3","Bachofen, Christoph||Hülsmann, Lisa||Revill, Andrew||Buchmann, Nina||D'Odorico, Petra",,,,,,,,,,,"2022-03-02T13:10:44Z","2022-01-07T06:27:36Z||2022-02-28T14:31:18Z||2022-02-28T14:36:42Z||2022-03-02T13:10:44Z",,"2022-03-01","2021-12-31","Vertical gradients in the canopy represent a major challenge for scaling from foliar photosynthesis to ecosystem-level CO2 fluxes. We tested whether accounting for independent gradients of carboxylation capacity (Vcmax) and photosynthetic electron transport (Jmax) improves estimates of forest net ecosystem CO2 exchange (NEE). We modified the process-based Soil-Plant-Atmosphere (SPA) model to represent different gradients of foliar N allocation to Vcmax and Jmax in the canopy, and inversely calibrated the model via Bayesian inference using eddy covariance measurements of NEE and evapotranspiration from a mixed-deciduous forest. Inversely calibrated N allocation resulted in highest Vcmax at the top and highest Jmax at the bottom of the canopy, which is similar to N allocation gradients from measured foliar traits. These vertical gradients resulted in the best fit of simulated CO2 fluxes to measured NEE compared to alternative N allocation schemes, due to a higher, more realistic foliar CO2 uptake in the lower canopy. Canopy gradients of Vcmax and Jmax are thus important drivers of NEE and need to be considered to improve simulations of ecosystem-level CO2 fluxes of forests.","application/pdf","10.3929/ethz-b-000523782",,"0168-1923||1873-2240",,"10.1016/j.agrformet.2021.108771","http://hdl.handle.net/20.500.11850/523782","en","Elsevier","Creative Commons Attribution-NonCommercial-NoDerivatives 4.0 International","http://creativecommons.org/licenses/by-nc-nd/4.0/","Bayesian inference||Canopy gradients||Nitrogen||Carboxylation||Electron transport||Soil-plant-atmosphere model","Accounting for foliar gradients in Vcmax and Jmax improves estimates of net CO2 exchange of forests",,"Journal Article","Open access",,,,"2022-01-07T06:27:39Z",,,,,,,"yes",,,,,,,,,,,,,,"85122007759",,"000819806600001","Agric. for. meteorol.",,"Agricultural and Forest Meteorology","314","ETH Zürich::00002 - ETH Zürich::00012 - Lehre und Forschung::00007 - Departemente::02350 - Dep. Umweltsystemwissenschaften / Dep. of Environmental Systems Science::02703 - Institut für Agrarwissenschaften / Institute of Agricultural Sciences::03648 - Buchmann, Nina / Buchmann, Nina","ETH Zürich::00002 - ETH Zürich::00012 - Lehre und Forschung::00007 - Departemente::02350 - Dep. Umweltsystemwissenschaften / Dep. of Environmental Systems Science::02703 - Institut für Agrarwissenschaften / Institute of Agricultural Sciences::03648 - Buchmann, Nina / Buchmann, Nina","03648","03648",,,"108771","Amsterdam","published",,,,,,,,,,,,,,"2022-03-02T13:10:51Z","2023-02-07T00:18:00Z","true","11 p.","SCOPUS",,,"publishedVersion",
