"468482","20.500.11850/3","Eugster, Werner||DelSontro, Tonya||Laundre, James A.||Dobkowski, Jason||Shaver, Gaius R.||Kling, George W.",,,,,,,,,,,"2022-09-20T07:32:33Z","2022-09-16T12:26:02Z||2022-09-20T07:32:33Z",,"2022-08-13",,"Methane and carbon dioxide effluxes from aquatic systems in the Arctic will affect and likely amplify global change. As permafrost thaws in a warming world, more dissolved organic carbon (DOC) and greenhouse gases are produced and move from soils to surface waters where the DOC can be oxidized to CO2 and also released to the atmosphere. Our main study objective is to measure the release of carbon to the atmosphere via effluxes of methane (CH4) and carbon dioxide (CO2) from Toolik Lake, a deep, dimictic, low-arctic lake in northern Alaska. By combining direct eddy covariance flux measurements with continuous gas pressure measurements in the lake surface waters, we quantified the k600 piston velocity that controls gas flux across the air–water interface. Our measured k values for CH4 and CO2 were substantially above predictions from several models at low to moderate wind speeds, and only converged on model predictions at the highest wind speeds. We attribute this higher flux at low wind speeds to effects on water-side turbulence resulting from how the surrounding tundra vegetation and topography increase atmospheric turbulence considerably in this lake, above the level observed over large ocean surfaces. We combine this process-level understanding of gas exchange with the trends of a climate-relevant long-term (30 + years) meteorological data set at Toolik Lake to examine short-term variations (2015 ice-free season) and interannual variability (2010–2015 ice-free seasons) of CH4 and CO2 fluxes. We argue that the biological processing of DOC substrate that becomes available for decomposition as the tundra soil warms is important for understanding future trends in aquatic gas fluxes, whereas the variability and long-term trends of the physical and meteorological variables primarily affect the timing of when higher or lower than average fluxes are observed. We see no evidence suggesting that a tipping point will be reached soon to change the status of the aquatic system from gas source to sink. We estimate that changes in CH4 and CO2 fluxes will be constrained with a range of +30% and −10% of their current values over the next 30 years.","application/pdf","10.3929/ethz-b-000571096",,"2296-665X",,"10.3389/fenvs.2022.948529","http://hdl.handle.net/20.500.11850/571096","en","Frontiers Media","Creative Commons Attribution 4.0 International","http://creativecommons.org/licenses/by/4.0/","Toolik Lake||long-term ecological research||LTER||methane flux||carbon dioxide flux||piston velocity||arctic trends||quantile regression","Effects of long-term climate trends on the methane and CO2 exchange processes of Toolik Lake, Alaska",,"Journal Article","Open access",,,,"2022-09-16T12:26:09Z",,,,,,,"yes",,,,,,,,,,,,,,"85138964168",,"000861958900001","Front. Environ. Sci.,",,"Frontiers in Environmental Science","10","ETH Zürich::00002 - ETH Zürich::00012 - Lehre und Forschung::00007 - Departemente::02350 - Dep. Umweltsystemwissenschaften / Dep. of Environmental Systems Science::02703 - Institut für Agrarwissenschaften / Institute of Agricultural Sciences::03648 - Buchmann, Nina / Buchmann, Nina","ETH Zürich::00002 - ETH Zürich::00012 - Lehre und Forschung::00007 - Departemente::02350 - Dep. Umweltsystemwissenschaften / Dep. of Environmental Systems Science::02703 - Institut für Agrarwissenschaften / Institute of Agricultural Sciences::03648 - Buchmann, Nina / Buchmann, Nina","03648","03648",,,"948529","Lausanne","published",,,,,,,,,,,,,,"2022-09-20T07:32:42Z","2023-02-07T06:25:38Z","true","22 p.","FORM",,,"publishedVersion",
"461110","20.500.11850/3","Schlathölter, Ina||Meissle, Michael||Boeriis, Timea||Dominique Heimo, Dominique||Studer, Bruno||Broggini, Giovanni A.L.||Romeis, Jörg||Patocchi, Andrea",,,,,,,,,,,"2022-08-01T11:14:27Z","2022-07-09T11:39:58Z||2022-08-01T11:14:27Z",,"2022-08","2022-06-11","Genetic modification of apple cultivars through cisgenesis can introduce traits, such as disease resistance from wild relatives, quickly and without crossing. This approach was used to generate the cisgenic apple line C44.4.146, a 'Gala Galaxy' carrying the fire blight resistance gene FB_MR5. In contrast to traditionally bred apple cultivars, genetically modified (GM) plants need to undergo a regulatory risk assessment considering unintended effects before approval for commercial release. To determine potential unintended effects of C44.4.146, we assessed major leaf components and effects on the fitness of the decomposers Drosophila melanogaster (fruit fly) and Folsomia candida (collembolan), which were fed a diet amended with powdered apple leaf material. Leaf material of 'Gala Galaxy', several natural 'Gala' mutants, and the unrelated apple cultivar 'Ladina' were used for comparison. The genetic modification did not alter major leaf components and did not adversely affect survival, growth, or fecundity of the two decomposers. Consistent with previous studies with other GM crops, the differences between conventionally bred cultivars were greater than between the GM line and its non-GM wild type. These data provide a baseline for future risk assessments.","application/pdf","10.3929/ethz-b-000557086",,"0147-6513||1090-2414",,"10.1016/j.ecoenv.2022.113749","http://hdl.handle.net/20.500.11850/557086","en","Elsevier","Creative Commons Attribution 4.0 International","http://creativecommons.org/licenses/by/4.0/","Biosafety||Genetic modification||Non-target organisms||Environmental risk assessment||Natural variation||Malus × domestica","No adverse dietary effect of a cisgenic fire blight resistant apple line on the non-target arthropods Drosophila melanogaster and Folsomia candida",,"Journal Article","Open access",,,,"2022-07-09T11:40:09Z",,,,,,,"yes",,,,,,,,,,,,,,"85132362008",,"000817725800001","Ecotoxicol. environ. saf.",,"Ecotoxicology and Environmental Safety","241","ETH Zürich::00002 - ETH Zürich::00012 - Lehre und Forschung::00007 - Departemente::02350 - Dep. Umweltsystemwissenschaften / Dep. of Environmental Systems Science::02703 - Institut für Agrarwissenschaften / Institute of Agricultural Sciences::03969 - Studer, Bruno / Studer, Bruno","ETH Zürich::00002 - ETH Zürich::00012 - Lehre und Forschung::00007 - Departemente::02350 - Dep. Umweltsystemwissenschaften / Dep. of Environmental Systems Science::02703 - Institut für Agrarwissenschaften / Institute of Agricultural Sciences::03969 - Studer, Bruno / Studer, Bruno","03969","03969",,,"113749","Amsterdam","published",,,,,,,,,,,,,,"2022-08-01T11:14:35Z","2023-02-07T04:55:47Z","true","9 p.","SCOPUS",,,"publishedVersion",
"449198","20.500.11850/3","Alkemade, Joris A.||Arncken, C.||Hirschvogel, Christa||Messmer, Monika M.||Leska, A.||Voegele, Ralf T.||Finckh, Maria R.||Kölliker, Roland||Groot, Steven P.C.||Hohmann, Pierre",,,,,,,,,,,"2022-05-03T09:03:05Z","2022-05-02T09:41:40Z||2022-05-03T09:03:05Z",,"2022-08","2022-04-28","White lupin (Lupinus albus L.) is a promising crop to meet the rising global demand for plant-based protein. The seed-borne pathogen Colletotrichum lupini, however, threatens lupin cultivation worldwide. Seed dressings using synthetic fungicides were shown effective to reduce infection levels, but their negative environmental impact and exclusion from organic production calls for more sustainable solutions. In this study, a total of eleven different alternative seed treatments were tested in field trials in Switzerland between 2018 and 2021. Treatment types consisted of: hot water, steam, electron, long-term storage, elevated partial pressure of oxygen (EPPO), vinegar, plant extracts and biological control agents (BCAs). The BCAs were tested for potential antagonistic activity against C. lupini during white lupin infection under controlled conditions prior to field trials. Long-term storage and vinegar treatments successfully reduced disease incidence and increased yield to levels similar to those observed for certified seeds, without significantly affecting germination rate. Although promising, effectiveness of these treatments needs further validation. Four BCAs showed significant disease reductions under controlled conditions. Besides lowering disease severity, two BCAs also reduced C. lupini DNA in stem tissue. These reductions, however, were not observed in the field, highlighting the importance of field validations. The treatments identified in this study provide a solid basis for the development of sustainable and effective seed protection strategies in white lupin to control C. lupini successfully.","application/pdf","10.3929/ethz-b-000544666",,"0261-2194||1873-6904",,"10.1016/j.cropro.2022.106009","http://hdl.handle.net/20.500.11850/544666","en","Elsevier","Creative Commons Attribution 4.0 International","http://creativecommons.org/licenses/by/4.0/","Biological control||Seed dressing||Colletotrichum lupini||Lupinus albus||Long-term storage||Vinegar","The potential of alternative seed treatments to control anthracnose disease in white lupin",,"Journal Article","Open access",,,,"2022-05-02T09:41:45Z",,,,,,,"yes",,,,,,,,,,,,,,"85129247018",,"000804365500007","Crop prot.",,"Crop Protection","158","ETH Zürich::00002 - ETH Zürich::00012 - Lehre und Forschung::00007 - Departemente::02350 - Dep. Umweltsystemwissenschaften / Dep. of Environmental Systems Science::02703 - Institut für Agrarwissenschaften / Institute of Agricultural Sciences::03969 - Studer, Bruno / Studer, Bruno","ETH Zürich::00002 - ETH Zürich::00012 - Lehre und Forschung::00007 - Departemente::02350 - Dep. Umweltsystemwissenschaften / Dep. of Environmental Systems Science::02703 - Institut für Agrarwissenschaften / Institute of Agricultural Sciences::03969 - Studer, Bruno / Studer, Bruno","03969","03969",,,"106009","Amsterdam","published",,,,,,,,,,,,,,"2022-05-03T09:03:13Z","2023-02-07T01:42:09Z","true","7 p.","FORM",,,"publishedVersion",
"457897","20.500.11850/3","Keller, Magdalena||Kreuzer, Michael||Reidy, Beat||Scheurer, Andreas||Liesegang, Annette||Giller, Katrin",,,,,,,,,,,"2022-07-07T10:21:49Z","2022-07-07T08:39:11Z||2022-07-07T10:21:05Z||2022-07-07T10:21:49Z",,"2022-08","2022-06-10","Replacing imported soybean meal (SBM) by domestic protein sources such as grain legumes, food industry by-products or novel resource-efficient feeds is a current research focus to enhance the sustainability of ruminant production systems. In addition, grass silage replacing maize silage can contribute to dietary crude protein (CP) supply as well and complies with the natural diet of ruminants. An experiment with 30 Limousin-sired beef bulls was performed with diets in which SBM was replaced by alternative protein sources when feeding a diet composed of, per kg dry matter (DM), 500 g grass silage, 300 g maize silage and 200 g concentrate. In the concentrate, SBM (control diet) was replaced by faba beans, pumpkin seed cake, or spirulina (Arthrospira platensis) to result on average in 226 g CP/kg concentrate dry matter (DM). A fifth group served as negative control, which received a grain-based concentrate with only 135 g CP/kg DM. Bulls were fed the experimental diets for the entire fattening period starting from an initial body weight (BW) of 164 ± 2.3 kg and 4.3 ± 0.06 months of age. At an average body weight (BW) of 275 ± 5.6 kg and 7.4 ± 0.17 months of age, each animal underwent a 9-day sampling period to determine individual N and energy intake and excretion (7 days of urine and faeces collection) as well as methane emission (2 days in respiration chambers). The diet had no effect on DM and nutrient intake. Apparent fibre digestibility was significantly affected by diet, being numerically lowest with faba beans instead of SBM. Compared to the other groups, the bulls fed no additional protein had the lowest urinary N excretion (25.1 vs. 40.3 g/bull/day; 366 vs. 460 g/kg total faecal and urinary N). Digestive and metabolic energy utilisation were comparable among diets. Methane (CH4) production adjusted to body weight differed significantly among groups, being numerically highest in bulls fed faba beans (547 vs. 513 mg CH4/kg BW/day in the other diets). These results show that none of the tested protein sources, including SBM, was of benefit when feeding a diet containing 500 g/kg DM grass silage complemented with maize silage and concentrate. Feeding such a diet seems to provide an adequate supply with metabolisable protein. Omitting the common protein supplementation therefore mitigated urinary N losses and thus likely N emissions from the manure at unchanged N and energy utilisation.","application/pdf","10.3929/ethz-b-000556721",,"0377-8401||1873-2216",,"10.1016/j.anifeedsci.2022.115362","http://hdl.handle.net/20.500.11850/556721","en","Elsevier","Creative Commons Attribution 4.0 International","http://creativecommons.org/licenses/by/4.0/","Spirulina||Faba beans||Pumpkin seed cake||Soybean||Grass silage||Urinary nitrogen","Methane emission, nitrogen and energy utilisation of beef cattle when replacing or omitting soybean meal in a forage-based diet",,"Journal Article","Open access",,,,"2022-07-07T08:39:16Z",,,,,,,"yes",,,,,,,,,,,,,,"85133751558",,"000827320200002","Anim. Feed Sci. Technol.",,"Animal Feed Science and Technology","290","ETH Zürich::00002 - ETH Zürich::00012 - Lehre und Forschung::00007 - Departemente::02350 - Dep. Umweltsystemwissenschaften / Dep. of Environmental Systems Science::02703 - Institut für Agrarwissenschaften / Institute of Agricultural Sciences::03428 - Kreuzer, Michael (emeritus) / Kreuzer, Michael (emeritus)||ETH Zürich::00002 - ETH Zürich::00012 - Lehre und Forschung::00007 - Departemente::02350 - Dep. Umweltsystemwissenschaften / Dep. of Environmental Systems Science::02703 - Institut für Agrarwissenschaften / Institute of Agricultural Sciences::09747 - Niu, Mutian / Niu, Mutian","ETH Zürich::00002 - ETH Zürich::00012 - Lehre und Forschung::00007 - Departemente::02350 - Dep. Umweltsystemwissenschaften / Dep. of Environmental Systems Science::02703 - Institut für Agrarwissenschaften / Institute of Agricultural Sciences::03428 - Kreuzer, Michael (emeritus) / Kreuzer, Michael (emeritus)||ETH Zürich::00002 - ETH Zürich::00012 - Lehre und Forschung::00007 - Departemente::02350 - Dep. Umweltsystemwissenschaften / Dep. of Environmental Systems Science::02703 - Institut für Agrarwissenschaften / Institute of Agricultural Sciences::09747 - Niu, Mutian / Niu, Mutian","03428||09747","03428||09747",,,"115362","Amsterdam","published",,,,,,,,,,,,,,"2022-07-07T10:21:16Z","2023-02-07T04:04:52Z","true","11 p.","FORM",,,"publishedVersion",
"499871","20.500.11850/10","Rico, Daniel E.||Ouellet, Valerie||Boucher, A.||Ruiz-Gonzalez, A.||Niu, Mutian",,,,,,,,,,,"2023-05-16T06:24:20Z","2023-01-31T11:16:17Z||2023-05-16T06:24:20Z",,"2022-08","2022-09-16",,,,,"2772-283X",,"10.1016/j.anscip.2022.07.188","http://hdl.handle.net/20.500.11850/596169","en","Elsevier",,,"Dairy cows||Diurnal pattern||Hyperthermia||Lying time","Heat stress and diet effects on the diurnal pattern of lying behavior in lactating dairy cows",,"Other Conference Item","Metadata only","Proceedings of the 7th EAAP International Symposium on Energy and Protein Metabolism and Nutrition (ISEP 2022)",,,"2023-01-31T11:16:17Z",,,,,,,"yes","7th EAAP International Symposium on Energy and Protein Metabolism and Nutrition (ISEP 2022)","September 12-15, 2022","Granada, Spain",,,,,,,,,,,,,,,"3","Animal - Science Proceedings","13","ETH Zürich::00002 - ETH Zürich::00012 - Lehre und Forschung::00007 - Departemente::02350 - Dep. Umweltsystemwissenschaften / Dep. of Environmental Systems Science::02703 - Institut für Agrarwissenschaften / Institute of Agricultural Sciences::09747 - Niu, Mutian / Niu, Mutian","ETH Zürich::00002 - ETH Zürich::00012 - Lehre und Forschung::00007 - Departemente::02350 - Dep. Umweltsystemwissenschaften / Dep. of Environmental Systems Science::02703 - Institut für Agrarwissenschaften / Institute of Agricultural Sciences::09747 - Niu, Mutian / Niu, Mutian","09747","09747","Poster abstract. Poster presentation on September 14, 2022.","469","468","Amsterdam","published",,,,,,,,,,,,,"true",,,,,"FORM",,,,
"463847","20.500.11850/3","Greve, Sarah||Kuhn, Gisela A.||Saenz-de-Juano, Mara D.||Ghosh, Adhideb||von Meyenn, Ferdinand||Giller, Katrin",,,,,,,,,,,"2022-08-19T10:59:30Z","2022-08-11T03:58:14Z||2022-08-19T10:59:30Z",,"2022-08-01",,"Scientific evidence suggests that not only murine scent communication is regulated by major urinary proteins, but that their expression may also vary in response to metabolism via a yet unknown mechanism. Major urinary proteins are expressed mainly in the liver, showing a sexually dimorphic pattern with substantially higher expression in males. Here, we investigate the metabolic implications of a major urinary protein knockout in twelve-week-old male and female C57BL/6N mice during ad libitum feeding. Despite both sexes of major urinary protein knockout mice displayed numerically increased body weight and visceral adipose tissue proportions compared to sex-matched wildtype mice, the main genotype-specific metabolic differences were observed exclusively in males. Male major urinary protein knockout mice exhibited plasma and hepatic lipid accumulation accompanied by a hepatic transcriptome indicating an activation of lipogenesis. These findings match the higher major urinary protein expression in male compared to female wildtype mice, suggesting a more distinct reduction in energy requirements in male compared to female major urinary protein knockout mice. The observed sex-specific anabolic phenotype confirms a role of major urinary protein in metabolism and, since major urinary proteins are not expressed in humans, suggests the major urinary protein knockout mouse as a potential alternative model for translational metabolism research which needs to be further elucidated.","application/pdf","10.3929/ethz-b-000563076",,"2045-2322",,"10.1038/s41598-022-17195-y","http://hdl.handle.net/20.500.11850/563076","en","Macmillan Publishers","Creative Commons Attribution 4.0 International","http://creativecommons.org/licenses/by/4.0/",,"The major urinary protein gene cluster knockout mouse as a novel model for translational metabolism research",,"Journal Article","Open access",,,,"2022-08-11T03:58:21Z",,,,,,,"yes",,,,,,,,,,,,,,"85135302952",,"000834992200016","Sci Rep","1","Scientific Reports","12","ETH Zürich::00002 - ETH Zürich::00012 - Lehre und Forschung::00007 - Departemente::02350 - Dep. Umweltsystemwissenschaften / Dep. of Environmental Systems Science::02703 - Institut für Agrarwissenschaften / Institute of Agricultural Sciences::03428 - Kreuzer, Michael (emeritus) / Kreuzer, Michael (emeritus)||ETH Zürich::00002 - ETH Zürich::00012 - Lehre und Forschung::00007 - Departemente::02350 - Dep. Umweltsystemwissenschaften / Dep. of Environmental Systems Science::02703 - Institut für Agrarwissenschaften / Institute of Agricultural Sciences::09747 - Niu, Mutian / Niu, Mutian||ETH Zürich::00002 - ETH Zürich::00012 - Lehre und Forschung::00007 - Departemente::02350 - Dep. Umweltsystemwissenschaften / Dep. of Environmental Systems Science::02703 - Institut für Agrarwissenschaften / Institute of Agricultural Sciences::03999 - Ulbrich, Susanne / Ulbrich, Susanne||ETH Zürich::00002 - ETH Zürich::00012 - Lehre und Forschung::00007 - Departemente::02070 - Dep. Gesundheitswiss. und Technologie / Dep. of Health Sciences and Technology::02701 - Inst.f. Lebensmittelwiss.,Ernährung,Ges. / Institute of Food, Nutrition, and Health::09658 - von Meyenn, Ferdinand / von Meyenn, Ferdinand||ETH Zürich::00002 - ETH Zürich::00003 - Schulleitung und Dienste::00022 - Bereich VP Forschung / Domain VP Research::02207 - Functional Genomics Center Zurich / Functional Genomics Center Zurich","ETH Zürich::00002 - ETH Zürich::00012 - Lehre und Forschung::00007 - Departemente::02350 - Dep. Umweltsystemwissenschaften / Dep. of Environmental Systems Science::02703 - Institut für Agrarwissenschaften / Institute of Agricultural Sciences::03428 - Kreuzer, Michael (emeritus) / Kreuzer, Michael (emeritus)||ETH Zürich::00002 - ETH Zürich::00012 - Lehre und Forschung::00007 - Departemente::02350 - Dep. Umweltsystemwissenschaften / Dep. of Environmental Systems Science::02703 - Institut für Agrarwissenschaften / Institute of Agricultural Sciences::09747 - Niu, Mutian / Niu, Mutian||ETH Zürich::00002 - ETH Zürich::00012 - Lehre und Forschung::00007 - Departemente::02350 - Dep. Umweltsystemwissenschaften / Dep. of Environmental Systems Science::02703 - Institut für Agrarwissenschaften / Institute of Agricultural Sciences::03999 - Ulbrich, Susanne / Ulbrich, Susanne||ETH Zürich::00002 - ETH Zürich::00012 - Lehre und Forschung::00007 - Departemente::02070 - Dep. Gesundheitswiss. und Technologie / Dep. of Health Sciences and Technology::02701 - Inst.f. Lebensmittelwiss.,Ernährung,Ges. / Institute of Food, Nutrition, and Health::09658 - von Meyenn, Ferdinand / von Meyenn, Ferdinand||ETH Zürich::00002 - ETH Zürich::00003 - Schulleitung und Dienste::00022 - Bereich VP Forschung / Domain VP Research::02207 - Functional Genomics Center Zurich / Functional Genomics Center Zurich","03428||09747||03999||09658||02207","03428||09747||03999||09658||02207",,,"13161","London","published",,,,,,,,,,,,,,"2022-08-19T10:59:37Z","2023-02-07T05:26:35Z","true","14 p.","SCOPUS",,,"publishedVersion",
"461307","20.500.11850/3","Edlinger, Anna||Garland, Gina||Hartman, Kyle||Banerjee, Samiran||Degrune, Florine||García-Palacios, Pablo||Hallin, Sara||Valzano-Held, Alain||Herzog, Chantal||Jansa, Jan||Kost, Elena||Maestre, Fernando T.||Sánchez Pescador, David||Philippot, Laurent||Rillig, Matthias C.||Romdhane, Sana||Saghaï, Aurélien||Spor, Ayme||Frossard, Emmanuel||van der Heijden, Marcel G.A.",,,,,,,,,,,"2022-08-02T09:49:30Z","2022-07-23T03:01:28Z||2022-07-27T14:33:35Z||2022-08-02T09:49:30Z",,"2022-08","2022-07-07","Phosphorus (P) acquisition is key for plant growth. Arbuscular mycorrhizal fungi (AMF) help plants acquire P from soil. Understanding which factors drive AMF-supported nutrient uptake is essential to develop more sustainable agroecosystems. Here we collected soils from 150 cereal fields and 60 non-cropped grassland sites across a 3,000 km trans-European gradient. In a greenhouse experiment, we tested the ability of AMF in these soils to forage for the radioisotope P-33 from a hyphal compartment. AMF communities in grassland soils were much more efficient in acquiring P-33 and transferred 64% more P-33 to plants compared with AMF in cropland soils. Fungicide application best explained hyphal P-33 transfer in cropland soils. The use of fungicides and subsequent decline in AMF richness in croplands reduced P-33 uptake by 43%. Our results suggest that land-use intensity and fungicide use are major deterrents to the functioning and natural nutrient uptake capacity of AMF in agroecosystems.",,,,"2397-334X",,"10.1038/s41559-022-01799-8","http://hdl.handle.net/20.500.11850/559663","en","Nature",,,,"Agricultural management and pesticide use reduce the functioning of beneficial plant symbionts",,"Journal Article","Metadata only",,,,"2022-07-23T03:02:45Z",,,,,,,"yes",,,,,,,,,,,,,,"85133586896",,"000825366700002","Nat Ecol Evol","8","Nature Ecology & Evolution","6","ETH Zürich::00002 - ETH Zürich::00012 - Lehre und Forschung::00007 - Departemente::02350 - Dep. Umweltsystemwissenschaften / Dep. of Environmental Systems Science::02703 - Institut für Agrarwissenschaften / Institute of Agricultural Sciences::03427 - Frossard, Emmanuel / Frossard, Emmanuel","ETH Zürich::00002 - ETH Zürich::00012 - Lehre und Forschung::00007 - Departemente::02350 - Dep. Umweltsystemwissenschaften / Dep. of Environmental Systems Science::02703 - Institut für Agrarwissenschaften / Institute of Agricultural Sciences::03427 - Frossard, Emmanuel / Frossard, Emmanuel","03427","03427",,"1154","1145","London","published",,,,,,,,,,,,,"true","2022-08-02T09:49:38Z","2023-02-07T04:57:57Z","true",,"WOS",,,,
