"261484","20.500.11850/3","Bachmann, Dörte||Gockele, Annette||Ravenek, Janneke M.||Roscher, Christiane||Strecker, Tanja||Weigelt, Alexandra||Buchmann, Nina",,,,,"2018-11-01T13:40:53Z","2017-06-11T16:02:02Z||2018-11-01T13:40:53Z","2015-01-14",,"Niche complementarity in resource use has been proposed as a key mechanism to explain the positive effects of increasing plant species richness on ecosystem processes, in particular on primary productivity. Since hardly any information is available for niche complementarity in water use, we tested the effects of plant diversity on spatial and temporal complementarity in water uptake in experimental grasslands by using stable water isotopes. We hypothesized that water uptake from deeper soil depths increases in more diverse compared to low diverse plant species mixtures. We labeled soil water in 8 cm (with 18O) and 28 cm depth (with ²H) three times during the 2011 growing season in 40 temperate grassland communities of varying species richness (2, 4, 8 and 16 species) and functional group number and composition (legumes, grasses, tall herbs, small herbs). Stable isotope analyses of xylem and soil water allowed identifying the preferential depth of water uptake. Higher enrichment in 18O of xylem water than in ²H suggested that the main water uptake was in the upper soil layer. Furthermore, our results revealed no differences in root water uptake among communities with different species richness, different number of functional groups or with time. Thus, our results do not support the hypothesis of increased complementarity in water use in more diverse than in less diverse communities of temperate grassland species.","application/pdf","10.3929/ethz-b-000097850",,"1932-6203",,"10.1371/journal.pone.0116367","http://hdl.handle.net/20.500.11850/97850","en","Public Library of Science","Creative Commons Attribution 4.0 International","http://creativecommons.org/licenses/by/4.0/",,"No Evidence of Complementary Water Use along a Plant Species Richness Gradient in Temperate Experimental Grasslands",,"Journal Article","Open access",,,"2017-06-11T16:02:11Z",,"pub:153001",,"yes",,,,,,,"Exploring mechanisms underlying the relationship between biodiversity and ecosystem functioning Subproject 8 Plant water relations: Complementary plant water and light use along a diversity gradient (D-A-CH/LAE)","131194","10.13039/501100001711","SNF","Projektförderung in Biologie und Medizin (Abteilung III)",,"imp593652e8829c749759","006206116","84921033921",,"000347928300011","PLoS ONE","1","PLoS ONE","10","ETH Zürich::00002 - ETH Zürich::00012 - Lehre und Forschung::00007 - Departemente::02350 - Dep. Umweltsystemwissenschaften / Dep. of Environmental Systems Science::02703 - Institut für Agrarwissenschaften / Institute of Agricultural Sciences::03648 - Buchmann, Nina / Buchmann, Nina","ETH Zürich::00002 - ETH Zürich::00012 - Lehre und Forschung::00007 - Departemente::02350 - Dep. Umweltsystemwissenschaften / Dep. of Environmental Systems Science::02703 - Institut für Agrarwissenschaften / Institute of Agricultural Sciences::03648 - Buchmann, Nina / Buchmann, Nina","03648","03648",,,"e0116367","San Francisco, CA, USA","published",,,,,,"2017-07-26T20:42:30Z","2021-02-15T02:22:38Z","true","14 p.","ECIT",,"publishedVersion"
"234796","20.500.11850/3","Burkart, Andreas||Aasen, Helge||Alonso, Luis||Menz, Gunter||Bareth, Georg||Rascher, Uwe",,,,,"2018-05-11T12:49:03Z","2018-05-08T16:38:33Z||2018-05-11T12:49:03Z","2015-01-12",,"In this study we present a hyperspectral flying goniometer system, based on a rotary-wing unmanned aerial vehicle (UAV) equipped with a spectrometer mounted on an active gimbal. We show that this approach may be used to collect multiangular hyperspectral data over vegetated environments. The pointing and positioning accuracy are assessed using structure from motion and vary from σ = 1° to 8° in pointing and σ = 0.7 to 0.8 m in positioning. We use a wheat dataset to investigate the influence of angular effects on the NDVI, TCARI and REIP vegetation indices. Angular effects caused significant variations on the indices: NDVI = 0.83–0.95; TCARI = 0.04–0.116; REIP = 729–735 nm. Our analysis highlights the necessity to consider angular effects in optical sensors when observing vegetation. We compare the measurements of the UAV goniometer to the angular modules of the SCOPE radiative transfer model. Model and measurements are in high accordance (r2 = 0.88) in the infrared region at angles close to nadir; in contrast the comparison show discrepancies at low tilt angles (r2 = 0.25). This study demonstrates that the UAV goniometer is a promising approach for the fast and flexible assessment of angular effects.","application/pdf","10.3929/ethz-b-000263223",,"2072-4292",,"10.3390/rs70100725","http://hdl.handle.net/20.500.11850/263223","en","MDPI","Creative Commons Attribution 4.0 International","http://creativecommons.org/licenses/by/4.0/","Hyperspectral||Unmanned aerial vehicle (UAV)||vegetation||bidirectional reflectance distribution function (BRDF)||goniometer||vegetation indices","Angular Dependency of Hyperspectral Measurements over Wheat Characterized by a Novel UAV Based Goniometer",,"Journal Article","Open access",,,"2018-05-08T16:38:34Z",,,,"no",,,,,,,,,,,,,,,,,,"Remote Sens.","1","Remote Sensing","7","ETH Zürich::00002 - ETH Zürich::00012 - Lehre und Forschung::00007 - Departemente::02350 - Dep. Umweltsystemwissenschaften / Dep. of Environmental Systems Science::02703 - Institut für Agrarwissenschaften / Institute of Agricultural Sciences::03894 - Walter, Achim / Walter, Achim","ETH Zürich::00002 - ETH Zürich::00012 - Lehre und Forschung::00007 - Departemente::02350 - Dep. Umweltsystemwissenschaften / Dep. of Environmental Systems Science::02703 - Institut für Agrarwissenschaften / Institute of Agricultural Sciences::03894 - Walter, Achim / Walter, Achim","03894","03894",,"746","725","Basel","published",,,,,,"2018-05-11T12:49:07Z","2022-03-28T20:04:02Z","true",,"FORM",,"publishedVersion"
"108114","20.500.11850/3","Senanayake, R.L.||Weerakoon, W.M.W.||Sangakkara, U.R.||Nissanka, S.P.||Herath, N.K.||Frossard, E.",,,,,"2017-06-11T21:47:15Z","2017-06-11T21:47:15Z","2015",,,,,,"1391-6947",,,"http://hdl.handle.net/20.500.11850/108147","en","Sri Lanka Department of Agriculture",,,,"Effect of N and K mineral fertilizers on growth and yield of water yam (Dioscorea alata)",,"Journal Article","Metadata only",,,"2017-06-11T21:47:54Z",,"pub:168936",,"yes",,,,,,,,,,,,,"imp593653c94ba1068475",,,,,,,"Sri Lanka Department of Agriculture. Annals","17","ETH Zürich::00002 - ETH Zürich::00012 - Lehre und Forschung::00007 - Departemente::02350 - Dep. Umweltsystemwissenschaften / Dep. of Environmental Systems Science::02703 - Institut für Agrarwissenschaften / Institute of Agricultural Sciences::03427 - Frossard, Emmanuel / Frossard, Emmanuel","ETH Zürich::00002 - ETH Zürich::00012 - Lehre und Forschung::00007 - Departemente::02350 - Dep. Umweltsystemwissenschaften / Dep. of Environmental Systems Science::02703 - Institut für Agrarwissenschaften / Institute of Agricultural Sciences::03427 - Frossard, Emmanuel / Frossard, Emmanuel","03427","03427",,"123","120","Peradeniya","published",,,,,,"2017-07-14T22:17:38Z","2018-11-02T20:55:29Z","true",,"ECIT",,
"108649","20.500.11850/5","Dorn, Brigitte||Studer, Bruno",,,,,"2017-06-11T22:05:09Z","2017-06-11T22:05:09Z","2015",,,,,,"1663-7852||1663-7909",,,"http://hdl.handle.net/20.500.11850/108682","de","Agroscope",,,,"Bruno Studer, Assistenzprofessor für Futterpflanzengenetik an der ETH Zürich",,"Other Journal Item","Metadata only",,,"2017-06-11T22:05:30Z",,"pub:169681",,"yes",,,,,,,,,,,,,"imp593653d37f8ef89291","005928960",,,"000366238600008","Agrarforsch. Schweiz","2","Agrarforschung Schweiz","6","ETH Zürich::00002 - ETH Zürich::00012 - Lehre und Forschung::00007 - Departemente::02350 - Dep. Umweltsystemwissenschaften / Dep. of Environmental Systems Science::02703 - Institut für Agrarwissenschaften / Institute of Agricultural Sciences::03969 - Studer, Bruno / Studer, Bruno","ETH Zürich::00002 - ETH Zürich::00012 - Lehre und Forschung::00007 - Departemente::02350 - Dep. Umweltsystemwissenschaften / Dep. of Environmental Systems Science::02703 - Institut für Agrarwissenschaften / Institute of Agricultural Sciences::03969 - Studer, Bruno / Studer, Bruno","03969","03969",,"77","76","Posieux","published",,,,,,"2017-07-13T05:38:10Z","2020-02-14T16:06:37Z","true",,"ECIT","Interview mit Bruno Studer",
"110324","20.500.11850/8","Khanna, Raghav||Möller, Martin||Pfeifer, Johannes||Liebisch, Frank||Walter, Achim||Siegwart, Roland",,,,,"2017-06-11T23:05:16Z","2017-06-11T23:05:16Z","2015",,,,,"978-1-4673-7929-8",,,"10.1109/ETFA.2015.7301583","http://hdl.handle.net/20.500.11850/110357","en","IEEE",,,"Crop height||Micro-Aerial Vehicles||Point cloud processing||Precision agriculture||UAVs","Beyond point clouds - 3D mapping and field parameter measurements using UAVs",,"Conference Paper","Metadata only","2015 IEEE 20th Conference on Emerging Technologies & Factory Automation (ETFA)",,"2017-06-11T23:05:37Z",,"pub:171572",,"yes","2015 IEEE 20th Conference on Emerging Technologies & Factory Automation (ETFA)","September 8-11, 2015","Luxembourg City, Luxembourg",,,,,,,,,,"imp593653f2a179e61949",,"84952900716",,"000378564800184",,,,,"ETH Zürich::00002 - ETH Zürich::00012 - Lehre und Forschung::00007 - Departemente::02130 - Dep. Maschinenbau und Verfahrenstechnik / Dep. of Mechanical and Process Eng.::02620 - Inst. f. Robotik u. Intelligente Systeme / Inst. Robotics and Intelligent Systems::03737 - Siegwart, Roland Y. / Siegwart, Roland Y.||ETH Zürich::00002 - ETH Zürich::00012 - Lehre und Forschung::00007 - Departemente::02350 - Dep. Umweltsystemwissenschaften / Dep. of Environmental Systems Science::02703 - Institut für Agrarwissenschaften / Institute of Agricultural Sciences::03894 - Walter, Achim / Walter, Achim","ETH Zürich::00002 - ETH Zürich::00012 - Lehre und Forschung::00007 - Departemente::02130 - Dep. Maschinenbau und Verfahrenstechnik / Dep. of Mechanical and Process Eng.::02620 - Inst. f. Robotik u. Intelligente Systeme / Inst. Robotics and Intelligent Systems::03737 - Siegwart, Roland Y. / Siegwart, Roland Y.||ETH Zürich::00002 - ETH Zürich::00012 - Lehre und Forschung::00007 - Departemente::02350 - Dep. Umweltsystemwissenschaften / Dep. of Environmental Systems Science::02703 - Institut für Agrarwissenschaften / Institute of Agricultural Sciences::03894 - Walter, Achim / Walter, Achim","03737||03894","03737||03894",,"4","1","Piscataway, NJ","published",,,,,,"2017-07-15T01:23:51Z","2021-02-14T13:49:14Z","true",,"ECIT",,
"108913","20.500.11850/9","Meller, Sonia||Frey, Beat||Frossard, Emmanuel||Spohn, Marie||Luster, Jörg",,,,,"2017-06-11T22:14:11Z","2017-06-11T22:14:11Z","2015",,,,,,,,,"http://hdl.handle.net/20.500.11850/108946","en","SPP 1689",,,,"Plant-induced chemical changes in the rhizosphere of Fagus sylvatica seedlings depending on soil P speciation and tree provenance",,"Conference Poster","Metadata only",,,"2017-06-11T22:14:49Z",,"pub:169976",,"yes","SPP 1689 Workshop on Ecosystem Nutrition 2015","July 1-3, 2015","Dipperz, Germany",,,,,,,,,,"imp593653d8d29db83812",,,,,,,,,"ETH Zürich::00002 - ETH Zürich::00012 - Lehre und Forschung::00007 - Departemente::02350 - Dep. Umweltsystemwissenschaften / Dep. of Environmental Systems Science::02703 - Institut für Agrarwissenschaften / Institute of Agricultural Sciences::03427 - Frossard, Emmanuel / Frossard, Emmanuel","ETH Zürich::00002 - ETH Zürich::00012 - Lehre und Forschung::00007 - Departemente::02350 - Dep. Umweltsystemwissenschaften / Dep. of Environmental Systems Science::02703 - Institut für Agrarwissenschaften / Institute of Agricultural Sciences::03427 - Frossard, Emmanuel / Frossard, Emmanuel","03427","03427",,,,"Dipperz","unpublished",,,,,,"2017-07-13T11:39:15Z","2018-11-02T21:12:21Z","true",,"ECIT",,
"107271","20.500.11850/9","Slavikova, R.||Jansa, J.||Püschel, D.||Ali, M.A.||Frossard, E.||Gamper, H.A.",,,,,"2017-06-11T21:22:14Z","2017-06-11T21:22:14Z","2015",,,,,,,,,"http://hdl.handle.net/20.500.11850/107304","en","Northern Arizona University",,,,"Arbuscular mycorrhizal symbiotic functioning along an experimental soil gradient",,"Conference Poster","Metadata only","Book of abstracts: International Conference on Mycorrhiza (ICOM8)",,"2017-06-11T21:22:32Z",,"pub:167879",,"yes","8th International Conference on Mycorrhiza (ICOM8)","August 3-7, 2015","Flagstaff, Arizona, USA",,,,,,,,,,"imp593653b89dece56769",,,,,,,,,"ETH Zürich::00002 - ETH Zürich::00012 - Lehre und Forschung::00007 - Departemente::02350 - Dep. Umweltsystemwissenschaften / Dep. of Environmental Systems Science::02703 - Institut für Agrarwissenschaften / Institute of Agricultural Sciences::03427 - Frossard, Emmanuel / Frossard, Emmanuel","ETH Zürich::00002 - ETH Zürich::00012 - Lehre und Forschung::00007 - Departemente::02350 - Dep. Umweltsystemwissenschaften / Dep. of Environmental Systems Science::02703 - Institut für Agrarwissenschaften / Institute of Agricultural Sciences::03427 - Frossard, Emmanuel / Frossard, Emmanuel","03427","03427",,"168","168","Flagstaff","published",,,,,,"2017-07-18T15:05:55Z","2018-11-02T20:40:24Z","true",,"ECIT",,
"102705","20.500.11850/10","Bünemann, Else K.||Augstburger, Salome",,,,,"2017-06-11T18:30:10Z","2017-06-11T18:30:10Z","2015",,,,,,,,,"http://hdl.handle.net/20.500.11850/102738","en","Universität Freiburg",,,,"The relative importance of soil organic phosphorus mineralization in mineral topsoil under beech forest is greatly affected by the availability of inorganic phosphorus",,"Other Conference Item","Metadata only","Book of abstracts: Workshop Ecosystems Nutrition 2015, Dipperz (Rhön), Deutschland",,"2017-06-11T18:30:36Z",,"pub:160887",,"yes","Ecosystem Nutrition 2015","July 2-4, 2015","Dipperz, Germany",,,,,,,,,,"imp593653575493b23770",,,"https://www.ecosystem-nutrition.uni-freiburg.de/",,,,,,"ETH Zürich::00002 - ETH Zürich::00012 - Lehre und Forschung::00007 - Departemente::02350 - Dep. Umweltsystemwissenschaften / Dep. of Environmental Systems Science::02703 - Institut für Agrarwissenschaften / Institute of Agricultural Sciences::03427 - Frossard, Emmanuel / Frossard, Emmanuel","ETH Zürich::00002 - ETH Zürich::00012 - Lehre und Forschung::00007 - Departemente::02350 - Dep. Umweltsystemwissenschaften / Dep. of Environmental Systems Science::02703 - Institut für Agrarwissenschaften / Institute of Agricultural Sciences::03427 - Frossard, Emmanuel / Frossard, Emmanuel","03427","03427",,"18","17","Freiburg","published",,,,,,"2017-07-20T14:58:26Z","2021-02-14T13:08:12Z","true",,"ECIT",,
"110667","20.500.11850/9","Bratus, A.||Rampoldi, A.||Hu, D.||Russo, G.||Neuenschwander, S.",,,,,"2017-06-11T23:16:44Z","2017-06-11T23:16:44Z","2015",,,,,,,,,"http://hdl.handle.net/20.500.11850/110700","en","Schweizerische Vereinigung für Tierproduktion",,,,"Re-sequencing of the F4ab / F4ac receptor candidate region in pig",,"Conference Poster","Metadata only","Schweizerische Vereinigung für Tierproduktion : Frühjahrstagung 2015 : Aktuelle Forschung in der Schweiz im Bereich Tierproduktion : Zusammenfassungen der Poster",,"2017-06-11T23:17:26Z",,"pub:171948",,"yes","Frühjahrstagung der Schweizerischen Vereinigung für Tierproduktion (2015)","April 9, 2015","Zollikofen, Switzerland",,,,,,,,,,"imp593653f8c9ef727220",,,,,,,,,"ETH Zürich::00002 - ETH Zürich::00003 - Schulleitung und Dienste::00022 - Bereich VP Forschung / Domain VP Research::02207 - Functional Genomics Center Zurich / Functional Genomics Center Zurich||ETH Zürich::00002 - ETH Zürich::00012 - Lehre und Forschung::00007 - Departemente::02350 - Dep. Umweltsystemwissenschaften / Dep. of Environmental Systems Science::02703 - Institut für Agrarwissenschaften / Institute of Agricultural Sciences::08690 - Einheit Tiergenetik","ETH Zürich::00002 - ETH Zürich::00003 - Schulleitung und Dienste::00022 - Bereich VP Forschung / Domain VP Research::02207 - Functional Genomics Center Zurich / Functional Genomics Center Zurich||ETH Zürich::00002 - ETH Zürich::00012 - Lehre und Forschung::00007 - Departemente::02350 - Dep. Umweltsystemwissenschaften / Dep. of Environmental Systems Science::02703 - Institut für Agrarwissenschaften / Institute of Agricultural Sciences::08690 - Einheit Tiergenetik","02207||08690","02207||08690",,"19","19","Zollikofen","published",,,,,,"2017-07-13T09:16:46Z","2021-02-14T13:51:32Z","true",,"ECIT",,
"105445","20.500.11850/9","Jonavičienė, Kristina||Yates, Steven||Nagelmüller, Sebastian||Liebisch, Frank||Kirchgessner, Norbert||Walter, Achim||Studer, Bruno",,,,,"2017-06-11T20:09:22Z","2017-06-11T20:09:22Z","2015",,,,,,,,,"http://hdl.handle.net/20.500.11850/105478","en","HAFL - Hochschule für Agrar-, Forst- und Lebensmittelwissenschaften",,,,"Lolium Perenne: Characterization of Drought Tolerant Genotypes and Identification of QTLs for Drought Response",,"Conference Poster","Metadata only",,,"2017-06-11T20:10:02Z",,"pub:165095",,"yes","23. Jahrestagung der Schweiz. Gesellschaft für Pflanzenbauwissenschaften (SGPW 2015)","March 20, 2015","Zollikofen, Switzerland",,,,,,,,,,"imp59365393a924c19003",,,,,,,"Bulletin SGPW/SSA","27","ETH Zürich::00002 - ETH Zürich::00012 - Lehre und Forschung::00007 - Departemente::02350 - Dep. Umweltsystemwissenschaften / Dep. of Environmental Systems Science::02703 - Institut für Agrarwissenschaften / Institute of Agricultural Sciences::03894 - Walter, Achim / Walter, Achim||ETH Zürich::00002 - ETH Zürich::00012 - Lehre und Forschung::00007 - Departemente::02350 - Dep. Umweltsystemwissenschaften / Dep. of Environmental Systems Science::02703 - Institut für Agrarwissenschaften / Institute of Agricultural Sciences::03969 - Studer, Bruno / Studer, Bruno","ETH Zürich::00002 - ETH Zürich::00012 - Lehre und Forschung::00007 - Departemente::02350 - Dep. Umweltsystemwissenschaften / Dep. of Environmental Systems Science::02703 - Institut für Agrarwissenschaften / Institute of Agricultural Sciences::03894 - Walter, Achim / Walter, Achim||ETH Zürich::00002 - ETH Zürich::00012 - Lehre und Forschung::00007 - Departemente::02350 - Dep. Umweltsystemwissenschaften / Dep. of Environmental Systems Science::02703 - Institut für Agrarwissenschaften / Institute of Agricultural Sciences::03969 - Studer, Bruno / Studer, Bruno","03894||03969","03894||03969",,"19","18","Zollikofen","published",,,,,,"2017-07-17T10:59:28Z","2018-11-02T20:13:36Z","true",,"ECIT",,
"324755","20.500.11850/5","Shapiro, Lori R.||Scully, Erin D.||Roberts, Dana||Straub, Timothy J.||Geib, Scott M.||Park, Jihye||Stephenson, Andrew G.||Salaau Rojas, Erika||Liu, Quin||Beattie, Gwyn||Gleason, Mark||De Moraes, Consuelo M.||Mescher, Mark C.||Fleischer, Shelby G.||Kolter, Roberto||Pierce, Naomi||Zhaxybayeva, Olga",,,,,"2019-12-13T12:31:31Z","2017-06-11T18:52:47Z||2019-12-13T12:31:31Z","2015","2015-06-06","Erwinia tracheiphila is one of the most economically important pathogens of cucumbers, melons, squashes, pumpkins, and gourds in the northeastern and midwestern United States, yet its molecular pathology remains uninvestigated. Here, we report the first draft genome sequence of an E. tracheiphila strain isolated from an infected wild gourd (Cucurbita pepo subsp. texana) plant. The genome assembly consists of 7 contigs and includes a putative plasmid and at least 20 phage and prophage elements.","application/pdf","10.3929/ethz-b-000103410",,"2169-8287",,"10.1128/genomeA.00482-15","http://hdl.handle.net/20.500.11850/103410","en","American Society for Microbiology Journals","Creative Commons Attribution 3.0 Unported","http://creativecommons.org/licenses/by/3.0/",,"Draft Genome Sequence of Erwinia tracheiphila, an Economically Important Bacterial Pathogen of Cucurbits",,"Other Journal Item","Open access",,,"2017-06-11T18:53:26Z",,"pub:161655",,"yes",,,,,,,,,,,,,"imp59365366dd20296514",,"85008487792",,"000460631200094","Genome Announc","3","Genome Announcements","3","ETH Zürich::00002 - ETH Zürich::00012 - Lehre und Forschung::00007 - Departemente::02350 - Dep. Umweltsystemwissenschaften / Dep. of Environmental Systems Science::02703 - Institut für Agrarwissenschaften / Institute of Agricultural Sciences::03970 - De Moraes, Consuelo / De Moraes, Consuelo||ETH Zürich::00002 - ETH Zürich::00012 - Lehre und Forschung::00007 - Departemente::02350 - Dep. Umweltsystemwissenschaften / Dep. of Environmental Systems Science::02720 - Institut für Integrative Biologie / Institute of Integrative Biology::03909 - Levine, Jonathan M. (ehemalig) / Levine, Jonathan M. (former)","ETH Zürich::00002 - ETH Zürich::00012 - Lehre und Forschung::00007 - Departemente::02350 - Dep. Umweltsystemwissenschaften / Dep. of Environmental Systems Science::02703 - Institut für Agrarwissenschaften / Institute of Agricultural Sciences::03970 - De Moraes, Consuelo / De Moraes, Consuelo||ETH Zürich::00002 - ETH Zürich::00012 - Lehre und Forschung::00007 - Departemente::02350 - Dep. Umweltsystemwissenschaften / Dep. of Environmental Systems Science::02720 - Institut für Integrative Biologie / Institute of Integrative Biology::03909 - Levine, Jonathan M. (ehemalig) / Levine, Jonathan M. (former)","03970||03909","03970||03909",,,"e00482-15","Washington, DC","published",,,,,,"2017-07-19T07:55:02Z","2021-02-15T07:04:45Z","true","2 p.","ECIT",,"publishedVersion"
"108917","20.500.11850/9","Meller, Sonia||Frey, Beat||Frossard, Emmanuel||Spohn, Marie||Luster, Jörg",,,,,"2017-06-11T22:14:12Z","2017-06-11T22:14:12Z","2015",,,,,,,,,"http://hdl.handle.net/20.500.11850/108950","en","Ecosystem Nutrition 2015",,,"Fagus sylvatica L.||Phosphorus mobilization||Acid forest soils||Root exudates","Plant-induced chemical properties in the rhizosphere of Fagus sylvatica seedings depending on soil P speciation and tree provenance",,"Conference Poster","Metadata only","Ecosystem Nutrition 2015: Status Workshop and Meeting. Program and Abstracts",,"2017-06-11T22:14:49Z",,"pub:169982",,"yes","Ecosystem Nuitrition","July 1-3, 2015","Dipperz, Germany",,,,,,,,,,"imp593653d8e094a18406",,,,,,,,,"ETH Zürich::00002 - ETH Zürich::00012 - Lehre und Forschung::00007 - Departemente::02350 - Dep. Umweltsystemwissenschaften / Dep. of Environmental Systems Science::02703 - Institut für Agrarwissenschaften / Institute of Agricultural Sciences::03427 - Frossard, Emmanuel / Frossard, Emmanuel","ETH Zürich::00002 - ETH Zürich::00012 - Lehre und Forschung::00007 - Departemente::02350 - Dep. Umweltsystemwissenschaften / Dep. of Environmental Systems Science::02703 - Institut für Agrarwissenschaften / Institute of Agricultural Sciences::03427 - Frossard, Emmanuel / Frossard, Emmanuel","03427","03427",,"53","53","Dipperz","published",,,,,,"2017-07-14T20:18:11Z","2018-11-02T21:12:27Z","true",,"ECIT",,
"100919","20.500.11850/3","Kayler, Zachary E.||De Boeck, H.J.||Fatichi, Simone||Gruenzweig, Jose M.||Merbold, Lutz||Beier, Claus||McDowell, Nathan||Dukes, Jeffrey S.",,,,,"2017-06-11T17:28:25Z","2017-06-11T17:28:25Z","2015",,,,,,"1540-9295||1540-9309",,"10.1890/140174","http://hdl.handle.net/20.500.11850/100952","en","Ecological Society of America",,,,"Experiments to confront the environmental extremes of climate change",,"Journal Article","Metadata only",,,"2017-06-11T17:28:48Z",,"pub:158599",,"yes",,,,,,,,,,,,,"imp5936532de905c44165","005870869",,,"000354002100017","Front. ecol. environ.","4","Frontiers in Ecology and the Environment","13","ETH Zürich::00002 - ETH Zürich::00012 - Lehre und Forschung::00007 - Departemente::02115 - Dep. Bau, Umwelt und Geomatik / Dep. of Civil, Env. and Geomatic Eng.::02608 - Institut für Umweltingenieurwiss. / Institute of Environmental Engineering::03473 - Burlando, Paolo / Burlando, Paolo||ETH Zürich::00002 - ETH Zürich::00012 - Lehre und Forschung::00007 - Departemente::02350 - Dep. Umweltsystemwissenschaften / Dep. of Environmental Systems Science::02703 - Institut für Agrarwissenschaften / Institute of Agricultural Sciences::03648 - Buchmann, Nina / Buchmann, Nina","ETH Zürich::00002 - ETH Zürich::00012 - Lehre und Forschung::00007 - Departemente::02115 - Dep. Bau, Umwelt und Geomatik / Dep. of Civil, Env. and Geomatic Eng.::02608 - Institut für Umweltingenieurwiss. / Institute of Environmental Engineering::03473 - Burlando, Paolo / Burlando, Paolo||ETH Zürich::00002 - ETH Zürich::00012 - Lehre und Forschung::00007 - Departemente::02350 - Dep. Umweltsystemwissenschaften / Dep. of Environmental Systems Science::02703 - Institut für Agrarwissenschaften / Institute of Agricultural Sciences::03648 - Buchmann, Nina / Buchmann, Nina","03473||03648","03473||03648",,"225","219","Washington, DC","published",,,,,,"2017-07-15T01:18:55Z","2020-02-14T15:19:05Z","true",,"ECIT",,
