"391505","20.500.11850/3","Part, Florian||Berge, Nicole||Baran, Paweł||Stringfellow, Anne||Sun, Wenjie||Bartelt-Hunt, Shannon||Mitrano, Denise||Li, Liang||Hennebert, Pierre||Quicker, Peter||Bolyard, Stephanie C.||Huber-Humer, Marion",,,,,,,,"2021-02-18T14:13:20Z","2021-02-17T08:57:07Z||2021-02-18T14:13:20Z",,"2018-05","2018-02-21","Significant knowledge and data gaps associated with the fate of product-embedded engineered nanomaterials (ENMs) in waste management processes exist that limit our current ability to develop appropriate end-of-life management strategies. This review paper was developed as part of the activities of the IWWG ENMs in Waste Task Group. The specific objectives of this review paper are to assess the current knowledge associated with the fate of ENMs in commonly used waste management processes, including key processes and mechanisms associated with ENM fate and transport in each waste management process, and to use that information to identify the data gaps and research needs in this area. Literature associated with the fate of ENMs in wastes was reviewed and summarized. Overall, results from this literature review indicate a need for continued research in this area. No work has been conducted to quantify ENMs present in discarded materials and an understanding of ENM release from consumer products under conditions representative of those found in relevant waste management process is needed. Results also indicate that significant knowledge gaps associated with ENM behaviour exist for each waste management process investigated. There is a need for additional research investigating the fate of different types of ENMs at larger concentration ranges with different surface chemistries. Understanding how changes in treatment process operation may influence ENM fate is also needed. A series of specific research questions associated with the fate of ENMs during the management of ENM-containing wastes have been identified and used to direct future research in this area. © 2018 Elsevier Ltd.",,,,"0956-053X||1879-2456",,"10.1016/j.wasman.2018.02.012","http://hdl.handle.net/20.500.11850/469893","en","Elsevier",,,"Engineered nanomaterials||Waste management||Landfills||Recycling||Incineration||Biological treatment","A review of the fate of engineered nanomaterials in municipal solid waste streams","Journal Article","Metadata only",,,,"2021-02-17T08:57:18Z",,,,,,"no",,,,,,,,,,,,,,,,"Waste Manag",,"Waste Management","75","ETH Zürich::00002 - ETH Zürich::00012 - Lehre und Forschung::00007 - Departemente::02350 - Dep. Umweltsystemwissenschaften / Dep. of Environmental Systems Science::02721 - Inst. f. Biogeochemie u. Schadstoffdyn. / Inst. Biogeochem. and Pollutant Dynamics::09717 - Mitrano, Denise M. / Mitrano, Denise M.","ETH Zürich::00002 - ETH Zürich::00012 - Lehre und Forschung::00007 - Departemente::02350 - Dep. Umweltsystemwissenschaften / Dep. of Environmental Systems Science::02721 - Inst. f. Biogeochemie u. Schadstoffdyn. / Inst. Biogeochem. and Pollutant Dynamics::09717 - Mitrano, Denise M. / Mitrano, Denise M.","09717","09717",,"449","427","Amsterdam","published",,,,,,,,,,,,,,,"2021-02-18T14:13:32Z","2021-02-18T14:13:32Z","true",,"FORM",,,,
"237780","20.500.11850/3","Sani-Kast, Nicole||Ollivier, Patrick||Slomberg, Danielle||Labille, Jérôme||Hungerbühler, Konrad||Scheringer, Martin",,,,,,,,"2018-06-06T14:02:00Z","2018-06-02T05:37:43Z||2018-06-06T14:02:00Z",,"2018-05",,"To assess the environmental fate of engineered nanoparticles (ENPs), it is essential to understand their interactions with dissolved organic matter (DOM). The highly complex nature of the interactions between DOM and ENPs and other particulate matter (PM) requires investigating a wide range of material types under different conditions. However, despite repeated calls for an increased diversity of the DOM and PM studied, researchers increasingly focus on certain subsets of DOM and PM. Considering the discrepancy between the calls for more diversity and the research actually carried out, we hypothesize that materials that were studied more often are more visible in the scientific literature and therefore are more likely to be studied again. To investigate the plausibility of this hypothesis, we developed an agent-based model simulating the material choice in the experiments studying the interaction between DOM and PM between 1990 and 2015. The model reproduces the temporal trends in the choice of materials as well as the main properties of a network that displays the DOM and PM types investigated experimentally. The results, which support the hypothesis of a positive reinforcing material choice, help to explain why calls to increase the diversity of the materials studied are repeatedly made and why recent criticism states that the selection of materials is unbalanced.","application/pdf","10.3929/ethz-b-000267251",,"1932-6203",,"10.1371/journal.pone.0196549","http://hdl.handle.net/20.500.11850/267251","en","Public Library of Science","Creative Commons Attribution 4.0 International","http://creativecommons.org/licenses/by/4.0/",,"The influence of past research on the design of experiments with dissolved organic matter and engineered nanoparticles","Journal Article","Open access",,,,"2018-06-02T05:38:20Z",,,,,,"yes",,,,,,,,,,,,,"85046686481",,"000431481700019","PLoS ONE","5","PLoS ONE","13","ETH Zürich::00002 - ETH Zürich::00012 - Lehre und Forschung::00007 - Departemente::02020 - Dep. Chemie und Angewandte Biowiss. / Dep. of Chemistry and Applied Biosc.::02516 - Inst. f. Chemie- und Bioingenieurwiss. / Inst. Chemical and Bioengineering::03402 - Hungerbühler, Konrad (emeritus) / Hungerbühler, Konrad (emeritus)||ETH Zürich::00002 - ETH Zürich::00012 - Lehre und Forschung::00007 - Departemente::02350 - Dep. Umweltsystemwissenschaften / Dep. of Environmental Systems Science::02721 - Inst. f. Biogeochemie u. Schadstoffdyn. / Inst. Biogeochem. and Pollutant Dynamics::03850 - McNeill, Kristopher / McNeill, Kristopher||ETH Zürich::00002 - ETH Zürich::00012 - Lehre und Forschung::00007 - Departemente::02350 - Dep. Umweltsystemwissenschaften / Dep. of Environmental Systems Science::02721 - Inst. f. Biogeochemie u. Schadstoffdyn. / Inst. Biogeochem. and Pollutant Dynamics::03850 - McNeill, Kristopher / McNeill, Kristopher","ETH Zürich::00002 - ETH Zürich::00012 - Lehre und Forschung::00007 - Departemente::02350 - Dep. Umweltsystemwissenschaften / Dep. of Environmental Systems Science::02721 - Inst. f. Biogeochemie u. Schadstoffdyn. / Inst. Biogeochem. and Pollutant Dynamics::03850 - McNeill, Kristopher / McNeill, Kristopher||ETH Zürich::00002 - ETH Zürich::00012 - Lehre und Forschung::00007 - Departemente::02350 - Dep. Umweltsystemwissenschaften / Dep. of Environmental Systems Science::02721 - Inst. f. Biogeochemie u. Schadstoffdyn. / Inst. Biogeochem. and Pollutant Dynamics::03850 - McNeill, Kristopher / McNeill, Kristopher||ETH Zürich::00002 - ETH Zürich::00012 - Lehre und Forschung::00007 - Departemente::02020 - Dep. Chemie und Angewandte Biowiss. / Dep. of Chemistry and Applied Biosc.::02516 - Inst. f. Chemie- und Bioingenieurwiss. / Inst. Chemical and Bioengineering::03402 - Hungerbühler, Konrad (emeritus) / Hungerbühler, Konrad (emeritus)","03402||03850||03850","03850||03850||03402",,,"e0196549","San Francisco, CA, USA","published",,,,,,,,,,,,,,,"2018-06-06T14:02:08Z","2021-02-15T00:17:16Z","true","15 p.","WOS",,,"publishedVersion",
"240852","20.500.11850/3","Ebrahimi, Ali||Or, Dani",,,,,,,,"2018-06-25T12:38:59Z","2018-06-23T06:03:27Z||2018-06-25T12:38:59Z",,"2018-05","2018-05-11",,,,,"0148-0227||2169-8953||2169-8961",,"10.1029/2017JG004347","http://hdl.handle.net/20.500.11850/271841","en","Wiley",,,"microbial processes||biophysical modeling||biogeochemical processes||regional scale||denitrification","On Upscaling of Soil Microbial Processes and Biogeochemical Fluxes From Aggregates to Landscapes","Journal Article","Metadata only",,,,"2018-06-23T06:03:45Z",,,,,,"yes",,,,,,,,,,,,,"85046783209",,"000435264200007","J. geophys. res. Biogeosciences","5","Journal of Geophysical Research: Biogeosciences","123","ETH Zürich::00002 - ETH Zürich::00012 - Lehre und Forschung::00007 - Departemente::02350 - Dep. Umweltsystemwissenschaften / Dep. of Environmental Systems Science::02721 - Inst. f. Biogeochemie u. Schadstoffdyn. / Inst. Biogeochem. and Pollutant Dynamics::03812 - Or, Dani (emeritus) / Or, Dani (emeritus)","ETH Zürich::00002 - ETH Zürich::00012 - Lehre und Forschung::00007 - Departemente::02350 - Dep. Umweltsystemwissenschaften / Dep. of Environmental Systems Science::02721 - Inst. f. Biogeochemie u. Schadstoffdyn. / Inst. Biogeochem. and Pollutant Dynamics::03812 - Or, Dani (emeritus) / Or, Dani (emeritus)","03812","03812",,"1547","1526","Hoboken, NJ","published",,,,,,,,,,,,,,,"2018-06-25T12:39:01Z","2022-03-28T20:31:03Z","true",,"SCOPUS",,,,
"235829","20.500.11850/3","Walpen, Nicolas||Getzinger, Gordon J.||Schroth, Martin Herbert||Sander, Michael",,,,,,,,"2018-05-22T08:59:33Z","2018-05-18T16:06:29Z||2018-05-22T08:59:33Z",,"2018-05","2018-03-28",,,,,"0013-936X||1520-5851",,"10.1021/acs.est.8b00594","http://hdl.handle.net/20.500.11850/265104","en","American Chemical Society",,,,"Electron-Donating Phenolic and Electron-Accepting Quinone Moieties in Peat Dissolved Organic Matter: Quantities and Redox Transformations in the Context of Peat Biogeochemistry","Journal Article","Metadata only",,,,"2018-05-18T16:07:03Z",,,,,,"yes",,,,,,,"Dissolved phenols in ombrotrophic bogs: occurrence and enzymatic transformations","159692","10.13039/501100001711","SNF","Projekte MINT",,"85046399148",,"000431466500023","Environ. Sci. Technol.","9","Environmental Science & Technology","52","ETH Zürich::00002 - ETH Zürich::00012 - Lehre und Forschung::00007 - Departemente::02350 - Dep. Umweltsystemwissenschaften / Dep. of Environmental Systems Science::02721 - Inst. f. Biogeochemie u. Schadstoffdyn. / Inst. Biogeochem. and Pollutant Dynamics::03850 - McNeill, Kristopher / McNeill, Kristopher","ETH Zürich::00002 - ETH Zürich::00012 - Lehre und Forschung::00007 - Departemente::02350 - Dep. Umweltsystemwissenschaften / Dep. of Environmental Systems Science::02721 - Inst. f. Biogeochemie u. Schadstoffdyn. / Inst. Biogeochem. and Pollutant Dynamics::03850 - McNeill, Kristopher / McNeill, Kristopher","03850","03850",,"5245","5236","Columbus, OH","published",,,,,,,,,,,,,,,"2018-05-22T08:59:36Z","2023-02-06T15:31:29Z","true",,"WOS",,,,
"297734","20.500.11850/4","D'Souza, Glen Gerald||Shitut, Shraddha||Preussger, Daniel||Yousif, Ghada||Waschina, Silvio||Kost, Christian",,,,,,,,"2019-06-19T06:51:42Z","2018-06-25T12:01:48Z||2018-06-25T12:04:23Z||2019-06-19T06:51:42Z",,"2018-05","2018-05-25",,"application/pdf","10.3929/ethz-b-000268532",,"0265-0568||0265-0568||1460-4752","http://hdl.handle.net/20.500.11850/268532||http://hdl.handle.net/20.500.11850/271888","10.1039/c8np00009c","http://hdl.handle.net/20.500.11850/272042","en","Royal Society of Chemistry","Creative Commons Attribution 3.0 Unported","http://creativecommons.org/licenses/by/3.0/",,"Ecology and evolution of metabolic cross-feeding interactions in bacteria","Review Article","Open access",,,,"2018-06-08T07:07:27Z",,,,,,"yes",,,,,,,"ETH Zurich Postdoctoral Fellowship Program II","608881","10.13039/501100000780","EC","FP7",,"85047625349",,"000433261200005","Nat. prod. rep. (Print)","5","Natural Product Reports","35","ETH Zürich::00002 - ETH Zürich::00012 - Lehre und Forschung::00007 - Departemente::02350 - Dep. Umweltsystemwissenschaften / Dep. of Environmental Systems Science::02721 - Inst. f. Biogeochemie u. Schadstoffdyn. / Inst. Biogeochem. and Pollutant Dynamics::03743 - Ackermann, Martin / Ackermann, Martin","ETH Zürich::00002 - ETH Zürich::00012 - Lehre und Forschung::00007 - Departemente::02350 - Dep. Umweltsystemwissenschaften / Dep. of Environmental Systems Science::02721 - Inst. f. Biogeochemie u. Schadstoffdyn. / Inst. Biogeochem. and Pollutant Dynamics::03743 - Ackermann, Martin / Ackermann, Martin","03743","03743",,"488","455","London","published",,,,,,,,,,,,,,,"2018-06-25T12:01:54Z","2023-02-06T17:17:45Z","true","34 p.","FORM||SCOPUS",,,"publishedVersion",
"239092","20.500.11850/5","McKay, Garrett||Korak, Julie A.||Erickson, Paul R.||Latch, Douglas E.||McNeill, Kristopher||Rosario-Ortiz, Fernando L.",,,,,,,,"2018-06-13T12:10:49Z","2018-05-18T17:08:12Z||2018-06-13T12:10:49Z",,"2018-05-01","2018-04-16",,,,,"0013-936X||1520-5851",,"10.1021/acs.est.8b01807","http://hdl.handle.net/20.500.11850/265151","en","American Chemical Society",,,,"Response to Comment on The Case Against Charge Transfer Interactions in Dissolved Organic Matter Photophysics","Other Journal Item","Metadata only",,,,"2018-05-18T17:08:45Z",,,,,,"yes",,,,,,,,,,,,,"85046411452",,"000431466500053","Environ. Sci. Technol.","9","Environmental Science & Technology","52","ETH Zürich::00002 - ETH Zürich::00012 - Lehre und Forschung::00007 - Departemente::02350 - Dep. Umweltsystemwissenschaften / Dep. of Environmental Systems Science::02721 - Inst. f. Biogeochemie u. Schadstoffdyn. / Inst. Biogeochem. and Pollutant Dynamics::03850 - McNeill, Kristopher / McNeill, Kristopher","ETH Zürich::00002 - ETH Zürich::00012 - Lehre und Forschung::00007 - Departemente::02350 - Dep. Umweltsystemwissenschaften / Dep. of Environmental Systems Science::02721 - Inst. f. Biogeochemie u. Schadstoffdyn. / Inst. Biogeochem. and Pollutant Dynamics::03850 - McNeill, Kristopher / McNeill, Kristopher","03850","03850",,"5516","5514","Washington, DC","published",,,,,,,,,,,,,"10.3929/ethz-b-000236024",,"2018-06-13T12:10:54Z","2023-02-06T15:35:42Z","true",,"WOS",,,,
"234281","20.500.11850/3","van Vliet, Simon||Dal Co, Alma||Winkler, Annina R.||Spriewald, Stefanie||Stecher, Bärbel||Ackermann, Martin",,,,,,,,"2018-05-08T12:37:03Z","2018-04-28T04:44:12Z||2018-05-08T12:37:03Z",,"2018-04-25","2018-04-11",,,,,"2405-4720",,"10.1016/j.cels.2018.03.009","http://hdl.handle.net/20.500.11850/261491","en","Cell Press",,,,"Spatially Correlated Gene Expression in Bacterial Groups: The Role of Lineage History, Spatial Gradients, and Cell-Cell Interactions","Journal Article","Metadata only",,,,"2018-04-28T04:44:28Z",,,,,,"yes",,,,,,,,,,,,,"85045758432",,"000432192100012","Cell Syst","4","Cell Systems","6","ETH Zürich::00002 - ETH Zürich::00012 - Lehre und Forschung::00007 - Departemente::02350 - Dep. Umweltsystemwissenschaften / Dep. of Environmental Systems Science::02721 - Inst. f. Biogeochemie u. Schadstoffdyn. / Inst. Biogeochem. and Pollutant Dynamics::03743 - Ackermann, Martin / Ackermann, Martin","ETH Zürich::00002 - ETH Zürich::00012 - Lehre und Forschung::00007 - Departemente::02350 - Dep. Umweltsystemwissenschaften / Dep. of Environmental Systems Science::02721 - Inst. f. Biogeochemie u. Schadstoffdyn. / Inst. Biogeochem. and Pollutant Dynamics::03743 - Ackermann, Martin / Ackermann, Martin","03743","03743",,"507.e6","496","Cambridge, MA","published",,,,,,,,,,,,,,,"2018-05-08T12:37:07Z","2023-02-06T15:29:36Z","true",,"SCOPUS",,,,
"290365","20.500.11850/9","Righetti, Damiano||Vogt, Meike||Gruber, Nicolas||Psomas, Achilleas||Zimmermann, Niklaus E.",,,,,,,,"2019-04-15T14:35:00Z","2019-01-29T15:24:00Z||2019-04-09T13:14:58Z||2019-04-15T14:35:00Z",,"2018-04-19",,,,,,,,,"http://hdl.handle.net/20.500.11850/321023","en","Swiss Global Change Day",,,,"Global and latitudinal biodiversity of marine phytoplankton","Conference Poster","Metadata only",,,,"2019-01-29T15:24:02Z",,,,,,"yes","19thSwiss Global Change Day","April 19, 2018","Bern, Switzerland",,,,,,,,,,,,,,,,,"ETH Zürich::00002 - ETH Zürich::00012 - Lehre und Forschung::00007 - Departemente::02350 - Dep. Umweltsystemwissenschaften / Dep. of Environmental Systems Science::02721 - Inst. f. Biogeochemie u. Schadstoffdyn. / Inst. Biogeochem. and Pollutant Dynamics::03731 - Gruber, Nicolas / Gruber, Nicolas","ETH Zürich::00002 - ETH Zürich::00012 - Lehre und Forschung::00007 - Departemente::02350 - Dep. Umweltsystemwissenschaften / Dep. of Environmental Systems Science::02721 - Inst. f. Biogeochemie u. Schadstoffdyn. / Inst. Biogeochem. and Pollutant Dynamics::03731 - Gruber, Nicolas / Gruber, Nicolas","03731","03731",,,,"S.l.","published",,,,,,,,,,,,,,,"2019-04-15T14:35:14Z","2019-04-15T14:35:14Z","true",,"FORM",,,,
"284600","20.500.11850/41","Gruber, Nicolas",,,,,,,,"2019-03-08T16:13:25Z","2019-01-29T14:43:08Z||2019-03-08T16:13:25Z",,"2018-04-18",,,,,,,,,"http://hdl.handle.net/20.500.11850/320983","en",,,,,"Decadal variability of the Southern Ocean carbon sink","Presentation","Metadata only",,,,"2019-01-29T14:43:13Z",,,,,,"yes","Lecture at the Yale University","April 18, 2018","New Haven, CT, USA",,,,,,,,,,,,,,,,,"ETH Zürich::00002 - ETH Zürich::00012 - Lehre und Forschung::00007 - Departemente::02350 - Dep. Umweltsystemwissenschaften / Dep. of Environmental Systems Science::02721 - Inst. f. Biogeochemie u. Schadstoffdyn. / Inst. Biogeochem. and Pollutant Dynamics::03731 - Gruber, Nicolas / Gruber, Nicolas","ETH Zürich::00002 - ETH Zürich::00012 - Lehre und Forschung::00007 - Departemente::02350 - Dep. Umweltsystemwissenschaften / Dep. of Environmental Systems Science::02721 - Inst. f. Biogeochemie u. Schadstoffdyn. / Inst. Biogeochem. and Pollutant Dynamics::03731 - Gruber, Nicolas / Gruber, Nicolas","03731","03731",,,,,"unpublished",,,,,,,,,,,,,,"false","2019-03-08T16:13:35Z","2019-03-08T16:13:35Z","true",,"FORM",,,,
"288408","20.500.11850/10","Righetti, Damiano||Vogt, Meike||Gruber, Nicolas||Guilhaumon, Francois||Ayata, Sakina-Dorothée",,,,,,,,"2019-04-01T16:21:18Z","2019-01-29T15:20:25Z||2019-03-22T13:58:49Z||2019-04-01T16:21:18Z",,"2018-04-13",,,,,,,,,"http://hdl.handle.net/20.500.11850/321019","en",,,,,"Patterns of phytoplankton diversity and cell size in the global ocean","Other Conference Item","Metadata only",,,,"2019-01-29T15:20:44Z",,,,,,"yes","The Annual Meeting of the Specialist Group for Macroecology","April 10-13, 2018","Birmensdorf, Switzerland",,,,,,,,,,,,,,,,,"ETH Zürich::00002 - ETH Zürich::00012 - Lehre und Forschung::00007 - Departemente::02350 - Dep. Umweltsystemwissenschaften / Dep. of Environmental Systems Science::02721 - Inst. f. Biogeochemie u. Schadstoffdyn. / Inst. Biogeochem. and Pollutant Dynamics::03731 - Gruber, Nicolas / Gruber, Nicolas","ETH Zürich::00002 - ETH Zürich::00012 - Lehre und Forschung::00007 - Departemente::02350 - Dep. Umweltsystemwissenschaften / Dep. of Environmental Systems Science::02721 - Inst. f. Biogeochemie u. Schadstoffdyn. / Inst. Biogeochem. and Pollutant Dynamics::03731 - Gruber, Nicolas / Gruber, Nicolas","03731","03731","Conference lecture on 13 April 2018",,,,"unpublished",,,,,,,,,,,,,,,"2019-04-01T16:21:28Z","2023-02-06T16:59:56Z","true",,"FORM",,,,
"248918","20.500.11850/21","Brugger, Fritz||Müller, Stefanie||Zanetti, Jessica||Winkler, Mirko||Knoblauch, Astrid||Wehrli, Bernhard",,,,,,,,"2018-08-16T13:27:39Z","2018-08-15T14:10:16Z||2018-08-15T15:02:21Z||2018-08-16T06:13:58Z||2018-08-16T10:13:45Z||2018-08-16T13:27:39Z",,"2018-04-11","2018-08-16","Artisanal and small-scale gold mining (ASGM) has become part of the livelihood strategy for a large part of the rural population in Burkina Faso. This interdisciplinary and exploratory research on four mining sites in the Center North region of Burkina Faso investigates the impact on soil and water caused by the widespread use of mercury and cyanide in the extraction process. Hotspots of contamination are found at the processing and tailing sites. Further, it quantifies the health burden of the mining community due to cyanide exposure. The results show elevated cyanide concentrations and related health patterns for workers exposed to cyanide. Finally, the socio-economic analysis reveals different mechanisms how agriculture and ASGM activities interact at the household level and how labor and capital is allocated. The findings suggest to expand development support from a predominantly agricultural focus towards an explicit livelihood approach that includes ASGM reality. This includes engagement on the ASGM work site for awareness rising in health and environmental issues as well as supporting means to more effectively and sustainably combine mining and agriculture.","application/pdf","10.3929/ethz-b-000282708",,,,,"http://hdl.handle.net/20.500.11850/282708","en","NADEL Center for Development and Cooperation, ETH Zurich","In Copyright - Non-Commercial Use Permitted","http://rightsstatements.org/page/InC-NC/1.0/","Mining contamination||Cyanide||Burkina Faso||Gold||Health||Rural development||Mercury||Environmental impact","Small-scale gold mining in Burkina Faso: Health effects, environmental burden and socio-economic interactions with agriculture","Report","Open access",,,,"2018-08-15T14:10:17Z",,,,,,"yes",,,,,,,,,,,,,,,,,,,,"ETH Zürich::00002 - ETH Zürich::00012 - Lehre und Forschung::00007 - Departemente::02350 - Dep. Umweltsystemwissenschaften / Dep. of Environmental Systems Science::02721 - Inst. f. Biogeochemie u. Schadstoffdyn. / Inst. Biogeochem. and Pollutant Dynamics::03328 - Wehrli, Bernhard (emeritus) / Wehrli, Bernhard (emeritus)||ETH Zürich::00002 - ETH Zürich::00012 - Lehre und Forschung::00007 - Departemente::02045 - Dep. Geistes-, Sozial- u. Staatswiss. / Dep. of Humanities, Social and Pol.Sc.::01859 - Lehre Geistes-, Sozial- und Staatswiss.::01857 - SR Geistes-,Sozial- und Staatsw.::01865 - MAS ETH Entwicklung und Zusammenarbeit / MAS ETH in Development and Cooperation","ETH Zürich::00002 - ETH Zürich::00012 - Lehre und Forschung::00007 - Departemente::02350 - Dep. Umweltsystemwissenschaften / Dep. of Environmental Systems Science::02721 - Inst. f. Biogeochemie u. Schadstoffdyn. / Inst. Biogeochem. and Pollutant Dynamics::03328 - Wehrli, Bernhard (emeritus) / Wehrli, Bernhard (emeritus)||ETH Zürich::00002 - ETH Zürich::00012 - Lehre und Forschung::00007 - Departemente::02045 - Dep. Geistes-, Sozial- u. Staatswiss. / Dep. of Humanities, Social and Pol.Sc.::01859 - Lehre Geistes-, Sozial- und Staatswiss.::01857 - SR Geistes-,Sozial- und Staatsw.::01865 - MAS ETH Entwicklung und Zusammenarbeit / MAS ETH in Development and Cooperation","03328||01865","03328||01865",,,,"Zurich","published",,,,,,,,,,,,,,,"2018-08-16T06:14:04Z","2023-02-06T15:46:19Z","true","36 p.","FORM",,"Project Report",,
"273465","20.500.11850/10","Bickel, Samuel||Or, Dani",,,,,,,,"2019-01-15T07:24:47Z","2019-01-14T16:20:14Z||2019-01-15T07:24:47Z",,"2018-04-10",,,"application/pdf","10.3929/ethz-b-000315679",,,,,"http://hdl.handle.net/20.500.11850/315679","en","Copernicus","Creative Commons Attribution 4.0 International","http://creativecommons.org/licenses/by/4.0/",,"Climate and soil properties affect diversity and abundance of soil microbial life across scales – from grains to biomes","Other Conference Item","Open access",,,,"2019-01-14T16:20:17Z",,,,,,"yes","EGU General Assembly 2018","April 8-13, 2018","Vienna, Austria",,,,,,,,,,,,,,,,"20","ETH Zürich::00002 - ETH Zürich::00012 - Lehre und Forschung::00007 - Departemente::02350 - Dep. Umweltsystemwissenschaften / Dep. of Environmental Systems Science::02721 - Inst. f. Biogeochemie u. Schadstoffdyn. / Inst. Biogeochem. and Pollutant Dynamics::03812 - Or, Dani (emeritus) / Or, Dani (emeritus)","ETH Zürich::00002 - ETH Zürich::00012 - Lehre und Forschung::00007 - Departemente::02350 - Dep. Umweltsystemwissenschaften / Dep. of Environmental Systems Science::02721 - Inst. f. Biogeochemie u. Schadstoffdyn. / Inst. Biogeochem. and Pollutant Dynamics::03812 - Or, Dani (emeritus) / Or, Dani (emeritus)","03812","03812","Poster presented on April 10, 2018",,"EGU2018-8486","Göttingen","published",,,,,,,,,,,,,,,"2019-01-15T07:25:06Z","2021-02-15T03:18:29Z","true","1 p.; poster 1 p.","FORM",,,"publishedVersion",
"245280","20.500.11850/10","Tecon, Robin||Ebrahimi, Ali||Kleyer, Hannah||Or, Dani",,,,,,,,"2018-07-25T08:34:27Z","2018-07-25T08:16:40Z||2018-07-25T08:34:27Z",,"2018-04-10",,,,,,,,,"http://hdl.handle.net/20.500.11850/278094","en","Copernicus Publications",,,,"Hydration conditions affect cell-to-cell bacterial interactions in porous media","Other Conference Item","Metadata only",,,,"2018-07-25T08:16:43Z",,,,,,"yes","EGU General Assembly 2018","April 8-13, 2017","Vienna, Austria",,,,,,,,,,,,,,,,,"ETH Zürich::00002 - ETH Zürich::00012 - Lehre und Forschung::00007 - Departemente::02350 - Dep. Umweltsystemwissenschaften / Dep. of Environmental Systems Science::02721 - Inst. f. Biogeochemie u. Schadstoffdyn. / Inst. Biogeochem. and Pollutant Dynamics::03812 - Or, Dani (emeritus) / Or, Dani (emeritus)","ETH Zürich::00002 - ETH Zürich::00012 - Lehre und Forschung::00007 - Departemente::02350 - Dep. Umweltsystemwissenschaften / Dep. of Environmental Systems Science::02721 - Inst. f. Biogeochemie u. Schadstoffdyn. / Inst. Biogeochem. and Pollutant Dynamics::03812 - Or, Dani (emeritus) / Or, Dani (emeritus)","03812","03812",,,"EGU2018-6380","Gottingen","published",,,,,,,,,,,,,,,"2018-07-25T08:34:29Z","2022-03-28T20:42:39Z","true","1 p.","FORM",,,,
