"328547","20.500.11850/14","Borduas-Dedekind, Nadine||Donahue, Neil M.",,,"Török, Béla||Dransfield, Timothy",,,,,"2020-01-13T16:14:16Z","2018-01-29T07:57:14Z||2018-01-29T09:44:57Z||2020-01-13T16:07:26Z||2020-01-13T16:14:16Z",,"2018","2017-11-10",,,,"9780128095492||9780128092705",,,"10.1016/B978-0-12-809270-5.00006-6","http://hdl.handle.net/20.500.11850/235780","en","Elsevier",,,"Aerosols||Atmospheric chemistry||Clouds||Greenhouse gases (GHGs)||Oxidants||Particulate matter||Photolysis||Radiation||Stratosphere||Troposphere||Volatile organic compounds (VOCs)","The Natural Atmosphere","Book Chapter","Metadata only","Green Chemistry: An Inclusive Approach",,,"2018-01-29T07:57:15Z",,,,,,"yes",,,,,,,,,,,,,"85042619563",,,,,,,"ETH Zürich::00002 - ETH Zürich::00012 - Lehre und Forschung::00007 - Departemente::02350 - Dep. Umweltsystemwissenschaften / Dep. of Environmental Systems Science::02721 - Inst. f. Biogeochemie u. Schadstoffdyn. / Inst. Biogeochem. and Pollutant Dynamics::03850 - McNeill, Kristopher / McNeill, Kristopher","ETH Zürich::00002 - ETH Zürich::00012 - Lehre und Forschung::00007 - Departemente::02350 - Dep. Umweltsystemwissenschaften / Dep. of Environmental Systems Science::02721 - Inst. f. Biogeochemie u. Schadstoffdyn. / Inst. Biogeochem. and Pollutant Dynamics::03850 - McNeill, Kristopher / McNeill, Kristopher","03850","03850",,"150","131","Amsterdam","published",,,,,,,,,,,,,,,"2018-01-29T09:45:03Z","2021-02-15T07:16:52Z","true",,"FORM",,,,
"244850","20.500.11850/16","Lovecchio, Elisa",,,,,,,"Gruber, Nicolas||Münnich, Matthias||Lachkar, Zouhair||Arístegui, Javier","2018-07-23T12:43:03Z","2018-07-23T11:55:56Z||2018-07-23T12:36:52Z||2018-07-23T12:43:03Z",,"2018","2018-07-23","The marine biological pump, consisting of organic carbon production, export and remineralization, is an essential component of the global carbon cycle and exerts an important control on atmospheric carbon concentrations. Lateral fluxes of organic carbon out of their region of production, especially from coastal regions, may explain the large rates of remineralization in regions of low productivity, but they are currently unaccounted by export and budget estimates. Here I quantify and characterize this lateral offshore transport of organic carbon from the north-western African coast of the Canary Upwelling System (CanUS) up to the middle of the oligotrophic North Atlantic Gyre. To this aim, I run the physical Regional Oceanic Modeling System (ROMS) coupled with the biogeochemical-ecosystem Nutrient Phytoplankton Zooplankton Detritus (NPZD) model on an Atlantic telescopic grid. This newly developed grid covers the entire Atlantic basin, allowing to study the lateral transport on very large spatial scales, and is eddy resolving in the region of interest thanks to a strong grid refinement towards the north-western African coast. With the use of climatological model simulations I study the magnitude, reach, pattern and impact of the total long range offshore flux of organic carbon, and study in detail the special role of mesoscale eddies and filaments in this transport, with a particular attention to the evolution of the eddy organic carbon budget. The results of my work indicate that, on average, more than 1/3 of the net community production of the first 100 km from the CanUS coast is laterally exported away from this region towards the open waters in the euphotic layer (100 m depth). On average in the CanUS, the divergence of this offshore flux is the largest lateral input of organic carbon in the open waters up to 1500 km from the coast and represents up to 1/3 of the large-scale mean offshore production in the open waters. This divergence even exceeds half of the mean offshore production in the euphotic layer of the central CanUS subregion, a key zonal band for the alongshore collection and offshore redistribution of the biogeochemical tracers. In the 100 m - 200 m depth layer, the offshore transport continues to dominate the lateral fluxes of organic carbon, displacing it further towards the center of the north Atlantic gyre. The long-range offshore transport of organic carbon results in a spatial decoupling of its sources and sinks, corresponding to a strongly net autotrophic watercolumn on the shelf, and a net heterotrophic watercolumn offshore, the latter stemming from the fueling of extra deep heterotrophic activity. My results demonstrate also that mesoscale activity has a fundamental role in the offshore redistribution of the organic carbon in the euphotic layer. Coastal upwelling filaments, identified with a newly developed algorithm, contribute 80% to the zonal fluxes at 100 km offshore and are the main advective source of organic carbon in the first 500 km from the coast, but their contribution declines to zero at 1000 km offshore.   Mesoscale eddies, instead, represent about 20% of the offshore flux between 500 km from the coast and the middle of the North Atlantic gyre. Despite their slow drift, eddies account for 30 % of the of the total organic carbon of the offshore euphotic layer (2/3 found in cyclonic eddies), thus contributing significantly to the carbon reservoir in the open ocean. In the eddy-rich northern region of the CanUS, the long lasting organic carbon reservoir of cyclonic eddies is sustained in large part by the efficient trapping of organic carbon and nutrients at formation. These core-centric and laterally-isolated structures lose organic carbon along their way to the open ocean via sinking, while rejunevating the organic carbon reservoir through local recycling and through the use of the trapped nutrients. Anticyclonic eddies, instead, are high in organic carbon at their rim; new production in this kind of eddies is allowed by the lateral stirring of the large scale regional gradient of nutrients combined with substantial vertical mixing.   Overall, the results of this work demonstrate the importance of accounting for the three-dimensionality of the marine biological pump, and highlight the essential role of the coastal ocean in the global carbon cycle. Moreover, they clarify the role of mesoscale activity in the lateral redistribution of the organic carbon from the coast, identifying the diversity of underlying mechanisms that regulate the organic carbon budget of mesoscale eddies.","application/pdf","10.3929/ethz-b-000277475",,,,,"http://hdl.handle.net/20.500.11850/277475","en","ETH Zurich","In Copyright - Non-Commercial Use Permitted","http://rightsstatements.org/page/InC-NC/1.0/","Oceanography||Ocean modeling||Organic carbon cycling||Mesoscale eddies||Upwelling","Long range offshore transport of organic carbon from the Canary Upwelling System, an eddy-resolving modeling study","Doctoral Thesis","Open access",,"DDC - DDC::5 - Science::550 - Earth sciences",,"2018-07-23T11:55:56Z",,,,,,"yes",,,,,,,"CALNEX: Quantifying the exchange of carbon and nutrients between the coastal and open seas: A comparative modeling study of the California and Canary Current Systems","149384||149384","10.13039/501100001711||10.13039/501100001711","SNF||SNF","Projektförderung in Mathematik, Natur- und Ingenieurwissenschaften (Abteilung II)||Projektförderung in Mathematik, Natur- und Ingenieurwissenschaften (Abteilung II)","25034",,,,,,,,"ETH Zürich::00002 - ETH Zürich::00012 - Lehre und Forschung::00007 - Departemente::02350 - Dep. Umweltsystemwissenschaften / Dep. of Environmental Systems Science::02721 - Inst. f. Biogeochemie u. Schadstoffdyn. / Inst. Biogeochem. and Pollutant Dynamics::03731 - Gruber, Nicolas / Gruber, Nicolas","ETH Zürich::00002 - ETH Zürich::00012 - Lehre und Forschung::00007 - Departemente::02350 - Dep. Umweltsystemwissenschaften / Dep. of Environmental Systems Science::02721 - Inst. f. Biogeochemie u. Schadstoffdyn. / Inst. Biogeochem. and Pollutant Dynamics::03731 - Gruber, Nicolas / Gruber, Nicolas","03731","03731",,,,"Zurich","published","10.3929/ethz-b-000190480",,,,,,,,,,,,,,"2018-07-23T12:38:01Z","2020-02-15T14:07:47Z","true","238 p.","FORM",,,,
"285702","20.500.11850/10","Lehmann, Peter||Berli, Markus||Koonce, Jeremy E.||Or, Dani",,,,,,,,"2019-03-15T14:15:37Z","2019-01-22T11:00:37Z||2019-03-15T14:15:37Z",,"2018",,,"application/pdf","10.3929/ethz-b-000318471",,"1029-7006||1607-7962",,,"http://hdl.handle.net/20.500.11850/318471","en","Copernicus","Creative Commons Attribution 4.0 International","http://creativecommons.org/licenses/by/4.0/",,"Modeling a decade-long record of evaporation and recharge dynamics in a deep desert soil lysimeter using the surface evaporation capacitor concept","Other Conference Item","Open access",,,,"2019-01-22T11:00:50Z",,,,,,"yes","EGU General Assembly 2018","April 8-13, 2018","Vienna, Austria",,,,,,,,,,,,,"GRA",,"Geophysical Research Abstracts","20","ETH Zürich::00002 - ETH Zürich::00012 - Lehre und Forschung::00007 - Departemente::02350 - Dep. Umweltsystemwissenschaften / Dep. of Environmental Systems Science::02721 - Inst. f. Biogeochemie u. Schadstoffdyn. / Inst. Biogeochem. and Pollutant Dynamics::03812 - Or, Dani (emeritus) / Or, Dani (emeritus)","ETH Zürich::00002 - ETH Zürich::00012 - Lehre und Forschung::00007 - Departemente::02350 - Dep. Umweltsystemwissenschaften / Dep. of Environmental Systems Science::02721 - Inst. f. Biogeochemie u. Schadstoffdyn. / Inst. Biogeochem. and Pollutant Dynamics::03812 - Or, Dani (emeritus) / Or, Dani (emeritus)","03812","03812","Poster abstract. Poster presented on 13 April 2018.",,"EGU2018-11412","Göttingen","published",,,,,,,,,,,,,,,"2019-03-15T14:15:42Z","2021-02-15T04:00:24Z","true","1 p.","FORM",,,"publishedVersion",
"276869","20.500.11850/10","Van Groeningen, Natacha",,,,,,,,"2019-01-25T10:41:27Z","2018-12-12T08:26:18Z||2019-01-25T10:41:27Z",,"2018",,,,,,,,,"http://hdl.handle.net/20.500.11850/310217","en","EAWAG",,,,"Sorption interactions between Cd(II) and Mn(II) on Fe-free montmorillonite under anoxic conditions","Other Conference Item","Metadata only","Poster Abstracts of the 11th IBP PhD Congress 2018",,,"2018-12-12T08:26:28Z",,,,,,"yes","11th IBP PhD Congress 2018","April 6, 2018","Zurich, Switzerland",,,,,,,,,,,,,,,,,"ETH Zürich::00002 - ETH Zürich::00012 - Lehre und Forschung::00007 - Departemente::02350 - Dep. Umweltsystemwissenschaften / Dep. of Environmental Systems Science::02721 - Inst. f. Biogeochemie u. Schadstoffdyn. / Inst. Biogeochem. and Pollutant Dynamics::03541 - Kretzschmar, Ruben / Kretzschmar, Ruben","ETH Zürich::00002 - ETH Zürich::00012 - Lehre und Forschung::00007 - Departemente::02350 - Dep. Umweltsystemwissenschaften / Dep. of Environmental Systems Science::02721 - Inst. f. Biogeochemie u. Schadstoffdyn. / Inst. Biogeochem. and Pollutant Dynamics::03541 - Kretzschmar, Ruben / Kretzschmar, Ruben","03541","03541","Poster Abstract",,"B18","Dübendorf, Switzerland","published",,,,,,,,,,,,,,,"2019-01-25T10:41:41Z","2019-01-25T10:41:41Z","true","1 p.","FORM",,,,
"227404","20.500.11850/36","Sander, Michael","Sander, Michael","Sander, Michael",,"Sander, Michael","Sander, Michael",,,"2018-03-26T10:22:51Z","2018-03-23T13:27:22Z||2018-03-26T10:22:51Z",,"2018",,,"video/mp4","10.3929/ethz-b-000252430",,,,,"http://hdl.handle.net/20.500.11850/252430","en","ETH Zurich","In Copyright - Non-Commercial Use Permitted","http://rightsstatements.org/page/InC-NC/1.0/",,"Drone sequences Storhultsmossen","Video","Open access",,,,"2018-03-23T13:27:22Z",,"indefinite","292278994-08-17T07:12:55Z",,,"yes",,,,,,,,,,,,,,,,,,,,"ETH Zürich::00002 - ETH Zürich::00012 - Lehre und Forschung::00007 - Departemente::02350 - Dep. Umweltsystemwissenschaften / Dep. of Environmental Systems Science::02721 - Inst. f. Biogeochemie u. Schadstoffdyn. / Inst. Biogeochem. and Pollutant Dynamics||ETH Zürich::00002 - ETH Zürich::00012 - Lehre und Forschung::00007 - Departemente::02350 - Dep. Umweltsystemwissenschaften / Dep. of Environmental Systems Science::02721 - Inst. f. Biogeochemie u. Schadstoffdyn. / Inst. Biogeochem. and Pollutant Dynamics::03850 - McNeill, Kristopher / McNeill, Kristopher","ETH Zürich::00002 - ETH Zürich::00012 - Lehre und Forschung::00007 - Departemente::02350 - Dep. Umweltsystemwissenschaften / Dep. of Environmental Systems Science::02721 - Inst. f. Biogeochemie u. Schadstoffdyn. / Inst. Biogeochem. and Pollutant Dynamics::03850 - McNeill, Kristopher / McNeill, Kristopher","02721||03850","03850",,,,"Zurich",,,,,,,,,,,,,,,,"2018-03-26T10:26:08Z","2021-02-14T23:01:19Z","true","305 MB","FORM",,,,
"290784","20.500.11850/9","Nissen, Cara||Vogt, Meike||Münnich, Matthias||Gruber, Nicolas",,,,,,,,"2019-04-18T14:50:46Z","2019-01-29T16:00:43Z||2019-04-09T11:43:38Z||2019-04-18T14:50:46Z",,"2018",,,,,,,,,"http://hdl.handle.net/20.500.11850/321056","en",,,,,"Coccolithophore controls on the Southern Ocean biogeochemistry","Conference Poster","Metadata only",,,,"2019-01-29T16:00:47Z",,,,,,"yes","19th Swiss Global Change Day","April 19, 2018","Bern, Switzerland",,,,"SOGate: Phytoplankton ecosystem control of the Southern Ocean biogeochemical gate","153452","10.13039/501100001711","SNF","Projektförderung in Mathematik, Natur- und Ingenieurwissenschaften (Abteilung II)",,,,,,,,,"ETH Zürich::00002 - ETH Zürich::00012 - Lehre und Forschung::00007 - Departemente::02350 - Dep. Umweltsystemwissenschaften / Dep. of Environmental Systems Science::02721 - Inst. f. Biogeochemie u. Schadstoffdyn. / Inst. Biogeochem. and Pollutant Dynamics::03731 - Gruber, Nicolas / Gruber, Nicolas","ETH Zürich::00002 - ETH Zürich::00012 - Lehre und Forschung::00007 - Departemente::02350 - Dep. Umweltsystemwissenschaften / Dep. of Environmental Systems Science::02721 - Inst. f. Biogeochemie u. Schadstoffdyn. / Inst. Biogeochem. and Pollutant Dynamics::03731 - Gruber, Nicolas / Gruber, Nicolas","03731","03731",,,,,"unpublished",,,,,,,,,,,,,,"false","2019-04-18T14:51:14Z","2019-04-18T14:51:14Z","true","1 p.","FORM",,,,
"355828","20.500.11850/31","Gruber, Nicolas","Gruber, Nicolas",,,"Clement, Dominic","Gruber, Nicolas",,,"2020-07-10T07:46:15Z","2018-02-23T22:21:19Z||2019-10-02T10:30:22Z||2020-03-05T08:24:57Z||2020-07-10T07:46:15Z",,"2018",,"The determination of the decadal change in anthropogenic CO2 in the global ocean from repeat hydrographic surveys represents a formidable challenge, which we address here by introducing a seamless new method. This method builds on the extended multiple linear regression (eMLR) approach [Friis et al., 2005] to identify the anthropogenic CO2 signal, but in order to improve the robustness of this method, we fit C* [Gruber and Sarmiento, 2002] rather than dissolved inorganic carbon and use a probabilistic method for the selection of the predictors. In order to account for the multi-year nature of the surveys, we adjust all C* observations of a particular observing period to a common reference year by assuming a transient steady-state. We finally use the eMLR models together with global gridded climatological distributions of the predictors to map the estimated change in anthropogenic CO2 to the global ocean. Testing this method with synthetic data generated from a hindcast simulation with an ocean model reveals that the method is able to reconstruct the change in anthropogenic CO2 with only a small global bias (<5%). Within ocean basins, the errors can be larger, mostly driven by changes in ocean circulation. Overall, we conclude from the model that the method has an accuracy of retrieving the column integrated change in anthropogenic CO2 of about 10% at the scale of whole ocean basins. We expect that this uncertainty needs to be doubled to about 20% when the change in anthropogenic CO2 is reconstructed from observations.",,,,,,,"http://hdl.handle.net/20.500.11850/243986","en","ETH Zurich, Institute of Biogeochemistry and Pollutant Dynamics (IBP)",,,,"Data supporting The eMLR(C*) method to determine decadal changes in the global ocean storage of anthropogenic CO2","Dataset","Metadata only",,,,"2018-02-23T22:21:25Z",,"10 years","2030-03-05T08:25:18Z","This data set contains the relevant data and information associated with the publication by Clement and Gruber in Global Biogeochemical Cycles.   Concretely, the following five items are included.  1) netcdf files with the synthetic data from the model runs used to test the method (constant and variable climate) 2) netcdf files with estimates of anthropogenic CO2 by the standard method and the sensitivity studies 3) xls file explaining the sensitivity studies and the resulting inventories 4) Matlab scripts implementing the eMLR(C*) method",,"yes",,,,,,,,,,,,,,,,,,,,"ETH Zürich::00002 - ETH Zürich::00012 - Lehre und Forschung::00007 - Departemente::02350 - Dep. Umweltsystemwissenschaften / Dep. of Environmental Systems Science::02721 - Inst. f. Biogeochemie u. Schadstoffdyn. / Inst. Biogeochem. and Pollutant Dynamics||ETH Zürich::00002 - ETH Zürich::00012 - Lehre und Forschung::00007 - Departemente::02350 - Dep. Umweltsystemwissenschaften / Dep. of Environmental Systems Science::02721 - Inst. f. Biogeochemie u. Schadstoffdyn. / Inst. Biogeochem. and Pollutant Dynamics::03731 - Gruber, Nicolas / Gruber, Nicolas","ETH Zürich::00002 - ETH Zürich::00012 - Lehre und Forschung::00007 - Departemente::02350 - Dep. Umweltsystemwissenschaften / Dep. of Environmental Systems Science::02721 - Inst. f. Biogeochemie u. Schadstoffdyn. / Inst. Biogeochem. and Pollutant Dynamics::03731 - Gruber, Nicolas / Gruber, Nicolas","02721||03731","03731","Since February 23, 2018, the data has not been published.",,,"Zurich",,,,,,,,,,,"handle/20.500.11850/265807",,,,,"2020-03-05T08:25:20Z","2020-07-10T07:46:34Z","true",,"FORM",,,,
"377659","20.500.11850/16","Molteni, Ugo",,,,,,,"Baltensperger, Urs||McNeill, Kristopher||Mentel, Thomas||Dommen, Josef","2020-11-27T11:06:40Z","2018-11-26T08:15:32Z||2018-11-26T10:47:47Z||2020-11-27T11:06:40Z",,"2018","2018-11-26",,"application/pdf","10.3929/ethz-b-000305954",,,,,"http://hdl.handle.net/20.500.11850/305954","en","ETH Zurich","In Copyright - Non-Commercial Use Permitted","http://rightsstatements.org/page/InC-NC/1.0/",,"Laboratory and field investigation into the gas-phase chemistry of highly oxygenated molecules","Doctoral Thesis","Open access",,"DDC - DDC::3 - Social sciences::333.7 - Natural resources, energy and environment||DDC - DDC::5 - Science::550 - Earth sciences",,"2018-11-26T08:15:36Z","2020-11-26",,,,,"yes",,,,,,,,,,,,"25107",,,,,,,,"ETH Zürich::00002 - ETH Zürich::00012 - Lehre und Forschung::00007 - Departemente::02350 - Dep. Umweltsystemwissenschaften / Dep. of Environmental Systems Science::02721 - Inst. f. Biogeochemie u. Schadstoffdyn. / Inst. Biogeochem. and Pollutant Dynamics::03850 - McNeill, Kristopher / McNeill, Kristopher","ETH Zürich::00002 - ETH Zürich::00012 - Lehre und Forschung::00007 - Departemente::02350 - Dep. Umweltsystemwissenschaften / Dep. of Environmental Systems Science::02721 - Inst. f. Biogeochemie u. Schadstoffdyn. / Inst. Biogeochem. and Pollutant Dynamics::03850 - McNeill, Kristopher / McNeill, Kristopher","03850","03850",,,,"Zurich","published",,,,,,,,,,,,,,,"2018-11-26T10:48:25Z","2021-02-15T21:16:26Z","true","122 p.","FORM",,,,
"264406","20.500.11850/16","Achermann, Stefan",,,,,,,"Fenner, Kathrin||McNeill, Kristopher||Drewes, Jörg E.||Johnson, David R.","2018-11-16T12:46:57Z","2018-11-16T12:18:06Z||2018-11-16T12:46:57Z",,"2018","2018-11-16",,"application/pdf","10.3929/ethz-b-000304313",,,,,"http://hdl.handle.net/20.500.11850/304313","en","ETH Zurich","In Copyright - Non-Commercial Use Permitted","http://rightsstatements.org/page/InC-NC/1.0/","Biotransformation||Activated sludge||Micropollutant||Metatranscriptomics||LC-MS/MS","Exploring Linkages between Micropollutant Biotransformation Reactions and Microbial Community Characteristics in Activated Sludge","Doctoral Thesis","Open access",,"DDC - DDC::6 - Technology, medicine and applied sciences::624 - Civil engineering",,"2018-11-16T12:18:08Z",,,,,,"yes",,,,,,,,,,,,"25288",,,,,,,,"ETH Zürich::00002 - ETH Zürich::00012 - Lehre und Forschung::00007 - Departemente::02350 - Dep. Umweltsystemwissenschaften / Dep. of Environmental Systems Science||ETH Zürich::00002 - ETH Zürich::00012 - Lehre und Forschung::00007 - Departemente::02350 - Dep. Umweltsystemwissenschaften / Dep. of Environmental Systems Science::02721 - Inst. f. Biogeochemie u. Schadstoffdyn. / Inst. Biogeochem. and Pollutant Dynamics::03850 - McNeill, Kristopher / McNeill, Kristopher","ETH Zürich::00002 - ETH Zürich::00012 - Lehre und Forschung::00007 - Departemente::02350 - Dep. Umweltsystemwissenschaften / Dep. of Environmental Systems Science::02721 - Inst. f. Biogeochemie u. Schadstoffdyn. / Inst. Biogeochem. and Pollutant Dynamics::03850 - McNeill, Kristopher / McNeill, Kristopher","02350||03850","03850",,,,"Zurich","published",,,,,,,,,,,,,,,"2018-11-16T12:47:21Z","2021-02-15T02:33:17Z","true","295 p.","FORM",,,,
"233461","20.500.11850/3","Nussbaum, Madlene||Spiess, Kay||Baltensweiler, Andri||Grob, Urs||Keller, Armin||Greiner, Lucie||Schaepman, Michael E.||Papritz, Andreas Jürg",,,,,,,,"2018-05-02T10:15:39Z","2018-01-15T07:53:35Z||2018-04-05T14:09:09Z||2018-05-02T10:15:39Z",,"2018","2018-01-10","The spatial assessment of soil functions requires maps of basic soil properties. Unfortunately, these are either missing for many regions or are not available at the desired spatial resolution or down to the required soil depth. The field-based generation of large soil datasets and conventional soil maps remains costly. Meanwhile, legacy soil data and comprehensive sets of spatial environmental data are available for many regions.Digital soil mapping (DSM) approaches relating soil data (responses) to environmental data (covariates) face the challenge of building statistical models from large sets of covariates originating, for example, from airborne imaging spectroscopy or multi-scale terrain analysis. We evaluated six approaches for DSM in three study regions in Switzerland (Berne, Greifensee, ZH forest) by mapping the effective soil depth available to plants (SD), pH, soil organic matter (SOM), effective cation exchange capacity (ECEC), clay, silt, gravel content and fine fraction bulk density for four soil depths (totalling 48 responses). Models were built from 300–500 environmental covariates by selecting linear models through (1) grouped lasso and (2) an ad hoc stepwise procedure for robust external-drift kriging (georob). For (3) geoadditive models we selected penalized smoothing spline terms by component-wise gradient boosting (geoGAM). We further used two tree-based methods: (4) boosted regression trees (BRTs) and (5) random forest (RF). Lastly, we computed (6) weighted model averages (MAs) from the predictions obtained from methods 1–5.Lasso, georob and geoGAM successfully selected strongly reduced sets of covariates (subsets of 3–6 % of all covariates). Differences in predictive performance, tested on independent validation data, were mostly small and did not reveal a single best method for 48 responses. Nevertheless, RF was often the best among methods 1–5 (28 of 48 responses), but was outcompeted by MA for 14 of these 28 responses. RF tended to over-fit the data. The performance of BRT was slightly worse than RF. GeoGAM performed poorly on some responses and was the best only for 7 of 48 responses. The prediction accuracy of lasso was intermediate. All models generally had small bias. Only the computationally very efficient lasso had slightly larger bias because it tended to under-fit the data. Summarizing, although differences were small, the frequencies of the best and worst performance clearly favoured RF if a single method is applied and MA if multiple prediction models can be developed.","application/pdf","10.3929/ethz-b-000228435",,"2199-3971||2199-398X",,"10.5194/soil-4-1-2018","http://hdl.handle.net/20.500.11850/228435","en","Copernicus","Creative Commons Attribution 3.0 Unported","http://creativecommons.org/licenses/by/3.0/",,"Evaluation of digital soil mapping approaches with large sets of environmental covariates","Journal Article","Open access",,,,"2018-01-15T07:53:35Z",,,,,,"yes",,,,,,,,,,,,,"85045835727",,"000457375200001",,"1","Soil","4","ETH Zürich::00002 - ETH Zürich::00012 - Lehre und Forschung::00007 - Departemente::02350 - Dep. Umweltsystemwissenschaften / Dep. of Environmental Systems Science::02721 - Inst. f. Biogeochemie u. Schadstoffdyn. / Inst. Biogeochem. and Pollutant Dynamics::03812 - Or, Dani (emeritus) / Or, Dani (emeritus)","ETH Zürich::00002 - ETH Zürich::00012 - Lehre und Forschung::00007 - Departemente::02350 - Dep. Umweltsystemwissenschaften / Dep. of Environmental Systems Science::02721 - Inst. f. Biogeochemie u. Schadstoffdyn. / Inst. Biogeochem. and Pollutant Dynamics::03812 - Or, Dani (emeritus) / Or, Dani (emeritus)","03812","03812",,"22","1","Göttingen","published",,,,,,,,,,,,,,,"2018-04-05T14:09:18Z","2021-02-14T23:41:29Z","true",,"BATCH",,,"publishedVersion",
