"245991","20.500.11850/4","Schinkel, Lena||Lehner, Sandro||Heeb, Norbert V.||Marchand, Philippe||Cariou, Ronan||McNeill, Kristopher||Bogdal, Christian",,,,,,,,"2018-07-27T14:42:47Z","2018-07-27T07:03:40Z||2018-07-27T14:42:47Z",,"2018-09","2018-07-07",,,,,"0165-9936||0167-2940",,"10.1016/j.trac.2018.07.002","http://hdl.handle.net/20.500.11850/278764","en","Elsevier",,,,"Dealing with strong mass interferences of chlorinated paraffins and their transformation products: An analytical guide","Review Article","Metadata only",,,,"2018-07-27T07:03:45Z",,,,,,"yes",,,,,,,,,,,,,"85050101993",,"000443258600008","TrAC, Trends anal. chem.",,"TrAC Trends in Analytical Chemistry","106","ETH Zürich::00002 - ETH Zürich::00012 - Lehre und Forschung::00007 - Departemente::02020 - Dep. Chemie und Angewandte Biowiss. / Dep. of Chemistry and Applied Biosc.::02516 - Inst. f. Chemie- und Bioingenieurwiss. / Inst. Chemical and Bioengineering::03402 - Hungerbühler, Konrad (emeritus) / Hungerbühler, Konrad (emeritus)||ETH Zürich::00002 - ETH Zürich::00012 - Lehre und Forschung::00007 - Departemente::02350 - Dep. Umweltsystemwissenschaften / Dep. of Environmental Systems Science::02721 - Inst. f. Biogeochemie u. Schadstoffdyn. / Inst. Biogeochem. and Pollutant Dynamics::03850 - McNeill, Kristopher / McNeill, Kristopher","ETH Zürich::00002 - ETH Zürich::00012 - Lehre und Forschung::00007 - Departemente::02350 - Dep. Umweltsystemwissenschaften / Dep. of Environmental Systems Science::02721 - Inst. f. Biogeochemie u. Schadstoffdyn. / Inst. Biogeochem. and Pollutant Dynamics::03850 - McNeill, Kristopher / McNeill, Kristopher","03402||03850","03850",,"124","116","Amsterdam","published",,,,,,,,,,,,,,,"2018-07-27T14:42:51Z","2021-02-15T00:52:31Z","true",,"SCOPUS",,,,
"258150","20.500.11850/5","Winton, R. Scott||Ocampo-Peñuela, Natalia",,,,,,,,"2018-10-15T13:10:47Z","2018-10-03T22:49:41Z||2018-10-08T12:47:08Z||2018-10-15T13:10:47Z",,"2018-09","2018-07-18",,,,,"0006-3606||1744-7429",,"10.1111/btp.12594","http://hdl.handle.net/20.500.11850/293146","en","Wiley",,,"Colombia||Environmental economics||Birdwatching||Environmental policy||Rwanda","How to realize social and conservation benefits from ecotourism in post‐conflict contexts","Other Journal Item","Metadata only",,,,"2018-10-03T22:49:48Z",,,,,,"yes",,,,,,,,,,,,,,,"000444459600002",,"5","Biotropica","50","ETH Zürich::00002 - ETH Zürich::00012 - Lehre und Forschung::00007 - Departemente::02350 - Dep. Umweltsystemwissenschaften / Dep. of Environmental Systems Science::02721 - Inst. f. Biogeochemie u. Schadstoffdyn. / Inst. Biogeochem. and Pollutant Dynamics::03328 - Wehrli, Bernhard (emeritus) / Wehrli, Bernhard (emeritus)||ETH Zürich::00002 - ETH Zürich::00012 - Lehre und Forschung::00007 - Departemente::02350 - Dep. Umweltsystemwissenschaften / Dep. of Environmental Systems Science::02722 - Institut für Terrestrische Oekosysteme / Institute of Terrestrial Ecosystems::03723 - Ghazoul, Jaboury / Ghazoul, Jaboury","ETH Zürich::00002 - ETH Zürich::00012 - Lehre und Forschung::00007 - Departemente::02350 - Dep. Umweltsystemwissenschaften / Dep. of Environmental Systems Science::02721 - Inst. f. Biogeochemie u. Schadstoffdyn. / Inst. Biogeochem. and Pollutant Dynamics::03328 - Wehrli, Bernhard (emeritus) / Wehrli, Bernhard (emeritus)||ETH Zürich::00002 - ETH Zürich::00012 - Lehre und Forschung::00007 - Departemente::02350 - Dep. Umweltsystemwissenschaften / Dep. of Environmental Systems Science::02722 - Institut für Terrestrische Oekosysteme / Institute of Terrestrial Ecosystems::03723 - Ghazoul, Jaboury / Ghazoul, Jaboury","03328||03723","03328||03723",,"722","719","Hoboken, NJ","published",,,,,,,,,,,,,,,"2018-10-15T13:10:50Z","2023-02-06T16:02:18Z","true",,"WOS",,,,
"288423","20.500.11850/41","Sander, Michael",,,,,,,,"2019-04-01T16:39:37Z","2019-01-24T09:48:38Z||2019-03-22T13:58:57Z||2019-04-01T16:39:37Z",,"2018-08-28",,,,,,,,,"http://hdl.handle.net/20.500.11850/319221","de",,,,,"Mikrobieller Abbau von Plastik aus der Landwirtschaft in landwirtschaftlichen Böden","Presentation","Metadata only",,,,"2019-01-24T09:48:40Z",,,,,,"yes","Bundesamt für Landwirtschaft. Input seminar; Federal Department of Economic Affairs, Education and Research EAER, Federal Office for Agriculture FOAG","August 28, 2018","Bern, Switzerland",,,,,,,,,,,,,,,,,"ETH Zürich::00002 - ETH Zürich::00012 - Lehre und Forschung::00007 - Departemente::02350 - Dep. Umweltsystemwissenschaften / Dep. of Environmental Systems Science::02721 - Inst. f. Biogeochemie u. Schadstoffdyn. / Inst. Biogeochem. and Pollutant Dynamics::03850 - McNeill, Kristopher / McNeill, Kristopher","ETH Zürich::00002 - ETH Zürich::00012 - Lehre und Forschung::00007 - Departemente::02350 - Dep. Umweltsystemwissenschaften / Dep. of Environmental Systems Science::02721 - Inst. f. Biogeochemie u. Schadstoffdyn. / Inst. Biogeochem. and Pollutant Dynamics::03850 - McNeill, Kristopher / McNeill, Kristopher","03850","03850",,,,,"unpublished",,,,,,,,,,,,,,,"2019-04-01T16:40:09Z","2019-04-01T16:40:09Z","true",,"FORM",,,,
"251772","20.500.11850/3","Lovecchio, Elisa||Gruber, Nicolas||Münnich, Matthias",,,,,,,,"2018-09-05T06:02:29Z","2018-09-05T00:56:16Z||2018-09-05T06:02:29Z",,"2018-08-27",,,"application/pdf","10.3929/ethz-b-000286944",,"1726-4170||1726-4170",,"10.5194/bg-15-5061-2018","http://hdl.handle.net/20.500.11850/286944","en","Copernicus GmbH","Creative Commons Attribution 4.0 International","http://creativecommons.org/licenses/by/4.0/",,"Mesoscale contribution to the long-range offshore transport of organic carbon from the Canary Upwelling System to the open North Atlantic","Journal Article","Open access",,,,"2018-09-05T00:57:07Z",,,,,,"yes",,,,,,,,,,,,,"85052818431",,"000442738300001",,"16","Biogeosciences","15","ETH Zürich::00002 - ETH Zürich::00012 - Lehre und Forschung::00007 - Departemente::02350 - Dep. Umweltsystemwissenschaften / Dep. of Environmental Systems Science::02721 - Inst. f. Biogeochemie u. Schadstoffdyn. / Inst. Biogeochem. and Pollutant Dynamics||ETH Zürich::00002 - ETH Zürich::00012 - Lehre und Forschung::00007 - Departemente::02350 - Dep. Umweltsystemwissenschaften / Dep. of Environmental Systems Science::02721 - Inst. f. Biogeochemie u. Schadstoffdyn. / Inst. Biogeochem. and Pollutant Dynamics::03731 - Gruber, Nicolas / Gruber, Nicolas","ETH Zürich::00002 - ETH Zürich::00012 - Lehre und Forschung::00007 - Departemente::02350 - Dep. Umweltsystemwissenschaften / Dep. of Environmental Systems Science::02721 - Inst. f. Biogeochemie u. Schadstoffdyn. / Inst. Biogeochem. and Pollutant Dynamics::03731 - Gruber, Nicolas / Gruber, Nicolas","02721||03731","03731",,"5091","5061","Göttingen","published",,,,,,,,,,,,,,,"2018-09-05T06:02:47Z","2021-02-15T01:31:57Z","true","31 p.","WOS",,,"publishedVersion",
"251028","20.500.11850/3","Erickson, Paul R.||Moor, Kyle J.||Werner, Jeffrey J.||Latch, Douglas E.||Arnold, William A.||McNeill, Kristopher",,,,,,,,"2018-08-31T08:01:56Z","2018-08-31T07:05:13Z||2018-08-31T08:01:56Z",,"2018-08-21","2018-07-19","Triplet-state chromophoric dissolved organic matter (3CDOM*) plays an important role in aquatic photochemistry, yet much remains unknown about the reactivity of these intermediates. To better understand the kinetic behavior and reactivity of 3CDOM*, we have developed an indirect observation method based on monitoring time-resolved singlet oxygen (1O2) phosphorescence kinetics. The underpinning principle of our approach relies on the fact that O2 quenches almost all triplets with near diffusion limited rate constants, resulting in the formation of 1O2, which is kinetically linked to the precursors. A kinetic model relating 1O2 phosphorescence kinetics to triplet excited states produced from isolated humic substances and in whole natural-water samples (hereafter referred to as 3CDOM*) was developed and used to determine rate constants governing 3CDOM* natural lifetimes and quenching by oxygen and 2,4,6-trimethylphenol (TMP), a common triplet probe molecule. 3CDOM* was found to exhibit smaller O2 and TMP quenching rate constants, ∼9 × 108 and ∼8 × 108 M–1 s–1, respectively, compared with model sensitizers, such as aromatic ketones. Findings from this report shed light on the fundamental photochemical properties of CDOM in organic matter isolates and whole waters and will help refine photochemical models to more accurately predict pollutant fate in the environment.","application/pdf","10.3929/ethz-b-000285931",,"0013-936X||1520-5851",,"10.1021/acs.est.8b02379","http://hdl.handle.net/20.500.11850/285931","en","American Chemical Society","Creative Commons Attribution 4.0 International","http://creativecommons.org/licenses/by/4.0/",,"Singlet Oxygen Phosphorescence as a Probe for Triplet-State Dissolved Organic Matter Reactivity","Journal Article","Open access",,,,"2018-08-31T07:05:16Z",,,,,,"yes",,,,,,,"Electron transfer properties of photoexcited natural organic matter","156198","10.13039/501100001711","SNF","Projekte MINT",,"85050600000",,"000442706700019","Environ. Sci. Technol.","16","Environmental Science & Technology","52","ETH Zürich::00002 - ETH Zürich::00012 - Lehre und Forschung::00007 - Departemente::02350 - Dep. Umweltsystemwissenschaften / Dep. of Environmental Systems Science::02721 - Inst. f. Biogeochemie u. Schadstoffdyn. / Inst. Biogeochem. and Pollutant Dynamics::03850 - McNeill, Kristopher / McNeill, Kristopher","ETH Zürich::00002 - ETH Zürich::00012 - Lehre und Forschung::00007 - Departemente::02350 - Dep. Umweltsystemwissenschaften / Dep. of Environmental Systems Science::02721 - Inst. f. Biogeochemie u. Schadstoffdyn. / Inst. Biogeochem. and Pollutant Dynamics::03850 - McNeill, Kristopher / McNeill, Kristopher","03850","03850",,"9178","9170","Washington, DC","published",,,,,,,,,,,,,,,"2018-08-31T08:02:01Z","2023-02-06T15:50:05Z","true",,"SCOPUS",,,"publishedVersion",
"250100","20.500.11850/3","Frölicher, Thomas L.||Fischer, Erich M.||Gruber, Nicolas",,,,,,,,"2018-08-27T08:49:36Z","2018-08-25T08:27:19Z||2018-08-27T08:49:36Z",,"2018-08-15",,,,,,"0028-0836||1476-4687",,"10.1038/s41586-018-0383-9","http://hdl.handle.net/20.500.11850/284539","en","Nature Publishing Group",,,,"Marine heatwaves under global warming","Journal Article","Metadata only",,,,"2018-08-25T08:27:25Z",,,,,,"yes",,,,,,,,,,,,,"85051643971",,"000441673400038",,"7718","Nature","560","ETH Zürich::00002 - ETH Zürich::00012 - Lehre und Forschung::00007 - Departemente::02350 - Dep. Umweltsystemwissenschaften / Dep. of Environmental Systems Science::02717 - Institut für Atmosphäre und Klima / Inst. Atmospheric and Climate Science::03777 - Knutti, Reto / Knutti, Reto||ETH Zürich::00002 - ETH Zürich::00012 - Lehre und Forschung::00007 - Departemente::02350 - Dep. Umweltsystemwissenschaften / Dep. of Environmental Systems Science::02721 - Inst. f. Biogeochemie u. Schadstoffdyn. / Inst. Biogeochem. and Pollutant Dynamics::03731 - Gruber, Nicolas / Gruber, Nicolas","ETH Zürich::00002 - ETH Zürich::00012 - Lehre und Forschung::00007 - Departemente::02350 - Dep. Umweltsystemwissenschaften / Dep. of Environmental Systems Science::02717 - Institut für Atmosphäre und Klima / Inst. Atmospheric and Climate Science::03777 - Knutti, Reto / Knutti, Reto||ETH Zürich::00002 - ETH Zürich::00012 - Lehre und Forschung::00007 - Departemente::02350 - Dep. Umweltsystemwissenschaften / Dep. of Environmental Systems Science::02721 - Inst. f. Biogeochemie u. Schadstoffdyn. / Inst. Biogeochem. and Pollutant Dynamics::03731 - Gruber, Nicolas / Gruber, Nicolas","03777||03731","03777||03731",,"364","360","London","published",,,,,,,,,,,,,,,"2018-08-27T08:49:37Z","2022-03-28T21:05:27Z","true",,"SCOPUS",,,,
"271874","20.500.11850/9","Borer, Benedict||Ataman, Meric||Hatzimanikatis, Vassily||Or, Dani",,,,,,,,"2019-01-07T11:31:09Z","2019-01-07T09:37:37Z||2019-01-07T11:28:55Z||2019-01-07T11:31:09Z",,"2018-08-14","2019-01-07",,"application/pdf","10.3929/ethz-b-000313913",,,,,"http://hdl.handle.net/20.500.11850/313913","en","ETH Zurich, Soil and Terrestrial Environmental Physics","In Copyright - Non-Commercial Use Permitted","http://rightsstatements.org/page/InC-NC/1.0/",,"Integrating metabolic networks into an individual based model of bacterial life in soil","Conference Poster","Open access",,,,"2019-01-07T09:37:39Z",,,,,,"yes","17th International Symposium on Microbial Ecology (ISME17 2018)","August 12-17, 2018","Leipzig, Germany",,,,,,,,,,,,,,,,,"ETH Zürich::00002 - ETH Zürich::00012 - Lehre und Forschung::00007 - Departemente::02350 - Dep. Umweltsystemwissenschaften / Dep. of Environmental Systems Science::02721 - Inst. f. Biogeochemie u. Schadstoffdyn. / Inst. Biogeochem. and Pollutant Dynamics::03812 - Or, Dani (emeritus) / Or, Dani (emeritus)","ETH Zürich::00002 - ETH Zürich::00012 - Lehre und Forschung::00007 - Departemente::02350 - Dep. Umweltsystemwissenschaften / Dep. of Environmental Systems Science::02721 - Inst. f. Biogeochemie u. Schadstoffdyn. / Inst. Biogeochem. and Pollutant Dynamics::03812 - Or, Dani (emeritus) / Or, Dani (emeritus)","03812","03812",,,,"Zurich","published",,,,,,,,,,,,,,,"2019-01-07T11:29:01Z","2021-02-15T03:14:19Z","true","1 p.","FORM",,,"submittedVersion",
"249667","20.500.11850/3","Helfenstein, Julian||Tamburini, Federica||von Sperber, Christian||Massey, Michael||Pistocchi, Chiara||Chadwick, Oliver||Vitousek, Peter||Kretzschmar, Ruben||Frossard, Emmanuel",,,,,,,,"2018-08-23T09:52:45Z","2018-08-23T08:04:32Z||2018-08-23T09:52:45Z",,"2018-08-13",,"Current understanding of phosphorus (P) cycling in soils can be enhanced by integrating previously discrete findings concerning P speciation, exchange kinetics, and the underlying biological and geochemical processes. Here, we combine sequential extraction with P K-edge X-ray absorption spectroscopy and isotopic methods (33P and 18O in phosphate) to characterize P cycling on a climatic gradient in Hawaii. We link P pools to P species and estimate the turnover times for commonly considered P pools. Dissolved P turned over in seconds, resin-extractable P in minutes, NaOH-extractable inorganic P in weeks to months, and HCl-extractable P in years to millennia. Furthermore, we show that in arid-zone soils, some primary mineral P remains even after 150 ky of soil development, whereas in humid-zone soils of the same age, all P in all pools has been biologically cycled. The integrative information we provide makes possible a more dynamic, process-oriented conceptual model of P cycling in soils.","application/pdf","10.3929/ethz-b-000283995",,"2041-1723",,"10.1038/s41467-018-05731-2","http://hdl.handle.net/20.500.11850/283995","en","Nature Publishing Group","Creative Commons Attribution 4.0 International","http://creativecommons.org/licenses/by/4.0/",,"Combining spectroscopic and isotopic techniques gives a dynamic view of phosphorus cycling in soil","Journal Article","Open access",,,,"2018-08-23T08:04:37Z",,,,,,"yes",,,,,,,"Forms and dynamics of soil phosphorus along a climosequence on basalt-derived soils (CLIMP)","162422","10.13039/501100001711","SNF","Projekte MINT",,"85051663673",,"000441382000004","Nat Commun",,"Nature Communications","9","ETH Zürich::00002 - ETH Zürich::00012 - Lehre und Forschung::00007 - Departemente::02350 - Dep. Umweltsystemwissenschaften / Dep. of Environmental Systems Science::02703 - Institut für Agrarwissenschaften / Institute of Agricultural Sciences::03427 - Frossard, Emmanuel / Frossard, Emmanuel||ETH Zürich::00002 - ETH Zürich::00012 - Lehre und Forschung::00007 - Departemente::02350 - Dep. Umweltsystemwissenschaften / Dep. of Environmental Systems Science::02703 - Institut für Agrarwissenschaften / Institute of Agricultural Sciences::03427 - Frossard, Emmanuel / Frossard, Emmanuel||ETH Zürich::00002 - ETH Zürich::00012 - Lehre und Forschung::00007 - Departemente::02350 - Dep. Umweltsystemwissenschaften / Dep. of Environmental Systems Science::02703 - Institut für Agrarwissenschaften / Institute of Agricultural Sciences::03427 - Frossard, Emmanuel / Frossard, Emmanuel||ETH Zürich::00002 - ETH Zürich::00012 - Lehre und Forschung::00007 - Departemente::02350 - Dep. Umweltsystemwissenschaften / Dep. of Environmental Systems Science::02721 - Inst. f. Biogeochemie u. Schadstoffdyn. / Inst. Biogeochem. and Pollutant Dynamics::03541 - Kretzschmar, Ruben / Kretzschmar, Ruben||ETH Zürich::00002 - ETH Zürich::00012 - Lehre und Forschung::00007 - Departemente::02350 - Dep. Umweltsystemwissenschaften / Dep. of Environmental Systems Science::02703 - Institut für Agrarwissenschaften / Institute of Agricultural Sciences::03427 - Frossard, Emmanuel / Frossard, Emmanuel","ETH Zürich::00002 - ETH Zürich::00012 - Lehre und Forschung::00007 - Departemente::02350 - Dep. Umweltsystemwissenschaften / Dep. of Environmental Systems Science::02703 - Institut für Agrarwissenschaften / Institute of Agricultural Sciences::03427 - Frossard, Emmanuel / Frossard, Emmanuel||ETH Zürich::00002 - ETH Zürich::00012 - Lehre und Forschung::00007 - Departemente::02350 - Dep. Umweltsystemwissenschaften / Dep. of Environmental Systems Science::02703 - Institut für Agrarwissenschaften / Institute of Agricultural Sciences::03427 - Frossard, Emmanuel / Frossard, Emmanuel||ETH Zürich::00002 - ETH Zürich::00012 - Lehre und Forschung::00007 - Departemente::02350 - Dep. Umweltsystemwissenschaften / Dep. of Environmental Systems Science::02703 - Institut für Agrarwissenschaften / Institute of Agricultural Sciences::03427 - Frossard, Emmanuel / Frossard, Emmanuel||ETH Zürich::00002 - ETH Zürich::00012 - Lehre und Forschung::00007 - Departemente::02350 - Dep. Umweltsystemwissenschaften / Dep. of Environmental Systems Science::02721 - Inst. f. Biogeochemie u. Schadstoffdyn. / Inst. Biogeochem. and Pollutant Dynamics::03541 - Kretzschmar, Ruben / Kretzschmar, Ruben||ETH Zürich::00002 - ETH Zürich::00012 - Lehre und Forschung::00007 - Departemente::02350 - Dep. Umweltsystemwissenschaften / Dep. of Environmental Systems Science::02703 - Institut für Agrarwissenschaften / Institute of Agricultural Sciences::03427 - Frossard, Emmanuel / Frossard, Emmanuel","03427||03427||03427||03541||03427","03427||03427||03427||03541||03427",,,"3226","London","published",,,,,,,,,,,,,,,"2018-08-23T09:52:50Z","2022-03-28T21:04:44Z","true","9 p.","WOS",,,"publishedVersion",
"287668","20.500.11850/9","Ben Said, Sami||Tecon, Robin||Or, Dani",,,,,,,,"2019-03-28T07:46:10Z","2019-01-23T11:16:02Z||2019-03-28T07:46:10Z",,"2018-08-12",,,,,,,,,"http://hdl.handle.net/20.500.11850/318910","en",,,,,"Spatial segregation of microbial consortia: biodiesel production example","Conference Poster","Metadata only",,,,"2019-01-23T11:16:04Z",,,,,,"no","17th International Symposium on Microbial Ecology (ISME17 2018)","August 12-17, 2018","Leipzig, Germany",,,,,,,,,,,,,,,,,"ETH Zürich::00002 - ETH Zürich::00012 - Lehre und Forschung::00007 - Departemente::02350 - Dep. Umweltsystemwissenschaften / Dep. of Environmental Systems Science::02721 - Inst. f. Biogeochemie u. Schadstoffdyn. / Inst. Biogeochem. and Pollutant Dynamics::03812 - Or, Dani (emeritus) / Or, Dani (emeritus)","ETH Zürich::00002 - ETH Zürich::00012 - Lehre und Forschung::00007 - Departemente::02350 - Dep. Umweltsystemwissenschaften / Dep. of Environmental Systems Science::02721 - Inst. f. Biogeochemie u. Schadstoffdyn. / Inst. Biogeochem. and Pollutant Dynamics::03812 - Or, Dani (emeritus) / Or, Dani (emeritus)","03812","03812",,,,,"published",,,,,,,,,,,,,,,"2019-03-28T07:46:34Z","2019-03-28T07:46:34Z","true","1 p.","FORM",,,,
"250372","20.500.11850/3","Capelli, Achille||Reiweger, Ingrid||Lehmann, Peter||Schweizer, Jürg",,,,,,,,"2018-08-28T09:53:00Z","2018-08-24T08:23:34Z||2018-08-28T09:53:00Z",,"2018-08","2018-08-15","Snow is a heterogeneous material with strain- and/or load-rate-dependent strength. In particular, a transition from ductile-to-brittle failure behavior with increasing load rate is observed. The rate-dependent behavior can partly be explained with the existence of a unique healing mechanism in snow that stems from its high homologous temperature (temperature close to melting point). As soon as broken elements in the ice matrix get in contact, they start sintering and the structure may regain strength. Moreover, the ice matrix is subjected to viscous deformation, inducing a relaxation of local load concentrations and, therefore, further counteracting the damage process. Ideal tools for studying the failure process of heterogeneous materials are the fiber-bundle models (FBMs), which allow investigating the effects of basic microstructural characteristics on the general macroscopic failure behavior. We present an FBM with two concurrent time-dependent healing mechanisms: sintering of broken fibers and relaxation of load inhomogeneities. Sintering compensates damage by creating additional intact, load-supporting fibers which lead to an increase of the bundle strength. However, the character of the failure is not changed by sintering alone. With combined sintering and load relaxation, load is distributed from old stronger fibers to new fibers that carry fewer load. So as we additionally incorporated load redistribution to the FBM, the failure occurred suddenly without decrease of the order parameter—describing the amount of damage in the bundle—and without divergence of the fiber failure rate. Moreover, the b value, i.e., the power-law exponent of frequency-magnitude statistics of fibers breaking in load redistribution steps, at failure converged to b≈2, a value higher than that of a classical FBM without healing (b=32). These results indicate that healing, as the combined effect of sintering and load relaxation, changes the type of the phase transition at failure. This change of the phase transition is important for quantifying or predicting the failure (e.g., by monitoring acoustic emissions) of snow or other materials for which healing plays an important role.","application/pdf","10.3929/ethz-b-000284322",,"1539-3755||1063-651X||1095-3787||1550-2376",,"10.1103/PhysRevE.98.023002","http://hdl.handle.net/20.500.11850/284322","en","American Physical Society","Creative Commons Attribution 4.0 International","http://creativecommons.org/licenses/by/4.0/",,"Fiber-bundle model with time-dependent healing mechanisms to simulate progressive failure of snow","Journal Article","Open access",,,,"2018-08-24T08:23:36Z",,,,,,"yes",,,,,,,,,,,,,"85051480059",,"000441720300005","Phys. rev., E","2","Physical Review E","98","ETH Zürich::00002 - ETH Zürich::00012 - Lehre und Forschung::00007 - Departemente::02350 - Dep. Umweltsystemwissenschaften / Dep. of Environmental Systems Science::02721 - Inst. f. Biogeochemie u. Schadstoffdyn. / Inst. Biogeochem. and Pollutant Dynamics::03812 - Or, Dani (emeritus) / Or, Dani (emeritus)","ETH Zürich::00002 - ETH Zürich::00012 - Lehre und Forschung::00007 - Departemente::02350 - Dep. Umweltsystemwissenschaften / Dep. of Environmental Systems Science::02721 - Inst. f. Biogeochemie u. Schadstoffdyn. / Inst. Biogeochem. and Pollutant Dynamics::03812 - Or, Dani (emeritus) / Or, Dani (emeritus)","03812","03812",,,"023002","Ridge, NY","published",,,,,,,,,,,,,,,"2018-08-28T09:53:04Z","2021-02-15T01:25:30Z","true","11 p.","SCOPUS",,,"publishedVersion",
"247191","20.500.11850/16","Ruiz, Siul A.",,,,,,,"Or, Dani||Schymanski, Stanislaus J.||Keller, Thomas||Hallett, Paul","2018-08-06T11:13:50Z","2018-08-06T10:13:18Z||2018-08-06T11:13:50Z",,"2018-08",,,"application/pdf","10.3929/ethz-b-000280625",,,,,"http://hdl.handle.net/20.500.11850/280625","en","ETH Zurich","In Copyright - Non-Commercial Use Permitted","http://rightsstatements.org/page/InC-NC/1.0/",,"Mechanics and Energetics of Soil Bioturbation by Earthworms and Growing Plant Roots","Doctoral Thesis","Open access",,"DDC - DDC::6 - Technology, medicine and applied sciences::630 - Agriculture||DDC - DDC::5 - Science::580 - Botanical sciences||DDC - DDC::5 - Science::590 - Zoological sciences",,"2018-08-06T10:13:19Z",,,,,,"yes",,,,,,,,,,,,"25015",,,,,,,,"ETH Zürich::00002 - ETH Zürich::00012 - Lehre und Forschung::00007 - Departemente::02350 - Dep. Umweltsystemwissenschaften / Dep. of Environmental Systems Science::02721 - Inst. f. Biogeochemie u. Schadstoffdyn. / Inst. Biogeochem. and Pollutant Dynamics::03812 - Or, Dani (emeritus) / Or, Dani (emeritus)","ETH Zürich::00002 - ETH Zürich::00012 - Lehre und Forschung::00007 - Departemente::02350 - Dep. Umweltsystemwissenschaften / Dep. of Environmental Systems Science::02721 - Inst. f. Biogeochemie u. Schadstoffdyn. / Inst. Biogeochem. and Pollutant Dynamics::03812 - Or, Dani (emeritus) / Or, Dani (emeritus)","03812","03812",,,,"Zurich","published",,,,,,,,,,,,,,,"2018-08-06T11:13:58Z","2021-02-15T00:58:14Z","true","228 p.","FORM",,,,
