"455454","20.500.11850/28","Pärli, Rea||Lieberherr, Eva||Holderegger, Rolf||Gugerli, Felix||Widmer, Alex||Fischer, Martin C.",,,,,,"2022-06-20T15:00:53Z","2022-06-13T07:03:37Z||2022-06-20T15:00:53Z",,"2022-05-10",,"Von internationalen Konventionen wird ein Monitoring der genetischen Vielfalt in natürlichen Populationen von wildlebenden Tier- und Pflanzenarten gefordert. Im Rahmen einer Machbarkeitsstudie für ein solches Monitoring in der Schweiz wurde festgestellt, dass sich die Stakeholder der mangelnden Datengrundlage zur genetischen Vielfalt bewusst sind. Bedenken wurden bezüglich Finanzierbarkeit und Praxisnutzen geäussert.||Les conventions internationales exigent un monitoring de la diversité génétique dans les populations naturelles d’espèces animales et végétales sauvages. Dans le cadre d’une étude de faisabilité pour un tel monitoring en Suisse, il a été constaté que les parties prenantes sont conscientes qu’il manque une base de données sur la diversité génétique. Des inquiétudes ont été exprimées quant à la faisabilité financière et l’utilité pratique d’un tel monitoring.",,,,,,,"http://hdl.handle.net/20.500.11850/551926","de||fr","Forum Biodiversität Schweiz",,,"Genetische Diversität||Monitoring||Stakeholder||Konventionen","Mögliches Monitoring der genetischen Vielfalt – Interessen, Erwartungen und Vorbehalte","Monitoring éventuel de la diversité génétique: intérêts, attentes et réserves","Other Publication","Metadata only",,,,,"2022-06-13T07:03:43Z",,,,"yes",,,,,,,,,,,,,"https://biodiversitaet.scnat.ch/publications/search_details?id=1972",,,,"IBS Infodienst Biodiversität Schweiz","162","ETH Zürich::00002 - ETH Zürich::00012 - Lehre und Forschung::00007 - Departemente::02350 - Dep. Umweltsystemwissenschaften / Dep. of Environmental Systems Science::02723 - Institut für Umweltentscheidungen / Institute for Environmental Decisions::09451 - Patt, Anthony G. / Patt, Anthony G.::08693 - Gruppe Natural Resource Policy / Natural Resource Policy||ETH Zürich::00002 - ETH Zürich::00012 - Lehre und Forschung::00007 - Departemente::02350 - Dep. Umweltsystemwissenschaften / Dep. of Environmental Systems Science::02720 - Institut für Integrative Biologie / Institute of Integrative Biology::03706 - Widmer, Alexander / Widmer, Alexander","ETH Zürich::00002 - ETH Zürich::00012 - Lehre und Forschung::00007 - Departemente::02350 - Dep. Umweltsystemwissenschaften / Dep. of Environmental Systems Science::02723 - Institut für Umweltentscheidungen / Institute for Environmental Decisions::09451 - Patt, Anthony G. / Patt, Anthony G.::08693 - Gruppe Natural Resource Policy / Natural Resource Policy||ETH Zürich::00002 - ETH Zürich::00012 - Lehre und Forschung::00007 - Departemente::02350 - Dep. Umweltsystemwissenschaften / Dep. of Environmental Systems Science::02720 - Institut für Integrative Biologie / Institute of Integrative Biology::03706 - Widmer, Alexander / Widmer, Alexander","08693||03706","08693||03706",,,,,"published",,,,,"10.1007/s10592-021-01379-6",,"2022-06-20T15:01:01Z","2023-02-07T03:38:14Z","true",,"FORM",,,,
"460879","20.500.11850/3","Qiu, Tong||Andrus, Robert||Aravena, Marie-Claire||Ascoli, Davide||Bergeron, Yves||Berretti, Roberta||Berveiller, Daniel||Bogdziewicz, Michal||Boivin, Thomas||Bonal, Raul||Bragg, Don C.||Caignard, Thomas||Calama, Rafael||Camarero, J. Julio||Chang‐Yang, Chia‐Hao||Cleavitt, Natalie L.||Courbaud, Benoît||Courbet, Francois||Curt, Thomas||Das, Adrian J.||Daskalakou, Evangelia||Davi, Hendrik||Delpierre, Nicolas||Delzon, Sylvain||Dietze, Michael||Donoso Calderon, Sergio||Dormont, Laurent||Espelta, Josep||Fahey, Timothy J.||Farfan-Rios, William||Gehring, Catherine A.||Gilbert, Gregory S.||Gratzer, Georg||Greenberg, Cathryn H.||Guo, Qinfeng||Hacket-Pain, Andrew||Hampe, Arndt||Han, Qingmin||Hille Ris Lambers, Janneke||Hoshizaki, Kazuhiko||Ibanez, Ines||Johnstone, Jill F.||Journé, Valentin||Kabeya, Daisuke||Kilner, Christopher L.||Kitzberger, Thomas||Knops, Johannes M.H.||Kobe, Richard K.||Kunstler, Georges||Lageard, Jonathan G.A.||LaMontagne, Jalene M.||Ledwon, Mateusz||Lefevre, Francois||Leininger, Theodor||Limousin, Jean‐Marc||Lutz, James A.||Macias, Diana||McIntire, Eliot J.B.||Moore, Christopher M.||Moran, Emily||Motta, Renzo||Myers, Jonathan A.||Nagel, Thomas A.||Noguchi, Kyotaro||Ourcival, Jean-Marc||Parmenter, Robert||Pearse, Ian S.||Pérez-Ramos, Ignacio M.||Piechnik, Lukasz||Poulsen, John||Poulton-Kamakura, Renata||Redmond, Miranda D.||Reid, Chantal D.||Rodman, Kyle C.||Rodriguez-Sanchez, Francisco||Sanguinetti, Javier D.||Scher, C. Lane||Schlesinger, William H.||Schmidt Van Marle, Harald||Seget, Barbara||Sharma, Shubhi||Silman, Miles||Steele, Michael A.||Stephenson, Nathan L.||Straub, Jacob N.||Sun, I Fang||Sutton, Samantha||Swenson, Jennifer J.||Swift, Margaret||Thomas, Peter A.||Uriarte, Maria||Vacchiano, Giorgio||Veblen, Thomas T.||Whipple, Amy V.||Whitham, Thomas G.||Wion, Andreas P.||Wright, Boyd||Wright, S. Joseph||Zhu, Kai||Zimmerman, Jess K.||Zlotin, Roman||Zywiec, Magdalena||Clark, James S.",,,,,,"2022-07-29T06:38:01Z","2022-05-14T03:55:47Z||2022-07-29T06:38:01Z",,"2022-05-02",,"The relationships that control seed production in trees are fundamental to understanding the evolution of forest species and their capacity to recover from increasing losses to drought, fire, and harvest. A synthesis of fecundity data from 714 species worldwide allowed us to examine hypotheses that are central to quantifying reproduction, a foundation for assessing fitness in forest trees. Four major findings emerged. First, seed production is not constrained by a strict trade-off between seed size and numbers. Instead, seed numbers vary over ten orders of magnitude, with species that invest in large seeds producing more seeds than expected from the 1:1 trade-off. Second, gymnosperms have lower seed production than angiosperms, potentially due to their extra investments in protective woody cones. Third, nutrient-demanding species, indicated by high foliar phosphorus concentrations, have low seed production. Finally, sensitivity of individual species to soil fertility varies widely, limiting the response of community seed production to fertility gradients. In combination, these findings can inform models of forest response that need to incorporate reproductive potential.","application/pdf","10.3929/ethz-b-000547198",,"2041-1723",,"10.1038/s41467-022-30037-9","http://hdl.handle.net/20.500.11850/547198","en","Nature","Creative Commons Attribution 4.0 International","http://creativecommons.org/licenses/by/4.0/",,"Limits to reproduction and seed size-number trade-offs that shape forest dominance and future recovery",,"Journal Article","Open access",,,,,"2022-05-14T03:55:49Z",,,,"yes",,,,,,,,,,,,"85129342208",,"000789924700024","Nat Commun",,"Nature Communications","13","ETH Zürich::00002 - ETH Zürich::00012 - Lehre und Forschung::00007 - Departemente::02350 - Dep. Umweltsystemwissenschaften / Dep. of Environmental Systems Science::02720 - Institut für Integrative Biologie / Institute of Integrative Biology::09716 - Hille Ris Lambers, Janneke / Hille Ris Lambers, Janneke","ETH Zürich::00002 - ETH Zürich::00012 - Lehre und Forschung::00007 - Departemente::02350 - Dep. Umweltsystemwissenschaften / Dep. of Environmental Systems Science::02720 - Institut für Integrative Biologie / Institute of Integrative Biology::09716 - Hille Ris Lambers, Janneke / Hille Ris Lambers, Janneke","09716","09716",,,"2381","London","published",,,,,,,"2022-07-29T06:38:09Z","2023-02-07T04:54:26Z","true","12 p.","SCOPUS",,,"publishedVersion",
"495200","20.500.11850/41","Fischer, Martin C.",,,,,,"2023-03-31T09:45:06Z","2022-12-22T12:08:46Z||2023-03-31T09:45:06Z",,"2022-05-02",,,,,,,,,"http://hdl.handle.net/20.500.11850/588853","de",,,,,"Pilotstudie zum Zustand und der Veränderung der genetischen Vielfalt in der Schweiz",,"Presentation","Metadata only",,,,,"2022-12-22T12:08:46Z",,,,"yes","Séance des Monitorings de la Biodiversité","May 2, 2022","Bern, Switzerland",,,,,,,,,,,,,,,,"ETH Zürich::00002 - ETH Zürich::00012 - Lehre und Forschung::00007 - Departemente::02350 - Dep. Umweltsystemwissenschaften / Dep. of Environmental Systems Science::02720 - Institut für Integrative Biologie / Institute of Integrative Biology::03706 - Widmer, Alexander / Widmer, Alexander","ETH Zürich::00002 - ETH Zürich::00012 - Lehre und Forschung::00007 - Departemente::02350 - Dep. Umweltsystemwissenschaften / Dep. of Environmental Systems Science::02720 - Institut für Integrative Biologie / Institute of Integrative Biology::03706 - Widmer, Alexander / Widmer, Alexander","03706","03706",,,,,"unpublished",,,,,,,"2023-03-31T09:45:07Z","2023-03-31T09:45:07Z","true",,"FORM",,,,
"480791","20.500.11850/3","Mathers, Kate L.||Robinson, Christopher T.||Weber, Christine",,,,,,"2022-12-16T12:49:57Z","2022-12-16T12:49:57Z",,"2022-05","2022-01-19","Flow refugia, locations that maintain substrate stability and low hydraulic stress during periods of high flow, can ensure riverine resilience in the face of increasing hydrological unpredictability. Despite their known importance, they have been overlooked in recent years with work on drought refugia currently seeing greater attention. Moreover, research on the role of flow refugia during artificial flood pulses in regulated rivers, where flood disturbances are no longer part of the hydrograph, is essentially absent. Here, we compared flow refugia for benthic macroinvertebrates among six habitats (main channel, side channel, riffle, margin, lentic including a floodplain pond, and inundated floodplain) within four different sites in response to an artificial flood pulse. We found that the grain-size distribution and macroinvertebrate community composition changed at each site following the flood. Macroinvertebrate assemblages became longitudinally homogeneous, but within-site beta diversity and taxa richness remained temporally stable following the flood pulse, suggesting the presence of flow refugia. In this respect, margin, inundated floodplain and lentic (a floodplain pond) habitats provided important flow refugia locations, particularly for the mobile mayfly Rhithrogena sp. In contrast, low substrate stability in riffle and side channels resulted in limited refugia potential for most taxa. Refuge use was however patchy with high levels of intra-habitat variability being evident for Rhithrogena sp. and the amphipod Gammarus fossarum in margin and side channel habitats. Further work is required to advance our knowledge of flow refugia in rivers with differing flow regimes to enable their integration into management and restoration schemes.","application/pdf","10.3929/ethz-b-000530412",,"1535-1459||1535-1467","http://hdl.handle.net/20.500.11850/587495||http://hdl.handle.net/20.500.11850/530412","10.1002/rra.3941","http://hdl.handle.net/20.500.11850/587722","en","Wiley","Creative Commons Attribution 4.0 International","http://creativecommons.org/licenses/by/4.0/","benthic macroinvertebrates||experimental flood||habitat diversity||patchiness||stability","Patchiness in flow refugia use by macroinvertebrates following an artificial flood pulse",,"Journal Article","Open access",,,,,"2022-02-02T04:04:38Z",,,,"yes",,,,,,,,,,,,"85122934601",,"000744327200001","River Res. Appl.","4","River Research and Applications","38","ETH Zürich::00002 - ETH Zürich::00012 - Lehre und Forschung::00007 - Departemente::02350 - Dep. Umweltsystemwissenschaften / Dep. of Environmental Systems Science::02720 - Institut für Integrative Biologie / Institute of Integrative Biology::03705 - Jokela, Jukka / Jokela, Jukka","ETH Zürich::00002 - ETH Zürich::00012 - Lehre und Forschung::00007 - Departemente::02350 - Dep. Umweltsystemwissenschaften / Dep. of Environmental Systems Science::02720 - Institut für Integrative Biologie / Institute of Integrative Biology::03705 - Jokela, Jukka / Jokela, Jukka","03705","03705",,"707","696","Hoboken, NJ","published",,,,,,,"2022-12-16T12:49:59Z","2023-02-07T08:54:41Z","true",,"BATCH||WOS",,,"publishedVersion",
"480814","20.500.11850/3","Drost, Annemieke M.||Siebers, Andre R.||Paillex, Amael||Misteli, Benjamin||Peeters, Edwin T.H.M.||Robinson, Christopher T.",,,,,,"2022-12-16T13:23:48Z","2022-12-16T13:23:48Z",,"2022-05","2022-03-29","Changing weather patterns and receding glaciers are predicted to increase flow intermittency in alpine streams. If aquatic macroinvertebrate communities largely comprise taxa adapted to perennial flows, an increase in flow intermittency substantially reduces biodiversity and affects functional processes. We conducted a before-after-control-impact field experiment to examine how macroinvertebrate communities in an alpine headwater stream responded to and recovered from a repeated experimental increase in flow intermittency. Flow in one channel was manipulated to simulate increased summer intermittency (June-September) over two consecutive years, whilst an adjacent channel served as a control. We monitored the density of benthic macroinvertebrates, periphyton and organic matter at approximately monthly intervals over three years during the snow-free period. Before manipulation, both channels had similar ecological properties. The flow manipulation reduced the overall macroinvertebrate density, and especially the proportional rheophile density, across both years. Recovery of the macroinvertebrate community following experimental flow intermittency took more than a year, and longer than our study period. This could be due to long aquatic life stages, dispersal limitation and biotic interactions. We conclude that climate-induced changes in alpine stream flow regimes can lead to a fundamental shift in macroinvertebrate assemblages through local extinctions, mostly of rheophilic species.","application/pdf","10.3929/ethz-b-000542512",,"0018-8158||1573-5117","http://hdl.handle.net/20.500.11850/587486||http://hdl.handle.net/20.500.11850/542512","10.1007/s10750-022-04843-7","http://hdl.handle.net/20.500.11850/587756","en","Springer","Creative Commons Attribution 4.0 International","http://creativecommons.org/licenses/by/4.0/","Glacial||Biodiversity||Intermittent rivers||Ephemeral streams||Rheophilic","Long-lasting effects of experimental flow intermittency on alpine stream macroinvertebrates (Val Roseg, Switzerland)",,"Journal Article","Open access",,,,,"2022-04-15T08:16:15Z",,,,"yes",,,,,,,,,,,,"85127347202",,"000774611900001","Hydrobiologia","8","Hydrobiologia","849","ETH Zürich::00002 - ETH Zürich::00012 - Lehre und Forschung::00007 - Departemente::02350 - Dep. Umweltsystemwissenschaften / Dep. of Environmental Systems Science::02720 - Institut für Integrative Biologie / Institute of Integrative Biology::03705 - Jokela, Jukka / Jokela, Jukka","ETH Zürich::00002 - ETH Zürich::00012 - Lehre und Forschung::00007 - Departemente::02350 - Dep. Umweltsystemwissenschaften / Dep. of Environmental Systems Science::02720 - Institut für Integrative Biologie / Institute of Integrative Biology::03705 - Jokela, Jukka / Jokela, Jukka","03705","03705",,"1946","1931","Dordrecht","published",,,,,,,"2022-12-16T13:23:50Z","2023-02-07T08:54:51Z","true",,"BATCH||WOS",,,"publishedVersion",
"480825","20.500.11850/3","Siebers, Andre R.||Paillex, Amael||Robinson, Christopher T.",,,,,,"2022-12-16T13:34:24Z","2022-12-16T13:34:24Z",,"2022-05","2022-03-07","In high-altitude Alpine streams, seasonal cycles of snowmelt, glacial melt, and rainfall drive variation in the availability of algal food resources. Yet, high-altitude streams also exhibit varying degrees of flow intermittency, ranging from solely winter-drying streams to others that dry periodically throughout summer and autumn. These environmental drivers may interact in different ways to determine the functional trophic base of macroinvertebrates inhabiting high-altitude streams. Here, we estimated the proportional contribution of autochthonous resources to the assimilated diets of benthic macroinvertebrates in 26 headwater streams of Val Roseg, a high Alpine glacial catchment, using stable isotope analysis (δ13C and δ15N) of different macroinvertebrate families and their potential food sources. We compared dietary estimates along a gradient of flow intermittency and across three seasons (Alpine spring, summer, and autumn). Assimilation from autochthonous sources was highest for collector-gatherers and filter feeders in spring, and for grazers in summer. Grazers had higher estimated assimilation from autochthonous sources in intermittent streams than in perennial streams, particularly in summer, while collector-gatherers showed little effect of flow intermittency on dietary estimates. However, responses were highly taxon-specific, with different responses to variation in flow intermittency and season across families within functional groups. Our results suggest that frequent summer-drying events represent tradeoffs between greater access to algal food resources and a higher risk of desiccation, but that differing life history and functional feeding traits across macroinvertebrate taxa drive marked variation in the risks or benefits associated with inhabitants of drying streams.","application/pdf","10.3929/ethz-b-000537920",,"0024-3590||1939-5590","http://hdl.handle.net/20.500.11850/587505||http://hdl.handle.net/20.500.11850/537920","10.1002/lno.12059","http://hdl.handle.net/20.500.11850/587773","en","Wiley","Creative Commons Attribution 4.0 International","http://creativecommons.org/licenses/by/4.0/",,"Seasonal and functional variation in the trophic base of intermittent Alpine streams",,"Journal Article","Open access",,,,,"2022-03-19T04:07:24Z",,,,"yes",,,,,,,,,,,,"85125627396",,"000765294300001","Limnol. oceanogr.","5","Limnology and Oceanography","67","ETH Zürich::00002 - ETH Zürich::00012 - Lehre und Forschung::00007 - Departemente::02350 - Dep. Umweltsystemwissenschaften / Dep. of Environmental Systems Science::02720 - Institut für Integrative Biologie / Institute of Integrative Biology::03705 - Jokela, Jukka / Jokela, Jukka","ETH Zürich::00002 - ETH Zürich::00012 - Lehre und Forschung::00007 - Departemente::02350 - Dep. Umweltsystemwissenschaften / Dep. of Environmental Systems Science::02720 - Institut für Integrative Biologie / Institute of Integrative Biology::03705 - Jokela, Jukka / Jokela, Jukka","03705","03705",,"1110","1098","Hoboken, NJ","published",,,,,,,"2022-12-16T13:34:25Z","2023-02-07T08:54:57Z","true",,"BATCH||WOS",,,"publishedVersion",
"484918","20.500.11850/3","Lembrechts, Jonas J.||van den Hoogen, Johan||Crowther, Thomas W.||Alexander, Jake M.||Andres, Christian||Barthel, Matti||Buchmann, Nina||Eugster, Werner||Feigenwinter, Iris||Frei, Esther R.||Gharun, Mana||Hörtnagl, Lukas||Maier, Regine||Pellissier, Loïc||Pitteloud, Camille||Shekhar, Ankit||Six, Johan||Zellweger, Florian||et al.",,,,,,"2023-01-16T11:01:26Z","2022-01-06T14:13:43Z||2022-01-28T19:21:29Z||2022-04-05T09:48:02Z||2023-01-16T11:01:26Z",,"2022-05","2021-12-29","Research in global change ecology relies heavily on global climatic grids derived from estimates of air temperature in open areas at around 2 m above the ground. These climatic grids do not reflect conditions below vegetation canopies and near the ground surface, where critical ecosystem functions occur and most terrestrial species reside. Here, we provide global maps of soil temperature and bioclimatic variables at a 1-km² resolution for 0–5 and 5–15 cm soil depth. These maps were created by calculating the difference (i.e., offset) between in-situ soil temperature measurements, based on time series from over 1200 1-km² pixels (summarized from 8500 unique temperature sensors) across all the world’s major terrestrial biomes, and coarse-grained air temperature estimates from ERA5-Land (an atmospheric reanalysis by the European Centre for Medium-Range Weather Forecasts). We show that mean annual soil temperature differs markedly from the corresponding gridded air temperature, by up to 10°C (mean = 3.0 ± 2.1°C), with substantial variation across biomes and seasons. Over the year, soils in cold and/or dry biomes are substantially warmer (+3.6 ± 2.3°C) than gridded air temperature, whereas soils in warm and humid environments are on average slightly cooler (-0.7 ± 2.3°C). The observed substantial and biome-specific offsets emphasize that the projected impacts of climate and climate change on near-surface biodiversity and ecosystem functioning are inaccurately assessed when air rather than soil temperature is used, especially in cold environments. The global soil-related bioclimatic variables provided here are an important step forward for any application in ecology and related disciplines. Nevertheless, we highlight the need to fill remaining geographic gaps by collecting more in-situ measurements of microclimate conditions to further enhance the spatiotemporal resolution of global soil temperature products for ecological applications.","application/pdf","10.3929/ethz-b-000523670",,"1354-1013||1365-2486",,"10.1111/gcb.16060","http://hdl.handle.net/20.500.11850/523670","en","Wiley","Creative Commons Attribution-NonCommercial 4.0 International","http://creativecommons.org/licenses/by-nc/4.0/","Bioclimatic variables||global maps||microclimate||near-surface temperatures||soil temperature||soil-dwelling organisms||temperature offset||weather stations","Global maps of soil temperature",,"Journal Article","Open access",,,,,"2022-01-06T14:13:49Z",,,,"yes",,,,"Robust models for assessing the effectiveness of technologies and managements to reduce N2O emissions from grazed pastures (Models4Pastures)||ICOS-CH: Integrated Carbon Observation System in Switzerland||ICOS-CH Phase 2||Reconciling innovative farming practices and networks to enable sustainable development of smart Swiss farming systems||Developing SUstainable PERmanent Grassland systems and policies","154245||148992||173691||172433||774124","10.13039/501100001711||10.13039/501100001711||10.13039/501100001711||10.13039/501100001711||10.13039/501100000780","SNF||SNF||SNF||SNF||EC","FACCE-JPI||Projektförderung in Mathematik, Natur- und Ingenieurwissenschaften (Abteilung II)||Forschungsinfrastrukturen||NFP 73: Gesuch||H2020",,,,"85123931737",,"000753944300001","Glob. Chang. Biol.","9","Global Change Biology","28","ETH Zürich::00002 - ETH Zürich::00012 - Lehre und Forschung::00007 - Departemente::02350 - Dep. Umweltsystemwissenschaften / Dep. of Environmental Systems Science::02703 - Institut für Agrarwissenschaften / Institute of Agricultural Sciences::03648 - Buchmann, Nina / Buchmann, Nina||ETH Zürich::00002 - ETH Zürich::00012 - Lehre und Forschung::00007 - Departemente::02350 - Dep. Umweltsystemwissenschaften / Dep. of Environmental Systems Science::02720 - Institut für Integrative Biologie / Institute of Integrative Biology::09625 - Crowther, Thomas Ward / Crowther, Thomas Ward||ETH Zürich::00002 - ETH Zürich::00012 - Lehre und Forschung::00007 - Departemente::02350 - Dep. Umweltsystemwissenschaften / Dep. of Environmental Systems Science::02720 - Institut für Integrative Biologie / Institute of Integrative Biology::09666 - Alexander, Jake (ehemalig) / Alexander, Jake (former)||ETH Zürich::00002 - ETH Zürich::00012 - Lehre und Forschung::00007 - Departemente::02350 - Dep. Umweltsystemwissenschaften / Dep. of Environmental Systems Science::02703 - Institut für Agrarwissenschaften / Institute of Agricultural Sciences::03982 - Six, Johan / Six, Johan||ETH Zürich::00002 - ETH Zürich::00012 - Lehre und Forschung::00007 - Departemente::02350 - Dep. Umweltsystemwissenschaften / Dep. of Environmental Systems Science::02722 - Institut für Terrestrische Oekosysteme / Institute of Terrestrial Ecosystems::09553 - Pellissier, Loïc / Pellissier, Loïc","ETH Zürich::00002 - ETH Zürich::00012 - Lehre und Forschung::00007 - Departemente::02350 - Dep. Umweltsystemwissenschaften / Dep. of Environmental Systems Science::02703 - Institut für Agrarwissenschaften / Institute of Agricultural Sciences::03648 - Buchmann, Nina / Buchmann, Nina||ETH Zürich::00002 - ETH Zürich::00012 - Lehre und Forschung::00007 - Departemente::02350 - Dep. Umweltsystemwissenschaften / Dep. of Environmental Systems Science::02720 - Institut für Integrative Biologie / Institute of Integrative Biology::09625 - Crowther, Thomas Ward / Crowther, Thomas Ward||ETH Zürich::00002 - ETH Zürich::00012 - Lehre und Forschung::00007 - Departemente::02350 - Dep. Umweltsystemwissenschaften / Dep. of Environmental Systems Science::02720 - Institut für Integrative Biologie / Institute of Integrative Biology::09666 - Alexander, Jake (ehemalig) / Alexander, Jake (former)||ETH Zürich::00002 - ETH Zürich::00012 - Lehre und Forschung::00007 - Departemente::02350 - Dep. Umweltsystemwissenschaften / Dep. of Environmental Systems Science::02703 - Institut für Agrarwissenschaften / Institute of Agricultural Sciences::03982 - Six, Johan / Six, Johan||ETH Zürich::00002 - ETH Zürich::00012 - Lehre und Forschung::00007 - Departemente::02350 - Dep. Umweltsystemwissenschaften / Dep. of Environmental Systems Science::02722 - Institut für Terrestrische Oekosysteme / Institute of Terrestrial Ecosystems::09553 - Pellissier, Loïc / Pellissier, Loïc","03648||09625||09666||03982||09553","03648||09625||09666||03982||09553",,"3144","3110","Oxford","published",,,,,,"true","2022-04-05T09:48:23Z","2023-02-07T09:53:00Z","true",,"FORM",,,"publishedVersion",
