"442277","20.500.11850/3","Igler, Claudia||Schwyter, Lukas||Gehrig, Daniel||Wendling, Carolin Charlotte",,,,,,"2022-03-04T16:33:24Z","2021-12-09T04:06:29Z||2022-03-03T10:07:04Z||2022-03-04T16:33:24Z",,"2022-01-17","2021-11-29","Antibiotic resistance spread via plasmids is a serious threat to successfully fight infections and makes understanding plasmid transfer in nature crucial to prevent the rise of antibiotic resistance. Studies addressing the dynamics of plasmid conjugation have yet neglected one omnipresent factor: prophages (viruses integrated into bacterial genomes), whose activation can kill host and surrounding bacterial cells. To investigate the impact of prophages on conjugation, we combined experiments and mathematical modelling. Using Escherichia coli, prophage lambda and the multidrug-resistant plasmid RP4 we find that prophages can substantially limit the spread of conjugative plasmids. This inhibitory effect was strongly dependent on environmental conditions and bacterial genetic background. Our empirically parameterized model reproduced experimental dynamics of cells acquiring either the prophage or the plasmid well but could only reproduce the number of cells acquiring both elements by assuming complex interactions between conjugative plasmids and prophages in sequential infections. Varying phage and plasmid infection parameters over empirically realistic ranges revealed that plasmids can overcome the negative impact of prophages through high conjugation rates. Overall, the presence of prophages introduces an additional death rate for plasmid carriers, the magnitude of which is determined in non-trivial ways by the environment, the phage and the plasmid. This article is part of the theme issue 'The secret lives of microbial mobile genetic elements'.","application/pdf","10.3929/ethz-b-000519641",,"0962-8436||1471-2970||0080-4622",,"10.1098/rstb.2020.0470","http://hdl.handle.net/20.500.11850/519641","en","Royal Society","Creative Commons Attribution 4.0 International","http://creativecommons.org/licenses/by/4.0/","horizontal gene transfer||prophages||plasmids||mobile genetic elements||conjugation||co-infection","Conjugative plasmid transfer is limited by prophages but can be overcome by high conjugation rates",,"Journal Article","Open access",,,,,"2021-12-09T04:06:56Z",,,,"yes",,,,"Evolution and Spread of Antibiotic Resistance Encoded by Prophages||Dynamics of phage Iysis systems and their evolutionary advantages","179743||19-2 FEL-74","10.13039/501100001711||10.13039/501100003006","SNF||ETHZ","Ambizione||ETH Fellows",,,,"85122276359",,"000723160300002","Phil. Trans. R. Soc. B","1842","Philosophical Transactions of the Royal Society B: Biological Sciences","377","ETH Zürich::00002 - ETH Zürich::00012 - Lehre und Forschung::00007 - Departemente::02350 - Dep. Umweltsystemwissenschaften / Dep. of Environmental Systems Science::02720 - Institut für Integrative Biologie / Institute of Integrative Biology::03584 - Bonhoeffer, Sebastian / Bonhoeffer, Sebastian","ETH Zürich::00002 - ETH Zürich::00012 - Lehre und Forschung::00007 - Departemente::02350 - Dep. Umweltsystemwissenschaften / Dep. of Environmental Systems Science::02720 - Institut für Integrative Biologie / Institute of Integrative Biology::03584 - Bonhoeffer, Sebastian / Bonhoeffer, Sebastian","03584","03584",,,"20200470","London","published",,,,,,,"2022-03-04T16:33:30Z","2023-02-07T00:19:11Z","true","14 p.","WOS",,,"publishedVersion",
"464103","20.500.11850/3","Rodríguez-Beltrán, Jerónimo||Leon-Sampedro, Ricardo||Ramiro-Martínez, Paula||de la Vega, Carmen||Baquero, Fernando||Levin, Bruce R.||San Millán, Álvaro",,,,,,"2022-08-22T13:28:15Z","2022-01-10T13:55:26Z||2022-03-07T13:34:14Z||2022-08-22T13:28:15Z",,"2022-01-17","2021-11-29","Plasmids are key drivers of bacterial evolution because they are crucial agents for the horizontal transfer of adaptive traits, such as antibiotic resistance. Most plasmids entail a metabolic burden that reduces the fitness of their host if there is no selection for plasmid-encoded genes. It has been hypothesized that the translational demand imposed by plasmid-encoded genes is a major mechanism driving the fitness cost of plasmids. Plasmid-encoded genes typically present a different codon usage from host chromosomal genes. As a consequence, the translation of plasmid-encoded genes might sequestrate ribosomes on plasmid transcripts, overwhelming the translation machinery of the cell. However, the pervasiveness and origins of the translation-derived costs of plasmids are yet to be assessed. Here, we systematically altered translation efficiency in the host cell to disentangle the fitness effects produced by six natural antibiotic resistance plasmids. We show that limiting translation efficiency either by reducing the number of available ribosomes or their processivity does not increase plasmid costs. Overall, our results suggest that ribosomal paucity is not a major contributor to plasmid fitness costs.","application/pdf","10.3929/ethz-b-000524295",,"0962-8436||1471-2970||0080-4622",,"10.1098/rstb.2020.0463","http://hdl.handle.net/20.500.11850/524295","de","The Royal Society","Creative Commons Attribution 4.0 International","http://creativecommons.org/licenses/by/4.0/",,"Translational demand is not a major source of plasmid-associated fitness costs",,"Journal Article","Open access",,,,,"2022-01-10T13:55:31Z",,,,"no",,,,,,,,,,,,,,,"Phil. Trans. R. Soc. B","1842","Philosophical Transactions of the Royal Society B: Biological Sciences","377","ETH Zürich::00002 - ETH Zürich::00012 - Lehre und Forschung::00007 - Departemente::02350 - Dep. Umweltsystemwissenschaften / Dep. of Environmental Systems Science::02720 - Institut für Integrative Biologie / Institute of Integrative Biology::09497 - Hall, Alex / Hall, Alex","ETH Zürich::00002 - ETH Zürich::00012 - Lehre und Forschung::00007 - Departemente::02350 - Dep. Umweltsystemwissenschaften / Dep. of Environmental Systems Science::02720 - Institut für Integrative Biologie / Institute of Integrative Biology::09497 - Hall, Alex / Hall, Alex","09497","09497",,,"20200463","London","published",,,,,,,"2022-03-07T13:34:21Z","2023-02-07T05:28:27Z","true","10 p.","FORM",,,"publishedVersion",
"445868","20.500.11850/3","Khan, Amir Javed||Sossi, Paolo A.||Liebske, Christian||Rivoldini, Attilio||Giardini, Domenico",,,,,,"2022-03-31T16:48:41Z","2022-01-03T03:51:27Z||2022-03-31T16:48:41Z",,"2022-01-15","2021-12-16","Constraints on the composition of Mars principally derive from chemical analyses of a set of Martian meteorites that rely either on determinations of their refractory element abundances or isotopic compositions. Both approaches, however, lead to models of Mars that are unable to self-consistently explain major element chemistry and match its observed geophysical properties, unless ad hoc adjustments to key parameters, namely, bulk Fe/Si ratio, core composition, and/or core size are made. Here, we combine geophysical observations, including high-quality seismic data acquired with the InSight mission, with a cosmochemical model to constrain the composition of Mars. We find that the FeO content of Mars' mantle is 13.7±0.4 wt%, corresponding to a Mg# of 0.81±0.01. Because of the lower FeO content of the mantle, compared with previous estimates, we obtain a higher mean core density of 6150±46 kg/m3 than predicted by recent seismic observations, yet our estimate for the core radius remains consistent around 1840±10 km, corresponding to a core mass fraction of 0.250±0.005. Relying on cosmochemical constraints, volatile element behaviour, and planetary building blocks that match geophysical and isotopic signatures of Martian meteorites, we find that the liquid core is made up of 88.4±3.9 wt% Fe-Ni-Co with light elements making up the rest. To match the mean core density constraint, we predict, based on experimentally-determined thermodynamic solution models, a light element abundance in the range of ≈9 wt% S, ⩾3 wt% C, ⩽2.5 wt% O, and ⩽0.5 wt% H, supporting the notion of a volatile-rich Mars. To accumulate sufficient amounts of these volatile elements, Mars must have formed before the nebular gas dispersed and/or, relative to Earth, accreted a higher proportion of planetesimals from the outer protoplanetary disk where volatiles condensed more readily.","application/pdf","10.3929/ethz-b-000522610",,"0012-821X||1385-013X",,"10.1016/j.epsl.2021.117330","http://hdl.handle.net/20.500.11850/522610","en","Elsevier","Creative Commons Attribution-NonCommercial-NoDerivatives 4.0 International","http://creativecommons.org/licenses/by-nc-nd/4.0/","Mars||InSight||seismology||interior structure||mantle and core composition||core formation","Geophysical and cosmochemical evidence for a volatile-rich Mars",,"Journal Article","Open access",,,,,"2022-01-03T03:51:30Z",,,,"yes",,,,"Experimental and stable isotope constraints on the accretion and differentiation of the terrestrial planets","180025","10.13039/501100001711","SNF","Ambizione",,,,"85121764149",,"000837878700012","Earth Planet. Sci. Lett.",,"Earth and Planetary Science Letters","578","ETH Zürich::00002 - ETH Zürich::00012 - Lehre und Forschung::00007 - Departemente::02350 - Dep. Umweltsystemwissenschaften / Dep. of Environmental Systems Science::02720 - Institut für Integrative Biologie / Institute of Integrative Biology::09625 - Crowther, Thomas Ward / Crowther, Thomas Ward||ETH Zürich::00002 - ETH Zürich::00012 - Lehre und Forschung::00007 - Departemente::02330 - Dep. Erdwissenschaften / Dep. of Earth Sciences::02506 - Institut für Geophysik / Institute of Geophysics::03476 - Giardini, Domenico / Giardini, Domenico||ETH Zürich::00002 - ETH Zürich::00012 - Lehre und Forschung::00007 - Departemente::02330 - Dep. Erdwissenschaften / Dep. of Earth Sciences::02725 - Institut für Geochemie und Petrologie / Institute of Geochemistry and Petrology::03592 - Schmidt, Max / Schmidt, Max||ETH Zürich::00002 - ETH Zürich::00012 - Lehre und Forschung::00007 - Departemente::02330 - Dep. Erdwissenschaften / Dep. of Earth Sciences::02725 - Institut für Geochemie und Petrologie / Institute of Geochemistry and Petrology::09784 - Sossi, Paolo Angelo / Sossi, Paolo Angelo","ETH Zürich::00002 - ETH Zürich::00012 - Lehre und Forschung::00007 - Departemente::02350 - Dep. Umweltsystemwissenschaften / Dep. of Environmental Systems Science::02720 - Institut für Integrative Biologie / Institute of Integrative Biology::09625 - Crowther, Thomas Ward / Crowther, Thomas Ward||ETH Zürich::00002 - ETH Zürich::00012 - Lehre und Forschung::00007 - Departemente::02330 - Dep. Erdwissenschaften / Dep. of Earth Sciences::02506 - Institut für Geophysik / Institute of Geophysics::03476 - Giardini, Domenico / Giardini, Domenico||ETH Zürich::00002 - ETH Zürich::00012 - Lehre und Forschung::00007 - Departemente::02330 - Dep. Erdwissenschaften / Dep. of Earth Sciences::02725 - Institut für Geochemie und Petrologie / Institute of Geochemistry and Petrology::03592 - Schmidt, Max / Schmidt, Max||ETH Zürich::00002 - ETH Zürich::00012 - Lehre und Forschung::00007 - Departemente::02330 - Dep. Erdwissenschaften / Dep. of Earth Sciences::02506 - Institut für Geophysik / Institute of Geophysics::03476 - Giardini, Domenico / Giardini, Domenico||ETH Zürich::00002 - ETH Zürich::00012 - Lehre und Forschung::00007 - Departemente::02330 - Dep. Erdwissenschaften / Dep. of Earth Sciences::02725 - Institut für Geochemie und Petrologie / Institute of Geochemistry and Petrology::09784 - Sossi, Paolo Angelo / Sossi, Paolo Angelo","09625||03476||03592||09784","09625||03476||03592||03476||09784",,,"117330","Amsterdam","published",,,,,,,"2022-03-31T16:48:51Z","2023-02-07T00:38:47Z","true","16 p.","SCOPUS",,,"publishedVersion",
"468043","20.500.11850/3","Zenkl, Radek||Timofte, Radu||Kirchgessner, Norbert||Roth, Lukas||Hund, Andreas||Van Gool, Luc||Walter, Achim||Aasen, Helge",,,,,,"2022-09-16T09:23:00Z","2022-01-28T04:10:07Z||2022-04-25T10:41:05Z||2022-09-16T09:23:00Z",,"2022-01-04",,"Robust and automated segmentation of leaves and other backgrounds is a core prerequisite of most approaches in high-throughput field phenotyping. So far, the possibilities of deep learning approaches for this purpose have not been explored adequately, partly due to a lack of publicly available, appropriate datasets. This study presents a workflow based on DeepLab v3+ and on a diverse annotated dataset of 190 RGB (350 x 350 pixels) images. Images of winter wheat plants of 76 different genotypes and developmental stages have been acquired throughout multiple years at high resolution in outdoor conditions using nadir view, encompassing a wide range of imaging conditions. Inconsistencies of human annotators in complex images have been quantified, and metadata information of camera settings has been included. The proposed approach achieves an intersection over union (IoU) of 0.77 and 0.90 for plants and soil, respectively. This outperforms the benchmarked machine learning methods which use Support Vector Classifier and/or Random Forrest. The results show that a small but carefully chosen and annotated set of images can provide a good basis for a powerful segmentation pipeline. Compared to earlier methods based on machine learning, the proposed method achieves better performance on the selected dataset in spite of using a deep learning approach with limited data. Increasing the amount of publicly available data with high human agreement on annotations and further development of deep neural network architectures will provide high potential for robust field-based plant segmentation in the near future. This, in turn, will be a cornerstone of data-driven improvement in crop breeding and agricultural practices of global benefit.",,"10.3929/ethz-b-000529363",,"1664-462X",,"10.3389/fpls.2021.774068","http://hdl.handle.net/20.500.11850/529363","en","Frontiers Media","Creative Commons Attribution 4.0 International","http://creativecommons.org/licenses/by/4.0/","deep learning||breeding||machine learning||remote sensing||random forrest||support vector classification||high resolution image analysis||benchmark","Outdoor Plant Segmentation With Deep Learning for High-Throughput Field Phenotyping on a Diverse Wheat Dataset",,"Journal Article","Open access",,,,,"2022-01-28T04:10:10Z",,,,"yes",,,,"PhenoCOOL: Wheat and soybean phenotyping under cold conditions using growth as a dynamic trait","169542","10.13039/501100001711","SNF","Projekte Lebenswissenschaften",,,,"85123214475",,"000745158300001","Front. Plant Sci.",,"Frontiers in Plant Science","12","ETH Zürich::00002 - ETH Zürich::00012 - Lehre und Forschung::00007 - Departemente::02350 - Dep. Umweltsystemwissenschaften / Dep. of Environmental Systems Science::02703 - Institut für Agrarwissenschaften / Institute of Agricultural Sciences::03894 - Walter, Achim / Walter, Achim||ETH Zürich::00002 - ETH Zürich::00012 - Lehre und Forschung::00007 - Departemente::02350 - Dep. Umweltsystemwissenschaften / Dep. of Environmental Systems Science::02720 - Institut für Integrative Biologie / Institute of Integrative Biology::03516 - McDonald, Bruce / McDonald, Bruce||ETH Zürich::00002 - ETH Zürich::00012 - Lehre und Forschung::00007 - Departemente::02140 - Dep. Inf.technologie und Elektrotechnik / Dep. of Inform.Technol. Electrical Eng.::02652 - Institut für Bildverarbeitung / Computer Vision Laboratory::03514 - Van Gool, Luc / Van Gool, Luc","ETH Zürich::00002 - ETH Zürich::00012 - Lehre und Forschung::00007 - Departemente::02350 - Dep. Umweltsystemwissenschaften / Dep. of Environmental Systems Science::02720 - Institut für Integrative Biologie / Institute of Integrative Biology::03516 - McDonald, Bruce / McDonald, Bruce||ETH Zürich::00002 - ETH Zürich::00012 - Lehre und Forschung::00007 - Departemente::02350 - Dep. Umweltsystemwissenschaften / Dep. of Environmental Systems Science::02703 - Institut für Agrarwissenschaften / Institute of Agricultural Sciences::03894 - Walter, Achim / Walter, Achim||ETH Zürich::00002 - ETH Zürich::00012 - Lehre und Forschung::00007 - Departemente::02140 - Dep. Inf.technologie und Elektrotechnik / Dep. of Inform.Technol. Electrical Eng.::02652 - Institut für Bildverarbeitung / Computer Vision Laboratory::03514 - Van Gool, Luc / Van Gool, Luc","03894||03516||03514","03516||03894||03514",,,"774068","Lausanne","published",,,,,,,"2022-04-25T10:41:27Z","2023-02-07T06:21:35Z","true","19 p.","SCOPUS",,,"publishedVersion",
"450374","20.500.11850/3","Chen, Xu||Zhang, Xianliang||Hernandez-Clemente, Rocío||Wei, Lu||Manzanedo, Rubén D.",,,,,,"2022-05-10T14:39:31Z","2022-01-14T06:35:40Z||2022-05-10T14:39:31Z",,"2022-01-02","2022-01-07","Forest types are generally identified using vegetation or land-use types. However, vegetation classifications less frequently consider the actual forest attributes within each type. To address this in an objective way across different regions and to link forest attributes with their climate, we aimed to improve the distribution of forest types to be more realistic and useful for biodiversity preservation, forest management, and ecological and forestry research. The forest types were classified using an unsupervised cluster analysis method by combining climate variables with normalized difference vegetation index (NDVI) data. Unforested regions were masked out to constrict our study to forest type distributions, using a 20% tree cover threshold. Descriptive names were given to the defined forest types based on annual temperature, precipitation, and NDVI values. Forest types had distinct climate and vegetation characteristics. Regions with similar NDVI values, but with different climate characteristics, which would be merged in previous classifications, could be clearly distinguished. However, small-range forest types, such as montane forests, were challenging to differentiate. At macroscale, the resulting forest types are largely consistent with land-cover types or vegetation types defined in previous studies. However, considering both potential and current vegetation data allowed us to create a more realistic type distribution that differentiates actual vegetation types and thus can be more informative for forest managers, conservationists, and forest ecologists. The newly generated forest type distribution is freely available to download and use for non-commercial purposes as a GeoTIFF file via doi: 10.13140/RG.2.2.19197.90082).","application/pdf","10.3929/ethz-b-000525475",,"2071-1050",,"10.3390/su14020634","http://hdl.handle.net/20.500.11850/525475","en","MDPI","Creative Commons Attribution 4.0 International","http://creativecommons.org/licenses/by/4.0/","forest types||NDVI||AVHRR GIMMS||temperature range||precipitation range","Global Forest Types Based on Climatic and Vegetation Data",,"Journal Article","Open access",,,,,"2022-01-14T06:35:49Z",,,,"yes",,,,,,,,,,,,"85122384103",,"000756923200001",,"2","Sustainability","14","ETH Zürich::00002 - ETH Zürich::00012 - Lehre und Forschung::00007 - Departemente::02350 - Dep. Umweltsystemwissenschaften / Dep. of Environmental Systems Science::02720 - Institut für Integrative Biologie / Institute of Integrative Biology::09716 - Hille Ris Lambers, Janneke / Hille Ris Lambers, Janneke","ETH Zürich::00002 - ETH Zürich::00012 - Lehre und Forschung::00007 - Departemente::02350 - Dep. Umweltsystemwissenschaften / Dep. of Environmental Systems Science::02720 - Institut für Integrative Biologie / Institute of Integrative Biology::09716 - Hille Ris Lambers, Janneke / Hille Ris Lambers, Janneke","09716","09716",,,"634","Basel","published",,,,,,,"2022-05-10T14:39:38Z","2023-02-07T02:41:58Z","true","14 p.","SCOPUS",,,"publishedVersion",
"433532","20.500.11850/3","Irvine-Fynn, Tristram D.L.||Bunting, Pete||Cook, Joseph M.||Hubbard, Alun||Barrand, Nicholas E.||Hanna, Edward||Hardy, Andy J.||Hodson, Andrew J.||Holt, Tom O.||Huss, Matthias||McQuaid, James B.||Nilsson, Johan||Naegeli, Kathrin||Roberts, Osian||Ryan, Jonathan C.||Tedstone, Andrew J.||Tranter, Martyn||Williamson, Christopher J.",,,,,,"2022-01-12T16:34:08Z","2022-01-03T03:51:33Z||2022-01-10T10:37:32Z||2022-01-12T13:37:39Z||2022-01-12T16:34:08Z",,"2022-01",,"Ice surface albedo is a primary modulator of melt and runoff, yet our understanding of how reflectance varies over time across the Greenland Ice Sheet remains poor. This is due to a disconnect between point or transect scale albedo sampling and the coarser spatial, spectral and/or temporal resolutions of available satellite products. Here, we present time-series of bare-ice surface reflectance data that span a range of length scales, from the 500 m for Moderate Resolution Imaging Spectrometer’s MOD10A1 product, to 10 m for Sentinel-2 imagery, 0.1 m spot measurements from ground-based field spectrometry, and 2.5 cm from uncrewed aerial drone imagery. Our results reveal broad similarities in seasonal patterns in bare-ice reflectance, but further analysis identifies short-term dynamics in reflectance distribution that are unique to each dataset. Using these distributions, we demonstrate that areal mean reflectance is the primary control on local ablation rates, and that the spatial distribution of specific ice types and impurities is secondary. Given the rapid changes in mean reflectance observed in the datasets presented, we propose that albedo parameterizations can be improved by (i) quantitative assessment of the representativeness of time-averaged reflectance data products, and, (ii) using temporally-resolved functions to describe the variability in impurity distribution at daily time-scales. We conclude that the regional melt model performance may not be optimally improved by increased spatial resolution and the incorporation of sub-pixel heterogeneity, but instead, should focus on the temporal dynamics of bare-ice albedo.","application/pdf","10.3929/ethz-b-000522618",,"2072-4292",,"10.3390/rs14010062","http://hdl.handle.net/20.500.11850/522618","en","MDPI","Creative Commons Attribution 4.0 International","http://creativecommons.org/licenses/by/4.0/","Greenland ice sheet||Reflectance||Albedo||MODIS||Sentinel-2||Uncrewed aerial vehicle||Spectrometry||Multiscale","Temporal variability of surface reflectance supersedes spatial resolution in defining greenland’s bare-ice albedo",,"Journal Article","Open access",,,,,"2022-01-03T03:51:43Z",,,,"yes",,,,,,,,,,,,"85121696816",,"000759474800001","Remote Sens.","1","Remote Sensing","14","ETH Zürich::00002 - ETH Zürich::00012 - Lehre und Forschung::00007 - Departemente::02350 - Dep. Umweltsystemwissenschaften / Dep. of Environmental Systems Science::02720 - Institut für Integrative Biologie / Institute of Integrative Biology::09625 - Crowther, Thomas Ward / Crowther, Thomas Ward||ETH Zürich::00002 - ETH Zürich::00012 - Lehre und Forschung::00007 - Departemente::02115 - Dep. Bau, Umwelt und Geomatik / Dep. of Civil, Env. and Geomatic Eng.::02611 - V. Wasserbau, Hydrologie u. Glaziologie / Lab. Hydraulics,Hydrology,Glaciology::09599 - Farinotti, Daniel / Farinotti, Daniel","ETH Zürich::00002 - ETH Zürich::00012 - Lehre und Forschung::00007 - Departemente::02350 - Dep. Umweltsystemwissenschaften / Dep. of Environmental Systems Science::02720 - Institut für Integrative Biologie / Institute of Integrative Biology::09625 - Crowther, Thomas Ward / Crowther, Thomas Ward||ETH Zürich::00002 - ETH Zürich::00012 - Lehre und Forschung::00007 - Departemente::02115 - Dep. Bau, Umwelt und Geomatik / Dep. of Civil, Env. and Geomatic Eng.::02611 - V. Wasserbau, Hydrologie u. Glaziologie / Lab. Hydraulics,Hydrology,Glaciology::09599 - Farinotti, Daniel / Farinotti, Daniel","09625||09599","09625||09599",,,"62","Lausanne","published",,,,,,,"2022-01-10T10:37:40Z","2022-03-29T17:29:56Z","true","22 p.","SCOPUS",,,"publishedVersion",
