"463712","20.500.11850/3","Scaramella, Nicholas||Mausbach, Jelena||Laurila, Anssi||Stednitz, Sarah||Räsänen, Katja",,,,,,"2022-08-18T12:59:45Z","2022-07-27T05:31:41Z||2022-07-27T06:08:12Z||2022-08-18T12:59:45Z",,"2022-09","2022-07-20","Environmental stress is a major driver of ecological and evolutionary processes in nature. To cope with stress, organisms can adjust through phenotypic plasticity and/or adapt through genetic change. Here, we compared short-term behavioural (activity) and physiological (corticosterone levels, CORT) responses of Rana arvalis tadpoles from two divergent populations (acid origin, AOP, versus neutral origin, NOP) to acid and predator stress. Tadpoles were initially reared in benign conditions at pH 7 and then exposed to a combination of two pH (acid versus neutral) and two predator cue (predator cue versus no predator cue) treatments. We assessed behavioural activity within the first 15 min, and tissue CORT within 8 and 24 h of stress exposure. Both AOP and NOP tadpoles reduced their activity in acidic pH, but the response to the predator cue differed between the populations: AOP tadpoles increased whereas NOP tadpoles decreased their activity. The AOP and NOP tadpoles differed also in their CORT responses, with AOP being more responsive (CORT levels of NOP tadpoles did not differ statistically across treatments). After 8 h exposure, AOP tadpoles had elevated CORT levels in the acid-predator cue treatment and after 24 h exposure they had elevated CORT levels in all three stress treatments (relative to the benign neutral-no-cue treatment). These results suggest that adaptation to environmental acidification in R. arvalis is mediated, in part, via behavioural and hormonal plasticity.","application/pdf","10.3929/ethz-b-000560201",,"0174-1578||1432-136X",,"10.1007/s00360-022-01449-2","http://hdl.handle.net/20.500.11850/560201","en","Springer","Creative Commons Attribution 4.0 International","http://creativecommons.org/licenses/by/4.0/","Adaptive divergence||Behaviour||Corticosterone||Phenotypic plasticity||Rana arvalis","Short-term responses of Rana arvalis tadpoles to pH and predator stress: adaptive divergence in behavioural and physiological plasticity?",,"Journal Article","Open access",,,,,"2022-07-27T05:31:48Z",,,,"yes",,,,,,,,,,,,"85134583188",,"000827919500001","J Comp Physiol B","5","Journal of Comparative Physiology B","192","ETH Zürich::00002 - ETH Zürich::00012 - Lehre und Forschung::00007 - Departemente::02350 - Dep. Umweltsystemwissenschaften / Dep. of Environmental Systems Science::02720 - Institut für Integrative Biologie / Institute of Integrative Biology",,"02720",,,"682","669","Heidelberg","published",,,,,,,"2022-08-18T12:59:52Z","2023-02-07T05:25:26Z","true",,"WOS",,,"publishedVersion",
"463774","20.500.11850/5","Trubenová, Barbora||Roizman, Dan||Moter, Annette||Rolff, Jens||Regoes, Roland R.",,,,,,"2022-08-19T05:20:10Z","2022-08-14T03:21:03Z||2022-08-19T05:20:10Z",,"2022-09",,"Biofilms are communities of bacteria forming high-density sessile colonies. Such a lifestyle comes associated with costs and benefits: while the growth rate of biofilms is often lower than that of their free-living counterparts, this cost is readily repaid once the colony is subjected to antibiotics. Biofilms can grow in antibiotic concentrations a thousand times higher than planktonic bacteria. While numerous mechanisms have been proposed to explain biofilm recalcitrance towards antibiotics, little is yet known about their effect on the evolution of resistance. We synthesize the current understanding of biofilm recalcitrance from a pharmacodynamic and a population genetics perspective. Using the pharmacodynamic framework, we discuss the effects of various mechanisms and show that biofilms can either promote or impede resistance evolution.",,,,"0966-842X",,"10.1016/j.tim.2022.02.005","http://hdl.handle.net/20.500.11850/563589","en","Cell Press",,,,"Population genetics, biofilm recalcitrance, and antibiotic resistance evolution",,"Other Journal Item","Metadata only",,,,,"2022-08-14T03:21:08Z",,,,"yes",,,,,,,,,,,,"85127354206",,"000864832400006","Trends Microbiol.","9","Trends in Microbiology","30","ETH Zürich::00002 - ETH Zürich::00012 - Lehre und Forschung::00007 - Departemente::02350 - Dep. Umweltsystemwissenschaften / Dep. of Environmental Systems Science::02720 - Institut für Integrative Biologie / Institute of Integrative Biology||ETH Zürich::00002 - ETH Zürich::00012 - Lehre und Forschung::00007 - Departemente::02350 - Dep. Umweltsystemwissenschaften / Dep. of Environmental Systems Science::02720 - Institut für Integrative Biologie / Institute of Integrative Biology::03584 - Bonhoeffer, Sebastian / Bonhoeffer, Sebastian","ETH Zürich::00002 - ETH Zürich::00012 - Lehre und Forschung::00007 - Departemente::02350 - Dep. Umweltsystemwissenschaften / Dep. of Environmental Systems Science::02720 - Institut für Integrative Biologie / Institute of Integrative Biology::03584 - Bonhoeffer, Sebastian / Bonhoeffer, Sebastian","02720||03584","03584",,"852","841","London","published",,,,,,,"2022-08-19T05:20:17Z","2023-02-07T05:25:53Z","true","12 p.","SCOPUS",,,,
"466665","20.500.11850/3","Paz Velez, Andrea||Hernandez, Leyla||Melo, Lilian S.O.||Lyra, Mariana||Haddad, Célio F.B.||Carnaval, Ana C.",,,,,,"2022-09-07T07:56:14Z","2022-06-26T02:56:46Z||2022-06-27T05:21:04Z||2022-09-07T07:56:14Z",,"2022-09","2022-06-16","Understanding how environmental filtering and biotic interactions structure communities across elevational and latitudinal gradients is still a matter of debate. To provide insight into their relative importance, we explore the mismatch between three dimensions of biodiversity (taxonomic, functional and phylogenetic), and compare their patterns to null models of random community assembly. We focus on a highly diverse tropical group: the tree frogs (hylids) of the Atlantic Forest of Brazil. For that, we combined geographic distribution data with phylogenetic and trait information for 158 species to produce maps of the three dimensions of diversity. We show that communities of tree frogs of the Hylidae family tend to have high functional richness along the Atlantic Forest, potentially driven by niche partitioning. However, environmental filtering gains importance in extreme environments, both at high elevations and higher latitudes. In these areas of the forest, clustering of both functional and phylogenetic diversity is observed. Trait overdispersion is found in areas of contact between vegetation types, or of adjacent biomes, reflecting the encounter of amphibian species adapted to distinct environmental conditions and landscape configurations. Considering all three dimensions of diversity along with multiple axes of environmental variation allows for a more comprehensive understanding of the processes shaping amphibian community assembly in this biodiversity hotspot.","application/pdf","10.3929/ethz-b-000554669",,"0906-7590||1600-0587",,"10.1111/ecog.06138","http://hdl.handle.net/20.500.11850/554669","en","Wiley-Blackwell","Creative Commons Attribution 3.0 Unported","http://creativecommons.org/licenses/by/3.0/","community ecology||dimensions of biodiversity||functional diversity||phylogenetic diversity","Extreme environments filter functionally rich communities of Atlantic Forest treefrogs along altitudinal and latitudinal gradients",,"Journal Article","Open access",,,,,"2022-06-26T02:57:11Z",,,,"yes",,,,,,,,,,,,"85131877664",,"000812280500001",,"9","Ecography","2022","ETH Zürich::00002 - ETH Zürich::00012 - Lehre und Forschung::00007 - Departemente::02350 - Dep. Umweltsystemwissenschaften / Dep. of Environmental Systems Science::02720 - Institut für Integrative Biologie / Institute of Integrative Biology",,"02720",,,,"e06138","Oxford","published",,,,,,,"2022-09-07T07:56:21Z","2023-02-07T06:02:17Z","true","14 p.","WOS",,,"publishedVersion",
"466674","20.500.11850/3","O'Brien, David||Laikre, Linda||Hoban, Sean||Bruford, Michael W.||Ekblom, Robert||Fischer, Martin C.||Hall, Jeanette||Hvilsom, Christina||Hollingsworth, Peter M.||Kershaw, Francine||Mittan, Cinnamon S.||Mukassabi, Tarek A.||Ogden, Rob||Segelbacher, Gernot||Shaw, Robyn E.||Vernesi, Cristiano||MacDonald, Anna J.",,,,,,"2022-09-07T08:29:51Z","2022-06-23T02:56:03Z||2022-06-23T16:37:56Z||2022-09-07T08:29:51Z",,"2022-09","2022-05-28","1. Genetic diversity is one of the three main levels of biodiversity recognised in the Convention on Biological Diversity (CBD). Fundamental for species adaptation to environmental change, genetic diversity is nonetheless under-reported within global and national indicators. When it is reported, the focus is often narrow and confined to domesticated or other commercial species.  2. Several approaches have recently been developed to address this shortfall in reporting on genetic diversity of wild species. While multiplicity of approaches is helpful in any development process, it can also lead to confusion among policy makers and heighten a perception that conservation genetics is too abstract to be of use to organisations and governments.  3. As the developers of five of the different approaches, we have come together to explain how various approaches relate to each other and propose a scorecard, as a unifying reporting mechanism for genetic diversity.  4. Policy implications. We believe the proposed combined approach captures the strengths of its components and is practical for all nations and subnational governments. It is scalable and can be used to evaluate species conservation projects as well as genetic conservation projects.","application/pdf","10.3929/ethz-b-000554170",,"0021-8901||1365-2664",,"10.1111/1365-2664.14225","http://hdl.handle.net/20.500.11850/554170","en","Wiley-Blackwell","Creative Commons Attribution-NonCommercial-NoDerivatives 4.0 International","http://creativecommons.org/licenses/by-nc-nd/4.0/","biodiversity||conservation||convention on biological diversity||indicators||monitoring||policy||scorecard||wild species","Bringing together approaches to reporting on within species genetic diversity",,"Journal Article","Open access",,,,,"2022-06-23T02:56:18Z",,,,"yes",,,,,,,,,,,,"85137193630",,"000810568500001","J. Appl. Ecol.","9","Journal of Applied Ecology","59","ETH Zürich::00002 - ETH Zürich::00012 - Lehre und Forschung::00007 - Departemente::02350 - Dep. Umweltsystemwissenschaften / Dep. of Environmental Systems Science::02720 - Institut für Integrative Biologie / Institute of Integrative Biology::03706 - Widmer, Alexander / Widmer, Alexander","ETH Zürich::00002 - ETH Zürich::00012 - Lehre und Forschung::00007 - Departemente::02350 - Dep. Umweltsystemwissenschaften / Dep. of Environmental Systems Science::02720 - Institut für Integrative Biologie / Institute of Integrative Biology::03706 - Widmer, Alexander / Widmer, Alexander","03706","03706",,"2233","2227","Oxford","published",,,,,,,"2022-09-07T08:29:59Z","2023-02-07T06:02:24Z","true",,"WOS",,,"publishedVersion",
"470433","20.500.11850/3","Bernasconi, Alessio||Alassimone, Julien||McDonald, Bruce A.||Sánchez-Vallet, Andrea",,,,,,"2022-10-04T12:28:11Z","2022-05-22T04:16:31Z||2022-06-20T14:56:35Z||2022-10-04T12:28:11Z",,"2022-09","2022-04-19","Natural infections frequently involve several co-infecting pathogen strains. These mixed infections can affect the extent of the infection, the transmission success of the pathogen and the eventual epidemic outcome. To date, few studies have investigated how mixed infections affect transmission between hosts. Zymoseptoria tritici is a highly diverse wheat pathogen in which multiple strains often coexist in the same lesion. Here we demonstrate that the most competitive strains often exclude their competitors during serial passages of mixed infections. The outcome of the competition depended on both the host genotype and the genotypes of the competing pathogen strains. Differences in virulence among the strains were not associated with competitive advantages during transmission, while differences in reproductive potential had a strong effect on strain competitive ability. Overall, our findings suggest that host specialization is determined mainly by the ability to successfully transmit offspring to new hosts during mixed infections.","application/pdf","10.3929/ethz-b-000548440",,"1462-2912||1462-2920",,"10.1111/1462-2920.16018","http://hdl.handle.net/20.500.11850/548440","en","Wiley","Creative Commons Attribution-NonCommercial 4.0 International","http://creativecommons.org/licenses/by-nc/4.0/",,"Asexual reproductive potential trumps virulence as a predictor of competitive ability in mixed infections",,"Journal Article","Open access",,,,,"2022-05-22T04:17:03Z",,,,"yes",,,,,,,,,,,,"85128845177",,"000794190000001","Environ. microbiol.","9","Environmental Microbiology","24","ETH Zürich::00002 - ETH Zürich::00012 - Lehre und Forschung::00007 - Departemente::02350 - Dep. Umweltsystemwissenschaften / Dep. of Environmental Systems Science::02720 - Institut für Integrative Biologie / Institute of Integrative Biology::03516 - McDonald, Bruce / McDonald, Bruce","ETH Zürich::00002 - ETH Zürich::00012 - Lehre und Forschung::00007 - Departemente::02350 - Dep. Umweltsystemwissenschaften / Dep. of Environmental Systems Science::02720 - Institut für Integrative Biologie / Institute of Integrative Biology::03516 - McDonald, Bruce / McDonald, Bruce","03516","03516",,"4381","4369","Hoboken, NJ","published",,,,,,,"2022-10-04T12:28:13Z","2023-02-07T06:55:47Z","true",,"WOS",,,"publishedVersion",
"470201","20.500.11850/3","Goncalves, Estefany||Herrera, Ileana||Alexander, Jake||Duarte, Milen||Cavieres, Lohengrin A.||Morales-Salinas, Luis||Bustamante, Ramiro O.",,,,,,"2022-10-03T09:33:22Z","2022-10-03T03:48:19Z||2022-10-03T09:33:22Z",,"2022-09","2022-09-08","Alien plant species are colonizing high-elevation areas along roadsides. In this study, we evaluated whether the distributions of alien plants in the central Chilean mountains have reached climatic equilibrium (i.e., upper distribution limits consistent with their climatic requirements). First, we evaluated whether the upper elevational limits of alien plants changed between 2008 and 2018 based on the Mountain Invasion Research Network (MIREN) database. Second, we compared the observed upper elevational limits with the upper limits predicted by each species' global climatic niche. On average across species, the upper elevation limit did not change between 2008 and 2018. However, most species maintained the same limit or shifted downward, while only 23% of the species shifted upwards. This lack of change does not mean that the species' distributions are in equilibrium with the climate, because the observed upper limit was lower than the limit predicted by the global niche model for 87% of species. Our results suggest that alien species in this study region may not only be climate-limited, but could also be limited by other local-scale factors, such as seed dispersal, intermittent disturbance rates, soil type and biotic interactions.","application/pdf","10.3929/ethz-b-000573861",,"2223-7747",,"10.3390/plants11182345","http://hdl.handle.net/20.500.11850/573861","en","MDPI","Creative Commons Attribution 4.0 International","http://creativecommons.org/licenses/by/4.0/","Andean mountains||biological invasions||climatic niche||elevation||elevational limit||roadsides","The Upper Range Limit of Alien Plants Is Not in Equilibrium with Climate in the Andes of Central Chile",,"Journal Article","Open access",,,,,"2022-10-03T03:48:22Z",,,,"yes",,,,,,,,,,,,"85138725602",,"000857037900001",,"18","Plants","11","ETH Zürich::00002 - ETH Zürich::00012 - Lehre und Forschung::00007 - Departemente::02350 - Dep. Umweltsystemwissenschaften / Dep. of Environmental Systems Science::02720 - Institut für Integrative Biologie / Institute of Integrative Biology::09666 - Alexander, Jake (ehemalig) / Alexander, Jake (former)","ETH Zürich::00002 - ETH Zürich::00012 - Lehre und Forschung::00007 - Departemente::02350 - Dep. Umweltsystemwissenschaften / Dep. of Environmental Systems Science::02720 - Institut für Integrative Biologie / Institute of Integrative Biology::09666 - Alexander, Jake (ehemalig) / Alexander, Jake (former)","09666","09666",,,"2345","Basel","published",,,,,,,"2022-10-03T09:33:23Z","2023-02-07T06:54:38Z","true","13 p.","WOS",,,"publishedVersion",
"463267","20.500.11850/3","Chin, Alana R. O.||Guzmán-Delgado, Paula||Sillett, Stephen C.||Kerhoulas, Lucy P.||Ambrose, Anthony R.||McElrone, Andrew R.||Zwieniecki, Maciej A.",,,,,,"2022-08-16T12:51:55Z","2022-07-10T03:17:35Z||2022-08-16T12:51:55Z",,"2022-09","2022-06-23","Tracheid buckling may protect leaves in the dynamic environments of forest canopies, where rapid intensifications of evaporative demand, such as those brought on by changes in light availability, can result in sudden increases in transpiration rate. While treetop leaves function in reliably direct light, leaves below the upper crown must tolerate rapid, thermally driven increases in evaporative demand. Using synchrotron-based X-ray microtomography, we visualized impacts of experimentally induced water stress and subsequent fogging on living cells in redwood leaves, adding ecological and functional context through crown-wide explorations of variation in leaf physiology and microclimate. Under drought, leaf transfusion tracheids buckle, releasing water that supplies sufficient temporal reserves for leaves to reduce stomatal conductance safely while stopping the further rise of tension. Tracheid buckling fraction decreases with height and is closely coordinated with transfusion tissue capacity and stomatal conductance to provide temporal reserves optimized for local variation in microclimate. Foliar water uptake fully restores collapsed and air-filled transfusion tracheids in leaves on excised shoots, suggesting that trees may use aerial water sources for recovery. In the intensely variable deep-crown environment, foliar water uptake can allow for repetitive cycles of tracheid buckling and unbuckling, protecting the tree from damaging levels of hydraulic tension and supporting leaf survival.","application/pdf","10.3929/ethz-b-000557116",,"0140-7791||1365-3040",,"10.1111/pce.14381","http://hdl.handle.net/20.500.11850/557116","en","WIley","Creative Commons Attribution-NonCommercial-NoDerivatives 4.0 International","http://creativecommons.org/licenses/by-nc-nd/4.0/","embolism repair||foliar water uptake||microclimate||Sequoia||tracheid buckling||transfusion tissue","Tracheid buckling buys time, foliar water uptake pays it back: Coordination of leaf structure and function in tall redwood trees",,"Journal Article","Open access",,,,,"2022-07-10T03:17:56Z",,,,"yes",,,,,,,,,,,,"85133132956",,"000819281600001","Plant cell environ.","9","Plant, Cell & Environment","45","ETH Zürich::00002 - ETH Zürich::00012 - Lehre und Forschung::00007 - Departemente::02350 - Dep. Umweltsystemwissenschaften / Dep. of Environmental Systems Science::02720 - Institut für Integrative Biologie / Institute of Integrative Biology::09716 - Hille Ris Lambers, Janneke / Hille Ris Lambers, Janneke","ETH Zürich::00002 - ETH Zürich::00012 - Lehre und Forschung::00007 - Departemente::02350 - Dep. Umweltsystemwissenschaften / Dep. of Environmental Systems Science::02720 - Institut für Integrative Biologie / Institute of Integrative Biology::09716 - Hille Ris Lambers, Janneke / Hille Ris Lambers, Janneke","09716","09716",,"2616","2607","Hoboken, NJ","published",,,,,,,"2022-08-16T12:52:03Z","2023-02-07T05:20:36Z","true",,"WOS",,,"publishedVersion",
"457069","20.500.11850/5","Manrubia, Susanna||Cuesta, José A.||Aguirre, Jacobo||Ahnert, Sebastian E.||Altenberg, Lee||Cano, Alejandro V.||Catalán, Pablo||DIaz-Uriarte, Ramon||Elena, Santiago F.||Garcia-Martin, Juan Antonio||Hogeweg, Paulien||Khatri, Bhavin S.||Krug, Joachim||Louis, Ard A.||Martin, Nora S.||Payne, Joshua L.||Tarnowski, Matthew J.||Weiss, Marcel",,,,,,"2022-06-30T12:10:42Z","2022-06-23T02:56:03Z||2022-06-30T12:10:42Z",,"2022-09",,,,,,"1571-0645||1873-1457",,"10.1016/j.plrev.2022.05.007","http://hdl.handle.net/20.500.11850/554171","en","Elsevier",,,,"The long and winding road to understanding organismal construction Reply to comments on ""From genotypes to organisms: State-of-the-art and perspectives of a cornerstone in evolutionary dynamics"" comment",,"Other Journal Item","Metadata only",,,,,"2022-06-23T02:56:18Z",,,,"yes",,,,,,,,,,,,,,"000808455300005",,,"Physics of Life Reviews","42","ETH Zürich::00002 - ETH Zürich::00012 - Lehre und Forschung::00007 - Departemente::02350 - Dep. Umweltsystemwissenschaften / Dep. of Environmental Systems Science::02720 - Institut für Integrative Biologie / Institute of Integrative Biology::09613 - Payne, Joshua / Payne, Joshua","ETH Zürich::00002 - ETH Zürich::00012 - Lehre und Forschung::00007 - Departemente::02350 - Dep. Umweltsystemwissenschaften / Dep. of Environmental Systems Science::02720 - Institut für Integrative Biologie / Institute of Integrative Biology::09613 - Payne, Joshua / Payne, Joshua","09613","09613",,"24","19","Amsterdam","published",,,,,,,"2022-06-30T12:10:51Z","2023-02-07T03:54:54Z","true",,"WOS",,,,
"473699","20.500.11850/3","Prevéy, Janet S.||Elmendorf, Sarah C.||Bjorkman, Anne||Alatalo, Juha M.||Ashton, Isabel||Assmann, Jakob J.||Björk, Robert G.||Björkman, Mats P.||Cannone, Nicoletta||Carbognani, Michele||Chisholm, Chelsea||Clark, Karin||Collins, Courtney G.||Cooper, Elisabeth J.||Elberling, Bo||Frei, Esther R.||Henry, Gregory H.R.||Hollister, Robert D.||Høye, Toke Thomas||Jónsdóttir, Ingibjörg Svala||Kerby, Jeffrey T.||Rixen, Christian||Wipf, Sonja||et al.",,,,,,"2022-10-31T14:49:57Z","2021-11-04T10:21:12Z||2021-11-05T15:57:38Z||2021-11-05T15:58:35Z||2022-10-31T14:49:57Z",,"2022-09","2021-05-11","Observations of changes in phenology have provided some of the strongest signals of the effects of climate change on terrestrial ecosystems. The International Tundra Experiment (ITEX), initiated in the early 1990s, established a common protocol to measure plant phenology in tundra study areas across the globe. Today, this valuable collection of phenology measurements depicts the responses of plants at the colder extremes of our planet to experimental and ambient changes in temperature over the past decades. The database contains 150,434 phenology observations of 278 plant species taken at 28 study areas for periods of 1 to 26 years. Here we describe the full dataset to increase the visibility and use of these data in global analyses, and to invite phenology data contributions from underrepresented tundra locations. Portions of this tundra phenology database have been used in three recent syntheses, some datasets are expanded, others are from entirely new study areas, and the entirety of these data are now available at the Polar Data Catalogue.","application/pdf","10.3929/ethz-b-000513568",,"2368-7460",,"10.1139/AS-2020-0041","http://hdl.handle.net/20.500.11850/513568","en","Canadian Science Publishing","Creative Commons Attribution 4.0 International","http://creativecommons.org/licenses/by/4.0/","Arctic||alpine||climate change||experimental warming||International Tundra Experiment (ITEX)||flowering||plant||vegetation change","The tundra phenology database: More than two decades of tundra phenology responses to climate change",,"Journal Article","Open access",,,,,"2021-11-04T10:21:18Z",,,,"yes",,,,,,,,,,,,"85131050650",,"000928440700014",,"3","Arctic Science","8","ETH Zürich::00002 - ETH Zürich::00012 - Lehre und Forschung::00007 - Departemente::02350 - Dep. Umweltsystemwissenschaften / Dep. of Environmental Systems Science::02720 - Institut für Integrative Biologie / Institute of Integrative Biology::09666 - Alexander, Jake (ehemalig) / Alexander, Jake (former)","ETH Zürich::00002 - ETH Zürich::00012 - Lehre und Forschung::00007 - Departemente::02350 - Dep. Umweltsystemwissenschaften / Dep. of Environmental Systems Science::02720 - Institut für Integrative Biologie / Institute of Integrative Biology::09666 - Alexander, Jake (ehemalig) / Alexander, Jake (former)","09666","09666",,"1039","1026","Ottowa","published",,,,,,"true","2022-10-31T14:49:59Z","2023-02-07T07:25:16Z","true",,"BATCH",,,"publishedVersion",
